Job ID,Job Title,Company,Detail URL,Posted Label,Hours Old,Posted Datetime (Local),Location,Category,Work Type,Salary,Ad Text
90878655,Technical Lead - ServiceNow,National Heavy Vehicle Regulator,https://www.seek.com.au/job/90878655?type=standard&ref=search-standalone&origin=jobCard#sol=af0d606cc432947840be19c580358ef1466f96f6,5h ago,5.0,2026-03-11T15:00:00+00:00,Brisbane QLD,Consultants (Information & Communication Technology),Full time,,"Role Details

Location: Brisbane
Division: Data and Technology
Reports to: ServiceNow Uplift Project Manager
Job Type: Contract
Rate - $700.00 - $800.00 per day + Super

Primary Purpose

The ServiceNow Uplift Technical Lead provides technical governance, implementation assurance, and structured requirements translation across the uplift program.

The role ensures that:

The Yokohama → Zurich → Australia upgrade path is stable, fully remediated, and regression-safe
The MVP build faithfully implements the approved operating model
Future phases are delivered on a sustainable architectural foundation
System Integrator delivery meets agreed requirements and avoids technical debt
Platform configuration underpins workforce management and front-door governance

The role does not perform build activities.  All configuration and development is delivered by the System Integrator.

Works closely with:

Project Change Manager
Permanent ServiceNow Platform Lead
Operating Model and Change Lead at programme level

Oversees: System Integrator technical delivery within project governance arrangements

Key Responsibilities

Upgrade Governance
Operating Model Implementation Assurance
Requirements and Test Governance
MVP Delivery Governance
Future Phase Architecture Governance
Configuration and Integration Oversight
Vendor Technical Accountability

Skills & Capabilities

Senior ServiceNow platform governance experience
Experience overseeing multi-family upgrades
Ability to interpret HealthScan outputs
Strong understanding of ITIL-based service management
Experience working with System Integrators
Experience supporting phased enterprise transformation"
