Job ID,Job Title,Company,Detail URL,Posted Label,Hours Old,Posted Datetime (Local),Location,Category,Work Type,Salary,Ad Text
89693559,Splunk Engineer,Capgemini Australia Pty Ltd,https://www.seek.com.au/job/89693559?type=standard&ref=search-standalone&origin=jobCard#sol=4f1928cd2a207fb7d5916cd6eb39a0c72c7d3eb7,1h ago,1.0,2026-01-14T21:00:00+00:00,Melbourne VIC,Engineering - Software (Information & Communication Technology),Full time,,"Company description:



CAPGEMINI SERVICE SAS



Job description:

Your Role

As the Splunk Monitoring Specialist, you will ensure proactive monitoring of IT infrastructure and applications using Splunk ITSI. The role includes validating automated tickets, performing manual interventions, analyzing alerts, maintaining SLA compliance, and supporting continuous improvement initiatives.

Key Responsibilities:
Monitor service health and KPIs in Splunk ITSI - proactively detect infrastructure and application issues.
Respond to alerts and incidents within SLA - perform triage and correlation analysis in ITSI.
Validate and manage ServiceNow tickets - create manual tickets when auto-creation fails.
Analyze alerts in ITSI - identify false positives and tune KPIs and thresholds.
Perform daily health checks - provide alert summaries, SLA compliance, and trend reports.
Update monitoring configurations, correlation searches, and maintain change logs.
Create and maintain SOPs, runbooks, dashboards, and response manuals for ITSI and ServiceNow.
Recommend improvements for alert tuning, automation, and continuous service optimization.

Your Experience

Strong expertise in Splunk ITSI for service health monitoring, KPI creation, and alert correlation.
Advanced ServiceNow Reporting & Performance Analytics skills, including dashboard creation and data visualization.
Solid understanding of ITIL processes (Incident, Change, SRM) and SIAM framework.
Hands-on experience with SLM process, SLA calculations, and ServiceNow ticket creation with alert analysis.
Proven problem-solving ability
Self-managing and a self-starter
Uses initiative and able to address any issues

Preferred Certifications:

Splunk Core Certified Power User
Splunk ITSI Certified
ITIL Foundation

Apply today!

Capgemini is a global business and technology transformation partner, helping organizations to accelerate their dual transition to a digital and sustainable world, while creating tangible impact for enterprises and society. It is a responsible and diverse group of 340,000 team members in more than 50 countries. With its strong over 55-year heritage, Capgemini is trusted by its clients to unlock the value of technology to address the entire breadth of their business needs. It delivers end-to-end services and solutions leveraging strengths from strategy and design to engineering, all fueled by its market leading capabilities in AI, generative AI, cloud and data, combined with its deep industry expertise and partner ecosystem."
