Job ID,Job Title,Company,Detail URL,Posted Label,Hours Old,Posted Datetime (Local),Location,Category,Work Type,Salary,Ad Text
87911722,"Senior Business Analyst, Risk Analytics - 12 month FTC",Rest Industry Super,https://www.seek.com.au/job/87911722?type=standard&ref=search-standalone&origin=jobCard#sol=fb96c23340eb84132d7a4de2779ee7d8a161a619,2h ago,2.0,2025-10-16T06:00:00+00:00,Sydney NSW (Hybrid),Analysis & Reporting (Banking & Financial Services),Full time,,"Company Description


Supporting millions of Aussies since 1988 with low fees and competitive long-term performance. Profits back to members, not shareholders

Closing date: 31st October 2025

Please note Rest does not accept speculative resumes from recruitment agencies 

Rest will review applications prior to the closing date and may close the role earlier 

Job Description


12 month fixed term contract
Hybrid working model

Established in 1988, Rest is one of Australia’s largest profit-to-member superannuation funds.

We support more than two million members, with around $100 billion of funds under management and are recognised as a responsible investment leader*. We believe when members understand and engage with their super, they’re more likely to get a better retirement outcome.

Everything we do at Rest is underpinned by our values and behaviours, we want to Be Daring, Keep it Simple, Take Action and Have Grit. To put it simply we want our people to thrive and love the work they do.

Rest’s Data, Technology and Delivery (DTD) business unit is accountable for planning and preparing the organisation for the future through strategic technology innovation, as well as charting our business strategy and executing for today and tomorrow. Situated in the Business Analysis Practice, the Senior Business Analyst has two main priorities: 1. Supporting the Product Owner/Business Owner/Sponsors to ensure that business needs and solutions options are understood 2. Ensuring the product/platform/project team have a shared understanding of the requirements, through written and verbal communication.

The Senior Business Analyst’s responsibilities are to:

Deliver clearly defined requirements and user stories that accurately capture business systems, processes, and user needs by employing rigorous analysis, validation, and mapping techniques to drive successful project outcomes.
Achieve business alignment and informed decision-making by engaging, negotiating, and prioritizing stakeholder requirements, resulting in a solid foundation for solution development.
Facilitate shared understanding and streamlined processes by creating actionable, visually driven models and documentation—using techniques like process and story mapping—that translate complex logic and process flows into clear business rules.
Maximize project impact and strategic value by managing a dynamic requirements lifecycle that prioritizes critical functionality based on complexity, feasibility, and overall business value.

Qualifications


Bachelor's degree
IIBA® or similar industry standard certification preferred.

Required experience, understanding or credentials including:

Business domain knowledge in superannuation or financial services desirable
Ability to understand business functionality, business complexity and interdependencies
Ability to develop compelling business cases with accurate cost and effort estimations
Highly developed strategic, analytical, problem solving, issues management and evaluation skills to deliver innovative solutions

Additional Information


Our benefits have been designed so you can tailor your experience with us and include:

Personal and professional development opportunities 
Hybrid working 
Purchase leave scheme and gender neutral 16 weeks paid parental leave 
Super Contribution Continuation for 12 Months of parental leave 
Linkedin Learning 
Income Protection Insurance 
Rest Excellence awards (peer recognition awards based on Rest’s values and behaviours) 
Rest Stops - meeting free breaks 

If you share our values, believe you can help make a difference for our members and want to be part of a leading superannuation fund with a Super culture, please click Apply Now.

Rest is committed to creating a flexible work environment and culture that embraces diversity, equity, and inclusion - where people feel welcome, safe to be themselves and inspired to do their best.

We value the different backgrounds, lived experiences and abilities our diverse team brings. We welcome and encourage applications from candidates of all ages, cultural backgrounds, faiths, gender identities, sexual orientations and thinking styles. This includes people with disability, neurodiverse individuals, Aboriginal & Torres Strait Islander peoples and those with disrupted work history due to career or other breaks.

Please note only people with the right to work in Australia will be considered.

*Funds under management as at 31 July 2025. Rest is recognised as a Responsible Investment Leader by the Responsible Investment Association Australia (RIAA) in its Responsible Investment Benchmark Report 2022."
87911025,Process Analyst,"Talent – Specialists in tech, transformation & beyond",https://www.seek.com.au/job/87911025?type=standard&ref=search-standalone&origin=jobCard#sol=f475b18d4f0354c07e6b1e7fbd07c2ab8ac5bbd8,2h ago,2.0,2025-10-16T06:00:00+00:00,"East Melbourne, Melbourne VIC (Hybrid)",Business/Systems Analysts (Information & Communication Technology),Contract/Temp,$140k - $160k + super + salary packaging,"2-year fixed term contract
Attractive salary on offer + salary packaging
Hybrid work arrangement with 2 days' from home


We have partnered up with a Not-for-profit company to hire an experienced Process Analyst. You will be supporting business requirements and activities for the program, ensuring compliance with business strategy and translating requirements and processes into system configuration artefacts.

Key Responsibilities:

Creation of as-is and to-be business processes, system processes, and data flows
Identify inefficiencies, inaccuracies, gaps (including compliance) and opportunities for improvement
Facilitate process workshops and stakeholder meetings to elicit business & system process
Develop and maintain comprehensive business process documentation and traceability


Key Skills and Experience Required:

Proven experience as a Process Analyst, preferably in transformation programs, including as-is and to-be business and system process design
Strong understanding of finance, payroll and/or HCM functions
Skilled in BPMN process modelling using tools like Visio or Signavio
Experienced in facilitating workshops and engaging stakeholders
Excellent documentation skills, with a focus on business process and analysis artefacts


Benefits;

Get in early on a large program of work (3-5 years)
Supportive and fostering environment
Attractive salary + salary packaging
Novated lease options
Work from home flexibility


For more information, please contact Brandon Wong at Brandon.Wong@talentinternational.com or hit Apply Now"
87910724,Senior Business Analyst,Michael Page,https://www.seek.com.au/job/87910724?type=standard&ref=search-standalone&origin=jobCard#sol=a2144430586083317973cdd1757b20585f880bea,2h ago,2.0,2025-10-16T06:00:00+00:00,"Laverton, Melbourne VIC (Hybrid)",Management Accounting & Budgeting (Accounting),Full time,$140K - $150K + Super,"The Senior Business Analyst will play a pivotal role in supporting the logistics and supply chain finance functions of one of Australians largest corporates. This permanent full-time role can be based out of any of their DCs in VIC, including Laverton, Truganina, Mulgrave, or Dandenong.

Client Details

This opportunity is with a large organisation operating within the retail sector. The company, known by every Australian for its commitment to operational excellence and offers a stable and professional environment for its employees. This role offers hybrid work of 3 days on-site and 2 days work from home; monthly travel between sites may be required.

Description

Develop and deliver financial and operational analysis to support strategic decision-making.
Collaborate with stakeholders to identify business challenges and provide data-driven solutions.
Monitor and evaluate key financial metrics to ensure business objectives are met.
Assist in the preparation of budgets, forecasts, and variance analysis.
Optimise processes and identify opportunities for cost savings and efficiency improvements.
Support the implementation of future finance projects.
Ensure compliance with financial regulations and company policies.

Profile

A successful Senior Business Analyst will be able to demonstarte:

A degree in Accounting, Finance, Business, or a related field.
Proficiency in financial modelling and data analysis tools.
Experience working in a Supply Chain or Logistics environment.
Excellent communication and presentation skills to engage with stakeholders.
SAP and/or TM1 experience, considered advantageous.
A proactive approach to identifying and addressing business challenges.

Job Offer

Salary of $140,000 - $150,000 + Super + Bonus.
Permanent role.
Team of 3.
Multiple locations available in South-East Melbourne or Western Melbourne.
Rare opportunity to work for a major Australian corporate.
Excellent Business Partnering role.

To apply online please click the 'Apply' button below. For a confidential discussion about this role please contact James Stewart on +61 3 8616 6219."
87910033,Business Analyst,TheDriveGroup,https://www.seek.com.au/job/87910033?type=standard&ref=search-standalone&origin=jobCard#sol=c38616120ad3eebb13ec1f579483e83d3de7ab1d,2h ago,2.0,2025-10-16T06:00:00+00:00,Sydney NSW (Hybrid),Business/Systems Analysts (Information & Communication Technology),Contract/Temp,$750 - $775 a day including super,"TheDriveGroup have partnered with a large Australian brand who are going through a huge Payroll Transformation. This is for a mid-level Business Analyst to join the team to look at functional design and system configuration specification and validation. Look at business processes, requirements, and procedure definition. This will be a 2 year Transformation offering support to a Senior BA who will also offer mentorship. To be successful you MUST HAVE:


Business Analyst experience
Payroll Transformation experience
Functional Design and system configuration
Change Management exposure 
Working with Vendors
Strong documentation, requirement gathering
Strong stakeholder management

This role will be a 6month rolling contract working in a hybrid working environment. It would be great to have a coachable mindset where you can develop in your career and may even offer a chance to move into a permanent position. There will be a two stage interview process and will require a background check. 

For The Latest Jobs, Tech News or to 'Introduce A Friend' for a $1000 Referral Fee - Follow Us On Linkedin:

https://www.linkedin.com/company/thedrivegroup 

TheDriveGroup is 100% committed to improving meaningful diversity in the technology industry. 

We partner with clients who embrace diversity and seek candidates across all backgrounds, abilities, genders, sexualities, cultures, and faiths.

If you have the right skills and attitude we would love to hear from you!"
87909894,Data Engineer,Davidson,https://www.seek.com.au/job/87909894?type=standard&ref=search-standalone&origin=jobCard#sol=3265ef0a7ed3d986083e3952e711fdcb91794d4d,3h ago,3.0,2025-10-16T05:00:00+00:00,Brisbane QLD (Hybrid),Other (Information & Communication Technology),Contract/Temp,$95 - $120 p.h.,"Location: Brisbane CBD
Contract duration: 12-month contract
Flexibility: Hybrid working model

Position overview
The Data Engineer drives data-driven decision-making by designing, developing, and maintaining secure, high-performance business intelligence solutions. This role transforms complex education system data into actionable insights that guide strategic priorities. Using Power BI and Microsoft Azure, the engineer builds scalable data models, pipelines, and visualisations while ensuring data integrity and compliance with governance standards. The role collaborates with business units, analysts, ICT teams, and stakeholders to deliver effective reporting and policy evaluation solutions.

The role

Design fit-for-purpose data models and engaging BI visualisations using Power BI, Azure DevOps, SQL Server Management Studio, and Visual Studio
Collaborate with IT and source system teams to ensure data solutions meet functional requirements and data agreements
Develop and optimise data warehouse architecture, ETL processes, and Power BI interactive reports
Implement Quality Assurance checks to ensure data quality, integrity, and lineage
Conduct unit and system testing, code optimisation, and maintain technical documentation
Use Azure DevOps for continuous integration and deployment
Communicate progress, risks, and blockers proactively during team planning sessions

Responsibilities

Build and maintain automated data pipelines using Microsoft Azure tools
Design and optimise SQL databases and ETL processes for analytics
Ensure compliance with departmental and government data governance, privacy, and security policies
Manage deployment and version control of Power BI workspaces
Engage with stakeholders to translate business needs into technical data solutions
Provide expert advice on data visualisation and self-service analytics options

Skills & Experience

Bachelor's degree in Computer Science, Data Engineering, Information Systems, or related field
3-5 years' data engineering and BI development experience, including 2+ years focused on Power BI
Extensive expertise in Microsoft Azure data warehouse solutions, data modelling, and ETL design
Strong skills in Power BI dashboard and report development, and data pipeline automation
Experience transitioning on-premise systems to Azure cloud platforms

How to apply
Please apply with current resume in Microsoft Word format only (.doc or .docx). Rachel.Matthias@davidsonwp.com, reference JN -102025-41586. We are experiencing a large number of applications currently, please apply directly to the job advert, emails may be missed or not receive a reply."
87909526,"Senior Manager Audit, Emerging Risks",NAB,https://www.seek.com.au/job/87909526?type=standard&ref=search-standalone&origin=jobCard#sol=fd499400f7eefccb05acbc774ba5f0b1cae87daa,3h ago,3.0,2025-10-16T05:00:00+00:00,Melbourne VIC (Hybrid),Audit - Internal (Accounting),Full time,,"Drive the audit process from planning to reporting to ensure high-quality assurance over emerging ESG (Environmental, Social, and Governance) risks and regulatory compliance.
Lead, coach, and mentor a team of ESG auditors.
Showcase your strong ESG experience.

Our people are customer obsessed. They prioritise the needs and satisfaction of the customer above all else. ?Our mindset fosters innovation and creates strong, lasting customer relationships as we strive to be the most customer centric company in Australia and New Zealand. 

In the role of Senior Audit Manager, you will join Internal Audit team that’s doubling down on winning together.

Each day you will go above and beyond to:

Oversee multiple audits simultaneously and be first point of escalation for Audit Managers.
Coordinate team portfolio training to ensure the auditors have a consistent level of capability relating to ESG, as well as meeting baseline auditing requirements.
Deliver strategic initiatives to ensure Audit is delivering assurance that is best in market, integrating AI, automation, data analytics, and continuous monitoring to deliver scalable, risk-focused audits.
Responsibility for resource allocation on audit assignments and sequencing of each assignment within the Audit plan.
Build strong stakeholder relationships to facilitate smooth delivery of audit findings and identify emerging ESG risks.
Engage across the Audit function to support delivery of assignments where ESG risk is included for assurance.
Bring ESG insights to the role and collaborate with industry experts to enhance the quality and relevance of audit findings.

What you’ll bring

Previous experience in ESG.
Excellent verbal and written communication skills to clearly convey assurance findings.
Experienced in leveraging data analytics in an assurance function.
Demonstrated leadership experience along strong influencing skills.
Experienced assurance professional or Risk leader with tertiary or post tertiary qualifications.

We respectfully ask candidates to hold any questions for the phone interview, where we’ll discuss the role in detail and answer any questions. This helps to ensure a focussed, efficient and fair application process. The talent acquisition team looks forward to addressing all inquiries at that time if your application progresses. 

A diverse and inclusive workplace works better for everyone

We know that our people make us who we are. That's why we have built a culture of equity and respect – where everyone feels valued and appreciated for being their authentic selves. In partnership with our multiple Employee Resource Groups (ERGs) we continue to foster an inclusive environment, where all NAB colleagues’ unique backgrounds and identities are understood, respected and celebrated.

We wish you the best of luck with your application! Application updates will be shared with you from PageUp (our recruitment system). We recommend you filter our current opportunities to your preferred location before applying.  If you require any adjustments to the recruitment process or the role, please let the Talent Acquisition Consultant know.

Join NAB

If you think this role is the right fit for you, we would love to hear from you. Please note candidate screening and interviews may be conducted prior to the closing date of the job advert. Unsolicited CVs from agencies will not be accepted."
87908577,Business Analyst,SustainRecruit,https://www.seek.com.au/job/87908577?type=standard&ref=search-standalone&origin=jobCard#sol=d8874a0ea7d2664137e9c52a5503e72e35c712b8,3h ago,3.0,2025-10-16T05:00:00+00:00,Sydney NSW (Hybrid),Business/Systems Analysts (Information & Communication Technology),Contract/Temp,$800 - $900 pd inc super,"About the Company
Join one of Australia’s leading financial services organisations, currently undertaking a multi-year transformation program to enhance digital customer experiences through data-driven personalisation. You’ll be part of a collaborative and high-performing Customer Technology & Journeys team that’s focused on enabling secure, seamless, and intelligent customer interactions.

About the Role
We’re seeking a Technical Business Analyst to join the Customer Data Platform (CDP) initiative, focused on enabling advanced customer segmentation and personalisation across digital channels.
You’ll work closely with Product Owners, Product Managers, and Adobe specialists to translate complex business needs into technical requirements for Adobe Experience Platform (AEP). The role will involve deep engagement with data, customer journeys, and integration points to ensure delivery aligns with business and customer outcomes.
This is a hands-on role suited to a BA who can operate with minimal direction, quickly understand complex data ecosystems, and bridge the gap between marketing, data, and technology teams.

What You’ll Do
Work across multiple customer journey use cases within the Adobe Experience Platform (AEP)
Translate business and marketing requirements into detailed technical artefacts for delivery
Collaborate with Adobe specialists, Product Owners, and engineering teams to align business outcomes with technical feasibility
Analyse and validate data sources used for customer segmentation and personalisation
Ensure clear documentation of requirements, data mapping, and integration logic
Support solution validation and testing to ensure traceability to business outcomes
Contribute to the definition of future-state data and customer experience designs in collaboration with external partners
About You
Establsihed experience as a Business Analyst with a strong focus on data, customer experience, or digital platforms
Proven ability to articulate business needs into technical specifications for data and integration teams
Experience working with or around Adobe Experience Platform (AEP) or other customer data platforms (CDPs)
Solid understanding of customer journey mapping and data-driven personalisation
Strong stakeholder management skills — confident engaging across marketing, product, and technology functions
Comfortable working in fast-paced, ambiguous environments with multiple moving parts
Data or analytics background beneficial, but not essential
Why Join?
6-month day rate contract with strong likelihood of extension (multi-year program) 
$800 - $900 pd inc super, depending on experience
High-visibility role in a large-scale customer experience uplift program
Work at the intersection of data, marketing, and technology
Flexible hybrid model – Sydney based
Opportunity to shape the future of digital personalisation in a leading enterprise"
87907865,Senior Project Manager,Dovida,https://www.seek.com.au/job/87907865?type=standard&ref=search-standalone&origin=jobCard#sol=d255a27e3c1712fd4ae2115318728cc73cb75e40,4h ago,4.0,2025-10-16T04:00:00+00:00,"Toowong, Brisbane QLD (Hybrid)",Programme & Project Management (Information & Communication Technology),Contract/Temp,,"About Us

Dovida is a national provider of high-quality, person-centred home care. We provide a range of services including everyday companionship, domestic assistance, personal care, meal preparation, medication reminders, and transport to appointments, shopping, and social outings. 

At Dovida, our mission is to support, empower, and uplift individuals by keeping them at the heart of everything we do and of every decision about their care. 

Why Join Us?

Hybrid working model – work from home up to 2 days per week

Flexible working hours

Paid birthday day off

Novated leasing options

Paid volunteering, emergency services & military reserve leave

About the Role

We’re seeking a strategic and delivery-focused Senior Project Manager to lead high-impact initiatives across finance, systems, and operations. Based in our Brisbane National Office, this role is central to driving structured delivery, cross-functional alignment, and scalable change across our care network.

You’ll manage complex projects such as uplifting our CRM, improving our ERP, and embedding our HRIS platform. Your focus will be on delivering outcomes with precision, transparency, and strong stakeholder engagement. This is a leadership role for someone who thrives in ambiguity, builds trust quickly, and knows how to turn vision into action.

This role is being offered on a 12-month contract.

Key Responsibilities

Lead end-to-end delivery of strategic projects across finance, systems, and operational functions 

Leading Change Management with responsible risk management

Develop and manage detailed project plans, timelines, and governance frameworks

Facilitate collaboration between finance, IT, Care operations and external partners

Oversee ERP-related initiatives including NetSuite optimisation and reporting uplift

Drive CRM uplift and HRIS platform embedding across the organisation

Identify and resolve delivery risks, resource constraints, and misalignment early

Drive stakeholder engagement through clear communication and structured updates

Support change management, training, and adoption across impacted teams

Champion continuous improvement and scalable delivery practices

Regular reporting to the leadership team

What You’ll Bring

5+ years’ experience as a senior project manager, ideally within aged care, health, or service-based sectors

Proven ability to lead cross-functional projects with multiple stakeholders

Strong understanding of ERP systems (NetSuite preferred), CRM platforms (Saleforce preferred), and HRIS solutions (ZoHo Preferred)

Excellent planning, governance, and communication skills

Experience in change management, stakeholder alignment, and vendor coordination

Commercial mindset with a focus on outcomes, not just activity

Ability to work independently, manage ambiguity, and drive clarity

Relevant qualifications in project management (e.g. PMP, PRINCE2, Agile)"
