Job ID,Job Title,Company,Detail URL,Posted Label,Hours Old,Posted Datetime (Local),Location,Category,Work Type,Salary,Ad Text
89215261,Data Platforms Specialist,Hunter Valley Coal Chain Coordinator Limited,https://www.seek.com.au/job/89215261?type=standard&ref=search-standalone&origin=jobCard#sol=d15d8450f01e5cf90a0b696dc11d24dbd2d71264,1h ago,1.0,2025-12-18T02:00:00+00:00,"Newcastle, Newcastle, Maitland & Hunter NSW",Database Development & Administration (Information & Communication Technology),Full time,,"HVCCC is an independent logistics organisation that brings together talented individuals and innovative technology to optimise the end-to-end Hunter Valley coal chain. We are proud to have been awarded the Business NSW Employer of Choice in 2023 and recipient of a Best Workplace Award in 2024 for exceptional employee engagement, wellbeing and progress.

The opportunities:

We’re seeking a visionary Data Platforms Specialist to architect, build, and continuously improve HVCCC’s Microsoft Fabric data platform. This is a leadership role, blending deep expertise in data engineering with the ability to influence and empower teams. You’ll be instrumental in our Fabric migration, embedding automation, observability, and best-practice data patterns, and preparing the platform for future AI and MLOps initiatives.

What You’ll Be Doing

Embed strong data governance practices across the platform, ensuring compliance, security, and clear data ownership.

Lead the evolution of HVCCC’s Fabric-based data architecture, expanding workflows and enabling new business capabilities.

Design and deliver robust, automated, and scalable data pipelines and models for operational and analytical excellence.

Champion automation, CI/CD, and observability across the data lifecycle, ensuring reliability and performance.

Empower business teams with self-service analytics, clear metric definitions, and trusted data assets.

Mentor and guide other data engineers, fostering a culture of continuous improvement and technical excellence.

Collaborate with internal stakeholders and external partners to drive platform innovation and readiness for advanced analytics.

Uphold HVCCC’s values: Care for People, Leadership, Integrity, Collaboration, and Customer Service.

About You

We’re committed to building a diverse and inclusive team where everyone feels valued, respected, and empowered to thrive. We welcome applicants from all backgrounds, experiences, and perspectives — and we’re especially interested in people who bring curiosity, initiative, and a collaborative mindset.

To succeed in this role, you’ll bring:

Tertiary qualification in Computer Science, Information Systems, or related discipline (or equivalent experience).

5–7 years’ experience designing, delivering, and operating enterprise-scale data platforms.

Experience implementing data governance frameworks, including metadata management, access controls, and compliance monitoring.

Proven expertise in Microsoft Fabric, Azure Data Factory, Synapse, and Power BI.

Strong background in automation, CI/CD, data observability, and platform monitoring.

Experience supporting self-service analytics and preparing platforms for AI/MLOps.

Technically curious, strategic in design, hands-on in execution, and passionate about data quality and resilience.

Excellent communication and stakeholder engagement skills; collaborative and supportive leader.

What we offer you

At HVCCC, we’re proud to offer a competitive salary package and a genuinely supportive work environment that values diversity, inclusion, and wellbeing. You’ll enjoy:

Professional Growth: Structured development programs, access to accredited workplace coaches, and opportunities to work with experts in their field.

Wellbeing & Support: Employee-led wellbeing initiatives, subsidised gym memberships, access to EAP, and paid domestic violence leave.

Community & Culture: Paid community days, employee-nominated charity support, family days, cultural lunches, and team BBQs.

Flexibility & Balance: Flexible start and finish times, free parking, and optional uniforms.

Financial Benefits: Salary packaging options including motor vehicle novated leasing.

Modern Workplace: Inclusive office facilities and a culture built on care, collaboration, integrity, leadership, and customer service.

To apply, please submit your CV and cover letter addressing the selection criteria and why you would like to join our team to hr@hvccc.com.au. 

Applications close: Sunday 11 January 2026.

www.hvccc.com.au"
89214361,Business Analyst Security - Privileged Access & Zero Trust,The Recruitment Alternative,https://www.seek.com.au/job/89214361?type=standard&ref=search-standalone&origin=jobCard#sol=dcfbc55ab140783f014caabfe629a7505c8223ae,1h ago,1.0,2025-12-18T02:00:00+00:00,Brisbane QLD (Hybrid),Security (Information & Communication Technology),Contract/Temp,,"12-Month Fixed-Term Contract (Extendable)
Brisbane | Hybrid & Flexible Working
 
A leading cyber security consultancy is delivering complex, high-impact security transformation programs for enterprise clients and is seeking an experienced Senior Business Analyst - Security Transformation to support a portfolio of initiatives focused on Privileged Access Management (PAM), Privileged Remote Access (PRA), and Zero Trust Network Access (ZTNA), alongside broader cyber and technology uplift workstreams.
 
This is a highly visible role working across security, technology, and business stakeholders, translating complex security requirements into clear, testable, and actionable deliverables that enable successful implementation.


The Role
Reporting to the Project Manager, you will act as the critical link between business stakeholders, delivery teams, and external vendors. You will lead requirements discovery, process mapping, and documentation while ensuring alignment with security controls, governance frameworks, and delivery milestones.


Key Responsibilities
Requirements & Analysis

Lead workshops, interviews, and discovery sessions across business, security, and technology teams
Elicit, structure, and validate requirements for PAM, PRA, and ZTNA initiatives
Produce user stories, process maps, and acceptance criteria
Documentation & Governance

Develop high-quality BRDs, FRDs, RACIs, traceability matrices, service definitions, and SOPs
Ensure documentation aligns with program standards, policies, and control objectives
Stakeholder & Vendor Engagement

Partner with Security, Technology Operations (IT & OT), PMO, enterprise systems teams, and business stakeholders
Coordinate with vendors, MSSPs/MSPs, and implementation partners
Delivery & Change Support

Support project planning, RAID management, dependencies, and change control
Define and support UAT scenarios and operational readiness activities
Validate delivered outcomes against agreed requirements and security controls
Reporting & Assurance

Prepare concise status updates, decision logs, and leadership briefings
Support benefits realisation tracking and compliance uplift reporting
What We're Looking For

Proven experience as a Business Analyst on security transformation programs
Strong exposure to PAM, Zero Trust, identity, remote access, or related security initiatives
Excellent stakeholder management skills with the ability to translate technical concepts into business outcomes
Strong documentation discipline within regulated or complex enterprise environments
Comfortable working with engineering teams, SOCs, and security vendors
Solid understanding of PMO practices (scope, change, sign-off, RAID)
Relevant BA and/or security certifications are highly regarded
Why Join This Engagement

Work on high-impact, enterprise-scale cyber security programs
Flexible, hybrid working environment
Collaborative and supportive consulting culture
Ongoing professional development and training opportunities
Exposure to leading security technologies, vendors, and delivery partners
Opportunity to extend beyond the initial 12-month term
 Ready to apply?"
89213950,Data and Analytics Manager,Endeavour Foundation,https://www.seek.com.au/job/89213950?type=standard&ref=search-standalone&origin=jobCard#sol=871d4001704498b7f678c3b75727187139db1ee3,1h ago,1.0,2025-12-18T02:00:00+00:00,"Cannon Hill, Brisbane QLD (Hybrid)",Management (Information & Communication Technology),Full time,Remuneration + Super + Salary Packaging,"Endeavour Foundation is one of Australia’s largest employers of people living with disability. Our people live and breathe our purpose every day, with flexible working, great perks, and work/life balance. We are dedicated to creating an inclusive culture where our employees can grow, learn, and do their best work. Our purpose is simple: make possibility a reality.

 

Make an Impact

The Data and Analytics Manager leads the direction and delivery of Endeavour Foundation’s data and analytics capability, enabling informed decision-making across the organisation.

Leading a team of technical specialists, the role provides strategic oversight of data platforms, governance and analytics, and partners closely with senior stakeholders to deliver trusted insights. The role also plays a key part in building organisational data capability and embedding a strong data-driven culture aligned to strategic priorities and long-term outcomes.

Key duties of this role are to:

Lead the organisation’s data and analytics strategy, ensuring alignment to organisational priorities and measurable outcomes.
Provide strategic oversight of data platforms, architecture and analytical capability to support digital enablement and decision-making.
Establish and champion strong data governance, quality, privacy and security standards that build trust and manage organisational risk.
Enable advanced analytics, reporting and insight that inform executive, operational and strategic decision-making.
Partner with senior leaders to translate complex business challenges into data-enabled solutions and insights.
Lead, develop and mature a high-performing data and analytics function that continuously builds organisational capability.

 

What you can bring to the team

A strategic and commercially minded data leader with the ability to translate complex analytics into practical business outcomes. Demonstrated capability in leading multidisciplinary teams, influencing senior stakeholders, and embedding a strong data-driven culture across the organisation.

To succeed in this role, you will have:

Relevant tertiary qualifications in analytics, data, IT or a related discipline.
Extensive senior leadership experience leading data, analytics or insights functions.
Demonstrated success defining and executing organisational data and analytics strategies.
Strong capability in data governance, risk, privacy and quality management.
Proven ability to translate complex data into clear, actionable insight for executives.
Experience leading and developing high-performing technical teams through change.
Strong commercial acumen with the ability to align data investment to business value.
Exceptional stakeholder engagement and influence at executive and senior levels.

You will be required to undertake a “Fit2Work” National Criminal History Check and hold or be willing to obtain a Blue Card and NDIS Worker Screening Check.

 

At Endeavour we offer a range of employee benefits including:

Salary Packaging Benefits! Package up to $15,900 of your annual salary tax free.
In addition to your tax-free benefit, you can also use up to $2,650 of your pre-tax income to pay for entertainment expenses (meals, holiday accommodation etc).
An Employee Assistance Program - a free and confidential counselling service available to all staff and their family members.
Discounts on Corporate Private Health Insurance Plans, white goods, and appliances.
Discounted family gym memberships through Fitness Passport.
Paid Parental Leave.
Reward and Recognition Program.
Free flu vaccinations.

 If you’re ready to join a team who are passionate, culturally strong and drive positive outcomes, apply now! We look forward to hearing from you!

 

Endeavour Foundation encourages applications from people of all ages, nationalities, abilities, and cultures. This includes Aboriginal and Torres Strait Islander peoples, CALD (Culturally and Linguistically Diverse), the LGBTQI+ community, and people with disability. We value inclusivity and are committed to adjusting our recruitment process to ensure accessibility and support of an applicant's needs.

Candidates for this role will be assessed in January 2026."
89212069,Senior Financial Systems Analyst (6 Month Contract),Norton Rose Fulbright,https://www.seek.com.au/job/89212069?type=standard&ref=search-standalone&origin=jobCard#sol=127a1ab06704283df48c1592c98f9dd4dae481da,2h ago,2.0,2025-12-18T01:00:00+00:00,Sydney NSW,Business/Systems Analysts (Information & Communication Technology),Contract/Temp,,"Norton Rose Fulbright is a global legal practice. We provide the world's pre-eminent corporations and financial institutions with a full business law service. We have more than 4000 lawyers based in over 58 offices across Europe, the United States, Canada, Latin America, Asia, Australia, Africa, the Middle East and Central Asia.

Reporting to the Financial Systems & Operations Manager this role will provide day to day support and technical advice in automating solutions that meet complex business requirements, ensuring that the legal practice content management methodology follows best practice; and undertake continuous improvement initiatives improving on business processes, new strategic business initiatives and organisational priorities.

Responsibilities

Management of practice management system

Responsible for managing the day-to-day support and the provision of technical expertise to facilitate the development and administration of the firm’s Practice Management System (currently Aderant Expert);
Co-ordinate the outsourcing of major project management system (PMS) related projects/tasks;
Liaise with DBAs to ensure reliability and efficiency of SQL systems;
Assist the Senior Financial Systems Analyst in the development and delivery of financial solutions; and
Act as a conduit between IT and Finance to ensure all integration and development work related to the practice management system is within business requirements.

Operational reporting

Provide support and technical advice in automating solutions that meet complex business requirements. This includes the system integration of key information sources i.e. PMS, CRM, Payroll, analytical reporting solutions (Reporting Services /Business Intelligent/SSAS) and developing ad hoc SQL reporting requests and data extraction;
Work closely with key stakeholders to ensure all reporting content is accurate and captured in a timely manner;
Manage, develop and maintain financial reporting solutions and ensure that the firm’s content management methodology follows best practice; and
Continually improve on data quality and capture to ensure accurate output for client reporting.

Business analysis/Project Management

Liaise with stakeholders to effectively identify, analyse and document project business requirements; work closely with Information Technology stakeholders to ensure the technical components of each project are delivered in a satisfactory and timely manner;
Continually look to improve on business processes, new strategic business initiatives and organisation priorities;
Design and develop efficient solutions based on functional business requirements;
Undertake complex system reviews through SQL based data analysis i.e. mining and modelling;
Assist in the delegation of responsibilities required to support new business initiatives.
Perform other tasks, as required by your direct manager; and
Provide leave coverage where required.

Requirements

The successful candidate should be able to demonstrate:

Advanced level of Microsoft Excel; Experience with BI solutions(desirable); Experience writing VBA (desirable).
Proven experience with developing Microsoft SQL queries and SSRS dashboard and reports;
Highly developed attention to detail, analytical and conceptual skills, strong financial acumen, with the ability to develop creative solutions to complex problems
Effective written and verbal communication skills and demonstrated ability to interpret financial and non-financial data to effectively add value to client analysis; and
A professional, friendly and client-focused approach at all times;
A continuous improvement mentality to support development of self, colleagues, business processes and interactions;
Demonstrated ability to manage and prioritise workload;
Ability to work under pressure and to tight deadlines;

Norton Rose Fulbright values diversity and strives to create an inclusive environment. We are proud that Norton Rose Fulbright in Australia has been recognised as an Employer of Choice for Gender Equality by the Workplace Gender Equality Agency (WGEA) as well as a gold tier employer for LGBTI Inclusion through the Australian Workplace Equality Index. In 2023 we were re-accredited as a Family Inclusive Workplace and always encourage people to discuss flexible and hybrid work options with us.

We encourage Aboriginal and Torres Strait Islander candidates to apply.

To apply online click the 'Apply' button below. If you require any adjustments to the recruitment process or if the application portal is inaccessible to you, please don't hesitate to contact Scott Baker via (02) 9330 8578 or scott.baker@nortonrosefulbright.com for a confidential discussion.

If you are trans or gender diverse and would like a confidential discussion before applying, please contact Yvette Borradale (03) 8686 6003 or Scott Baker (02) 9330 8578.

Please be aware in the course of routine work some of our lawyers and teams can be exposed to details of trauma. The firm has controls in place including educational and psychological support. Our talent team can provide further details."
