Job ID,Job Title,Company,Detail URL,Posted Label,Hours Old,Posted Datetime (Local),Location,Category,Work Type,Salary,Ad Text
89209932,Consultants - Cyber Security,Humanised Group,https://www.seek.com.au/job/89209932?type=standard&ref=search-standalone&origin=jobCard#sol=fb5a987a677fb3466fc85438f2d1669194121201,4h ago,4.0,2025-12-17T23:00:00+00:00,Brisbane QLD,Security (Information & Communication Technology),Contract/Temp,,"Business Analysts, Project Managers & Change Managers
Cyber Security Projects | Contract Opportunities | Brisbane / Hybrid
 
We are partnering with large enterprise and government organisations delivering critical cyber security initiatives and are seeking experienced Business Analysts, Project Managers and Change Managers (consultants) to support multiple programs of work.
 
These roles will suit professionals who have hands-on experience working across cyber security, risk, compliance and technology uplift programs in complex environments.
 
About the Opportunities

You will work across a range of cyber security initiatives, including:
Cyber uplift and remediation programs
Identity & Access Management (IAM)
GRC, risk and compliance initiatives
Security architecture, tooling and control improvements
Regulatory, audit and assurance-driven programs
Key Responsibilities (Depending on Discipline)
Business Analysts

Eliciting and documenting business, functional and non-functional requirements
Translating cyber security, risk and technical concepts into clear documentation
Supporting solution design, traceability and delivery
Working closely with security, architecture and delivery teams
Project Managers

Leading end-to-end delivery of cyber security projects
Managing scope, schedule, budget, risks and dependencies
Coordinating vendors, security teams and internal stakeholders
Driving delivery across regulatory and compliance-driven timelines
Change Managers

Leading change impact assessments and stakeholder engagement
Developing and delivering change, communication and training plans
Supporting adoption of new security processes, tools and ways of working
Working closely with delivery and security teams to embed change
About You

You are an experienced consultant who has:
Proven experience delivering cyber security-related projects
Background in complex, regulated or enterprise environments
Strong stakeholder engagement and communication skills
Experience working alongside security, risk, technology and business teams
Consulting or contract experience is highly regarded
What's on Offer

Multiple contract opportunities across cyber security programs
Competitive daily rates
Hybrid working arrangements (Brisbane-based)
Opportunity to work on meaningful, high-impact security initiatives
If you're a Business Analyst, Project Manager or Change Manager with cyber security project experience and are looking for your next contract, we'd love to hear from you."
89209689,Commercial Analyst - Newcastle,Whitehaven Coal Limited,https://www.seek.com.au/job/89209689?type=standard&ref=search-standalone&origin=jobCard#sol=b24d99ef2ed7aaa69b992888909c61aba4735f0b,4h ago,4.0,2025-12-18T00:00:00+00:00,"Newcastle, Newcastle, Maitland & Hunter NSW (Hybrid)",Analysis & Reporting (Accounting),Contract/Temp,Attractive remuneration package,"Whitehaven Coal is the dominant player in Australia’s only emerging high-quality coal basin. With a culture based on our STRIVE values, our reputation for excellence in project delivery and safe, efficient and environmentally responsible operations continues to grow.

 
Our STRIVE Values connect us and define how we behave. Whitehaven Coal award, recognise and celebrate individuals and teams going above and beyond the requirements of their role to deliver excellent outcomes while demonstrating our values of Safety, Teamwork, Respect, Integrity, Value and Excellence.




About The Role

We are seeking a highly motivated Commercial Analyst to join our dynamic team. This role is a fixed term 12 month contract and is based in our Newcastle office.




Accountable for oversight of the revenue stream at Whitehaven Coal, with a strong focus on the development and coordination of the annual revenue budget and ongoing monthly revenue forecasting. The role supports forward-looking revenue planning through analysis of sales volumes, pricing assumptions, shipment timing, and market conditions, providing insight to senior management and the Board to support decision-making.




The position is responsible for forecasting and monitoring demurrage and other voyage-related revenue impacts, ensuring these are appropriately reflected in revenue outlooks. The role also supports a robust control environment across sales operations by maintaining disciplined forecasting processes, assumptions governance, and alignment between marketing, commercial and finance teams.


What You’ll Do

Develop annual budgets and forecasts in collaboration with relevant stakeholders and monitor the performance against those budgets and forecasts
Assist with the completion of sales forecasts based on market trends, customer demand, and production capacity.
Collaborate with sales and operations teams to ensure alignment between sales targets and operational capabilities.
Prepare and present regular sales performance reports to management, highlighting key metrics and trends.
Assist in reporting of value generation achieved via purchase and blending of third-party coals
Conduct ad-hoc analysis and special projects as requested by senior management, providing timely and accurate insights to support strategic initiatives
Assist with preparation of ELT, Board and Leadership Team reports

What You’ll Bring 

Proven experience in commercial analysis, preferably within the coal industry or related sectors.
Proficiency in financial modelling, forecasting, and budgeting.
Degree qualified in Accounting, Commerce, Business or Law
Experience dealing with multiple stakeholder inputs both internal and external
The ability to build and maintain strong and trusted relationships across all levels of the business
Experience and understanding of international and domestic coal markets (desirable)
Experience in the coal industry across coal mining, coal processing and logistics chain (Desirable)




Why Whitehaven Coal?

Career development, mentorship and coaching
Australian owned industry leader
Attractive remuneration package
Employee referral scheme - $4000 for successful referrals
12 month contract opportunity




Whitehaven Coal is committed to increasing the representation of women and Aboriginal and Torres Strait Islander peoples in the workplace. We strive for an inclusive workplace that engages people from diverse backgrounds and welcomes diversity of gender, culture and experience."
89209447,Dig Del Support - Senior Data Engineer,Uniting NSW & ACT,https://www.seek.com.au/job/89209447?type=standard&ref=search-standalone&origin=jobCard#sol=0d6f230bb16e3d31299f218a4a32839fab1d2be5,4h ago,4.0,2025-12-18T00:00:00+00:00,"Parramatta, Sydney NSW (Hybrid)",Engineering - Software (Information & Communication Technology),Contract/Temp,Base + Super + Full NFP Salary packaging benefits,"Senior Data Engineer

10-month fixed-term contract
Marsden Street, Parramatta (hybrid working available)

About Uniting

Our purpose: To inspire people, enliven communities and confront injustice.
Our values: Imaginative, Respectful, Compassionate and Bold.

At Uniting, we take real steps to make the world a better place. Our focus is always on the people we serve, wherever they are in life.

We deliver services across aged care, disability, child and family services, community services and chaplaincy, alongside strong social justice and advocacy work. We celebrate diversity and welcome all people regardless of lifestyle choices, ethnicity, faith, sexual orientation or gender identity.

Uniting is the services and advocacy arm of the Uniting Church NSW & ACT. Our leaders understand, support and can articulate the mission and purpose of the Uniting Church.

About the role

As a Senior Data Engineer, you will design, build and maintain scalable, secure and high-quality data platforms that enable analytics, reporting and advanced data use across Uniting.

Working within the Data Engineering Chapter in the Data & Analytics team, you will collaborate closely with data analysts, data architects and business stakeholders. You will provide technical leadership, contribute to architectural decisions, and help uplift data engineering practices to support informed, data-driven decision-making across the organisation.

This role is a 10-month fixed-term contract and reports to the Chapter Lead – Data Engineering, within the Property, Finance & IT directorate.

Key accountabilities

In this role, you will:

Integrate diverse data sources to create trusted, accessible datasets
Architect and implement solutions to support large-scale data processing
Automate data ingestion, transformation and delivery workflows
Monitor system performance, identify bottlenecks and implement improvements
Apply best practice in data security, access controls and compliance
Provide technical leadership through code reviews, mentoring and design guidance
Evaluate and adopt new tools and frameworks to enhance data engineering capability

About you

You are an experienced, hands-on data engineer who thrives in complex environments and enjoys partnering with both technical and non-technical stakeholders. You bring strong problem-solving skills, a collaborative approach, and the confidence to guide technical outcomes while remaining pragmatic and delivery-focused.

As a staff member at Uniting, you actively support diversity and inclusion and work in ways that reflect our values.

Your capabilities

Individual leadership

Takes ownership of outcomes and delivers with a proactive, “can-do” mindset
Works collaboratively to improve performance and ways of working
Remains resilient and focused when navigating complexity
Plans and delivers work within agreed timeframes

Business acumen

Understands Uniting’s objectives and how this role contributes to them
Applies organisational values to day-to-day decision-making
Analyses problems, seeks input where appropriate and implements effective solutions
Builds strong relationships and influences outcomes without direct authority




Qualifications and experience

Essential

Tertiary qualification in Computer Science, Information Technology, Systems Engineering or a related discipline, or equivalent professional experience
10+ years’ experience designing, developing and supporting data engineering, analytics and ML solutions
Strong proficiency in Python and SQL
Proven experience designing and managing ETL/ELT pipelines
Solid understanding of data modelling, governance, quality and security
Experience working with non-technical stakeholders, demonstrating strong communication, empathy and insight
Proficiency with Git or similar source control tools
Ability to quickly learn and apply new tools and technologies

Highly regarded

Experience with cloud data platforms, particularly Microsoft Azure (e.g. Azure Data Factory)
Experience with Snowflake, including schema design, performance tuning and secure data sharing
DevOps and automation experience (e.g. Python scripting, API integration, automated releases)
Exposure to predictive analytics, machine learning or statistical techniques (Python/R)"
89209167,Head Evidence and Impact,Watermark Search International,https://www.seek.com.au/job/89209167?type=standard&ref=search-standalone&origin=jobCard#sol=a74b7b53e6cb01c1ad8ae8d2c453d5823dfcbeed,4h ago,4.0,2025-12-18T00:00:00+00:00,Sydney NSW (Hybrid),Policy (Consulting & Strategy),Full time,,"Direct report to the Chief Executive at a leading independent health research organisation

Lead an engaged, high calibre team to solve some of Australia’s most complex health and wellbeing challenges using evidence and research

Exciting role bringing together business development and relationship management whilst delivering high quality consulting projects, which improve public health outcomes

The Organisation

The Sax Institute is an independent, not-for-profit organisation that improves health and wellbeing by driving better use of evidence in policies, programs and services. The Institute has an international reputation as an Evidence Specialist, with nearly 20 years' experience in translating research findings into policy drawing on our own expertise as well as that of our more than 80 member organisations. It works with governments, health organisations, research organisations and a network of experts nationwide to analyse policy problems and find the best evidence-based solutions.

Its work spans a broad portfolio of programs and services, including; The 45 and Up Study, SURE (Secure Unified Research Environment), Evidence Check, Dynamic Simulation, Aboriginal Health Division, The Australian Prevention Partnership Centre and the Evaluation and Impact Services Division, which this role leads.

Evidence and Impact Division

Sax Institute’s Evaluation and Impact Services team delivers high-quality, independent evaluations that help organisations understand the effectiveness, value and outcomes of their programs and policies. With deep expertise in health and social policy, the team works across government, non-profit and community sectors to provide actionable insights that drive improvement and innovation.

The Role

The Head, Evidence and Impact Division is a senior executive role reporting to the Chief Executive and responsible for the strategic development and operational management of the Division. This is an exciting role that continues to expand the Institute’s impact through business development, strategic relationship management, and the delivery of high-quality programs.

This role will be responsible for building and maintaining a strong pipeline of opportunities in a competitive marketplace; balancing multiple complex consulting projects simultaneously; and managing client expectations. The role will position the Division and the Institute for growth whilst maintaining a reputation for independence and analytical excellence, and foster whole of Institute collaboration to leverage all Institute capabilities in service delivery.

The Individual

Essential

Postgraduate qualifications, preferably in public health, health policy, health services, research or related.

10+ years’ experience in health policy, strategy and planning, evidence mobilisation, modelling, program review and evaluation, and impact assessment.

Demonstrated ability to problem solve at a high level and develop, implement and evaluate innovative solutions to complex policy challenges.

Substantial leadership experience in leading multi-disciplinary teams, operational and budget management, bringing excellence in methodology and analytical rigour.

A proactive approach to developing and nurturing a strong network of professional contacts across government and the health sectors.

Desirable

Publication in peer reviewed journals.

Understanding of health system design and reform.




For a confidential discussion, please call Bronwen Kerr, Jocelyn Hinder or Daniel Nicholls on 02 9233 1200.  

To obtain a copy of the Candidate Brief for this role, please visit: watermarksearch.com.au/position-descriptions

To express interest, please send your application quoting Ref No A006163 to Watermark Search International via the form below. We will reply to the email address used for your application.

https://watermarksearchinternational.snapforms.com.au/form/application-form-sydney-search

Closing date: Wednesday 14 January 2026 at 11.59pm AEDT"
89209071,Digital Experience Monitoring (DEM) SME / Delivery Lead,Capgemini Australia Pty Ltd,https://www.seek.com.au/job/89209071?type=standard&ref=search-standalone&origin=jobCard#sol=3bcaa9ed2a876d828dc415471346aad1d9320d1a,4h ago,4.0,2025-12-18T00:00:00+00:00,Melbourne VIC,Other (Information & Communication Technology),Full time,,"Company description:



CAPGEMINI SERVICE SAS



Job description:

Your Role

As a Digital Experience Monitoring (DEM) Tool SME within the Experience Management Office, you will play a key role in shaping and elevating the digital experiences of our employees. You'll be responsible for the expert management, configuration, and optimization of DEM platforms such as SysTrack and Nexthink. By analysing rich performance and experience data, you will help identify issues, uncover improvement opportunities, and drive initiatives that enhance productivity and employee satisfaction across the organisation.


Own the configuration, performance, and overall health of DEM tools to ensure accurate and meaningful insight generation.
Monitor digital experience data to identify trends, performance gaps, and user‑impacting issues.
Translate technical findings into clear, actionable insights to improve the digital work environment.
Support the evolution of the DEM platform ecosystem by contributing to enhancements, best practices, and new capability development.
Your Experience

Technical Skills

Strong hands‑on experience with key modules (e.g., SysTrack DEX Pack, Campaigns, extensions; Nexthink Experience Central, Engagement, Remote Actions).
PowerShell Automation - advanced scripting and workflow automation.
Windows Administration including Windows Server and desktop management.
Solid SQL experience for data querying and analysis.
Ability to design and architect effective technical solutions.

Analytic Skills

Performance data analysis to identify trends and issues
Integrating DEM tool data with other systems.y
Creating clear reports and dashboards.

Interpersonal and Strategic Skills

Effective collaboration across IT teams.
Strong communication of insights and technical concepts.
Identifying and leading automation opportunities.
Willingness to learn and adapt to new technologies
Strong troubleshooting and issue-resolution skills"
89208494,Business Analyst,Sestra People Pty Ltd,https://www.seek.com.au/job/89208494?type=standard&ref=search-standalone&origin=jobCard#sol=f70239b2c60f6b4a0c996094a5fb2b9eeb1fa01d,5h ago,5.0,2025-12-17T23:00:00+00:00,Melbourne VIC (Hybrid),Business/Systems Analysts (Information & Communication Technology),Contract/Temp,$90 – $100 per hour,"Seeking a highly skilled Business Analyst with a strong background in ERP implementations to join our dynamic team. This role is pivotal in bridging the gap between business needs and technology solutions, ensuring successful delivery of ERP projects that drive operational efficiency and business growth.Key Responsibilities

Collaborate with stakeholders to gather, analyze, and document business requirements for ERP systems.

Translate business needs into functional specifications and work closely with technical teams to ensure accurate implementation.

Conduct gap analysis between current processes and ERP capabilities.

Support ERP configuration, testing, and deployment activities.

Facilitate workshops, training sessions, and user acceptance testing (UAT).

Provide post-implementation support and continuous improvement recommendations.

Skills & Experience

Proven experience as a Business Analyst in ERP implementation projects (e.g., SAP, Oracle, Microsoft Dynamics, NetSuite).

Strong understanding of business processes across finance, supply chain, HR, or manufacturing.

Excellent stakeholder management and communication skills.

Ability to create detailed documentation, process maps, and functional specifications.

Familiarity with project management methodologies (Agile, Waterfall) is a plus.

What We Offer

Competitive salary and benefits package.

Opportunity to work on transformative ERP projects.

Collaborative and innovative work environment.

Professional development and career growth."
89208217,Senior Business Analyst,Anglicare,https://www.seek.com.au/job/89208217?type=standard&ref=search-standalone&origin=jobCard#sol=000343d9c3b6e1d191189c65ab9296de46d92b37,5h ago,5.0,2025-12-17T23:00:00+00:00,"Macquarie Park, Sydney NSW (Hybrid)",Strategy & Planning (Consulting & Strategy),Contract/Temp,,"Transform lives, every single day



Do you want a career that means more? At Anglicare Sydney, we bring the strength, the support and the strategy to make it happen.

We're a well-respected not-for-profit that's been serving society's most vulnerable for more than 160 years. Each year, we achieve life-changing outcomes for more than 40,000 people across NSW. As we continue to grow and evolve, our For Life program is a key initiative supporting consistent, high-quality experiences for residents and staff across our retirement villages.

Your opportunity

12 month Contract - Based in Macquarie Park with travel around Sydney

As our Senior Business Analyst, you will lead the definition, documentation and coordination of onboarding for the For Life program. In this role you will work closely with stakeholders to gather requirements, map processes, and develop role-specific onboarding and induction content and Standard Operating Procedures in partnership with instructional designers.

Reporting to the For Life Program Manager you'll apply strong judgement, systems thinking and stakeholder management skills to navigate complexity, align priorities and deliver clear, practical outputs that support business readiness and change.

With integrity and resilience, you will:

Define role-based onboarding and induction requirements across diverse roles and tailor onboarding by position

Facilitate discussions and workshops to gather, validate and document business requirements

Map and document new onboarding processes and Standard Operating Procedures

Analyse processes, data and artefacts to identify risks, opportunities and improvements

Apply strategic judgement to balance competing stakeholder needs and priorities

Engage extensively with operations, village and project teams, vendors, systems and Digital & Technology teams

Coordinate and drive delivery of documentation, process and onboarding outputs

Develop high-quality documentation including business processes, procedures and flowcharts

Support implementation where required

Contribute to training, coaching and documentation to support change in collaboration with Change Managers

Ensure solutions align with regulatory, compliance, security and organisational standards

Contribute to a strong safety culture in line with WHS and WHSIMS requirements

What you'll bring

You are a senior, people-centred Business Analyst who thrives in complex environments and brings clarity, structure and empathy to stakeholder engagement. You are confident navigating ambiguity and influencing outcomes without formal authority.

You will also need:

7+ years' experience as a Business Analyst delivering business projects

Proven experience leading requirements gathering, process mapping and documentation

Exceptional stakeholder engagement and communication skills across all levels

Strong facilitation skills and confidence leading workshops and discussions

Ability to apply systems thinking, sound judgement and prioritisation

High-quality documentation and writing skills with strong attention to detail

Ability to navigate complex or politically sensitive environments with diplomacy

Experience contributing to business cases, discovery phases and solution design

Demonstrated ability to work independently and collaboratively in project teams

Ideally, you will also have:

Experience in aged care, community services, hospitality or customer service environments

Experience supporting end-to-end implementations including testing, training and transition

Why Anglicare?

We provide meaningful opportunities and choice - for the individuals and communities we support and the dedicated people who make it happen.

At Anglicare, you'll be part of a purpose-driven organisation where your work has real impact. You'll enjoy flexibility, professional trust and the opportunity to contribute to initiatives that strengthen communities and improve lives.

Some of the benefits you will enjoy include:

Salary packaging to increase your take-home pay

Hybrid work flexibility

Meaningful, organisation-wide impact

Ongoing professional development opportunities

Discounts with 400+ retailers

Employee Assistance Program and Fitness Passport for you and your family

Are you ready for a career that means more?

To apply, please click the 'Apply' button. All applicants will receive a response.

Anglicare is as wonderfully diverse as the customers and communities we support. While guided by our Christian values, we welcome people of all backgrounds who share our commitment to serving others. We strongly encourage applications from Aboriginal and Torres Strait Islander peoples, and people of all ages, genders, abilities and cultural backgrounds.

Disclaimer: We do not accept unsolicited agency resumes and are not responsible for any fees related to unsolicited resumes.

Please note: Our Talent Acquisition team will be taking a well-deserved break from 25 December 2025 and will return on Monday, 5 January 2026. We look forward to reviewing your application upon our return.

Wishing you a safe, restful, and joyful Festive Season."
