Job ID,Job Title,Company,Detail URL,Posted Label,Hours Old,Posted Datetime (Local),Location,Category,Work Type,Salary,Ad Text
90892039,Head of Estimating,Rawson Group,https://www.seek.com.au/job/90892039?type=standard&ref=search-standalone&origin=jobCard#sol=287bc995b255d87558b0a04338a2a1bf3452e2e2,1h ago,1.0,2026-03-12T04:00:00+00:00,Sydney NSW (Hybrid),Estimating (Construction),Full time,,"Company description:



For over 45 years, Rawson Group has helped thousands of Australians make their dream home a reality, taking pride in our beautiful designs and quality build.

From humble beginnings in country NSW, we have grown to be one of the largest and most trusted builders and land developers in NSW and the ACT.



Job description:



About the role:

Rawson Group are searching for a senior leader to join us as the Head of Estimating. Where you will lead the strategic direction, governance and performance of the estimating function across Rawson Group. This is a senior leadership opportunity to shape the future of estimating at Rawson Group and influence outcomes at both operational and strategic levels. Reporting to the General Manager, Operations, this role is responsible for building a best‑in‑class capability that strengthens commercial outcomes, supports margin discipline, improves operational efficiency and enables scalable growth. You'll provide leadership across our Sales, Production, Masters Estimating & Cost Planning divisions, ensuring consistent methodology, accurate data, aligned systems and processes across the business.

A key focus of the role is establishing a high‑performing estimating operating model that embeds continuous improvement and lifts the maturity of the function. You'll drive collaboration across internal teams and external partners, ensuring the estimating function is tightly integrated with broader business objectives and project delivery requirements.

Does this sound like the next step in your career? If so, Apply now!

Why Join Us?

More than a place to work, Rawson Group is a place to grow. Join our team and you'll be rewarded with:

Hybrid work balance of Wednesday & Friday WFH
Optional 5 weeks paid leave
Friendly, social and collaborative team environment
Company Wide Reward and Recognition Platform, where points are redeemable for cash vouchers or days off
Recruitment Referral Program - up to $5000
Discount on home builds and land packages
Access to our employee assistance program for you and your family
Paid parental leave
Gym membership discounts


Rawson Group is proud to be ranked as the 5th largest detached home builder in N.S.W. & A.C.T and we're still growing! We believe our people are key to success. We foster a culture of appreciation, support, and internal growth. We promote from within, invest in training and development, and offer flexible work-from-home options to help you thrive both professionally and personally. Apply today and be part of something great!

Key Responsibilities:

Define and execute the Group's estimating strategy aligned to Rawson's commercial, operational, and growth objectives.
Establish a long-term vision for the estimating function, transitioning from transactional estimating to a strategic commercial capability.
Develop and implement a best-practice estimating framework across sales, production, and cost planning.
Embed an Ideal Operating Model (IOM) for estimating, including structure, capability, capacity, systems, and governance.
Lead and integrate the sales estimating, production estimating, cost planning, and masters & systems teams to operate as a cohesive, high-performing function.
Build leadership capability & oversee workload planning within the estimating leadership team through coaching, mentoring, and performance management.
Establish and maintain margin governance frameworks across sales and production estimating.
Provide oversight of estimating assumptions, contingencies, risk allowances, and commercial levers.
Build strong relationships with external consultants and offshore partners to enhance capability and performance.
Develop and implement a comprehensive reporting framework for estimating performance, productivity, accuracy, and margin outcomes.

About You:

Qualifications:

Tertiary:

Bachelor's degree in construction management, Quantity Surveying, Engineering, Commerce, or a related discipline (preferred).
Postgraduate qualification in Business, Project Management, Construction Economics, or MBA (not-essential).

Professional:

Experience in a similar role is essential.
RICS (Royal Institute of Chartered Surveyors) is desirable.
AIQS (Certified Quantity Surveyor or equivalent) is desirable.

Skills:

Proven and strong experience with liaising with senior stakeholders of an organisation.
Ability to analyse and resolve complex problems which may require the involvement of multiple parties.
Senior leadership experience in estimating, cost planning, or related disciplines.
Proven ability to design and implement high-level operating models and process frameworks.
Strong commercial acumen with demonstrated success in margin management and cost governance.
Experience leading multi-disciplinary teams and driving organisational change.
Advanced stakeholder management and executive communication capability.
Experience working with offshore or external delivery models.

Attributes:

High level communication, influencing and negotiation skills in stakeholder management to achieve positive outcomes.
Ability to work under pressure, resilience and ""drive"" to succeed when faced with obstacles.
Strong analytical and strategic thinking skills with the ability to translate data into commercial insight Work as part of a broader team.

Everyone belongs at Rawson Group

Diversity, equity, inclusion and belonging are key to realising our purpose of building better together. We recognise all individuals, regardless of their gender, cultural origin, LGBTQIA+, disability, or neurodiversity and acknowledge that those from underrepresented groups may face unique challenges in the job application process. We encourage all candidates to apply - your unique experiences and perspectives is what makes us great. Please reach out to us, opportunities@rawson.com.au if you have any accessibility requirements throughout the application process - we will provide reasonable adjustments for individuals to ensure a smooth application process."
90891998,APAC E2E Solutions Manager,Microsoft,https://www.seek.com.au/job/90891998?type=standard&ref=search-standalone&origin=jobCard#sol=d1a0f24ef8330de8b676f11f49ffeaeffc44a84a,1h ago,1.0,2026-03-12T05:00:00+00:00,Sydney NSW,Management (Information & Communication Technology),Contract/Temp,Subsidised health insurance + stock discounts,"Overview


Cloud Operations + Innovation (CO+I) is the team behind one of the world’s largest Cloud Infrastructures, responsible for powering all Microsoft online Products and Services as well as powering Microsoft’s “Cloud First” mission. Our focus is on smart growth, high efficiency, and delivering a trusted experience to customers and partners worldwide, and we are looking for passionate, high energy program managers to help achieve that mission.

If you want to have fundamental impact on how Microsoft’s Cloud is deployed and operated globally, want to be involved with one of the most strategically important teams at Microsoft, if strong technical and business acumen, leadership, creativity, and out of the box thinking are some of the skills you bring to the table - this job is for you!

We are looking for experienced technical program managers with deep technical and business expertise, extraordinary leadership and demonstrated large-scale technical program management success. You should have exceptional industry knowledge, technical depth in the execution and delivery of datacenters, and have the executive presence to lead complex and time sensitive initiatives.In alignment with our Microsoft values, we are committed to cultivating an inclusive work environment for all employees to positively impact our culture every day.

Responsibilities

Lead Strategic Discovery & Intake - Drive structured discovery for complex or ambiguous business needs, articulating the business problem, aligning stakeholders, and translating requirements into actionable solution roadmaps.

Develop Innovative, Actionable Solutions - Design creative, scalable solutions that ensure measurable outcomes such as improved delivery predictability, schedule efficiency, and improved business outcomes.

Communicate with Impact - Deliver clear, concise, and compelling communication across executive stakeholders and project teams.Use storytelling and visual dashboards to foster alignment and transparency.

Lead Cross-Functional, Global Teams - Manage geographically dispersed teams, building strong connections across engineering, operations, finance, and business units.Drive collaboration, resolve conflicts, and champion change management for successful adoption.

Drive Business Results Through Data - Establish and monitor KPIs and OKRs tied to business goals.Apply data-driven insights to optimize timelines, quality, and cost performance.

Apply Technical & Market Expertise - Maintain fluency in technical architecture, integration points, and competitive ecosystem trends.Use this knowledge to anticipate challenges and deliver differentiated solutions.

Champion Process Excellence & Automation - Continuously improve delivery processes and tools, leveraging automation and AI-driven analytics.Implement predictive insights and workflow automation to enhance scalability and efficiency.

Enable Intelligent Reporting & Governance - Design and implement self-service BI dashboards and reporting frameworks.Ensure data accuracy, compliance, and security across all solution delivery metrics.

Manage Ambiguity & Risk - Navigate projects with unclear requirements and incomplete data through proactive risk management and scenario planning.Maintain resilience and adaptability in dynamic business environments

Qualifications

Bachelor’s Degree and 4+ years of technical project / program management experience, or equivalent experience.

2+ years experience managing cross-functional and/or cross-team projects.

Full lifecycle technical program management methodology (PMP, Prince 2, etc) experience planning and managing scope, schedule, budget, quality, people, risk and communications

Experience in organizational change management and business process improvement

Should have a mix of technical and program management skills and experience

Strong interpersonal, communication and presentation skills

While not required, we also look for the following  Preferred Qualifications:

Demonstrates deep subject matter expertise on key functional areas of mechanical, electrical, networking, construction, or building automation systems

8+ years of program management / datacenter construction / network engineering experience; self-motivated, confident working at a senior executive level and comfortable working in a matrixed organization

6+ years experience managing cross-functional and/or cross-team projects.

Professional PM certification, PMP, ESi, PMI, Prince 2 or equivalent

Demonstrably clear leadership skills and experience working with large, diverse teamsUnderstanding of business and financial objectives and plans accordingly

Exceptional executive level communication and engagement skillsAbility to work in a flexible, fast-paced environment

Track record of coaching teams and mentoring others in planning, organizing and coordinating their work.

The ideal candidate possesses the following:

MBA or equivalent advanced degree

Experience applying Earned Value Management techniques to measure project performance

Experience managing large scale construction or network infrastructure projects

Exceptional problem identification and problem resolution skills

Understanding of contract language

Background Check Requirements: Ability to meet Microsoft, customer and/or government security screening requirements are required for this role. These requirements include, but are not limited to the following specialized security screenings: Microsoft Cloud Background Check: This position will be required to pass the Microsoft Cloud background check upon hire/transfer and every two years thereafter.

#COICareers 

This position will be open for a minimum of 5 days, with applications accepted on an ongoing basis until the position is filled.

Microsoft is an equal opportunity employer. All qualified applicants will receive consideration for employment without regard to age, ancestry, citizenship, color, family or medical care leave, gender identity or expression, genetic information, immigration status, marital status, medical condition, national origin, physical or mental disability, political affiliation, protected veteran or military status, race, ethnicity, religion, sex (including pregnancy), sexual orientation, or any other characteristic protected by applicable local laws, regulations and ordinances. If you need assistance with religious accommodations and/or a reasonable accommodation due to a disability during the application process, read more about requesting accommodations."
90891998,APAC E2E Solutions Manager,Microsoft,https://www.seek.com.au/job/90891998?type=standard&ref=search-standalone&origin=jobCard#sol=0a3d11023ea1ddb3f38291055ee69e5355cc3e52,1h ago,1.0,2026-03-12T05:00:00+00:00,Sydney NSW,Management (Information & Communication Technology),Contract/Temp,Subsidised health insurance + stock discounts,"Overview


Cloud Operations + Innovation (CO+I) is the team behind one of the world’s largest Cloud Infrastructures, responsible for powering all Microsoft online Products and Services as well as powering Microsoft’s “Cloud First” mission. Our focus is on smart growth, high efficiency, and delivering a trusted experience to customers and partners worldwide, and we are looking for passionate, high energy program managers to help achieve that mission.

If you want to have fundamental impact on how Microsoft’s Cloud is deployed and operated globally, want to be involved with one of the most strategically important teams at Microsoft, if strong technical and business acumen, leadership, creativity, and out of the box thinking are some of the skills you bring to the table - this job is for you!

We are looking for experienced technical program managers with deep technical and business expertise, extraordinary leadership and demonstrated large-scale technical program management success. You should have exceptional industry knowledge, technical depth in the execution and delivery of datacenters, and have the executive presence to lead complex and time sensitive initiatives.In alignment with our Microsoft values, we are committed to cultivating an inclusive work environment for all employees to positively impact our culture every day.

Responsibilities

Lead Strategic Discovery & Intake - Drive structured discovery for complex or ambiguous business needs, articulating the business problem, aligning stakeholders, and translating requirements into actionable solution roadmaps.

Develop Innovative, Actionable Solutions - Design creative, scalable solutions that ensure measurable outcomes such as improved delivery predictability, schedule efficiency, and improved business outcomes.

Communicate with Impact - Deliver clear, concise, and compelling communication across executive stakeholders and project teams.Use storytelling and visual dashboards to foster alignment and transparency.

Lead Cross-Functional, Global Teams - Manage geographically dispersed teams, building strong connections across engineering, operations, finance, and business units.Drive collaboration, resolve conflicts, and champion change management for successful adoption.

Drive Business Results Through Data - Establish and monitor KPIs and OKRs tied to business goals.Apply data-driven insights to optimize timelines, quality, and cost performance.

Apply Technical & Market Expertise - Maintain fluency in technical architecture, integration points, and competitive ecosystem trends.Use this knowledge to anticipate challenges and deliver differentiated solutions.

Champion Process Excellence & Automation - Continuously improve delivery processes and tools, leveraging automation and AI-driven analytics.Implement predictive insights and workflow automation to enhance scalability and efficiency.

Enable Intelligent Reporting & Governance - Design and implement self-service BI dashboards and reporting frameworks.Ensure data accuracy, compliance, and security across all solution delivery metrics.

Manage Ambiguity & Risk - Navigate projects with unclear requirements and incomplete data through proactive risk management and scenario planning.Maintain resilience and adaptability in dynamic business environments

Qualifications

Bachelor’s Degree and 4+ years of technical project / program management experience, or equivalent experience.

2+ years experience managing cross-functional and/or cross-team projects.

Full lifecycle technical program management methodology (PMP, Prince 2, etc) experience planning and managing scope, schedule, budget, quality, people, risk and communications

Experience in organizational change management and business process improvement

Should have a mix of technical and program management skills and experience

Strong interpersonal, communication and presentation skills

While not required, we also look for the following  Preferred Qualifications:

Demonstrates deep subject matter expertise on key functional areas of mechanical, electrical, networking, construction, or building automation systems

8+ years of program management / datacenter construction / network engineering experience; self-motivated, confident working at a senior executive level and comfortable working in a matrixed organization

6+ years experience managing cross-functional and/or cross-team projects.

Professional PM certification, PMP, ESi, PMI, Prince 2 or equivalent

Demonstrably clear leadership skills and experience working with large, diverse teamsUnderstanding of business and financial objectives and plans accordingly

Exceptional executive level communication and engagement skillsAbility to work in a flexible, fast-paced environment

Track record of coaching teams and mentoring others in planning, organizing and coordinating their work.

The ideal candidate possesses the following:

MBA or equivalent advanced degree

Experience applying Earned Value Management techniques to measure project performance

Experience managing large scale construction or network infrastructure projects

Exceptional problem identification and problem resolution skills

Understanding of contract language

Background Check Requirements: Ability to meet Microsoft, customer and/or government security screening requirements are required for this role. These requirements include, but are not limited to the following specialized security screenings: Microsoft Cloud Background Check: This position will be required to pass the Microsoft Cloud background check upon hire/transfer and every two years thereafter.

#COICareers 

This position will be open for a minimum of 5 days, with applications accepted on an ongoing basis until the position is filled.

Microsoft is an equal opportunity employer. All qualified applicants will receive consideration for employment without regard to age, ancestry, citizenship, color, family or medical care leave, gender identity or expression, genetic information, immigration status, marital status, medical condition, national origin, physical or mental disability, political affiliation, protected veteran or military status, race, ethnicity, religion, sex (including pregnancy), sexual orientation, or any other characteristic protected by applicable local laws, regulations and ordinances. If you need assistance with religious accommodations and/or a reasonable accommodation due to a disability during the application process, read more about requesting accommodations."
90891714,Senior Consultant,Harwell Consulting,https://www.seek.com.au/job/90891714?type=standard&ref=search-standalone&origin=jobCard#sol=2fa7a5826ea01a145d089a8d98278e24c1bf1ce3,2h ago,2.0,2026-03-12T04:00:00+00:00,Sydney NSW (Hybrid),Consultants (Information & Communication Technology),Full time,"$150,000 - $210,000","FloQast Practice Lead – ANZ | Build It. Own It. Lead It.




You have spent years delivering finance transformation work at a high standard. You know the methodology, you know how to manage a CFO, and you know you are ready for more than the next project.




This is the role that gives you that.




A global finance technology consultancy is building their FloQast practice in Australia, and they need someone to lead it. Not manage it once someone else has built it... lead it from inception. That means setting the methodology, owning delivery, building client relationships, supporting commercial conversations, and scaling a team beneath you.




The business has doubled year-on-year since entering the APAC market. The platform is credible, the clients are corporate and enterprise, and the APAC director is commercially sharp and backing this hire properly.




What you bring:

CA qualification or equivalent (non-negotiable)
Demonstrated experience leading finance technology or transformation engagements end-to-end
Commercial confidence (you can talk to a CFO, shape a proposal, and think about growth)




The honest reality: this is a build role. There is no fully-formed team waiting for you. If you need structure around you to operate, this will not suit you.




Base salary $150,000 – $210,000 + 12% super + discretionary bonus + private healthcare + benefits package. Sydney-based, hybrid.




Send your CV to Danny (danny@harwell.au) or call 0468 047 809 for a confidential conversation. Your CV doesn't need to be current, send whatever you have."
