Job ID,Job Title,Company,Detail URL,Posted Label,Hours Old,Posted Datetime (Local),Location,Category,Work Type,Salary,Ad Text
89288691,Digital Engineering Lead,AusNet Services,https://www.seek.com.au/job/89288691?type=standard&ref=search-standalone&origin=jobCard#sol=706b6060375dd8f420454f94ad7e1508acd977f9,7h ago,7.0,2025-12-22T22:00:00+00:00,Melbourne VIC,Engineering Drafting (Engineering),Full time,,"Are you ready to make a real impact in Australia’s energy transition?




At AusNet, we play a key role in the energy transition and providing essential energy to Victorian households and businesses.




Help us lead the way, while enriching your career with real people who encourage you to bring your best and make real impact – for your career, our communities and Australia’s clean energy future.




About the role




The Western Renewable Link (WRL) is one of Victoria’s major transmission projects and a critical part of the state’s energy transition. As a Digital Engineering Lead, this role will see you at the forefront of delivering the Project Information Model and Asset Information Model in collaboration with WRL’s EPC contractor, ensuring alignment with the project’s Information Management Plan (IMP).




You will lead the implementation and development of WRL’s Digital Engineering (DE) technologies and solutions, driving adoption across the project and among stakeholders. It’s an opportunity to shape how cutting-edge digital practices transform project delivery.




Key Responsibilities




Lead the creation and successful handover of the Asset Information Model

Manage Digital Engineering (including BIM & GIS) operations, ensuring EPC contractor alignment with the project’s Information Management Plan (IMP)

Collaborate with WRL functional teams and the EPC contractor to develop innovative DE use cases (e.g., Issue Tracking, 4D/5D) and capture lessons learned

Provide technical DE support to WRL teams and deliver tailored training sessions for WRL and stakeholders, including upstream clients, in partnership with the EPC contractor

Shape the project IMP by incorporating DE strategy and execution updates

Contribute to the development of DE processes and standards for future major projects

Build and maintain strong stakeholder relationships to influence and drive DE success

Manage DE technology vendors and service providers to ensure optimal performance

Review and approve DE-related claims from subcontractors and suppliers







What You’ll Bring




You have proven experience managing and implementing Digital Engineering (DE) processes on large, multi-disciplinary engineering projects. Your working knowledge of design and construction management practices, processes, and procedures is complemented by familiarity with key standards such as ISO19650, SOCI, and other DE-specific frameworks.




You’re confident in using DE collaboration and coordination tools, including Autodesk Construction Cloud, Navisworks Manage, Revizto, Synchro, and Aconex, with hands-on experience in implementing ACC Build highly desirable.




Qualifications & Certifications




Tertiary degree (bachelor’s or above) in Engineering/Science is desirable




Skills & Experience




7+ years of experience in delivering large complex AEC projects, including 3+ years of experience in DE.

Expertise in design authoring tools such as Revit, OpenBuildings Designer, InfraWorks, Plant3D, or Civil3D

Knowledge of GIS and digital solutions for design and construction management

Working knowledge in Desing and Construction management practice, process and procedures

Proven stakeholder management skills to facilitate collaboration and drive delivery outcomes

Working knowledge in the extraction, transformation and visualisation of Digital Engineering data







Please note, we will not be engaging in Recruitment agencies for this role, please apply directly!




A real place to belong.




We celebrate unique voices, refreshing perspectives and diversity in our team. Engage and connect through our social club, wide range of events or by joining one of our Employee Network Groups.




We believe in more than just competitive pay. Here’s what sets us apart:




Leave: more than typical personal leave and a generous 14 weeks of paid parental leave, with no minimum service.

Community giving: a paid day to volunteer with our social impact partner, Foodbank, or for a cause that matters to you.

Perks: we offer all the other perks you’ve come to expect like purchased leave, income protection insurance, novated leasing, corporate discounts, private health cover discounts and more




As an industry in transformation, we’re excited by the possibilities ahead.




So, if you’re passionate about our purpose and committed to making real progress, bring your energy and join AusNet. Together, we can shape a new way forward."
89288605,Control System Engineer,Mescada,https://www.seek.com.au/job/89288605?type=standard&ref=search-standalone&origin=jobCard#sol=14eec544817f5854bf8b2fa0e302b0d353ba6fbb,7h ago,7.0,2025-12-22T22:00:00+00:00,Melbourne VIC,Electrical/Electronic Engineering (Engineering),Full time,,"Company
An opportunity has arisen for a control system engineer within an exciting organisation. Our technical competency has led us to be a premier automation and control company. As partners with key system suppliers and a substantial customer base we have new requirements to fill automation roles in pharmaceuticals, water, manufacturing, oil, gas and mining.
 
Role
Reporting to the Control system manager you will have assistance from our lead engineers but would be required to work independently and take on the responsibilities of projects and customers. The role will be interacting directly with our clients and managing these relationships. You would require a personable attitude, willingness to learn, independence and strong problem solving skills to solve and implement control system solutions according to customer requirements. This opportunity's remuneration will depend on experiences and all levels of experience should apply.
 
To be considered for this role you should have:

Tertiary degree qualified or substantial industry experience

Electrical experience is highly desirable

Previous experience with Siemens PCS7, Step 7, TIA Portal, WinCC OA and their other products is highly desirable

Previous experience with Rockwell PLCs and HMIs and their other products is highly desirable

Experience with other control systems such as Schneider, Yokogawa, Emerson and Wonderware is also desirable

Industry experience within the process industry

Database experience is very useful as well

Computer and networking skills

Visual Basic, C Sharp and C/C++ programming skills"
89288438,Senior Data Engineer,Profectus Australia Pty ltd,https://www.seek.com.au/job/89288438?type=standard&ref=search-standalone&origin=jobCard#sol=f2a7a9c7200a2e2d76619cb3cb585a03fb483063,7h ago,7.0,2025-12-22T22:00:00+00:00,Melbourne VIC (Hybrid),Engineering - Software (Information & Communication Technology),Full time,,"About Profectus

Profectus’ Core Values are Trust, Integrity, Relationships, Teamwork, Innovation and Results.

Profectus exists to Deliver extraordinary compliance and analytical solutions that enrich organisations and aspires to Embed Commercial Truth to Fuel the World of Business. Profectus aims to reach its’ new Vision by transforming its’ Operating Model through the Technology Roadmap and aiming to achieve an “Augmented Machine Learning” future state.

Your new role

We are seeking an experienced Senior Data Engineer to design, deliver, and continuously improve reliable, scalable, and secure data solutions across the organisation. In this role, you will ensure timely and accurate data availability, strengthen data governance and automation, and provide technical leadership to uplift our data engineering capability.

Working closely with operational and technology teams, you’ll balance “build fast” with “build right,” supporting urgent business needs while contributing to a long-term strategic data roadmap.

Some of the key duties of this role include:

Design, build, optimise, and maintain scalable, secure, and high-performance data pipelines and architectures across multiple platforms.

Provide timely, up-to-date data to business teams and resolve any process failures within 24 hours.

Implement and enforce data engineering best practices across CI/CD, testing, monitoring, documentation, and version control.

Collaborate closely with analysts, engineers, and operational teams to support data ingestion, accessibility, and quality.

Drive data governance, security, and compliance standards across all data solutions.

Optimise data workflows for performance, scalability, and cost efficiency, reducing technical debt through automation.

Mentor and guide junior data engineers, conduct code reviews, and provide technical leadership.

Contribute to the strategic data roadmap and support delivery of analytics and reporting initiatives.

Work effectively in agile sprints, consistently meeting delivery commitments.

Maintain compliance with technology and cybersecurity policies.

You will have:

Qualifications & Experience

Bachelor’s or Master’s degree in Computer Science, Engineering, or a related field.

5+ years’ experience in data engineering, including at least 2 years in a senior role.

Core Technical Skills

Expert knowledge of data architecture, distributed systems, and large-scale data platforms (e.g. Databricks, Snowflake, Spark, Kafka).

Strong experience designing and building data pipelines using technologies such as Databricks, Snowflake, and Azure Data Factory.

Proficiency in Python and other scripting or development languages for data manipulation.

Hands-on experience with relational and non-relational databases (Postgres, MS SQL Server, Redis).

Practical understanding of iPaaS solutions (e.g. Informatica, Fivetran, Boomi).

Strong knowledge of ETL processes, data validation automation, and data lifecycle management.

Experience with Git-based version control and CI/CD practices.

Familiarity with Linux environments and cloud platforms, preferably Azure.

Proven ability to work in agile environments and meet tight delivery deadlines.

Bonus Skills (Nice to Have)

Experience using OpenAI APIs or other LLM platforms.

Exposure to MLOps and deploying data science models into production.

Experience integrating LLMs such as OpenAI (GPT-4/5), Claude, or Llama.

Familiarity with RAG frameworks (LangChain, LlamaIndex, Haystack).

Knowledge of prompt engineering, embeddings, and AI-powered search solutions.

We will offer you

Working at Profectus Group will allow you to enjoy many employee benefits, an inclusive and engaged culture and the opportunity to grow and develop with a clear plan mapped out. Below are some of our benefits:

A values-based workplace, transcending to client interactions 

Variety of employee benefits including paid parental leave, flexible work options and an excellent Employee Assistance Program 

Meaningful learning and development programs that are tailored to your professional development areas/needs 

Quarterly goal setting and review sessions that are linked to company goals

Clear competency frameworks so you know what is expected of you and what skills you require, also identifying any training requirements

Diversity Policy and Working Group, current activity is putting into place a Reconciliation Action Plan

Along with all these wonderful benefits, Profectus Group also has a mentoring program and wellbeing initiatives, including free group personal training sessions and the opportunity to contribute to charity events.

If this sounds like you and you would like more information on the role, please apply today by sending through a copy of your resume and cover letter outlining why we should select you.  

Compliance requirements for this role include Australian Citizenship or Permanent residency and a Police check.

Profectus Group respects people as individuals and values their differences.  It is committed to an inclusive and diverse work environment.  We encourage people from all backgrounds to apply."
89277876,Controls Software Engineer - PLC / Machine Control,TMR Recruitment Services Pty Ltd,https://www.seek.com.au/job/89277876?type=standard&ref=search-standalone&origin=jobCard#sol=6509ef5cd80fdbd3a04eb35e7aca03dd195b1c7a,9h ago,9.0,2025-12-22T20:00:00+00:00,"Bayswater, Melbourne VIC",Electrical/Electronic Engineering (Engineering),Full time,"$100,000 – $120,000 per year","This isn't HVAC or BMS work.

It's PLC-based machine control for large-scale, oil-free centrifugal chillers used in data centres, industrial facilities and critical infrastructure worldwide.

If you enjoy Structured Text, safety-critical logic and product engineering done properly, this role will make sense very quickly.

You'll join a small, focused controls team developing control software for high-power rotating equipment where performance, protection logic and system stability genuinely matter. This is lab-based product engineering, not site firefighting.

WHY THIS ROLE IS DIFFERENT

Work on industrial machines, not building automation

Controls software for high-value equipment where failures aren't an option

Small, capable team where your work directly impacts a global product

Structured engineering environment with ISO9001 practices, testing and controlled releases

Collaboration with international engineering teams across multiple regions

Clear exposure to deeper controls, embedded systems and platform architecture

WHAT YOU'LL DO

Develop and test PLC control software using Structured Text (IEC 61131-3)

Design and maintain state machines, sequencing logic, control loops and safety interlocks

Work on protection logic, system behaviour and stability under real operating conditions

Lab-based commissioning, validation and troubleshooting

Support disciplined documentation and version control processes

Collaborate with global engineering teams on platform evolution

Occasional domestic or international project travel (planned, not constant)

WHAT YOU'LL NEED

2–3 years' experience in PLC controls or industrial automation

Strong Structured Text fundamentals and FBD (ladder-only backgrounds won't suit)

Experience with complex machine control and safety-critical systems

Background in Siemens, Rockwell/Allen-Bradley, Schneider or similar PLC platforms

Comfortable working in a structured, quality-driven engineering environment

Clear communicator with a methodical approach to problem-solving

NICE TO HAVE

Exposure to C#, Python or Java (tools, diagnostics, IPC-based logic)

Beckhoff (TwinCAT), CODESYS or other soft PLC / IPC-based control environments

Experience with Modbus, BACnet, CAN or similar protocols

Background in machinery, OEMs, manufacturing, process control, F&B, pharma or water

If you want controls engineering where performance, safety and quality genuinely matter, not endless maintenance tickets or building automation — let's talk.

Apply now or contact Trudi at TMR Recruitment for a confidential discussion.

Full Australian working rights required."
