Job ID,Job Title,Company,Detail URL,Posted Label,Hours Old,Posted Datetime (Local),Location,Category,Work Type,Salary,Ad Text
90032843,Automation Specialist,Abergeldie Complex Infrastructure,https://www.seek.com.au/job/90032843?type=standard&ref=search-standalone&origin=jobCard#sol=692d2c0954caa2e1b12904aae47a8b08b5acf3d0,1h ago,1.0,2026-01-30T06:00:00+00:00,"Sydney Olympic Park, Sydney NSW (Hybrid)",Other (Information & Communication Technology),Full time,Competitive salary + annual bonus,"About the West Region Delivery Team

The West Region Delivery Team (WRDT) is delivering one of Sydney Water’s most significant infrastructure programs, with a circa $2bn pipeline of works over 10 years.

One of our core strategic priorities is to improve how work is done, using data, automation and artificial intelligence (AI) to drive efficiency and value. This is a rare opportunity to drive and embed automation at scale across a mature and complex delivery environment.

About the opportunity

In this role you will work across the program, partnering closely with business and technical stakeholders to identify, design and implement practical automation and AI enabled solutions that reduce manual effort, streamline workflows and uplift how work is delivered. 

This is a hands-on role for someone who enjoys getting close to the work, understanding how processes really operate, and turning that insight into scalable, future-ready automation and AI use cases.

Analyse complex business processes and identify opportunities for automation and optimisation.

Partner with business SMEs to document current and future-state processes, with a strong focus on reducing manual and repetitive work.

Design, build and implement robust, reusable automation solutions.   

Work hands-on with tools such as Python, SQL, Power BI and VBA and emerging AI tools to design and deliver automation initiatives.

Conduct cost-benefit and feasibility assessments to prioritise initiatives with the greatest impact.

Develop documentation, standards and training materials to support adoption and knowledge transfer

What you’ll bring to the team

You are an experienced technical or automation analyst who thrives in complex, fast-moving environments and enjoys working at the intersection of business, data and engineering.  You’ll bring:

Strong analytical thinking and the ability to quickly understand how work actually gets done.

Hands-on experience delivering automation solutions in real business environments.

Well-developed stakeholder engagement and communication skills.

A genuine interest in automation, AI and data as drivers of business improvement.

Extensive experience in Python, VBA and/or other similar tools.

Experience with data visualisation tools such as Power BI

Experience working within construction, engineering or major infrastructure environments is highly regarded

A tertiary qualification in Computer Science, Information Technology, Engineering, Business Analytics, or equivalent practical experience.

 Why join WRDT

Work on a long-term, complex infrastructure program with real scale and impact.

Influence how automation and AI is embedded across a large and evolving digital ecosystem.

You will have end-to-end ownership, from identifying opportunities through to building and implementation.

Deliver solutions that genuinely improve efficiency, reduce cost and create value for our client

Ready to make an impact?

If this sounds like your next step, apply now or contact Hayley Urriola at hurriola@abergeldie.com for a confidential discussion.

 #bestpeople #bestdelivery #bestplanning"
90032138,Data Observability Engineer,Pinpoint Talent,https://www.seek.com.au/job/90032138?type=standard&ref=search-standalone&origin=jobCard#sol=51adf39086d0acdb17ad7f8f92bb2628c5c3832c,1h ago,1.0,2026-01-30T06:00:00+00:00,Canberra ACT,Army (Government & Defence),Contract/Temp,,"Pinpoint Talent is supporting a Defence client in seeking an experienced Data Observability Engineer to join a highly technical, mission-focused environment in Canberra.
This role supports Army’s digital network integration mission and plays a critical part in enabling systems-of-systems integration, test and evaluation, and experimentation across Land, Joint and Coalition capability boundaries.
  
Canberra | 12 month contract + 2x 12 month extensions | NV1 Clearance or above Mandatory
  
The position is a senior, hands-on technical role focused on the design, development, implementation, and ongoing support of data observability, monitoring, and analytics tooling. You will lead the development and maturation of data observability frameworks and processes that underpin integration testing, risk reduction, and capability validation activities. The role operates at the intersection of data engineering, communications systems engineering, networking, and DevSecOps, within a secure Defence environment.
  
You will design and integrate hardware and software solutions, review technical designs, provide systems integration advice, and support test activities, exercises, and trials. The role also includes contributing to automation and DevSecOps pipelines, producing technical documentation and reports, and providing subject matter expertise across emerging and deployed technologies.
  
Extensive experience in data observability and analytics technologies such as Elastic Stack and NetFlow, strong Linux expertise (particularly Red Hat-based systems), and hands-on experience with DevSecOps environments including CI/CD pipelines and Git-based tooling is essential.
Defence experience is essential.
  
If this sounds like you, APPLY TODAY!
Please reach out to jamie@pinpointtalent.com.au for further information."
90031690,AI Engineer,Morgan McKinley,https://www.seek.com.au/job/90031690?type=standard&ref=search-standalone&origin=jobCard#sol=ebc09e798d3c39fdeeb47ae044016fc522f66641,1h ago,1.0,2026-01-30T06:00:00+00:00,Sydney NSW,Engineering - Software (Information & Communication Technology),Full time,$150000.00 - $200k p.a.,"AI Engineer (Senior)

Sydney/Melbourne

$150-200k

We are seeking a highly experienced AI Engineer with deep technical expertise and strong design thinking skills to help lead and deliver cutting-edge, practical AI solutions across a range of business use cases.

The ideal candidate will be a senior-level AI practitioner who can not only build and implement AI models and systems, but also contribute meaningfully to technical design conversations, mentor other consultants, and help shape best practices for applying AI to real-world application development.

Key Responsibilities

Lead the design, development, and deployment of AI-enabled solutions for specific business use cases, ensuring practical and scalable implementations.

Partner with cross-functional teams (front-end, back-end, and data engineering) to integrate AI capabilities into application development workflows.

Apply and extend modern AI development tools and frameworks to support high-impact projects.

Act as a technical advisor in conversations about AI system architecture, design patterns, and solution trade-offs, not limited to pure coding tasks.

Drive innovation in how AI is applied across software engineering projects, including early-stage ideation, prototyping, and production readiness.

Mentor and coach other consultants and engineers to elevate AI literacy and upskill team members.

Work across both AI engineering and software engineering domains, with a bias toward practical application development and integration.

Translate business problems into actionable AI solutions, balancing speed of delivery with maintainability and performance.

Stay current on advancements in AI technologies and tools, and help evaluate suitability for internal adoption.

Required Skills & Experience

Proven experience as a senior AI engineer or similar role with a strong delivery track record.

Deep understanding of AI/ML technologies, development tools, and frameworks.

Demonstrated experience with both the design and implementation of AI systems in production contexts.

Strong coding skills in languages such as Python, with experience applying AI and ML libraries.

Ability to engage in solution design discussions and make sound technical recommendations.

Experience with software engineering practices, including collaboration with front-end, back-end, and data engineering teams.

A mindset geared toward practical, use-case driven AI delivery rather than theoretical research.

Strong mentoring, communication, and knowledge-sharing capabilities.

Familiarity with modern AI development tooling (e.g., model hubs, generative AI SDKs, LLM APIs, MLOps tooling).

Nice to Have

Experience upskilling technical teams or running internal enablement initiatives.

Background in data engineering or systems integration.

Exposure to cloud-native deployment of AI applications.

Prior consulting experience where translation between business needs and technical execution was central.

Why This Role Matters

This role will be central to accelerating how AI capabilities are designed and delivered across meaningful business solutions. Beyond building models, the successful candidate will influence how teams think about AI engineering, help raise the overall technical capability of the organisation, and ensure AI is applied in ways that generate real value."
90030301,Software Engineer / Control Systems,Six Degrees Executive Pty Ltd,https://www.seek.com.au/job/90030301?type=standard&ref=search-standalone&origin=jobCard#sol=a8b47e447283ae3beba4f9bfaaf0ea57f74b0612,2h ago,2.0,2026-01-30T05:00:00+00:00,"Seven Hills, Sydney NSW (Hybrid)",Electrical/Electronic Engineering (Engineering),Full time,,"We are partnering with a leading Australian Automation and robotics organisation that have been providing smart solutions to the food, industrial and beverage production sectors for over 50 years. 

Working as the Software Engineer you will play a key role in delivering data-driven solutions for industrial automation projects within the fast-moving consumer goods (FMCG) sector. This position requires expertise in integrating OT (Operational Technology) and IT systems, developing scalable software solutions, and ensuring seamless connectivity between plant-floor equipment and enterprise-level systems. The role will involve working at our Seven Hills facility as well as customer sites, which may include occasional weekends and public holidays to support project delivery and commissioning activities.

The role involves:

Design & development of solutions and databases
Integration of PLC's, MES and SCADA systems
Write code for Rockwell Automation, Siemens & TIA portals
Enable real time data gathering and analysis
To be successful in this role you will possess;

Strong background in industrial Automation
Database design and SQL query
PLC programming (Rockwell / Siemens) 
C# & Python for custom applications

If you are an electronics / mechatronics / software engineer with experience and an interest in Automation and robotics then we would love to hear from you. Please click on the Apply now button and we will reply within 48 business hours

Six Degrees Executive acknowledges the Traditional Custodians of the lands on which we work and live. We are also committed to equal opportunity and strive to promote diversity, inclusion, belonging, flexibility, and accessibility in all that we do.

Should you require assistance in your interactions with us or through a recruitment process, please let us know so we can provide adjustments for you."
90029407,AI Engineering Lead,Troocoo,https://www.seek.com.au/job/90029407?type=standard&ref=search-standalone&origin=jobCard#sol=31f232977c007866a7389962f94a0e403e897d49,3h ago,3.0,2026-01-30T04:00:00+00:00,Sydney NSW (Hybrid),Engineering - Software (Information & Communication Technology),Full time,"Up to $200,000 including super","We’re seeking an AI Engineering Lead to join Virgin Australia Group at a pivotal time in their transformation. This role is for a technically strong leader who leads from the front, setting direction, staying hands on, and building high-performing teams that deliver real business impact.

In this role, you’ll bridge deep technical execution with business outcomes, ensuring the AI engineering team delivers high-quality, scalable solutions that support Virgin Australia’s ambition to be the most loved airline.

Your day-to-day will include:
Leading a team of AI engineers, providing technical guidance, mentorship, and clear engineering standards
Owning architectural decisions and ensuring solutions are robust, secure, and fit for long-term use
Staying hands-on where needed to unblock delivery and model best-practice engineering
Partnering closely with senior stakeholders to translate complex technical concepts into clear business outcomes
Driving consistent engineering practices across code quality, testing, deployment, and operational excellence
Identifying and mitigating technical risks before they impact delivery or system reliability
Contributing to broader cross-team technical discussions to share knowledge and improve consistency across the engineering organisation
About You: You’re an experienced AI engineering leader who enjoys solving complex problems and developing people as much as technology. Ideally, you’ll bring:

Proven experience designing, building, and operating AI production-grade systems in complex environments
Demonstrated success leading engineering teams, including mentoring, delivery ownership, and technical decision-making
A strong technical foundation in your area of expertise, with the ability to evaluate emerging tools and trends
Confidence communicating technical trade-offs, timelines, and risks to both technical and non-technical stakeholders
A pragmatic approach to balancing delivery speed with code quality and manageable technical debt
A collaborative mindset and a genuine interest in building high-performing, engaged teams
If you’re passionate about shaping AI platforms, leading talented engineers, and playing a key role in a large-scale, customer-focused organisation, this role offers both challenge and influence in equal measure.
  
If you are seeking your next position and would like to discuss this opportunity in further and expanded detail, please reach out directly to Dan Nyhuis at daniel.nyhuis@troocoo.com"
90029350,AI Engineering Lead,Troocoo,https://www.seek.com.au/job/90029350?type=standard&ref=search-standalone&origin=jobCard#sol=32c17f0a294520315cc3c046cbe5f308dbf18d63,3h ago,3.0,2026-01-30T04:00:00+00:00,Brisbane QLD (Hybrid),Engineering - Software (Information & Communication Technology),Full time,"Up to $200,000 including super","We’re seeking an AI Engineering Lead to join Virgin Australia Group at a pivotal time in their transformation. This role is for a technically strong leader who leads from the front, setting direction, staying hands on, and building high-performing teams that deliver real business impact.

In this role, you’ll bridge deep technical execution with business outcomes, ensuring the AI engineering team delivers high-quality, scalable solutions that support Virgin Australia’s ambition to be the most loved airline.

Your day-to-day will include:
Leading a team of AI engineers, providing technical guidance, mentorship, and clear engineering standards
Owning architectural decisions and ensuring solutions are robust, secure, and fit for long-term use
Staying hands-on where needed to unblock delivery and model best-practice engineering
Partnering closely with senior stakeholders to translate complex technical concepts into clear business outcomes
Driving consistent engineering practices across code quality, testing, deployment, and operational excellence
Identifying and mitigating technical risks before they impact delivery or system reliability
Contributing to broader cross-team technical discussions to share knowledge and improve consistency across the engineering organisation
About You: You’re an experienced AI engineering leader who enjoys solving complex problems and developing people as much as technology. Ideally, you’ll bring:

Proven experience designing, building, and operating AI production-grade systems in complex environments
Demonstrated success leading engineering teams, including mentoring, delivery ownership, and technical decision-making
A strong technical foundation in your area of expertise, with the ability to evaluate emerging tools and trends
Confidence communicating technical trade-offs, timelines, and risks to both technical and non-technical stakeholders
A pragmatic approach to balancing delivery speed with code quality and manageable technical debt
A collaborative mindset and a genuine interest in building high-performing, engaged teams
If you’re passionate about shaping AI platforms, leading talented engineers, and playing a key role in a large-scale, customer-focused organisation, this role offers both challenge and influence in equal measure.
  
If you are seeking your next position and would like to discuss this opportunity in further and expanded detail, please reach out directly to Dan Nyhuis at daniel.nyhuis@troocoo.com"
90028882,Data Observability Engineer,Compas Pty Ltd,https://www.seek.com.au/job/90028882?type=standard&ref=search-standalone&origin=jobCard#sol=e3ba4dd02edf153b5035f0397b36058c29a38e46,3h ago,3.0,2026-01-30T04:00:00+00:00,Canberra ACT,Database Development & Administration (Information & Communication Technology),Contract/Temp,,"Data Observability Engineer (NV1) – Secure Analytics & Monitoring

Join a hands-on engineering team building and maturing data observability and analytics capabilities across complex, secure environments. You’ll design, implement and support monitoring/analytics tooling (think Elastic/ELK and NetFlow), automate repeatable processes, and contribute to technical documentation and integration outcomes for a high-impact program.


Location: Canberra, ACT (Onsite – Symonston)

Contract Duration: March 2026 to 30 October 2027 + two (2) x 12-month extension options
Security Clearance: Must hold a current NV1 (or higher) clearance
Closing Date: 10:00am Friday 13 February 2026

Essential Tasks:

Design, build and implement data observability and analytics tooling (Elastic/ELK, NetFlow).
Develop and maintain observability practices/procedures, including root cause analysis and optimisation advice.
Collaborate with engineering and validation teams to deploy/maintain experimental systems and support architectural decisions.
Provide SME support, reporting, and technical uplift (including just-in-time training as required).

Key Criteria:

Strong data observability/analytics experience (Elastic/ELK, Elastic Stack, NetFlow).
Advanced Linux capability (Red Hat environments) plus automation/scripting (e.g., Python/Bash/PowerShell).
DevSecOps and integration experience (CI/CD e.g., GitLab, APIs, networking/virtualisation).

How to Apply

Does this role sound perfect for you? If so, to register your interest in this role, please either contact Peter Ding or the Compas Team on (02) 6230 0233 and send through your CV by following the link below.


About Compas:

Compas Pty Ltd is a Canberra based wholly Australian owned, Recruitment and Services company that has been operating since 1987. We specialise in the provision of permanent, contract and temporary recruitment services, as well as specialised Consulting assignments.


YOUR APPLICATION WILL BE TREATED WITH THE STRICTEST CONFIDENCE

Due to the nature of this environment, candidates must hold a current NV1 clearance."
90028303,M365 Consultant/Engineer,Unisys,https://www.seek.com.au/job/90028303?type=standard&ref=search-standalone&origin=jobCard#sol=dd4191bf506b691ff0dc84292fd4efa19c838a82,3h ago,3.0,2026-01-30T04:00:00+00:00,Sydney NSW,Consultants (Information & Communication Technology),Full time,,"What success looks like in this role:

We are seeking a highly experienced Microsoft 365 Consultant/Engineer to join our dynamic team. The ideal candidate will possess extensive experience in Microsoft 365 implementation, configuration, and migration projects. This role requires exceptional technical skills, strong communication abilities, and a solid understanding of both on-premises and cloud-based infrastructure.

Key Responsibilities

Work with Architect and execute Microsoft 365 implementation and migration projects, ensuring minimal disruption to business operations.

Implement comprehensive Microsoft 365 solutions tailored to client needs, encompassing various workloads including Exchange Online, SharePoint Online, OneDrive for Business, Teams, Teams Voice, Active Directory, and Entra ID.

Provide expert IT consulting services, guiding clients through the design and implementation phases of Microsoft 365 projects.

Collaborate with cross-functional teams to integrate Microsoft 365 solutions with existing on-premises infrastructure, such as Active Directory, servers, network, EUC, and applications.

Utilize PowerShell scripting to automate administrative tasks and enhance the efficiency of Microsoft 365 implementations.

Maintain up-to-date knowledge of Microsoft 365 technologies, industry trends, and best practices to ensure the delivery of cutting-edge solutions.

Identify and troubleshoot technical issues related to Microsoft 365 environments, providing timely resolutions to maintain optimal system performance.

Communicate effectively with clients, stakeholders, and team members to ensure the successful delivery of projects and fulfillment of client requirements.


Required Skills and Experience

Proven experience in delivering complex Microsoft 365 projects.

Expertise in Microsoft 365 implementation, configuration, and migration.

Strong technical skills across various Microsoft 365 workloads, including:

Exchange Online

SharePoint Online

OneDrive for Business

Teams

Teams Voice

Extensive knowledge of on-premises infrastructure, including Active Directory, servers, networks, EUC, and applications.

Proficiency in PowerShell scripting for automation and administrative tasks.

Excellent communication skills, with the ability to convey technical concepts to non-technical stakeholders.

Strong troubleshooting skills and a methodical approach to problem-solving.

Ability to work independently and as part of a team, managing multiple priorities and deadlines.


You will be successful in this role if you have:

NV1 Security Clerance is required.

Excellent communication and interpersonal skills.

Strong problem-solving and analytical abilities.

Familiarity with industry best practices and regulatory requirements related to Microsoft 365 and cloud-based solutions."
90025752,Principal Engineer - AI AND Automation,"Talent – Specialists in tech, transformation & beyond",https://www.seek.com.au/job/90025752?type=standard&ref=search-standalone&origin=jobCard#sol=b1d57e816490a70e9b934a7538b9086e10747ac1,4h ago,4.0,2026-01-30T03:00:00+00:00,Sydney NSW (Hybrid),Help Desk & IT Support (Information & Communication Technology),Full time,Up to $220k p.a.,"Talent International, a leading Australian recruitment firm, have been engaged by our long standing client, an international Music and Entertainment organisation. We are seeking a Principal Engineer - AI and Automation, to pioneer AI and Automation across their global technology function.

This is a rare opportunity to shape strategy, drive meaningful change, and build AI capability from the ground up with real executive visibility.

Role Title: Principal Engineer - AI and Automation

Opportunity: Permanent Career Opportunity

Location: Sydney CBD

Salary: $220,000 incl super + 15% annual bonus

Client Industry: Music and Entertainment

Start Date: ASAP

Interview Process: 3 rounds of interviews

Role Details:


Own and execute the enterprise AI and automation strategy for Technology Operations, aligning initiatives to business outcomes and long-term platform maturity.
Architect, build, and govern end-to-end AI-driven (agentic) automation solutions, taking concepts from ideation through production, adoption, and continuous optimisation.
Identify, evaluate, and prioritise high-impact use cases where AI can materially reduce operational complexity, accelerate incident response, and deliver measurable efficiency and reliability gains.
Partner with senior technology leaders and delivery teams to embed AI and automation into core platforms and operational workflows, ensuring sustained adoption, value realisation, and scalability.
Provide technical leadership and oversight across AI and automation initiatives, including vendor strategy, platform selection, and architectural standards, within a complex, global environment.

Required Skills and Experiences:

10+ years of experience in the IT operations industry
Demonstrated experience designing or delivering AI-driven, Machine Learning or intelligent automation solutions, with a focus on real-world adoption and outcomes
Ability to operate at a senior, principal level with a consultative approach, confidently influencing fellow leaders and stakeholders and driving adoption across global teams
Familiarity with cloud platforms such as Amazon Web Service, Azure, and Google Cloud.
Experience with automation tools such as Automation Anywhere, UiPath, Zapier, Microsoft Power Automate, and ActiveCampaign.

Additional Details & Benefits:

Working from home flexibility
Annual bonus
Team Events and Activities
Opportunity to join a new, global team

To Apply:

If this sounds like your next opportunity or you would like to hear more, please 'apply now' and submit your resume!


For more information or a confidential discussion please contact Sienna Coate Thompson at Talent International - Sienna.coatethompson@talentinternational.com"
