Job ID,Job Title,Company,Detail URL,Posted Label,Hours Old,Posted Datetime (Local),Location,Category,Work Type,Salary,Ad Text
90893880,Lead Financial Analyst (Finance SME) People Systems Consolidation,Brisbane Catholic Education,https://www.seek.com.au/job/90893880?type=standard&ref=search-standalone&origin=jobCard#sol=e9ceaca2d0067df7c837ae3920169255a6613279,1h ago,1.0,2026-03-12T04:00:00+00:00,"Woolloongabba, Brisbane QLD",Financial Managers & Controllers (Accounting),Contract/Temp,"$155,351 - $172,606 plus super","Company description:



About Brisbane Catholic Education
Brisbane Catholic Education (BCE) is a vibrant learning community within the Archdiocese, employing over 12,000 people across a diverse range of positions. As the largest provider of Catholic education in Queensland, BCE is dedicated to delivering high-quality education from Prep to Year 12. Through strong partnerships with parents, governments, and the wider community, BCE fosters social responsibility, self-discipline and Catholic values in all its students. We offer a supportive working culture where care for the individual is an important part of our ethos. Arrive at work every day to a welcoming and compassionate environment, knowing that you'll be supported to take care of what's important to you. Learn more about Brisbane Catholic Education.



Job description:



Summary

The Lead Financial Analyst (Finance SME) plays a critical role in delivering a major People Systems Consolidation program. In this senior position, you will represent Financial Services across payroll, time, reimbursements and learning systems, ensuring finance outcomes are accurate, auditable and sustainable. Working closely with Finance, People & Culture and Technology teams, you will shape integration design, governance, controls and reporting to strengthen financial integrity and support enterprise‑wide transformation. Your expertise will directly influence how finance outcomes are embedded into future‑state people systems.

Location: BCEO Woolloongabba
Work hours: Fulltime | Flexible Working Arrangements Available
Status: Fixed Term | April 2026 - July 2027 (Possibility for Extension)
Salary: $155,351 - $172,606 plus super
Ad Close date: 16 March 2026
Contact: CareersBCE@bne.catholic.edu.au
About the opportunity

In this position you will:

Act as the Finance SME for the People Systems Consolidation Program, representing Financial Services in design, governance and decision‑making.
Define end‑to‑end finance processes, controls and future‑state designs across payroll and people‑related activities.
Lead finance integration requirements into the enterprise finance platform (D365), ensuring accurate payroll and expense accounting.
Establish finance governance, controls, audit trails and reconciliation processes to support compliance and reporting integrity.
Define finance reporting and analytics requirements for schools and corporate stakeholders.
Partner with payroll, people systems and technology teams to ensure data integrity across integrated systems.
Support finance requirements traceability, testing and validation including SIT, UAT and parallel pay activities.
Support cutover, go‑live and transition to BAU, providing finance input into operating procedures and hypercare.
About you

To be successful in this position you will bring relevant contemporary skills and experience including:  

Senior experience in finance systems and financial accounting within large, complex organisations, with strong focus on data integrity, timeliness and auditability.
Deep understanding of payroll‑to‑general‑ledger accounting, including costing allocations, provisions and reconciliations, translating payroll operations into accurate accounting outcomes.
Proven experience defining and assuring integrations between people systems and enterprise finance platforms, covering data mapping and transformation logic
Strong capability designing governance and control frameworks for integrated systems, including audit trails and evidence standards
Solid working knowledge of enterprise reporting and analytics, including defining requirements for dashboards and reporting platforms impacted by payroll and learning data.
Proven experience in process documentation and redesign, including SME facilitation, capture of business rules, and development of clear process maps and work instructions.
Strong delivery, stakeholder engagement and communication capability across requirements, design, testing and go‑live phases, with a track record producing high‑quality artefacts and driving adoption of improved ways of working.
Degree qualification in accounting, finance, commerce or a related field and hold a CA/CPA

Eligibility and Safeguarding requirements:

Eligibility to work in Australia for the duration of the appointment
Ability to obtain a National Criminal History check prior to commencement.
Why choose BCE

Join us and be part of the largest Catholic Diocese in Queensland, nurturing your personal and professional development goals. As a valued member of our organisation, enjoy these and other rewards:

Opportunities for career advancement and professional development
Competitive remuneration and flexible work arrangements (position dependent)
Salary packaging and salary-sacrificing options
Active staff social club and wellness programs
Personal support for our employees and families through the Employee Assistance Program.
Fitness Passport access 

Please note applications for this position may be considered as they are received, and an appointment made prior to the advertised close date.

Everyone at BCE models and fosters a commitment to the safeguarding of children and promotes a culture where student protection is everyone's responsibility. The Archdiocese of Brisbane has standards of conduct for workers to maintain a safe and healthy environment for children. Our commitment to these standards requires that we conduct working with children checks and background referencing for all persons who will engage in direct and regular involvement with children and young people and/or adults-at-risk. The organisation is fully committed to child safety and has a zero tolerance to abuse of children or adults-at-risk.

Equity and inclusion are at the core of our Catholic values and we recognise the benefits of a diverse workforce. We encourage and welcome candidates from all backgrounds to apply for this position.

By choosing to continue, you agree to the Privacy Policy (Employment Collection Notice which includes being contacted by Brisbane Catholic Education in future if a similar position becomes available) and to be included in BCE's talent pools for future opportunities. Show Privacy Policy"
90893845,Senior Data Engineer,Cox Purtell Staffing Services,https://www.seek.com.au/job/90893845?type=standard&ref=search-standalone&origin=jobCard#sol=b2aa1908c5458ccd5b43e9ee091e76d7e5566f8d,1h ago,1.0,2026-03-12T04:00:00+00:00,Sydney NSW (Hybrid),Database Development & Administration (Information & Communication Technology),Full time,$150k - $180k p.a. + Superannuation,"Senior Data Engineer

Sydney | $180k + Super

If you are the type of engineer who enjoys understanding how data moves through systems - pipelines, warehouses, storage layers and infrastructure - this role may interest you.

You would be joining a small B2B software company where data sits close to the core of the product. The team is technical, curious and hands-on. There is no management layer here - you will work directly with the CTO and other engineers to shape how data flows through the organisation.

What You Would Be Doing

Your focus will be building and evolving the company's data platform.

That includes:

Designing and improving data pipelines

Working with AWS data infrastructure

Managing and optimising the Redshift warehouse

Structuring and modelling messy source data

Ensuring data moves reliably across systems

Supporting the reporting and analytics layer

This role suits someone who enjoys building systems and solving complex data problems rather than managing people.

The Environment

You would be working with a stack that currently includes:

Python

SQL

AWS

RDS (Postgres)

Redshift

AWS Glue

Terraform

Some legacy MySQL

QuickSight today, with interest in Power BI

The engineering team is also experimenting with AI-assisted development and internal tooling that allows safe exploration of replicated data environments.

What Matters Most

Tools are useful, but mindset matters more.

You will likely enjoy this role if you:

Like understanding how data flows through systems

Enjoy fixing and improving data pipelines

Take pride in building reliable infrastructure

Prefer hands-on engineering rather than management

Are naturally curious about how systems can be improved

The Team

You would be joining a small, highly capable engineering team that values curiosity, technical depth and thoughtful problem solving.

This role tends to suit engineers who enjoy tackling complex technical problems but prefer working in a smaller environment where they can have meaningful ownership of the systems they build.

Sydney based - Hybrid work environment.

Australian working rights essential.

Apply by sending your CV?"
90893797,Senior TechnolgyOne Technical Consultant,xAmplify Services Pty Ltd,https://www.seek.com.au/job/90893797?type=standard&ref=search-standalone&origin=jobCard#sol=3ff24daa4317ad6cd2b250eee0a5426f028443ae,1h ago,1.0,2026-03-12T04:00:00+00:00,Brisbane QLD (Hybrid),Engineering - Software (Information & Communication Technology),Full time,,"xAmplify – Leading Australia’s Digital Evolution

At xAmplify, we’re not just another technology company. We are shaping Australia’s future by combining intelligent automation and human‑centred technology services to deliver exceptional value.

Our vision is BOLD to lead Australia’s digital evolution by accelerating the safe and secure adoption of Automation and AI.

We don’t pretend to do everything. Instead, we partner with the world’s largest and most innovative technology companies, aggregating cutting‑edge solutions to transform businesses, industries, and government services. Every project we undertake is an opportunity to transform industries, solve real‑world problems, and push the boundaries of what’s possible in technology.

And as part of this growth, xAmplify became an official TechnologyOne partner following our acquisition of Green Cloud in late 2025, expanding our ERP capability across Finance, Supply Chain, Assets, HR/Payroll, Property & Rating, and more.

We are enablers. What’s ours is yours, check us out at xAmplify.com.au

About the Role

As our new Senior TechnologyOne Technical Consultant, you’ll join our expanding TechOne Practice and work with a diverse team delivering meaningful ERP modernisation and transformation projects across Australia. You’ll help clients rethink their processes, uplift critical systems, and maximise value from the TechnologyOne platform.

As a Senior Technical Consultant, you’ll represent xAmplify during requirements gathering and design phases and help structure delivery across multiple TechnologyOne modules and industry verticals.

You’ll be involved end‑to‑end across the project lifecycle, including: 

Early‑stage demonstrations and proof‑of‑concepts    
Requirements workshops and process mapping 
Solution design and documentation  
Technical configuration and development     
Data migration, integrations, testing and deployment    
Hypercare and post‑go‑live support

Responsibilities

Implementing and configuring TechnologyOne solutions to meet diverse client needs.     
Supporting uplift across modules such as Financials, Supply Chain, EAM, HRP, Corporate Performance Management, and more.
Integrating TechOne with third‑party systems using APIs, ETL tools, and web services.
Designing and maintaining BPA’s, forms, dashboards, data models, workflows, and automation.

Required Skills

At xAmplify, we look for individuals who thrive in dynamic, fast‑paced environments and bring a passion for technology, problem‑solving, and collaboration.

For this Senior TechnologyOne Technical Consultant role, we’re looking for:

3+ years of hands‑on TechnologyOne administration, development, and configuration experience across Ci or Ci Anywhere.
Experience across multiple TechnologyOne modules such as Financials, Supply Chain Management, Asset Management, Property & Rating, HR & Payroll, CPM.
Strong configuration and development capability, including:

o  XLOne reporting

o   Design Studio dashboards and data models

o   ETLand workflow automation

o   CiA Web Services (REST/SOAP)

o   BPA’s/Forms

Experience facilitating workshops, defining requirements, and producing solution design documentation in an Agile delivery model.
Ability to work collaboratively or independently, managing scope, deliverables, and client expectations.
Confidence presenting solution designs to technical and non‑technical stakeholders. 
Integration background (REST/SOAP APIs, data transformation, external system connectivity).    
Interest in mentoring junior talent and contributing to practice capability uplift.
Experience preparing effort estimates, supporting RFQ responses, and participating in technical solution conversations.  
Strong communication, organisation, and time‑management skills.

We’re flexible! If you’re in Canberra, Sydney, Brisbane, or the Sunshine Coast you’ll have the opportunity to connect with us in person in our offices, but we also welcome candidates from locations across the Australian East Coast. Our team operates on a hybrid work model, so you will have the ability to work from our office, client sites (as required with your allocated projects), or from home.

Equal Opportunity Statement

At xAmplify, we believe diversity drives innovation. We welcome applications from people of all genders, identities, ethnicities, religions, abilities, and ages. xAmplify is an advocate for diversity and inclusion, and welcomes applications from all irrespective of their gender, LGBTQI identity, ethnicity, religion, physical ability, or age.

Intrigued? Want to know more? Reach out to us at recruitment@xamplify.com.au or visit xamplify.com.au. Join us in shaping Australia’s digital landscape — because the future isn’t just coming, we’re creating it!"
90893577,Senior TechnolgyOne Technical Consultant,xAmplify Services Pty Ltd,https://www.seek.com.au/job/90893577?type=standard&ref=search-standalone&origin=jobCard#sol=0078278d75cc382145b627d4a9cab27b15f234ad,1h ago,1.0,2026-03-12T04:00:00+00:00,Sydney NSW (Hybrid),Developers/Programmers (Information & Communication Technology),Full time,,"xAmplify – Leading Australia’s Digital Evolution

At xAmplify, we’re not just another technology company. We are shaping Australia’s future by combining intelligent automation and human‑centred technology services to deliver exceptional value.

Our vision is BOLD to lead Australia’s digital evolution by accelerating the safe and secure adoption of Automation and AI.

We don’t pretend to do everything. Instead, we partner with the world’s largest and most innovative technology companies, aggregating cutting‑edge solutions to transform businesses, industries, and government services. Every project we undertake is an opportunity to transform industries, solve real‑world problems, and push the boundaries of what’s possible in technology.

And as part of this growth, xAmplify became an official TechnologyOne partner following our acquisition of Green Cloud in late 2025, expanding our ERP capability across Finance, Supply Chain, Assets, HR/Payroll, Property & Rating, and more.

We are enablers. What’s ours is yours, check us out at xAmplify.com.au

About the Role

As our new Senior TechnologyOne Technical Consultant, you’ll join our expanding TechOne Practice and work with a diverse team delivering meaningful ERP modernisation and transformation projects across Australia. You’ll help clients rethink their processes, uplift critical systems, and maximise value from the TechnologyOne platform.

As a Senior Technical Consultant, you’ll represent xAmplify during requirements gathering and design phases and help structure delivery across multiple TechnologyOne modules and industry verticals.

You’ll be involved end‑to‑end across the project lifecycle, including: 

Early‑stage demonstrations and proof‑of‑concepts    
Requirements workshops and process mapping 
Solution design and documentation  
Technical configuration and development     
Data migration, integrations, testing and deployment    
Hypercare and post‑go‑live support

Responsibilities

Implementing and configuring TechnologyOne solutions to meet diverse client needs.     
Supporting uplift across modules such as Financials, Supply Chain, EAM, HRP, Corporate Performance Management, and more.
Integrating TechOne with third‑party systems using APIs, ETL tools, and web services.
Designing and maintaining BPA’s, forms, dashboards, data models, workflows, and automation.

Required Skills

At xAmplify, we look for individuals who thrive in dynamic, fast‑paced environments and bring a passion for technology, problem‑solving, and collaboration.

For this Senior TechnologyOne Technical Consultant role, we’re looking for:

3+ years of hands‑on TechnologyOne administration, development, and configuration experience across Ci or Ci Anywhere.
Experience across multiple TechnologyOne modules such as Financials, Supply Chain Management, Asset Management, Property & Rating, HR & Payroll, CPM.
Strong configuration and development capability, including:

o  XLOne reporting

o   Design Studio dashboards and data models

o   ETLand workflow automation

o   CiA Web Services (REST/SOAP)

o   BPA’s/Forms

Experience facilitating workshops, defining requirements, and producing solution design documentation in an Agile delivery model.
Ability to work collaboratively or independently, managing scope, deliverables, and client expectations.
Confidence presenting solution designs to technical and non‑technical stakeholders. 
Integration background (REST/SOAP APIs, data transformation, external system connectivity).    
Interest in mentoring junior talent and contributing to practice capability uplift.
Experience preparing effort estimates, supporting RFQ responses, and participating in technical solution conversations.  
Strong communication, organisation, and time‑management skills.

We’re flexible! If you’re in Canberra, Sydney, Brisbane, or the Sunshine Coast you’ll have the opportunity to connect with us in person in our offices, but we also welcome candidates from locations across the Australian East Coast. Our team operates on a hybrid work model, so you will have the ability to work from our office, client sites (as required with your allocated projects), or from home.

Equal Opportunity Statement

At xAmplify, we believe diversity drives innovation. We welcome applications from people of all genders, identities, ethnicities, religions, abilities, and ages. xAmplify is an advocate for diversity and inclusion, and welcomes applications from all irrespective of their gender, LGBTQI identity, ethnicity, religion, physical ability, or age.

Intrigued? Want to know more? Reach out to us at recruitment@xamplify.com.au or visit xamplify.com.au. Join us in shaping Australia’s digital landscape — because the future isn’t just coming, we’re creating it!"
90893542,Senior FP&A Analyst,Mars Recruitment,https://www.seek.com.au/job/90893542?type=standard&ref=search-standalone&origin=jobCard#sol=9ef353ddfc44b79083b7ca8a3d17a08a9d5f13ac,1h ago,1.0,2026-03-12T04:00:00+00:00,Sydney NSW (Hybrid),Management Accounting & Budgeting (Accounting),Full time,"$140,000 - $150,000 + Super","MARS Recruitment is partnering with an esteemed Financial Services business who are looking to hire a Senior FP&A Analyst to join them on a permanent basis.

This is a commercially focused FP&A role supporting senior leaders across the business, with responsibility for delivering high-quality management reporting, forecasting and financial modelling. The position will partner closely with key stakeholders to provide insights into financial performance, support strategic initiatives and drive data-led decision making.

The Responsibilities:

Produce insightful management reporting including variance analysis, commentary on financial performance and identification of key drivers impacting results.
Build and maintain robust financial models to support forecasting, budgeting cycles and longer-term strategic planning.
Track and enhance key financial and operational metrics, ensuring performance insights support strategic decision-making.
Lead the preparation of annual budgets and periodic reforecasts, working closely with business stakeholders to ensure alignment with operational plans.
Maintain rolling forecasts and provide visibility on financial performance against plan.
Conduct profitability and performance analysis across products, customer segments and distribution channels, identifying trends and areas for improvement.
Support strategic initiatives and investment decisions through financial modelling, scenario analysis and commercial insight.
Utilise advanced analytics and AI-driven tools to extract insights from portfolio performance and new originations, enabling data-driven decision making for senior stakeholders.
Assist in the preparation of reporting materials and analysis for executive leadership and board discussions.
Collaborate with the Financial Control team to improve the integration of FP&A processes with core finance activities such as month-end close and management reporting.
Partner with the Data & Analytics team to improve data integrity, automation and the use of advanced analytics in financial reporting.
Contribute to enterprise-wide projects by delivering timely financial analysis and recommendations to support decision making.


The Requirements:

CA/CPA/ACCA qualified.
Minimum 5 years' experience in a similar finance role encompassing management accounting, financial reporting and analytical responsibilities.
Prior exposure to the financial services sector is highly regarded.
Commercially minded with a proactive approach to identifying trends, risks and opportunities within the business.


To Note:

Flexible working arrangements
Only considering Australian Citizens and Permanent Resident Visa holders currently.

If you're interested in this opportunity, please apply to the role directly. Alternatively, you can send your CV over to Jonathon.Lynn@marsrecruitment.com.au."
