Job ID,Job Title,Company,Detail URL,Posted Label,Hours Old,Posted Datetime (Local),Location,Category,Work Type,Salary,Ad Text
91105231,Senior Finance Analyst,Talent Web Recruitment,https://www.seek.com.au/job/91105231?type=standard&ref=search-standalone&origin=jobCard#sol=a7b6987950343b4255b7d2ce9dc61c154bbbd8a8,1h ago,1.0,2026-03-23T22:00:00+00:00,Sydney NSW (Hybrid),Analysis & Reporting (Accounting),Contract/Temp,$600 per day inclusive of super,"Immediate start | High-impact role within a complex investment environment

Our client is a well-established and highly regarded organisation operating within a sophisticated funds management environment. They are seeking a Senior Finance Analyst to join the team on a 3-month contract, supporting key financial reporting, analysis, and capital initiatives during a critical period.

This is an opportunity to step into a commercially focused finance role where your work will directly support investment decisions, capital partnerships, and the continued development of scalable finance processes.

The Opportunity
Working closely with senior stakeholders across finance, treasury, and commercial teams, you will play a key role in delivering accurate reporting, insightful analysis, and supporting capital transactions. You will contribute to both ongoing operations and strategic initiatives, with exposure to a broad range of stakeholders and complex financial structures.

Key Responsibilities

Deliver financial and management reporting across funds and capital partnerships, ensuring accuracy, timeliness, and compliance with relevant standards
Provide detailed financial analysis, including variance commentary and insights to support decision-making and risk management
Support capital transactions and funding arrangements, working alongside senior finance leaders
Assist in managing relationships with external stakeholders including auditors, tax advisors, and fund administrators
Contribute to financial modelling, scenario analysis, and commercial evaluation of strategic initiatives
Support continuous improvement of financial processes, systems, and reporting frameworks, with a focus on scalability and efficiency
About You
You will bring a strong technical accounting foundation combined with the ability to operate in a commercially focused environment. This role will suit someone who enjoys working across both reporting and strategic finance activities.

We welcome candidates from a range of backgrounds who can demonstrate:

CA or CPA qualification with relevant tertiary education
Experience in funds management, capital partnering, or property-related environments will be highly regarded
Strong understanding of accounting standards and financial reporting requirements
Advanced analytical and problem-solving skills, with the ability to translate data into meaningful insights
Proven ability to manage competing priorities while building effective stakeholder relationships
Open to working holiday visa candidates
Could suit a Big4 recent leaver
What’s on Offer

Immediate start in a high-impact contract role
Exposure to complex funds management and capital structures
Collaborative environment with strong cross-functional engagement
Opportunity to contribute to meaningful projects and process improvements
If you’re available immediately or on short notice and looking to apply your technical and commercial finance skills in a dynamic environment, we encourage you to follow the prompts to apply.

Alternatively, you can contact Fraser Chapman on fraser.chapman@talentweb.com.au or 0424 155 675."
91104940,"Business Analyst, IT",Royal Australasian College of Physicians (RACP),https://www.seek.com.au/job/91104940?type=standard&ref=search-standalone&origin=jobCard#sol=f4f3cf474ec0f7d2faf62a3eb7400bd7757a60a6,1h ago,1.0,2026-03-23T22:00:00+00:00,Sydney NSW,Business/Systems Analysts (Information & Communication Technology),Full time,,"About the RACP 
The Royal Australasian College of Physicians (RACP) connects, represents, and trains physicians and trainee physicians across Australia and Aotearoa New Zealand. The RACP provides services to support the delivery of training, continuing professional development, and health policy and advocacy to medical health professionals. 

Our Values 
Accountable | Collaborate | Indigenise and Decolonise | Lead the way | Respect 

Why Join Us? 
As part of our team, you will be offered a competitive remuneration salary and access to some amazing benefits including a flexible hybrid work model, additional paid leave between Christmas and New Year, paid parental leave, free annual flu vaccinations, professional development opportunities, access to our Employee Assistance Program, special corporate discounts and more! To view all our benefits, visit www.racp.edu.au/about/careers-at-racp.

Our 3-2-1 Hybrid Working Model

3 days from anywhere in Australia or Aotearoa New Zealand per week,  
2 days from an RACP office location per week,  
1 of the two days per week in office spent with your team.  



The IT Business Analyst plays a critical role in helping business teams to articulate their needs and for IT to understand, prioritise and implement its pipeline of change requests.

This is a full-time, fixed-term position for one year.

Collaborates with stakeholders across the College to clarify and articulate needs and identify, justify, and ensure implementation of appropriate technological solutions that align with College goals.
Assists requestors, solution development stakeholders to prepare business cases, product roadmaps, clarify project scope, identify solution and project risks and impacts.
Collaborates with stakeholders to understand current practices, define, engineer and document target processes
Aligns processes with requirements and solutions
Leverages College system solutions such as M365, Atlassian suite, Dynamics 0365 modules, Power Apps, Power Automate, Dataverse and Power BI.
Supports testing and change adoption activities.
Produces specifications for application features, workflows, and data models
Produces release notes to ensure stakeholders understand process changes and new solutions.
Ensures compliance with College security, risk, project management and governance frameworks when scoping, designing and assisting deployment of solutions

In order to be considered for this role we are seeking the following skills, experience and attributes:

 Essential:

Over 8 years of experience working as a Business Analyst with highly developed business analysis skills.
Experience writing business cases, engineering and re-engineering and modelling processes and developing business architecture documentation.
Ability to manage multiple internal projects, prioritise tasks, and meet deadlines
Experience working in Waterfall and Agile/Scrum environments.
Experience working within Project Management frameworks
Product Management Frameworks
Knowledge of DevOps practices and tools, such as Azure DevOps, Jira Projects for managing application lifecycle and deployments.

Desirable:

Microsoft Certified in Dynamics 365 Fundamentals and PL-200 Power Platform Functional.
Experience implementing Dynamics 365 and Power Platform solutions (Power Apps, Power Automate, Power BI, Dataverse).
Skilled with Atlassian and Microsoft 365 product suite implementations.
Proficient in Power BI reporting and dashboard development.
Knowledge of industry-specific Dynamics 365 solutions across Education, Membership‑based organisations, and NFP sectors.

 




Please submit your cover letter and CV 

For additional information please find the job description listed here: ba-it-position-description.pdf

If you would like any further information, please email recruitment@racp.edu.au. This email address is for enquiries only.

We encourage you to submit your application as soon as possible as will be shortlisting and interviewing as applications are received. Our ad may close earlier than the specified closing date should a suitable candidate be found.

This role is currently being managed by our internal People & Culture team, and we are not accepting applications from recruitment agencies."
91104490,Senior Commercial Finance Analyst - Supply Chain,David Jones Limited,https://www.seek.com.au/job/91104490?type=standard&ref=search-standalone&origin=jobCard#sol=042f85a30f5b51b709b3e594a02614759f570319,2h ago,2.0,2026-03-23T21:00:00+00:00,Sydney NSW (Hybrid),Analysis & Reporting (Accounting),Full time,,"The Role

David Jones exists to inspire like no other. As we continue delivering our ambitious Vision 2025+ transformation agenda, we are committed to creating inspired careers where our people can thrive.

We are seeking a Senior Commercial Finance Analyst – Supply Chain Transformation to join our Commercial Finance team. This role plays a pivotal part in enabling commercial decision-making through insightful financial analysis, strategic evaluation, and partnering across key transformation initiatives within our Supply Chain operations.

You will be embedded within project teams and operational stakeholders, supporting major business initiatives with data-driven insights, financial modelling, and performance tracking to ensure the successful delivery of transformation outcomes.


What YOUR DAY LOOKS LIKE

Partner with project and operational teams to understand challenges and opportunities across major supply chain initiatives and ongoing operations.
Deliver robust financial analysis, including P&L modelling, scenario analysis, feasibility studies, and post-implementation reviews.
Support the evaluation of business cases by analysing financial impacts, risks, and mitigation options for proposed initiatives.
Develop and maintain financial models to support planning, forecasting, and performance tracking across transformation projects.
Prepare and present decision-support materials and insights for executive-level stakeholders.
Monitor actuals vs. projections, analyse variances, and provide actionable recommendations.
Support the budgeting and forecasting process for transformation projects and operational teams.
Identify opportunities for process improvement or innovative financial approaches that enhance decision-making.
Collaborate closely with the broader finance team and cross-functional stakeholders to ensure alignment with strategic and operational objectives.

What YOU’LL NEED TO THRIVE

Tertiary qualification in Accounting, Finance, or related discipline; CA/CPA qualified (or near completion).
Strong experience in commercial finance, ideally within a retail or FMCG supply chain environment.
Proven experience in business partnering with non-finance stakeholders and providing commercial insights.
Strong analytical and problem-solving skills, with experience in financial modelling and scenario analysis.
Excellent communication and presentation skills - able to convey complex financial insights clearly.
Ability to manage multiple priorities and deliver to tight timelines within a fast-paced transformation environment.
A collaborative mindset, with a proactive approach to driving value and continuous improvement.
Ability to manage multiple priorities and deliver to tight timelines within a fast-paced transformation environment.
A collaborative mindset, with a proactive approach to driving value and continuous improvement.
initiatives.
Outstanding communication and presentation skills, with the ability to convey complex financial concepts to non-finance stakeholders.
Strong financial modelling skills with the ability to handle complex, multi-variable scenarios.
Ability to lead planning process for multi-functional projects balancing financial and non-financial considerations as well as clearly articulating assumptions
Ability to prioritise workload and manage multiple competing projects with varying timelines.
Ability to build strong relationships across various business units and work effectively in cross-functional project teams.

Why WORK FOR US?

Unique opportunity to be part of a highly engaged, successful team, focused on the transformation of an iconic Australian brand
Opportunity to directly impact major business decisions and shape the future of a leading retail organisation
A competitive remuneration package including performance-based incentives
Hybrid working arrangements in office and from home that provide appropriate work/life balance
Parental leave policy of 18-weeks paid leave for the primary carer, and 3-weeks paid leave for the supporting partner
Generous employee discounts across David Jones and access to partner benefits
An additional day of leave for your birthday along with time to support charitable work
Opportunities to support community partnerships across our Corporate Social Responsibility program
Be a member of a company committed to sustainable practices, driving change in the retail landscape
Ongoing training and development to pursue individual ambitions and career goals

About Us

Since 1838, David Jones’ limitless quest for innovation and progress established the brand as Australia’s original influencer in fashion and lifestyle. Having revolutionised the way Australians shop, David Jones’ creation of a social centre inspired and created lasting memories for past, present and future generations. Today, our vision to inspire Like No Other drives us to continue this legacy in our ambitious purpose to be the destination that inspires, with experiences and services Like No Other.


Our Thriving cultural pillars inspire our people to deliver on our vision and purpose. We are Customer Obsessed; curious to understand and dedicated to delighting them with seamless solutions as one team. We care for our people, customers, partners and community by creating Inclusive environments through belonging and respect. We Empower with implied trust to act with integrity, value our unique skills and be accountable for our decisions. We constantly seek Innovative ways of improving, changing and exploring ways that we can inspire."
91101069,Principal Capital Finance Business Partner | Perth,BHP,https://www.seek.com.au/job/91101069?type=standard&ref=search-standalone&origin=jobCard#sol=66f335443e5f3c05e0e2ac649e68d28315998dcc,10h ago,10.0,2026-03-23T13:00:00+00:00,Perth WA,"Analysis & Reporting (Mining, Resources & Energy)",Full time,,"About BHP 


At BHP we support our people to grow, learn, develop their skills and reach their potential. With a global portfolio of operations, we offer a diverse and inclusive environment with extraordinary career opportunities. Our strategy is to focus on creating a safe work environment where our employees feel strongly connected to our values and objectives, and where the capability of our people is key to our success.

Come and be a part of this success.

About the Role


The Principal Capital Finance Business Partner acts as a trusted advisor to the business, providing commercial insight, constructively challenging assumptions, and supporting informed decision making across the capital lifecycle. The role has a strong focus on capital productivity, governance, prioritisation, and ensuring alignment between strategic objectives and capital deployment.

Key Responsibilities:

Partnering with project and asset leaders to support capital planning, prioritisation, and performance management
Providing investment evaluation and commercial advice on capital projects
Stewardship of the capital portfolio, including cash prioritisation and governance
Driving improved capital efficiency and value outcomes through insight and challenge
Engaging across a broad range of stakeholders to support effective decision making
Leading and delivering capital reporting, including portfolio performance insights, cash flow, and capital productivity reporting, to support governance, prioritisation, and informed decision making

About You


To be successful in this role, you will be able to manage multiple priorities and stakeholders while maintaining a high attention to detail. You will be naturally curious with a continuous improvement mindset, inspiring challenge through highly effective communication and strong interpersonal skills. You will build constructive relationships and credibility across a range of stakeholders and cross functional teams.

Key experience and attributes:

Experience as a finance professional with strong commercial acumen and relevant finance exposure
Well developed commercial and analytical skills, including the ability to translate complex financial analysis into clear, actionable insights for decision makers
Demonstrated experience in reviewing capital investment, investment evaluation, or decision support, including providing commercial advice across the capital lifecycle and supporting disciplined capital allocation decisions
Postgraduate qualifications such as a Master’s degree or MBA, CPA, CFA, or CA are highly desirable
About Our Process 


At BHP, we are committed to employing individuals who align with the BHP Charter Values and meet the requirements of the role. As part of the recruitment process, there are a number of checks which may be conducted to demonstrate applicants suitability for a role including police / criminal background checks, medical, drug and alcohol testing, due diligence checks, right to work checks, and/or reference checks. 

If you are already employed directly by BHP, please log in using your BHP email address or apply via our internal jobs portal. 

Supporting a Diverse Workforce  
 


The size, stability and magnitude of our business not only provides significant opportunity for professional development, but also attractive salary packages with performance-based bonuses and a best-in-class employee share program. We know there are many aspects of our employees' lives that are important, and work is only one of these, so we offer benefits to enable your work to fit with your life. These benefits include flexible working options, a generous paid parental leave policy, other extended leave entitlements and parent rooms.  

At BHP, we know that we are strengthened by diversity. We are an Equal Opportunity employer that is committed to making BHP a safe and inclusive workplace where everyone can thrive and be at their best every day. We are focused on creating a workforce that’s more diverse and represents the communities where we work and live. providing a work environment in which everyone is included, treated fairly and with respect. We are an Equal Opportunity employer and recognise that true diversity includes gender, age, race, disability status, sexual orientation, religion, neurodiversity, education levels, and many more aspects of your identity.

BHP is committed to providing a recruitment process that is fair, equitable and accessible for all. If you have a disability, we know that it may be helpful for us to adjust our process to make it equitable for your individual situation. If you would like to reach out to someone about your situation and our recruitment process, please email us at inclusion@bhp.com."
