Job ID,Job Title,Company,Detail URL,Posted Label,Hours Old,Posted Datetime (Local),Location,Category,Work Type,Salary,Ad Text
89863486,Data and Analytics Technical Lead,Yarra Valley Water,https://www.seek.com.au/job/89863486?type=standard&ref=search-standalone&origin=jobCard#sol=2ea44b2d6a81c86e96e4e0a0f8b816e1cebb1722,1h ago,1.0,2026-01-22T05:00:00+00:00,"Mitcham, Melbourne VIC (Hybrid)","Engineering - Software (Information & Communication Technology)
Government - State (Government & Defence)",Contract/Temp,"Up to $181,800 TRP (inclusive of 12% Super)","Position overview

2-Year Maximum-Term Contract, Full-Time opportunity
True hybrid working - work from home and our Mitcham office
$181,800 Total Remuneration Package per annum (inclusive of 12% superannuation)

About us
We're on a mission to create a brighter future, where you can be a change maker at the actual source. We're one of Australia's largest water utilities with over 30% of Victoria's population relying on us for their essential water and sanitation services.

Our award-winning culture fosters an inclusive, collaborative, and flexible environment that enables our people to thrive. Here, you'll be inspired and challenged to grow alongside us.

We're committed to reconciliation and supporting the self-determined role for Traditional Owners/Custodians in water and land management.

The Role
The Technical Lead will drive the design, delivery, and evolution of YVW's next-generation data platform, with end-to-end accountability for migrating our legacy finance system to modern platforms to underpin improved financial integrity, regulatory confidence, operational insight and decision-making. You will lead all phases of data ingestion, complex transformations, and enhancements, while also redesigning and optimising existing Enterprise, Data and Analytics (EDA) platform solutions to deliver scalable, automated, and high-performance data pipelines.

Reporting directly to the Head of Data & Analytics, you will provide hands-on technical leadership across multi-disciplinary teams and contractors, ensuring solutions are delivered on time, to specification, and aligned to enterprise architecture and governance standards. This is a highly visible and strategic role, combining deep technical expertise, data engineering mastery, scripting proficiency, and delivery leadership with the ability to influence and guide senior stakeholders and vendor partners.

You will also be responsible for reverse engineering existing ETL jobs, stored procedures, and reporting logic, modernising and optimising them for maintainability, performance, and automation, ensuring the platform delivers trusted, accurate, and timely reporting and analytics.

Working closely with Project Managers, data engineers, delivery leads, analysts, architects, vendors, and business stakeholders, you will drive delivery excellence across all initiatives. This role is ideal for an experienced technical leader who thrives in complex, high-impact environments and is motivated by shaping the future of enterprise data at scale.

Your key responsibilities

Lead the end-to-end delivery of data migration, data engineering, and transformation initiatives across Finance domains (General Ledger, Accounts Payable/Receivable, Asset Accounting, Payroll, Procurement, Treasury) on Azure and Databricks, ensuring automation, scalability, reliability, and high data quality.
Own data migration strategy, designs, and execution, including planning, remediation, and data quality validation throughout all phases of the migration.
Provide hands-on technical leadership across multi-disciplinary teams and contractors, guiding delivery of migration, engineering, analytics, and EDA optimisation initiatives.
Redesign, refactor, and optimise existing data pipelines, transformations, and models on the EDA platform to improve performance, maintainability, and alignment with target architecture.
Assess current EDA solutions and identify opportunities to simplify logic, remove duplication, and retire technical debt.
Architect, develop, and optimise scalable data pipelines, lakehouse architectures, and reusable data products.
Lead complex legacy-to-cloud data migrations, including reverse engineering ETL jobs, stored procedures, and reporting logic, and re-engineering them for performance, automation, and maintainability.
Design and implement enterprise-grade data models and semantic layers to support analytics, operational reporting, and future machine learning use cases.
Ensure migrated and redesigned data assets are fully reconciled, validated, and fit for business consumption.
Enable self-service analytics through well-curated, trusted datasets and Power BI semantic models.
Implement CI/CD and DevOps practices to automate data ingestion, transformation, testing, and deployment.
Enforce data governance, quality, security, and documentation standards across the data platform.
Conduct data discovery and profiling of legacy and source systems to identify quality issues, gaps, risks, and ownership responsibilities.
Develop and maintain source-to-target data mappings and support ETL processes using Databricks, SQL, and related technologies.
Execute mock migrations, reconciliations, and validations across Dev, SIT, and UAT environments, documenting and resolving defects.
Collaborate with business SMEs, analysts, and product owners to translate requirements into scalable, sustainable solutions.
Provide technical oversight, assurance, and quality review of vendor-delivered solutions.
Support Agile delivery, including estimation, planning, and management of technical dependencies.
Mentor and coach data engineers and analysts, driving capability uplift, standards adoption, and delivery maturity.
Drive continuous improvement across migration, data engineering, analytics, and EDA optimisation practices.

What we're looking for

Proven experience as a Tech Lead or Lead Data Engineer in complex enterprise environments.
Delivering large-scale data migration projects, ideally within Finance systems
Strong hands‑on expertise in data engineering, including ETL/ELT design, data modelling, and integration patterns.
Demonstrated experience leading and delivering end‑to‑end data migration programs.
Strong capability in reverse engineering undocumented or poorly documented legacy data solutions.
Advanced Power BI experience, including semantic modelling, DAX, performance optimisation, and governance.
Deep hands‑on experience with Microsoft Azure data services (e.g. Azure Data Lake, Data Factory, Azure SQL/Synapse, Databricks).
Strong understanding of lakehouse architectures, scalable data pipelines, and modern analytics platforms.
Experience implementing DevOps, CI/CD, and automation for data workloads.
Strong stakeholder engagement and communication skills, with the ability to translate technical concepts for non‑technical audiences.
Experience working in Agile, cross‑functional delivery environments.
Demonstrated ability to manage multiple priorities under pressure, with excellent analytical and problem-solving skills.

To view the full position description, click HERE.

Why Yarra Valley Water?
We celebrate and encourage new thinking at every level. Creating opportunities for you to grow - both professionally, and personally. When you flourish, we all do.

$181,800 TRP per annum inclusive of 12% superannuation
Flexible working arrangements where our people are empowered to design their days with their team. Read our hybrid playbook HERE.
Free and secure on-site parking with on-site café at our Mitcham office.
14 weeks paid leave parental leave.
15 days paid personal leave, which can be used for caring, wellbeing, mental health, menstrual or menopause.
Request to swap certain public holidays for another day of paid leave.

To read more about our benefits and culture, read our employee handbook HERE.

Did you know?
Research shows that men apply to jobs when they meet an average of 60% of the criteria, while women and other marginalised people tend to only apply when they meet all of them. So, if you think you have what it takes, but don't necessarily tick every box, please apply or get in touch. We'd love to have a chat and see if you could be a great fit.

How to apply
Applications should include a supporting Cover Letter and Resume.
Closing date: Thursday, 5th February 2026
This position is available for Yarra Valley Water employees and external applicants.

We welcome applications from everyone, including Aboriginal and/or Torres Strait Islander peoples, people with disability, mature age and young job seekers, members of the LGBTIQA+ community and people of all cultural backgrounds. If you need this information in an accessible format or would like to discuss reasonable adjustments during the recruitment process. Please call 03 9872 2599 or email dei@yvw.com.au. If you need any help with the application process or would like to discuss the recruitment process, please contact us via email recruit@yvw.com.au.

Successful applicants must be eligible to work in Australia and agree to provide information for pre-employment checks, if required for the position. This may also include a Police Check or AusCheck, where an offer will be subject to a satisfactory outcome of these checks."
89863396,Business Analyst,Terra Firma Business Consulting,https://www.seek.com.au/job/89863396?type=standard&ref=search-standalone&origin=jobCard#sol=93fbe57aca53a96ca000a3b9d0ee3d64fbbe107d,2h ago,2.0,2026-01-22T04:00:00+00:00,Melbourne VIC (Hybrid),Business/Systems Analysts (Information & Communication Technology),Full time,,"The Opportunity

Business Analyst
Location: Melbourne, VIC (Hybrid)

 

Terra Firma is a highly respected Australian business and technology consulting firm with more than 30 years of success delivering meaningful outcomes for clients. We support programs end‑to‑end, combining deep domain expertise with pragmatic delivery, and are known for the quality of our people and the trust we build with clients.

With an average tenure of eight years, our people stay because they are supported, challenged and given the opportunity to do work they are proud of. Whether you are deepening your specialisation or broadening your consulting exposure, Terra Firma offers a place to build a long-term career.

We are seeking a consultant-minded Business Analyst to bring their HCM, HR, Payroll and Workforce Management expertise into our consulting practice. If you have other Corporate systems experience (ERP, CRM etc) we also welcome your application.

This role is ideal for someone who enjoys working across clients, operating at the intersection of business and technology, and contributing thoughtful analysis that genuinely influences outcomes.

While this role may focus on HCM HR Payroll and Workforce Management solutions, your work as a consultant may also span other projects platforms and technologies depending on client needs and your areas of interest. This flexibility allows you to grow your experience develop new skills and apply your BA capability across a broad range of transformation initiatives.

You’ll work across a diverse portfolio of clients and future projects, including Government, Banking and Financial Services, Not‑for‑Profit, Telecommunications, Technology and Utilities, gaining exposure to different industries, operating models and delivery environments.

At Terra Firma, our people are masters of their craft, but what truly sets us apart is our willingness to support one another. Collaboration, shared learning and high‑quality outcomes are at the heart of everything we do.




Key Responsibilities

Run requirements workshops with Business, HR, Technology, and Operations stakeholders to capture business needs and pain points.

Document requirements (BRDs/user stories), current‑state and future‑state process maps, and acceptance criteria.

Analyse processes and recommend improvements aligned to best practice and system capability.

Partner with delivery teams and vendors across all phases of implementation, including solution design, configuration validation and deployment. Define functional specifications for integrations, data, workflows, and reporting.

Contribute to data migration activities: data mapping, cleansing, and validation.

Plan and execute SIT/UAT testing, manage defects, and support cutover and go‑live readiness.

Create documentation, training materials, and support user adoption.

Maintain governance, release documentation, and continuous improvement initiatives.




Required Experience & Skills

5+ years as a Business Analyst within HRIS/Payroll/WFM or ERP/CRM projects.

Mandatory proven implementation experience with one or more major platforms:

Workday, SAP SuccessFactors, Oracle HCM Cloud, Dayforce (Ceridian), UKG/Kronos, ADP, ichris/Chris21, Aurion, ELMO.

SAP, Oracle (Fusion / NetSuite), Microsoft Dynamics 365, Salesforce, TechnologyOne, Workday, Infor, ServiceNow, Pronto.

Strong grounding in BA and delivery approaches, including Agile/Scrum and hybrid models.

Strong stakeholder engagement and management skills with the ability to build trusted relationships across business and technical teams and influence outcomes at all levels.

Hands-on experience with:

Process mapping (BPMN/Visio),

Writing user stories/acceptance criteria

Functional/specification documentation

Integration requirements

Tools:  Jira/Confluence, Visio, Lucidchart, Signavio, ProMap, Excel/Power Query, Power BI/Tableau, SQL




If you’re a Business Analyst who thrives on delivering real outcomes, building strong client relationships, and doing quality consulting then Terra Firma is the place to grow your long-term consulting career."
89862829,Principal Business Analyst,Public Sector People,https://www.seek.com.au/job/89862829?type=standard&ref=search-standalone&origin=jobCard#sol=2a2d3215af1e0c74194df20dfadb81e38c80ced9,2h ago,2.0,2026-01-22T04:00:00+00:00,Brisbane QLD (Hybrid),Business/Systems Analysts (Information & Communication Technology),Contract/Temp,,"An opportunity is available for an experienced Principal Business Analyst to join one of our clients on a short-term contract through to the end of March.
This role would suit a senior BA who is available immediately and comfortable stepping into a fast-paced environment to provide leadership, structure, and clarity across complex initiatives.
What you’ll be doing:

Leading business analysis activities across complex programs of work
Working closely with senior stakeholders to define requirements and outcomes
Translating business needs into clear documentation and actionable insights
Supporting delivery teams through analysis, change, and decision-making phases
What we’re looking for:

Proven experience operating at a Principal / Senior BA level
Strong stakeholder engagement and communication skills
Experience in large, complex organisations (public sector experience highly regarded, especially in the Health Sector) 
Ability to hit the ground running in a short-term engagement
Be able to start ASAP
Why consider this role?

Immediate start
Short-term contract ideal for bridging between roles
High-impact work with an established client
If you’re available now and interested in a short-term engagement, apply today or reach out for a confidential discussion."
89862657,Portfolio Reporting Analyst,Optus,https://www.seek.com.au/job/89862657?type=standard&ref=search-standalone&origin=jobCard#sol=1612280d8a948c8a41ea8492d019b8469fde365d,2h ago,2.0,2026-01-22T04:00:00+00:00,Melbourne VIC (Hybrid),Other (Science & Technology),Full time,,"Optus is an Australian telecommunications company, delivering more than 11 million services to our customers every day across mobile, broadband, and digital solutions.

The Portfolio Reporting Analyst sits within Optus' Billing and Credit function in Group Finance, providing analytical and reporting support to the Senior Portfolio Analyst and the wider Billing & Credit Performance Analytics team. The role contributes to secure customer onboarding, accurate billing, and effective credit and collections outcomes across all customer segments by enabling high quality insight, reliable reporting, and robust data foundations.

Working under the guidance of the Senior Portfolio Analyst, the role assists in translating complex data into clear insights that inform decision making across the end-to-end collections and recoveries lifecycle, including hardship. The position plays a key role in supporting performance analysis, reporting integrity, and stakeholder engagement, helping ensure senior leaders and stakeholders have the insights required to drive improvements in customer experience, operational efficiency, risk management, and financial outcomes.

What you'll be doing

Support the design, build, automation, and maintenance of dashboards, reports, and scorecards, ensuring alignment with best practice data visualisation standards and direction set by the Senior Portfolio Analyst.
Assist in the development and delivery of analysis and forecasting outputs by preparing data, identifying trends, and highlighting risks and opportunities for escalation and discussion.
Contribute to the translation of complex data into clear, consistent performance narratives to support portfolio level reporting and reviews.
Partner with Billing & Payments stakeholders to support performance discussions, respond to ad hoc analytical requests, and provide timely insights to inform business decisions.
Work closely with the Senior Portfolio Analyst to support portfolio deep dives, stakeholder packs, and executive ready reporting materials.
Collaborate with enterprise data and analytics teams to implement agreed reporting solutions in line with broader data strategy, standards, and best practice.
Support strong data accuracy and governance by maintaining reporting integrity, applying standardised definitions and methodologies, and assisting with the upkeep of data models and documentation.

What makes you perfect for the role?

University degree in business, finance, marketing, statistics, or a related field.
3+ years' experience supporting data analytics, integration, and visualisation initiatives within a complex environment.
Strong SQL capability, including complex querying and large-scale data manipulation to support analytical outcomes.
Experience using BI and analytics tools (e.g. Tableau, Cognos, Alteryx) and advanced Excel to produce reliable and repeatable reporting.
Exposure to complex data models, data quality considerations, and governance frameworks.
Strong analytical and communication skills, with the ability to present insights clearly and support engagement with senior stakeholders.

Optus is a place where we let you do you. We offer a range of benefits including:

Competitive remuneration and employee discounts. Make life easier (and more affordable) with $80 monthly credit and 25% off Optus products and unique shopping discounts with our retail partners.
Flexible working arrangements with opportunities to work three days in the office, two days remote or home.
Vibrant and collaborative office campus that includes cafes, convenience store, chill out zones, GP, post office, gym and on-site childcare centre.
Competitive leave policies, including additional 'Connected' days to focus on culture, family, health, community, or whatever's important to you.
We support growing families with inclusive, carer-neutral paid Parental Leave of up to 16 weeks.
Direct your own development and build future-ready skills with Optus U's industry-focused micro-credentials, developed with La Trobe and Macquarie Universities.
Build meaningful connections through employee-led networks and diversity initiatives including Culture Connect, Elevate Women, Disability Network and Express Yourself (LGBTQIA+).
Put your wellbeing first with free access to counselling and support services, 24/7 — in-person, by phone, SMS, or video.

At Optus, we are strengthened by others and that means valuing diversity and saying ‘yes' to embracing individual differences. We are committed to ensuring that our application process provides an equal employment opportunity to all job seekers, including individuals from diverse gender, cultural and linguistic backgrounds, individuals with a disability, individuals identifying as being part of the LGBTQIA+ community, individuals who may have served in the armed forces or who identify as Aboriginal and/or Torres Strait Islander. We also want to do our best to make our recruitment process inclusive.

If you require any adjustments or accessibility support to participate fairly and equitably in the recruitment process, please email AccessibleRecruitment@optus.com.au or call 1800 309 170. We're here to help. When you contact us, please advise your preferred method of contact and we will be in touch within 48 hours.

For more information on Diversity, Inclusion & Belonging at Optus, please visit https://www.optus.com.au/about/inclusion-diversity."
89862211,SAP HANA Analyst,Lynch Group,https://www.seek.com.au/job/89862211?type=standard&ref=search-standalone&origin=jobCard#sol=5739aa5dc9ef02112f504c52ce2ed82565016027,2h ago,2.0,2026-01-22T04:00:00+00:00,"Ingleburn, Sydney NSW",Business/Systems Analysts (Information & Communication Technology),Full time,,"Lynch Group is recruiting a hands-on SAP Integration Technical Lead to own the design, delivery and operational stability of integrations for our SAP S/4HANA Public Cloud landscape. This is a senior technical lead role (no direct reports). You will provide technical leadership for integration architecture, HANA modelling for reporting (side-by-side/analytics environments), and manage third-party vendors who deliver development and integration work.

Role scope — technical lead: This is a hands-on technical role responsible for integration architecture, data provisioning and analytics support. Detailed functional requirements elicitation, or running stakeholder workshops. The Integration Lead converts business/BA requirements into technical designs and implements them; the business/BA teams retain ownership of functional requirements and acceptance.

Key responsibilities

· Lead design and delivery of interfaces using SAP Integration Suite (Cloud Integration / CPI), API Management and SAP BTP.

· Design, build and support iFlows in CPI — adapter configuration, message mapping (graphical/XSLT), Groovy for custom logic, error subprocesses, retries and production monitoring.

· Design and optimise SAP HANA data models (Calculation, Analytical and Attribute Views) for reporting and integration in side-by-side HANA/HANA Cloud environments.

· Implement data provisioning strategies suitable for S/4 Public Cloud (API/OData extraction, SDI / HANA Cloud replication or other side-by-side approaches).

· Manage third-party vendors and contractors: define SoWs, perform technical acceptance testing, enforce SLAs, and remediate performance or security issues.

· Provide senior production support, incident triage and root-cause analysis; participate in a rostered on-call rotation.

· Define and maintain integration standards, governance and operational runbooks; mentor internal engineers.

Essential

· 5+ years SAP technical experience with 3+ years hands-on SAP Integration Suite / CPI experience (iFlows, adapters, mappings).

· Strong experience in SAP HANA data modelling and performance optimisation (calculation/analytical/attribute views) in side-by-side/analytics environments.

· Proven experience implementing API/OData-based integrations and performing technical acceptance.

· Demonstrated experience managing third-party vendors/outsourced development.

· Knowledge of secure authentication (OAuth, SAML, certificates) and protocols (OData, REST, SOAP, RFC, IDoc, SFTP).

· Excellent stakeholder and communication skills.

Highly regarded

· API Management, Event Mesh, SAP BTP services, HANA Cloud/SDI experience.

· Groovy/Java/XSLT or graphical mapping experience.

· Relevant SAP certifications.

Other

· Based at Ingleburn. Occasional travel and China engagement possible.

· Pre-employment police/background check required."
