Job ID,Job Title,Company,Detail URL,Posted Label,Hours Old,Posted Datetime (Local),Location,Category,Work Type,Salary,Ad Text
88589540,Senior Business Process Consultant - SAP Business Data Cloud & Analytics...,SAP Australia Pty Ltd,https://www.seek.com.au/job/88589540?type=standard&ref=search-standalone&origin=jobCard#sol=135d25ebeffedb61c2e4b7127b99f98ed97bda77,7h ago,7.0,2025-11-18T01:00:00+00:00,Brisbane QLD (Hybrid),Consultants (Information & Communication Technology),Full time,,"We help the world run betterAt SAP, we keep it simple: you bring your best to us, and we'll bring out the best in you. We're builders touching over 20 industries and 80% of global commerce, and we need your unique talents to help shape what's next. The work is challenging – but it matters. You'll find a place where you can be yourself, prioritize your wellbeing, and truly belong. What's in it for you? Constant learning, skill growth, great benefits, and a team that wants you to grow and succeed. 

Role Overview

Are you passionate about the transformative power of cloud data and analytics? Are you ready to help Australia’s public and private sectors unlock greater efficiency and insight through smarter data strategies and migrations?
Join SAP and play a leading role in redefining how organisations harness the potential of SAP Business Data Cloud and advanced analytics. As a Senior Business Process Consultant, you will architect and design complex data and analytics solutions, provide strategic leadership, and guide teams to deliver impactful outcomes. This is your opportunity to set new industry benchmarks and drive real transformation where it matters most

Key Responsibilities

Lead the modernisation of legacy data and analytics platforms (such as SAP BW), developing and executing strategies to migrate and transform these environments to cloud-based architectures, leveraging SAP Business Data Cloud and related technologies.
Architect and design end-to-end data management and analytics solutions using SAP Business Data Cloud, ensuring scalability, security, and alignment with industry best practices.
Provide strategic advisory to clients, developing data strategies and roadmaps that align with organisational objectives and compliance requirements.
Lead and mentor delivery teams, providing technical direction and best practice guidance at both regional and, where required, global levels.
Engage with senior stakeholders (including C-level executives) to understand business needs, facilitate workshops, and drive business use case discovery.
Oversee the implementation of data integration, modelling, and analytics solutions, ensuring quality and consistency across projects.
Maintain deep expertise in SAP’s data and analytics portfolio, with a focus on SAP Datasphere, SAP Analytics Cloud, and SAP HANA Cloud.
Foster a culture of innovation, collaboration, and continuous learning within project teams and across the wider SAP community.
Contribute to the development of best practices, technical documentation, and knowledge sharing across teams.
Support the sales process as a subject matter expert, including proposal development, solution scoping, and customer presentations.
Ensure adherence to SAP and client project methodologies, including Activate and relevant frameworks.

Education, Skills & Competencies

Bachelor’s or Master’s degree in Business Administration, Computer Science, Information Management, or a related field.
Proven expertise in solution architecture and design for large-scale data and analytics platforms, ideally within the SAP ecosystem.
Strong experience with SAP data and analytics solutions (such as SAP Analytics Cloud, SAP Datasphere, SAP HANA Cloud, or similar platforms), with the ability and motivation to rapidly learn and apply new SAP Business Data Cloud capabilities.
Demonstrated ability to lead, guide, and instruct teams across regions and, where required, globally, fostering knowledge transfer and capability uplift.
Solid understanding of cloud concepts, data architecture, and enterprise data management.
Demonstrated experience working with or for government agencies or large enterprises.
Excellent communication and stakeholder engagement skills, with the ability to present complex concepts to non-technical audiences.
Proven ability to capture business requirements and translate them into effective data solutions.

Beneficial

Experience with modern data platforms such as Databricks and/or Snowflake.
Hands-on experience in artificial intelligence (AI), particularly with SAP Business AI or similar enterprise AI solutions.
Experience in business planning and financial processes (e.g., SAP BPC, SAP Planning, or similar solutions).
Knowledge of ABAP programming and its application within SAP data and analytics environments.

Personal Attributes

High integrity, reliability, and ability to work effectively under pressure.
Self-starter with a passion for learning and staying ahead of technology trends.
Team player with strong interpersonal skills and a collaborative, inclusive mindset.

Customer-Facing Skills

Ability to inspire confidence and engage with stakeholders at all levels, including executives.
Skilled at delivering clear, concise presentations and facilitating workshops.

Travel

Willingness to travel as required, primarily within Brisbane and occasionally interstate or internationally.

What We Offer

At SAP, you’ll join a dynamic, inclusive, and flexible work environment, with opportunities for personal and professional growth, recognition for your unique contributions, and the chance to make a real impact on digital transformation in Australia

Bring out your bestSAP innovations help more than four hundred thousand customers worldwide work together more efficiently and use business insight more effectively. Originally known for leadership in enterprise resource planning (ERP) software, SAP has evolved to become a market leader in end-to-end business application software and related services for database, analytics, intelligent technologies, and experience management. As a cloud company with two hundred million users and more than one hundred thousand employees worldwide, we are purpose-driven and future-focused, with a highly collaborative team ethic and commitment to personal development. Whether connecting global industries, people, or platforms, we help ensure every challenge gets the solution it deserves. At SAP, you can bring out your best.  

Please note that any violation of these guidelines may result in disqualification from the hiring process.

Requisition ID: 440075  | Work Area: Consulting and Professional Services  | Expected Travel: 0 - 30%  | Career Status: Professional  | Employment Type: Regular Full Time   | Additional Locations:  #LI-Hybrid"
88589267,Business Analyst - Data Projects,GWG Recruitment,https://www.seek.com.au/job/88589267?type=standard&ref=search-standalone&origin=jobCard#sol=f1523699a4ef392bb5a23352e4d7c12ec33926c7,7h ago,7.0,2025-11-18T01:00:00+00:00,"Newcastle, Newcastle, Maitland & Hunter NSW (Hybrid)",Business/Systems Analysts (Information & Communication Technology),Contract/Temp,,"We’re seeking an experienced Business Analyst to support a major in-flight data and digital transformation initiative. This role will help drive delivery by supporting requirements gathering, technical translation, and coordination across multiple teams working within a complex data environment.

You’ll collaborate closely with business stakeholders, technical teams, and vendors to maintain delivery momentum and support the transition of core systems and processes into a modernised operating environment.

About the Role
- Work as a Business Analyst with the capability to act in a Product Owner capacity
- Translate business needs into clear user stories, documentation, and functional specifications
- Support data-focused project work, system enhancements, and transition activities
- Ensure requirements stay aligned with scope, timelines, and delivery expectations

Key Skills & Experience
- Proven experience in data, analytics, digital, or platform-related projects
- Strong BA capability, including translating business needs into actionable work for development teams
- Understanding of data concepts (e.g., ingestion, pipelines, data quality, modelling)
- Ability to collaborate effectively with technical teams, vendors, and diverse stakeholders
- Tools: Jira & Confluence (essential)
- Exposure to legacy and cloud-based analytics or data platforms is beneficial

Primary Responsibilities
- Gather and document business and technical requirements
- Translate business needs into specifications for development and data teams
- Create and manage user stories, acceptance criteria, and project documentation
- Identify and manage risks, issues, and dependencies
- Support communication, change, and transition activities
- Contribute to smooth coordination throughout the project lifecycle

Contract Details
- Location: Newcastle – 3 days onsite, 2 days WFH
- Length: 11-month contract
- Start: ASAP
- Engagement: Day rate contract

Interested? Apply now with your resume to be considered. Still have questions? Reach out to Elizabeth on 0432 398 128 or email elizabeth.behnesmith@gwg.com.au"
88588424,Financial Analyst,Sigma Healthcare,https://www.seek.com.au/job/88588424?type=standard&ref=search-standalone&origin=jobCard#sol=02a60da34c0138e7b83e444662abeba25c374191,8h ago,8.0,2025-11-18T00:00:00+00:00,"Preston, Melbourne VIC",Analysis & Reporting (Accounting),Full time,,"About Us

Sigma Healthcare is proudly powering pharmacy! We have the largest pharmacy network in Australia with trusted brands including Chemist Warehouse, Amcal and Discount Drug Stores. We are powered by our dedicated people and our leading Australian full-line pharmacy wholesale and distribution business that delivers medicines to any pharmacy anywhere in Australia. With Chemist Warehouse now operating in four countries outside Australia, we continue to expand our reach.


The Opportunity

We’re looking for a commercially minded Financial Analyst to support our Wholesale Commercial team with high-quality reporting, analysis, and insights that drive stronger financial performance.

Reporting to the Commercial Finance Manager – Wholesale, you’ll partner closely with Commercial leaders to interpret financial results, support margin improvement initiatives, and enhance decision-making across one of the most critical areas of the business.

This role is ideal for an analytical, detail-driven finance professional who enjoys problem-solving, business partnering, and taking ownership of key financial processes in a fast-moving and transforming ASX-listed environment.




Key Responsibilities

Partner with the Wholesale Commercial team to interpret monthly financial results

Own the month-end close process for Commercial cost centres

Support development and continuous improvement of the CPM model

Analyse business performance to provide insight on sales, margins, volume, mix, price and COGS

Prepare accurate and timely monthly financial performance reporting for Commercial Leaders, Executives and the Board

Review and analyse financial and non-financial data to identify trends, risks and opportunities

Support annual budgets and rolling monthly forecasts

Champion continuous improvement across finance systems and reporting

Build strong engagement and customer-focused relationships with key stakeholders




About You
To succeed in this role, you’ll bring:

CA or CPA qualification (or near completion)

Strong financial and commercial acumen

Advanced Excel skills

Experience in finance business partnering, ideally within FMCG, wholesale or retail

Proven ability to analyse complex datasets and deliver actionable insights

Strong communication and stakeholder management capability

A proactive, curious mindset with a continuous-improvement focus




Why Join Us?
At Sigma Healthcare, our people make the difference. Here’s what you can expect:

Competitive salary + superannuation

Hybrid working arrangements (Preston HQ)

Staff discounts across all Sigma Healthcare group stores (Chemist Warehouse, Ultra Beauty, My Beauty Spot, Discount Drug Store & Optometrist Warehouse

Exposure to senior commercial stakeholders

Career progression in a Top 50 ASX-listed company

A collaborative, high-performing Commercial Finance team




Apply Now
If you’re ready to shape financial insights and support commercial decision-making across Australia’s largest pharmacy network, apply now and help power the future of pharmacy with Sigma Healthcare."
88587881,Manager Asset Data Reporting & Visualisation,Department of Transport and Planning,https://www.seek.com.au/job/88587881?type=standard&ref=search-standalone&origin=jobCard#sol=9d262ca0c47511e942df34e7624e5eedc1afa607,8h ago,8.0,2025-11-18T00:00:00+00:00,Melbourne VIC,Government - State (Government & Defence),Full time,"$138,631 - $185,518 Per Annum + Superannuation","Company description:



About Us

The Department of Transport and Planning oversees key planning, transport and land use policy decisions and management across the State. A life-cycle approach to planning, building, connecting and sustaining communities means our people can come together to; improve services, deliver sustainable projects, focus on customer engagement, streamline regulatory approval pathways, facilitate community consultation and better realise local economic opportunities for more liveable communities across Victoria.

Network Design and Integration delivers transport priorities through the planning, development and maintenance of an integrated pipeline of projects and strategic initiatives that provide safe, efficient and sustainable outcomes to all Victorians.

We're focused on outcomes that deliver more choice, connections and confidence in our travel, ensuring the whole transport network works as one to deliver better services and outcomes.



Job description:



About the Role

The Manager, Asset Data Reporting and Visualisation is a position that sits within the Asset Information Requirements, Governance and Reporting Team in Asset Intelligence Branch of Assets and Engineering Division. The position leads the on-going management of asset related data reporting and visualisation capabilities that align with business needs, organisational objectives and regulatory requirements.

This position ensures that timely and accurate asset reports and dashboards are available to meet DTP reporting and visualisation decision-making including strategic asset management, asset assurance, monitoring of asset health, lifecycle performance, risks and other asset management activities across the asset lifecycle.

The position plays a critical role in bridging technical data outputs with business needs by collaborating closely with stakeholders across asset management to ensure reporting outputs are aligned with organisational goals and priorities.

To access the Position Description, please click here.

Position Outcomes / Accountabilities

Asset Data Reporting and Visualisation - The incumbent leads the development, implementation and continuous improvement of asset data reporting and visualisation capabilities that align with organisational objectives and business needs.
Asset Reports and Dashboards Development - The incumbent provides advanced expertise and knowledge in the production, management and improvement of dashboards and reports using tools such as Power BI, Tableau or similar platform to provide clear, targeted and timely reports that contributes to regulatory submissions, audits, and reporting obligations related to asset inventory, condition and performance.
Asset Data Mining and Integration - The incumbent develops methods to obtain/access data from asset custodians and stewards, asset information specialists, and collaborate with data engineers and modellers to ensure data from multiple sources (e.g. Enterprise Asset Management System, GIS, Analytics Platform, SCADA) are harmonised and integrated for reporting.
Asset Trend Analysis - The incumbent applies sound statistical and analytical techniques to build and maintain methodologies to enable trend analysis in asset condition, performance, failure rates to support evidence-based problem solving with respect to asset management lifecycle activities.
Stakeholder Management - The incumbent demonstrates excellent interpersonal and communication skills, with the ability to collaborate with a range of internal and external stakeholders to understand business needs and requirements to ensure delivery of value-added reporting solutions.
In line with Section 31A of the Public Administration Act 2004 (Vic) other duties may be assigned consistent with employment classification, skills, and capabilities.

Key Selection Criteria

The DTP is seeking a professional with strong data literacy and reporting expertise to analyse complex datasets, generate meaningful insights, and support effective decision-making. You will apply accomplished critical thinking, stakeholder management, and organisational asset management capabilities to deliver value-add outcomes and drive service improvements. The role also encourages innovation and continuous improvement, contributing ideas and enhancing processes to improve quality and efficiency.

Qualifications and Experience

Mandatory

Tertiary qualifications in data analytics, data science, statistics, asset management and/or engineering related disciplines
Experience in data visualisation development through BI Tools such as Power BI, Tableau
Experience in people management and team leadership
Experience in complex infrastructure, asset and/or engineering data management

Desirable

Experience in one or more programming languages (R, SQL, Python)
Experience in Asset Management, preferably in Transport industry (Roads, Rail, Bus)
Experience in managing geospatial data (Shapefile, GeoJSON, WKT, KML, KMZ) and products (Esri)

Culture Value

We welcome applicants from a diverse range of backgrounds representing the community that we serve, including veterans, parents, carers, First Peoples, people with disability, multicultural, multifaith and LGBTIQA+ individuals.

As an equal opportunity employer, we are committed to fostering a safe, inclusive, and high-performance culture. Through shared actions and behaviours aligned with our strategy and direction, we empower our people to thrive and meaningfully contribute to the department's goals.

What we offer

Meaningful work making Victorian communities more accessible and liveable
Professional growth and development opportunities across the department and the wider Victorian Public Services
A hybrid working model focused on collaboration and teamwork
Optimal work-life balance initiatives including flexible working arrangements
Opportunity to work across multiple urban and suburban hubs
We prioritise the development of a safe and inclusive culture

Pre-employment checks and employment conditions

All new appointments to the department will be subject to a National Criminal Records Check, Misconduct Screening, and a Qualification Check where there is a requirement for a mandatory qualification. Information provided to the Department of Transport and Planning will be treated in the strictest confidence consistent with the requirements of the Privacy and Data Protection Act 2014.

Applicants must be an Australian Citizen, Permanent Resident or hold a valid work permit or visa necessary for the nature of the position.

Recipients of Victorian Public Service (VPS) voluntary departure packages should note that re-employment restrictions apply.

Non-VPS applicants will be subject to a probation period of six months.

How to Apply

Click the ‘Apply' button to be redirected to our recruitment platform, where you may need to create an account to submit your application.

If you encounter any issues, refer to our Quick Reference Guide for step-by-step instructions.

Applications close at 11:59 pm on Tuesday 02 December 2025.

Please include both your resume and a cover letter. All applications must be submitted via the online portal, we're unable to accept email or manual submissions.

For further information about the role, please contact Cassie Khaw, Senior Manager Asset Information Requirements, Governance and Reporting via cassie.khaw@transport.vic.gov.au

Important Information:

If you require any adjustments to fully participate in the recruitment process, or need the advert or attachments in an accessible format (e.g., large print), please contact us by phone or email. We're here to support you."
88587442,Financial Planning and Analysis Manager,Q Consulting Group,https://www.seek.com.au/job/88587442?type=standard&ref=search-standalone&origin=jobCard#sol=7dbd955cd32d017f2f86678cbdd61edc74c10362,8h ago,8.0,2025-11-18T00:00:00+00:00,Darwin NT,Analysis & Reporting (Accounting),Full time,,"Our client is one of the largest companies in Australia and is continuing to grow as they acquire new customers and expand their footprint across the country. 2025 was another record for the business and the company is on target to achieve $1 billion in revenues by 2028.

As Financial Planning and Analysis Manager, you will be in charge of leading the financial planning, budgeting and forecasting processes to support strategic decision-making and drive performance and growth. Key responsibilities include overseeing budgets, performing financial analysis, creating financial models and forecasts, monitoring performance and providing actionable insights to the Executive Management Team.

This is a manager role with the Finance team with high exposure to the CFO and EMT.

The role requires strong analytical skills, technical proficiency in financial software and effective collaboration with various business stakeholders. 

Ideally, you will have at least 5-10 years in a senior FP+A role from a large organisation.

In addition, we are looking for:-
· CPA or CA qualification
· Bachelor degree in Accounting, Finance, Commerce, Economics or equivalent required
· Masters degree in Accounting, Finance or Business Administration preferred
· Excellent coordination, planning and organisational skills
 
In return, you can expect to significantly accelerate your career and and enjoy the mentorship of a top ranking CFO.

$150,000 plus super plus bonus."
