Job ID,Job Title,Company,Detail URL,Posted Label,Hours Old,Posted Datetime (Local),Location,Category,Work Type,Salary,Ad Text
87600191,Investment Analyst / Senior Analyst,Mutual Trust,https://www.seek.com.au/job/87600191?type=standard&ref=search-standalone&origin=jobCard#sol=8215294b2fd5a5c8f7e8aeb324bde1ecf4ff48a5,2h ago,2.0,2025-10-02T06:00:00+00:00,Melbourne VIC (Hybrid),Funds Management (Banking & Financial Services),Full time,,"The Opportunity

Reporting to the Senior Investment Analyst, Research & Portfolio Management, you’ll play a vital role in the implementation and monitoring of investment strategies across fixed income, cash and externally managed funds. This is a hands-on opportunity to build technical expertise in both trade execution and fund manager research, while contributing directly to portfolio outcomes in a collaborative buy-side environment.

Key Responsibilities:

Supporting fixed income and cash trade execution, including government and corporate bonds, cash instruments and FX; monitoring market data/news.
Monitoring and researching external managers across fixed income and cash funds, contributing to Approved Product List (APL) maintenance and new manager recommendations.
Producing performance, attribution and risk reporting for multi-asset model portfolios and assisting with rebalancing and implementation.
Contributing investment research and insights, including materials for internal committees and client-facing content.
Collaborating with advisers, Operations and Legal/Risk/Compliance to ensure efficient implementation, best-execution practices and strong governance.
Maintaining relationships with brokers and investment banks; undertaking credit research as required.
About You

You’re analytical, detail-focused and thrive where accuracy and timing matter. You enjoy working across both fixed income trading and manager research, and you’re motivated to broaden your exposure across asset classes while operating to high ethical standards.

You have:

A degree in finance, economics, commerce or a related discipline (post-grad/CFA progress highly regarded).
3+ years’ experience in financial markets, ideally in fixed income trading, treasury or fund manager research.
Genuine interest and knowledge of fixed income (essential), with broader interest in macroeconomics and investment markets.
Strong quantitative, analytical and research skills with excellent attention to detail.
The ability to manage multiple demands, work effectively under pressure and maintain accuracy under time constraints.
High integrity and professionalism, with a commitment to continuous improvement and learning.
Strong communication and stakeholder skills to work effectively with advisers and colleagues.
Culture & Benefits

Supportive flexible (hybrid) work arrangements.
Option to purchase up to four weeks’ additional leave each year.
Recognised as a WGEA Employer of Choice for Gender Equality.
Ongoing professional training & development (mentoring and study support).
Health & wellbeing allowance and activities.
Work with industry experts in highly specialised roles.
Employee Assistance Program for you and your family.
Annual performance payment (firm and individual performance).
Paid community/volunteer days and award-winning giving program.
Reward & Recognition program and regular team events.
About Us

Mutual Trust is a multi-family office providing integrated wealth services to Australia’s most successful families, family businesses, trustees, not-for-profits and individuals. Our purpose is to help families achieve what matters most.

About Our Team

With 220+ staff across Melbourne, Sydney, Perth and Adelaide, our team enjoys a fun, collaborative culture and diverse roles across wealth management, accounting, tax, family office, agri-business, trustee and philanthropy. We back technical excellence with extensive learning and development.

How to Apply

Please submit your application online including:

A cover letter, and
A detailed résumé (Word or PDF)
Only applicants with permanent residency or without visa restrictions will be considered.

For enquiries, contact Kate Farmer on (03) 9605 9645."
87599884,APS6 Senior Data Analyst,relatbl,https://www.seek.com.au/job/87599884?type=standard&ref=search-standalone&origin=jobCard#sol=44f53c0cba22e1adde21b684d1bc497b714f893f,2h ago,2.0,2025-10-02T06:00:00+00:00,Adelaide SA (Hybrid),Government - Federal (Government & Defence),Contract/Temp,Competitive hourly rate negotiable upon experience,"About the role

Our Commonwealth Government client is seeking an APS6 Senior Data Analyst to interpret complex datasets and deliver insights that support strategic decision-making and organisational outcomes. The successful candidates will contribute to data quality initiatives, assess customer data requirements, and analyse matching scenarios using data management tools.

An initial 6-month labour hire contract is on offer. We anticipate a start date in early-November 2025.

This role is based in Adelaide; however other locations around Australia will be considered. Flexible working arrangements will also be considered.

Please note: only Australian citizens can be considered for this role.

Duties
Execute and oversee technical data tasks, including loading, maintaining, analysing, and distributing data.
Support data processing, matching, and management of master data elements.
Audit and enhance data quality through targeted programmes and error handling.
Resolve data integration issues and ensure alignment with enterprise systems and business needs.
Develop and maintain data standards, business rules, and retention criteria; contribute to governance strategy.
Provide data modelling support, ensuring documentation accuracy and consistency.
Collaborate with stakeholders to resolve issues, implement improvements, and support project delivery.
Lead a small team, managing priorities, performance, wellbeing, and capability development.

Requisite skills, experience, and knowledge
Demonstrated strategic thinking and ability to assess impacts across work areas.
Proven experience supervising and developing staff through coaching and mentoring.
Skilled in building and maintaining effective stakeholder relationships.
Strong risk identification, mitigation, and conflict management skills.
Effective at prioritising tasks and collaborating for quality outcomes.
Excellent communication skills, adaptable to different audiences.
Strong analytical skills with the ability to draw evidence-based conclusions.
Sound judgement in decision-making and problem-solving.

Required SFIA (Skills for the Information Age) levels:
Data modelling and design DTAN - Level 4
Programming/software development PROG - Level 2
Business intelligence BINT - Level 2
Data visualisation VISL - Level 3

Culture and benefits
People enjoy contracting with relatbl because our business is owned and managed by people who have first-hand experience working as contractors. We can relate. We treat people the way we would want to be treated, and we provide a range of perks and benefits to our staff.

How to apply
Click APPLY or get in touch with Fern (fern.boulton@relatbl.com.au) or Sam (sam.gavan@relatbl.com.au) for a confidential discussion. Applications for this position close on Sunday 12 October 2025. However, applications received after the closing date will be considered for similar future roles."
87599350,Business Analyst,Perigon Group Pty Limited,https://www.seek.com.au/job/87599350?type=standard&ref=search-standalone&origin=jobCard#sol=48f352046de2204afbc9ba13a8eccc28e6c933c6,3h ago,3.0,2025-10-02T05:00:00+00:00,Brisbane QLD (Hybrid),Business/Systems Analysts (Information & Communication Technology),Full time,Salary inline with experience,"About the Role
Our Client is seeking a cross-functional Business Analyst who thrives on connecting people, process, and technology. In this role, you’ll help business teams articulate and refine their requirements, design fit-for-purpose processes, and ensure these are translated into practical solutions. With the ability to converse confidently with both internal stakeholders and third-party development teams, you’ll play a pivotal role in aligning business needs with technical delivery.

Key Responsibilities

Facilitate workshops to elicit, clarify, and prioritise requirements
Define and document As-Is and To-Be processes and user journeys
Translate requirements into clear artefacts for internal and vendor development teams
Support testing, acceptance criteria, and solution validation
Build collaborative relationships across business, operations, and technology
About You

Strong experience as a BA across systems, processes, and technology change
Skilled in gathering requirements and creating process documentation
Comfortable bridging business stakeholders with developers (internal and external)
Strong interpersonal and communication skills with a consultative style
Financial services or investment knowledge beneficial, but not essential
About the Company
Our Client is a growing investment services organisation with a national footprint and global connections. They support a network of specialist investment managers with leading operational and technology solutions, and are recognised for delivering high-quality outcomes to clients.

For more information or a confidential discussion, please apply."
87599241,Business Analyst,Perigon Group Pty Limited,https://www.seek.com.au/job/87599241?type=standard&ref=search-standalone&origin=jobCard#sol=b44790659ee43e845f7bc0b0c4cc52935c501597,3h ago,3.0,2025-10-02T05:00:00+00:00,Brisbane QLD,Business/Systems Analysts (Information & Communication Technology),Full time,"Circa $130,000 Inclusive of Super","About the Role
Our client is seeking a Business Analyst to play a pivotal role in supporting system implementations, upgrades, and enhancements. You’ll work closely with project managers, technical teams, and stakeholders to gather requirements, document processes, and ensure smooth delivery of technology solutions. A key part of the role will involve coordinating integrations across systems and leading user acceptance testing, ensuring projects land successfully with the business.

Key Responsibilities

Analyse, capture, and document requirements for system changes and upgrades
Support end-to-end implementation activities, including configuration and rollout
Work with technical teams to manage integrations and data migrations
Plan, coordinate, and execute UAT, managing defects through to resolution
Provide clear communication and training support to business users
About You

Experience as a Business Analyst in technology projects
Background in system implementations, upgrades, or enhancements
Knowledge of integrations, data mapping, and migration processes
Practical experience running UAT cycles and working with business stakeholders
Strong communication, documentation, and problem-solving skills
For more information or a confidential discussion, please apply."
87599116,Data Solution Lead,Nutrien Ag Solutions Limited,https://www.seek.com.au/job/87599116?type=standard&ref=search-standalone&origin=jobCard#sol=fc027272bb959662b98300ce1d9b06c3bc32c151,3h ago,3.0,2025-10-02T05:00:00+00:00,"Docklands, Melbourne VIC (Hybrid)",Database Development & Administration (Information & Communication Technology),Full time,Competitive salary and access to incentive program,"For over 180 years, Nutrien Ag Solutions has been an integral part of the Australian agricultural industry and we have been committed to providing quality local advice, knowledge and expertise to growers and rural producers. Nutrien Ag Solutions is one of the largest agribusinesses operating in Australia with a national network of more than 700 locations.




An exciting opportunity now exists for an experienced Data Solution Lead to join our growing team on a full-time permanent basis. In this varied and challenging position, you will lead a team of skilled Data Analysts and Modelers to deliver end to end data enablement and solutions for the organisation.




Key areas of responsibility include

Successfully plan, design, develop, and deliver end-to-end, value-adding data solutions.

Collaborate closely with stakeholders to understand business challenges and opportunities, assess feasibility, viability, cost, priority, and the value of solutions.

Apply hands-on technical skills to guide, design and develop new data solutions, and improve existing ones as required.

Present data solutions, insights and recommendations to stakeholders.

Ensure high data quality, integrity, and security throughout all data handling processes.

Manage demand, assessment, planning, and delivery of data solutions against time, resources, and budget.

Stay informed about emerging trends in data technologies and analytics, steering the data and analytics to higher capabilities.

Lead, mentor, and develop team members, nurturing an environment of innovation and continuous improvement.




About You:

Demonstrated success in a similar Data Solution Lead role within a large corporate organisation.

Deep data expertise in SAP sales, procurement, and inventory

Experience in market-leading data solution tools to manage the end-to-end data life cycle including integration, storage, transformation, modelling, analysis and presentation.

SAP data/BW/HANA modelling experience is preferred

Experience in Snowflake, Data Services, AWS Analytics Services would be advantageous

Experience in KANBAN methods of workflow and adaptability in a dynamic and agile environment

Strong stakeholder management ability with highly developed verbal, personal and written communications skills

Strong skills in Business Analysis to frame the right questions and find the right answers

Excellent analytical and problem-solving skills

Proficiency in Python or R, and experience with AI/ML use cases, is advantageous but not essential




Why work for us?

A competitive remuneration package

Flexible hybrid working environment

An additional day of leave – Nutrien Day

Attractive employee benefits including salary sacrificing, novated leasing, and health insurance discounts

Gender neutral parental leave policy

Opportunities to support community partnerships across our network

Be a member of a company committed to feeding the future

Ongoing training and development to pursue individual ambitions

A culture of learning




Make a difference. Being part of Nutrien Ag Solutions, one of Australia’s largest agriculture companies, means your purpose for coming to work every day is real and impactful – Feeding the Future. If this sounds like you click on the APPLY button now!




To find out more about Nutrien Ag Solutions go to  https://www.nutrienagsolutions.com.au/  or follow us on LinkedIn.


At Nutrien Ag Solutions we value diversity in our teams and encourage people of all genders and from all backgrounds to apply. At this time only candidates with an existing and future right to work in Australia will be considered.

 In accordance with Nutrien Ag Solutions’ policies, you may be required to undergo a pre-employment background check. While we appreciate all applications we receive, only candidates under consideration will be contacted. 

Please note that unsolicited CVs or profiles will not be accepted, and Nutrien Ag Solutions will not be held liable for any that are sent through."
87598408,Senior Data Platform Engineer,Hearing Australia,https://www.seek.com.au/job/87598408?type=standard&ref=search-standalone&origin=jobCard#sol=283b6738143d7394842f1ce0d7034fc6af8edd8f,3h ago,3.0,2025-10-02T05:00:00+00:00,"Macquarie Park, Sydney NSW (Hybrid)","Engineering - Software (Information & Communication Technology)
Government - Federal (Government & Defence)",Full time,,"Job description:


Are you looking for a new challenge and want to see your work make a real impact?
Gain skills with Australia's largest provider of government-funded hearing care
Permanent, Hybrid working, Macquarie Park based

Want to improve the lives of Australians, no matter who they are?

Join us and build a career and future you'll be proud of.

It matters more at Hearing Australia

Hearing Australia is a trusted leader in our field. Working across the country, we exist to support and empower people through hearing health when and where they need it.

Your opportunity

As a Senior Data Platform Engineer, you'll be reporting to the Data Engineering Manager, and will be responsible for the design, build and maintaining the Azure modern data platform. Lift data quality and governance. Keep the platform reliable, secure, and cost‑aware. Work with Microsoft Dynamics 365 and Clinical teams on clean upstream data. Working side by side with people who go the extra mile, you'll also love the feeling of helping children and adults who need us.

Must haves

Clear communication style. Able to explain complex data and architecture concepts to business stakeholders.
Minimum eight years of hands-on data engineering experience delivering enterprise-grade data solutions.
Architecture and operations mindset. Defines target patterns and reference designs, leads design reviews, sets up robust monitoring and alerting and manages incidents and problems effectively.
Designs solutions with security, privacy and reliability built in from the start.
Data governance expertise applied daily. Implements and maintains data quality checks, cataloguing, lineage tracking, glossary management and fine-grained access control using Microsoft Purview or equivalent tools.
Proven experience with Dynamics 365 and Dataverse.
Proven delivery of modern data warehouse platforms in production environments, including design, build, deployment and ongoing maintenance for performance and reliability.
Deep Azure platform expertise across Azure Data Lake Storage (Gen2), Azure Databricks, Azure Synapse Analytics, Microsoft Fabric and Azure Data Factory, with supporting experience in Azure Functions, Logic Apps, Event Hubs or Stream Analytics.
Strong data modelling experience. Designs and maintains star schemas, lakehouse layers and semantic models in Microsoft Fabric or Power BI.
Expert-level SQL skills with proficiency in either Python or PySpark.
CI/CD for data pipelines using Azure DevOps. Builds and maintains automated deployment pipelines with structured branching strategies, environment promotion, approval workflows, and release automation for data assets and infrastructure.

Nice to haves

Advanced Microsoft Fabric capabilities and complex pipeline orchestration
Strong FinOps awareness, including cost monitoring and optimisation.
Experience supporting data science and AI initiatives, ML-ready datasets or Azure Machine Learning integration

Why Hearing Australia?

There's so much to love about a role with us. But our people say there's three things that set us and their careers apart. They're about:

How we do what we do: Our vision is to deliver the best hearing solutions for anyone, anytime, anywhere. At Hearing Australia, you'll know you're making a contribution that really means something
Who we work with: Here, you'll support and empower clients of all backgrounds. That's what drives our teams and what makes them so special
Where we're going next: As our industry evolves, we're committed to learning and improving what we do and how we do it and building an organisation where everyone can thrive.

What does that mean for you?

As a Senior Data Platform Engineer you'll know that every day, your work is helping children and adults who need us. Just ask Sandeep, one of our IT professionals about why they choose to work with us:

""The work we do in helping people hear sound again and for the very first time is quite inspirational. Everything we do here is purpose-driven.""

You'll also enjoy a range of benefits, including:

Attractive employee benefits (salary sacrifice superannuation, HCF private health cover discount, well-being programs, salary packaging, discounts across an exciting range of retailers)
Free, onsite staff parking
Employee recognition awards programFlexible work arrangement opportunities to support work, personal and family commitments
Flexible work arrangement opportunities to support work, personal and family commitments

Let's create the gold standard of hearing care

We will require the successful candidate to be willing to have a Police Check conducted (we pay), a current driver's licence and must have rights to work in Australia.

Hearing Australia is an Equal Opportunity Employer and embraces diversity, equity and inclusion. We are passionate about building a diverse and inclusive culture from within.

We encourage Aboriginal and Torres Strait Islander peoples and applicants from different cultures who are bilingual to apply.

We are committed to facilitating a barrier-free recruitment process and work environment. If you require any accommodations, we welcome you to let us know so we can work with you to participate fully in our recruitment experience."
87596487,"Senior Analyst, Valuations (Unlisted Assets)",AustralianSuper,https://www.seek.com.au/job/87596487?type=standard&ref=search-standalone&origin=jobCard#sol=da841c24eb7175e8762cf905af604e583832ba15,4h ago,4.0,2025-10-02T04:00:00+00:00,Sydney NSW (Hybrid),Superannuation (Insurance & Superannuation),Full time,,"Senior Analyst, Valuations (Unlisted Assets)


Play a key role in valuing unlisted investments across infrastructure, private debt, and private equity. Shape outcomes for millions of members. Sydney or Melbourne.

At AustralianSuper, we believe work should be rewarding, meaningful, and yes, enjoyable! We know that life doesn't pause when you're at work, so we champion flexibility, celebrate diversity, and support you to thrive both professionally and personally. Here, your unique perspective helps us deliver better results for our members and creates a workplace where everyone can grow.


Your New Role

Step into a dynamic *Senior Analyst role within our Valuations Team, where you'll help oversee the valuation of our rapidly expanding portfolio of directly held unlisted assets. You'll collaborate with independent valuers and asset class teams, ensuring our valuation process is robust, insightful, and future-focused.

Your days will be filled with analytical challenges-diving into financial models, crafting impactful presentations, and working side-by-side with talented peers and senior leaders in the Mid Risk and Private Equity Groups. You'll share investment insights, sharpen your technical skills, and play a hands-on role in priority projects.

*Note that whilst this is a Senior Analyst position, we would also be open to Analyst level candidates for this role.


Key responsibilities include:


Supporting, and helping to drive the valuation process for unlisted assets (Infrastructure, Private Equity, and Debt/Credit): facilitate stakeholder meetings, review independent valuation reports, perform shadow valuations and cross-checks, verify data accuracy, and assess key assumptions.
Supporting internal valuations for investments not externally valued, ensuring accuracy and timeliness.
Researching and delivering insights that power valuation analysis, and collating key metrics to ensure assets are valued appropriately.
Contributing to valuation papers for the Valuation Committee, supporting investment recommendations.
Preparing Requests for Proposal to help appoint independent valuers for new and rotating assets.
Assisting in the creation of thought leadership and sharing valuation insights with stakeholders.
Analysing data for Board and committee reporting.
Enhancing our valuation function by developing systems, controls, and processes to support our growing fund.
Helping deliver on internal, external, and regulatory reporting requirements.
Building strong relationships with internal and external stakeholders on valuation matters.


What You'll Need

Experience in a valuation team at a large accounting firm, boutique corporate advisor, or institutional/corporate investing role.
Familiarity with infrastructure or related sectors (note - You don't have to have specific Infrastructure / Private Asset Valuations experience!).
Strong skills in report preparation, data analysis, and drawing clear conclusions.
Excellent communication and presentation skills (written and verbal), with proficiency in Excel, PowerPoint, and Word.
A keen eye for detail, great time management, and a collaborative spirit.
Tertiary qualifications in Commerce or a related field.
Bonus points for experience with S&P Capital IQ, Bloomberg, and post-grad qualifications (e.g., CFA, Chartered Accountants ANZ).


Life at AustralianSuper

We're committed to your growth, offering ongoing learning, coaching, and career opportunities across our global organisation. Enjoy generous leave, a blended working environment, and the flexibility to make work fit your life. We champion safety, respect, and inclusiveness, and we're always ready to support reasonable adjustments throughout the recruitment process and beyond.


What's Next

Apply now, if you share our values of Energy, Integrity, Generosity of Spirit and Excellent Outcomes and would like the opportunity to work in a challenging, growing and rapidly evolving team to deliver outstanding results.

Australian or New Zealand citizenship or Australian permanent residency status is required.

Progress powered by purpose.

Agencies please note: this vacancy is being managed directly by AustralianSuper's Talent Acquisition team. We will contact our preferred agency partners should we require additional support. Thank you."
