Job ID,Job Title,Company,Detail URL,Posted Label,Hours Old,Posted Datetime (Local),Location,Category,Work Type,Salary,Ad Text
86822742,Power BI Analyst,Robert Half,https://www.seek.com.au/job/86822742?type=standard&ref=search-standalone&origin=jobCard#sol=c3ba854e1f64b247c555bbdd2eda4c1151d4e90b,21h ago,21.0,2025-08-29T00:00:00+00:00,"Darra, Brisbane QLD",Financial Accounting & Reporting (Accounting),Contract/Temp,$75 - $80 per hour + superannuation,"Our client, a leading FMCG business, has recently implemented Power BI and is looking for an experienced Power BI Consultant to support its integration and help build out a comprehensive suite of reports.

This is a unique opportunity to work closely with the Head of FP&A as well as the full suite of Senior leaders to play a key role in shaping reporting and analytics across the business.

The Role

The client is embarking on a significant reporting uplift project, moving to Power BI. The consultant will be responsible for designing and developing a large suite of reports across all business areas including finance, sales, and operations.

Building new reports and dashboards in Power BI
Replicating and uplifting existing reports in Power BI
Working closely with the Head of FP&A to prioritise and deliver reporting requirements
Supporting the move from daily data refreshes to near real-time updates
Designing reports that incorporate internal business data, with future scope for customer/external data
Integrating third-party plugins such as Google, Facebook & Instagram advertising
Applying DAX to enhance data models and calculations
Delivering insights that support decision-making across finance, sales, and operations

About You

Strong experience in Power BI report development (including DAX and data modelling)
Strong understand and a background in accounting or finance is required
Experience with Snowflake or other data warehouse environments
Familiarity with ERP systems
Ability to translate business requirements into impactful reporting solutions
Strong communication skills and stakeholder engagement experience

Why This Role?

Play a lead role in a major reporting transformation project
Partner directly with senior leadership
Work with a modern BI environment
Exposure to a wide range of business functions and data sources
Attractive contract with the potential for extension

By clicking 'apply', you give your express consent that Robert Half may use your personal information to process your job application and to contact you from time to time for future employment opportunities. For further information on how Robert Half processes your personal information and how to access and correct your information, please read the Robert Half privacy notice: https://www.roberthalf.com/au/en/privacy. Please do not submit any sensitive personal data to us in your resume (such as government ID numbers, ethnicity, gender, religion, marital status or trade union membership) as we do not collect your sensitive personal data at this time."
86807904,Principal Business Analyst - Property Data Asset Valuation Business Analyst,Infinity Pro,https://www.seek.com.au/job/86807904?type=standard&ref=search-standalone&origin=jobCard#sol=0d1bbd853174cc7b188a3a01c18328f060a90f25,1d ago,24.0,2025-08-28T21:00:00+00:00,"Parramatta & Western Suburbs, Sydney NSW (Hybrid)",Business/Systems Analysts (Information & Communication Technology),Contract/Temp,"$1,000 to $1,176 p/d - WFH Hybrid","$1,000 to $1,176 per day;
Initial 6 Months Contract with potential of renewal;
WFH Hybrid;
Large End-user Organization;
High profile project
Great Team to work with;

Our client a large NSW government organisation is seeking an experienced Senior Business Analyst with deep expertise in property data and valuation to join a high-profile project that is shaping the future of property information services.
  
You will play a pivotal role in bridging the gap between business stakeholders, technical teams, and data specialists—ensuring solutions meet industry standards for accuracy, compliance, and usability.
  
Must Have skills:

Proven background in property data analysis, valuation processes, and market data interpretation.
Strong experience as a Business Analyst in complex data-driven projects.
Understanding of property data models, geospatial concepts, and valuation workflows.
Excellent stakeholder engagement and facilitation skills.
Strong analytical mindset with attention to detail.
Ability to work on weekend / after hours on occasion.
Desirable skills:

Experience within NSW government organisations;
Experience with Pega workflow automation or similar BPM/workflow systems (e.g., Appian, IBM BPM).
Knowledge of databases (SQL) and ability to query, analyse, and validate datasets.
Exposure to spatial data systems, GIS tools, or property data platforms.
Demonstrated understanding of Oracle / Azure databases

Key Responsibilities:

Partner with business units to understand needs, gather information, and analyse requirements, producing Needs Analysis documents that clearly define issues, proposed improvements, and expected benefits for the spatially enabled workflow platform (Valnet III).
Engage with stakeholders to review current operations and workflows, creating process and information models to identify and prioritise opportunities for improvement.
Lead the creation and documentation of business requirements in line with agreed methodologies, policies, standards, and architectures, securing formal stakeholder approval.
Prepare business cases and support the development of High-Level and Detailed Requirements Specifications to guide the design and delivery of solutions that achieve targeted business benefits.
Contribute to testing activities by developing test strategies, plans, and scripts, and assisting with IT test execution to ensure solutions meet requirements.
Analyse issues and stakeholder feedback to produce actionable insights and recommendations that improve services in alignment with business strategy and user needs.
Ensure high-quality analysis and documentation to provide a robust foundation for future system enhancements and operations.
Best method to apply is using the application button on this advert. We can be contacted on (02) 9687 1025 for a confidential discussion but please ensure the resume has been sent.


Please ensure all documents are sent in Microsoft word format."
