Job ID,Job Title,Company,Detail URL,Posted Label,Hours Old,Posted Datetime (Local),Location,Category,Work Type,Salary,Ad Text
86934638,Senior Business Analyst,CSIRO,https://www.seek.com.au/job/86934638?type=standard&ref=search-standalone&origin=jobCard#sol=bb346943990d33445a09cf70e63c67ad93aebdd1,16h ago,16.0,2025-09-03T05:00:00+00:00,Melbourne VIC (Hybrid),"Business/Systems Analysts (Information & Communication Technology)
Government - Federal (Government & Defence)",Contract/Temp,,"Job description:

Acknowledgement of Country

CSIRO acknowledges the Traditional Owners of the land, sea and waters, of the area that we live and work on across Australia. We acknowledge their continuing connection to their culture and pay our respects to their Elders past and present. View our vision towards reconciliation

Child safety

CSIRO is committed to the safety and wellbeing of all children and young people involved in our activities and programs. View our Child Safe Policy.

The opportunity

​​​​

Join CSIRO - Australia's National Science & Innovation Agency
Lead high-impact, enterprise-scale projects and service improvement initiatives
12 Month opportunity

As the Senior Business Analyst, you will play a key role in delivering enterprise-scale projects, service improvements and lifecycle management initiatives.

Reporting to the Lead Business Analyst, this position leads analysis activities such as facilitating workshops, gathering and refining requirements, developing user stories, verifying deliverables, hosting product demonstrations and preparing operational documentation.

Working closely with project teams and stakeholders across geographically and technically diverse environments, the role supports the growth and development of capabilities within the architecture model.

Your duties will include:
Elicit, capture and document requirements across a diverse range of initiatives for multiple functions and business units.
Facilitate workshops, identify risks, issues and benefits of existing and proposed solutions and outlining business impacts.
Work with the project manager and /or team leader in estimating project costs and identifying business savings.
Effectively communicate insights and plans to cross-functional team members and management.
Provide visibility to the work being undertaken, ensuring that project timelines are maintained.
Use sound judgement when dealing with unexpected or competing project priorities or issues
Actively contribute to improvement in business analysis processes and delivery procedures within the team
Work with other team members, internal and external stakeholders to develop, implement, promote and support all aspects of project delivery lifecycle.
Coach, mentor and support junior team members.

Location: Canberra, Melbourne, Sydney or Brisbane preferred but all Australian Capital cities considered

Salary: AU$131,113 - AU$153,639 plus up to 15.4% superannuation

Tenure: Specified term of 12 Months

Reference: 100942

To be considered you will need:
Demonstrated experience with a minimum of 5 years as a business analyst within the ICT sector
Demonstrated effective communication and requirements-gathering skills
Demonstrated experience in business process improvements in complex environments and situations.
Demonstrated ability to effectively manage several competing project priorities simultaneously.
Demonstrated customer-focused approach in formulating project solutions.
Proven ability and motivation to seek out underlying problems and requirements.
Proven ability to develop and maintain effective working relationships with clients and stakeholders.

Desirable:

Demonstrated experience using Design Thinking Methodology.
Proficiency in BA tools modelling standaerds (e.g. Business Process Modl and Notation)

For full details about this role please review the Position Description

Eligibility

Applications for this position are open to Australian Citizens, the successful candidate will be required to obtain and maintain a security clearance at the Negative Vetting 1 (NV1) level. Appointment to this role is subject to provision of a national police check and may be subject to other security/medical/character requirements.

Flexible working arrangements

We work flexibly at CSIRO, offering a range of options for how, when and where you work.

Diversity and inclusion

We are working hard to recruit people representing the diversity across our society, and ensure that all our people feel supported to do their best work and feel empowered to let their ideas flourish.

About CSIRO

At CSIRO Australia's national science agency, we solve the greatest challenges through innovative science and technology. We put the safety and wellbeing of our people above all else and earn trust everywhere because we only deal in facts. We collaborate widely and generously and deliver solutions with real impact.

CSIRO is committed to values-based leadership to inspire performance and unlock the potential of our people.

Join us and start creating tomorrow today!

How to apply

Please apply on-line and provide a cover letter and CV that best demonstrate your motivation and ability to meet the requirements of this role.

Applications close

17 September 2025 11:00pm AEST"
86937884,Business and Data Analyst,Capital Talent Consulting Pty Ltd,https://www.seek.com.au/job/86937884?type=standard&ref=search-standalone&origin=jobCard#sol=d6fafb956b570a0bde2bca85b0a801dd44e37bcd,15h ago,15.0,2025-09-03T06:00:00+00:00,Brisbane QLD (Hybrid),Business/Systems Analysts (Information & Communication Technology),Contract/Temp,$90 – $110 per hour,"We are partnering with a QLD Govt Dept to recruit an experienced Business and Data Analyst to work within their Major Projects team, this team manages the QLD govt key infrastructure portfolio.  In this role you will lead the development and implementation of data driven strategies, provide expert advice on business processes and deliver innovative data solutions that align with strategic objectives to support the entire built asset lifecycle.  You will work closely with a range of building industry specialists across the government and private sector to develop innovative data analysis and insight strategies to increase efficiency, value for money, productivity, innovation, and safety across government infrastructure projects.

What you will be doing:

Data Analysis and Insights: 

Conduct research, analysis and interpretation of data to provide actionable insights that inform business improvement initiatives. 

Design and implement data integration and categorisation processes particularly around transactional data derived from ERP systems and other platforms

Geolocate government assets and undertake analysis or trends and predictive analytics to inform maintenance, refurbishment and new construction requirements for agencies.

Use advanced data tools (e.g.PowerBI, SQL, Python) to create reports/dashboards

Business Analysis and Strategic Advice: 

Liaise with stakeholders to identify operational needs, gather requirements and propose solutions to improve processes and systems. 

Develop comprehensive project documentation (business cases, process maps and change management artefacts) to support effective implementation. 

Provide strategic advice on emerging technologies, business intelligence and enterprise systems to improve organisational capability. 

Data Governance and Policy Development: 

Develop, implement, and maintain data governance policies and procedures

Identify risks and gaps in data management practices, recommending solutions

Lead cross agency workshops to foster collaboration,

Stakeholder Engagement and Leadership: 

Build and maintain strong relationships with internal and external stakeholders

Flexibility to accommodate to different client requirements

Develop and present findings, recommendations and solutions to senior management and stakeholders in a clear, structured and audience appropriate manner. 

Mentor and guide team members,

To be suitable for this role, we are looking for someone with the following experience:

Use contemporary data science tools.

Use data governance principles, information management and privacy standards.

Use project management methodologies and tools. 

Analyse and interpret complex business challenges and propose solutions. 

Leverage business intelligence, enterprise systems and mobile technologies. 

Present data to senior stakeholders and respond to questions.

Provide high level strategic and professional advice to a range of key stakeholders.

Develop and manage projects within timeframes.

Be resilient and adaptable to changing organisational priorities and environments.

Write and speak with precision and persuasion.

This is a 12 month contract, with a hybrid WFH environment of 50/50 per fortnight.    Applications close on the 9/09/25."
86924800,Senior Digital Business Analyst,Davidson,https://www.seek.com.au/job/86924800?type=standard&ref=search-standalone&origin=jobCard#sol=82365420d8f5bbfddd79d986f4c71b2a35c34658,20h ago,20.0,2025-09-03T01:00:00+00:00,Melbourne VIC (Hybrid),Business/Systems Analysts (Information & Communication Technology),Contract/Temp,$800 - $900 p.d.,"About the Company

Davidson has proudly partnered with a leading financial institution to assist in sourcing a senior digital business analyst.

About the Role

As the senior digital business analyst you will work across a major digital transformation initiative, shaping the future of member experiences across digital channels.
Key responsibilities:

Lead business analysis across large-scale digital transformation projects
Work on superannuation products and member journeys (investment switches, MySuper vs Choice, insurance, SuperMatch)
Partner with Product Owners to shape and manage backlogs, ensuring delivery of real business value
Translate business needs into clear user stories, requirements, and process designs
Use Google Analytics or Adobe Analytics to validate insights and optimise customer journeys
Run workshops, refine requirements, and collaborate with stakeholders across delivery teams

About You

Significant experience as a Senior Business Analyst on complex digital projects
Superannuation industry expertise (mandatory) - strong understanding of products, operations, and member interactions
Hands-on experience with Martech - Google Analytics and/or Adobe Analytics
Strong facilitation, communication, and stakeholder management skills
Ability to shape digital user flows and requirements, even in ambiguous environments
A collaborative, adaptable, and problem-solving mindset

The Benefits

Long-term initial contract
Competitive daily rates
Hybrid working environment




Please apply with current resume in Microsoft Word format only (.doc or .docx). If you would like to have a confidential discussion, please contact Maaz Mian on Maaz.Mian@Davidsonwp.com, quoting reference JN -092025-41192. Want to know more about Davidson? Visit us at www.davidsonwp.com"
86931459,Business Analyst AI,AJQ,https://www.seek.com.au/job/86931459?type=standard&ref=search-standalone&origin=jobCard#sol=7301535c5c919d1639b25dc54867f7b45fc6e891,17h ago,17.0,2025-09-03T04:00:00+00:00,Melbourne VIC (Hybrid),Business/Systems Analysts (Information & Communication Technology),Contract/Temp,,"AJQ Consulting is a leading provider in the delivery of Information Technology & Professional Services.

Our success is built on our team.

We aim to provide our team with meaningful projects to work on where they can stretch their minds and showcase their expertise. With our growth mindset including customer-centric approach, we add value to our communities and to our clients’ outcomes.

We are proud to be supporting government initiatives across multiple sectors which has a direct impact on our communities’ experience.

We have partnered with a Vic State Government Agency on a digital transformation initiative and are looking to place a Business Analyst to join our team on a 5 month contract basis with a possibility to extend.

The role will be based in Melbourne.




The Role:

Analysis and project coordination services are required to assist the department in progressing a number of Artificial Intelligence project initiatives. The scope of the engagement will be to establish a project plan and coordinate the delivery of a number of key AI-related artefacts.

Artefacts include but are not limited to AI Strategy & Roadmap, AI platform and Ecosystem As Is and Data & Infrastructure readiness assessment.




To be successful in this role you will have:

Proven experience providing Agile business analysis/functional analysis services.

Extensive experience with documenting business requirements and functional design through user stories, wireframes, screen mock-ups, etc.

Experience in negotiating with business stakeholders, users, technical staff and product owners to achieve desired outcomes.

Ability to lead workshops and work directly with solution stakeholders.

Experience in undertaking process re-engineering, including capturing business processes as-is and to-be states in process flows.

Experience in the Artificial Intelligence domain space and/or AI-related implementation initiatives is desirable.

Prior knowledge of working with government departments and/or the health industry.

To find out more about AJQ Professional Services and other opportunities, please go to our website and follow us on LinkedIn:

www.ajq.com.au

www.linkedin.com/company/AJQ

AJQ strives to be an inclusive workplace for all people. We recognise that we operate in a diverse community and welcome and encourage applications from all suitably qualified applicants."
86896869,Senior Business Analyst,Techforce Recruitment,https://www.seek.com.au/job/86896869?type=standard&ref=search-standalone&origin=jobCard#sol=a90becf54cf0e3b510cafae5174c42c5e8918086,1d ago,24.0,2025-09-02T21:00:00+00:00,Melbourne VIC (Hybrid),Business/Systems Analysts (Information & Communication Technology),Contract/Temp,,"Senior Business Analyst – Transformation Projects – Utilities Sector – Initial 12-month contract (extensions highly likely)
  
Are you interested in joining an organisation dedicated to providing services to individuals and communities in remote regions? Our client is a well-respected entity working on exciting projects and are currently seeking a Senior Business Analyst to support several key initiatives within their transformation program. This role will play a critical part in shaping business requirements, process design and proof of concepts for high-profile projects.
  
Your responsibilities will include but not be limited to:

Lead the development, documentation and validation of detailed business requirements across multiple workstreams.
Facilitate workshops and discovery sessions to capture insights, map processes and align stakeholders.
Translate business needs into proof of concepts and functional specifications to guide solution design.
Produce high-quality artefacts including process maps, business cases and user support documentation.
Collaborate with project managers, change leads and technical teams to ensure delivery quality and alignment.
Support transition, change management and capability uplift activities to embed new processes.
The role will be offered as an initial 12-month Day Rate contract with a very flexible hybrid WFH agreement. There will also be a requirement to travel to Darwin with the rest of the team for 1 week every month, though all costs and allowances are covered.
  
The skills/experience needed will include but not be limited to:

Demonstrated success as a Senior Business Analyst within utilities, infrastructure or other regulated environments.
Proven ability to obtain, document and validate complex business and functional requirements.
Strong facilitation skills, with the ability to run workshops and build consensus among diverse stakeholders.
Experience with business process mapping and process improvement methodologies.
Excellent communication and documentation skills, with the ability to work autonomously.
Advantageous: Exposure to asset management systems such as Maximo or Oracle.
Want to apply?
  
Either hit apply or send your CV to cameron@techforcerecruitment.com.au with a brief reason why you think you’d be the best fit for the role, and I’ll be in touch with more details."
86939666,Data and Business Analyst,Aspirante,https://www.seek.com.au/job/86939666?type=standard&ref=search-standalone&origin=jobCard#sol=d6981be3d0e5e3eb663ef0a0e437974d76bccfc2,14h ago,14.0,2025-09-03T07:00:00+00:00,Brisbane QLD (Hybrid),Business/Systems Analysts (Information & Communication Technology),Contract/Temp,,"Aspirante is partnering with a local QLD government department to assist in their search for a Principal Data and Business Analyst to lead the development and implementation of data-driven strategies that support large-scale infrastructure and asset management initiatives. This is a senior role with the opportunity to shape data, policy, and insights frameworks that will directly inform decision-making at an enterprise level.

12 month contract with likely extension
Paying up to $113 per hour
3 days per week in Brisbane office
What you’ll be doing In this role, you’ll:

Conduct advanced data analysis and develop insights to drive business improvement initiatives.
Design and implement data integration and categorisation processes, particularly around transactional and ERP data.
Apply geolocation and predictive analytics to inform asset maintenance, refurbishment, and new construction requirements.
Create compelling dashboards and reports using tools such as Power BI, SQL, and Python.
Engage with stakeholders to gather requirements, propose solutions, and deliver tailored business process improvements.
Provide strategic advice on emerging technologies, business intelligence, and enterprise systems.
Develop and implement data governance policies, identifying risks and ensuring compliance with legislation and standards.
Lead cross-agency workshops to improve data literacy, collaboration, and whole-of-organisation reporting.
Present findings and recommendations to senior stakeholders and guide team members in a culture of innovation and continuous improvement.
About you You’ll bring:

Proven ability to use contemporary data science tools (e.g., Power BI, SQL, Python).
Strong knowledge of data governance, information management, and privacy standards.
Experience using project management methodologies to deliver initiatives on time.
The ability to analyse complex business challenges and propose practical, data-driven solutions.
Excellent communication skills, with confidence presenting insights to senior stakeholders.
A track record of providing high-level strategic and professional advice.
Resilience and adaptability in changing environments.
To apply in strict confidence, click the apply now button. Alternatively if you would like to discuss this role in more detail, please feel free to email chenderson@aspirante.com.au to arrange a call."
