Job ID,Job Title,Company,Detail URL,Posted Label,Hours Old,Posted Datetime (Local),Location,Category,Work Type,Salary,Ad Text
88593444,Manager Investment Analytics and Insights Operations,Department of Transport and Planning,https://www.seek.com.au/job/88593444?type=standard&ref=search-standalone&origin=jobCard#sol=25b28a2d182457255c4b54c15b10d88cea5dd558,5h ago,5.0,2025-11-18T03:00:00+00:00,Melbourne VIC (Hybrid),Government - State (Government & Defence),Full time,"$138,631 - $185,518 Per Annum + Superannuation","Company description:



About Us

The Department of Transport and Planning oversees key planning, transport and land use policy decisions and management across the State. A life-cycle approach to planning, building, connecting and sustaining communities means our people can come together to; improve services, deliver sustainable projects, focus on customer engagement, streamline regulatory approval pathways, facilitate community consultation and better realise local economic opportunities for more liveable communities across Victoria.

Network Design and Integration delivers transport priorities through the planning, development and maintenance of an integrated pipeline of projects and strategic initiatives that provide safe, efficient and sustainable outcomes to all Victorians. We're focused on outcomes that deliver more choice, connections and confidence in our travel, ensuring the whole transport network works as one to deliver better services and outcomes.



Job description:



About the Role

The Manager, Investment Modelling, Analytics & Insights Operations leads a team delivering investment modelling and analytics across DTP and franchisees for both road and rail assets. The role oversees daily operations, develops and maintains long-term lifecycle models, undertakes modelling to inform asset renewal and maintenance plans, and contributes to multidisciplinary projects. It also manages rail and road modelling artefacts, reviews asset condition data, produces insights for stakeholders, and drives continuous improvement while fostering effective relationships in a complex, dynamic environment.

To access the Position Description, please click here.

Position Outcomes / Accountabilities

Leadership - Manager operations is accountable for establishing an ongoing annual modelling task plan, leading and supervising the operations team and its assigned functions to ensure delivery of high-quality work in alignment with current strategies and in line with the annual task plan.
Effective Lifecycle Planning and Cost Analysis - As the functional lead of the Investment Analytics and Insights Operations team, manager will develop and sustain investment analytics capabilities across rail and road networks to enable DTP to be informed custodian of the rail and road infrastructure.
Continuous Improvement Strategy and Culture - Manager successfully foster a culture of engagement, participation and shared understanding across different stakeholders in relation to continuous improvement practices that aligned with the priorities of the Asset Intelligence department.
Stakeholder Liaison and Management - The Manager builds a strong and effective working relationship with stakeholders; facilitates innovative solutions to resolve stakeholder competing needs. Acts as the key point of contact and

Key Selection Criteria

The DTP is seeking a dynamic leader with strong critical thinking and problem-solving skills, capable of delivering effective solutions while considering broader business impacts. The role requires exceptional stakeholder management, high-impact communication, and commercial acumen to drive value and manage organisational risk. Applicants should demonstrate expertise in data and digital literacy, foster innovation and continuous improvement, effectively manage teams, and show flexibility to adapt strategies to achieve optimal outcomes.

Qualifications and Experience

Mandatory

Tertiary qualification in engineering, asset management or an equivalent qualification.
Extensive demonstrated experience in asset management, Insights Analytics and life cycle planning
Demonstratable experience in leading a team

Desirable

Demonstrated experience in change management
Demonstrated experience in systems engineering

Culture Value

We welcome applicants from a diverse range of backgrounds representing the community that we serve, including veterans, parents, carers, First Peoples, people with disability, multicultural, multifaith and LGBTIQA+ individuals.

As an equal opportunity employer, we are committed to fostering a safe, inclusive, and high-performance culture. Through shared actions and behaviours aligned with our strategy and direction, we empower our people to thrive and meaningfully contribute to the department's goals.

What we offer

Meaningful work making Victorian communities more accessible and liveable
Professional growth and development opportunities across the department and the wider Victorian Public Services
A hybrid working model focused on collaboration and teamwork
Optimal work-life balance initiatives including flexible working arrangements
Opportunity to work across multiple urban and suburban hubs
We prioritise the development of a safe and inclusive culture

Pre-employment checks and employment conditions

All new appointments to the department will be subject to a National Criminal Records Check, Misconduct Screening, and a Qualification Check where there is a requirement for a mandatory qualification. Information provided to the Department of Transport and Planning will be treated in the strictest confidence consistent with the requirements of the Privacy and Data Protection Act 2014.

Applicants must be an Australian Citizen, Permanent Resident or hold a valid work permit or visa necessary for the nature of the position.

Recipients of Victorian Public Service (VPS) voluntary departure packages should note that re-employment restrictions apply.

Non-VPS applicants will be subject to a probation period of six months.

How to Apply

Click the ‘Apply' button to be redirected to our recruitment platform, where you may need to create an account to submit your application. If you encounter any issues, refer to our Quick Reference Guide for step-by-step instructions.

Applications close at 11:59 pm on Wednesday 10 December 2025.

Please include both your resume and a cover letter. All applications must be submitted via the online portal, we're unable to accept email or manual submissions.

For further information about the role, please contact Raman Pelia, Senior Manager Investment Modelling, Analytics & Insights via 0449 944 391 or Raman.Pelia@transport.vic.gov.au

Important Information:

If you require any adjustments to fully participate in the recruitment process, or need the advert or attachments in an accessible format (e.g., large print), please contact us by phone or email. We're here to support you."
88593067,Manager Investment Analytics and Insights Assurance,Department of Transport and Planning,https://www.seek.com.au/job/88593067?type=standard&ref=search-standalone&origin=jobCard#sol=a2204fd1d6043f1fda6237a7effa2fc37edf8644,5h ago,5.0,2025-11-18T03:00:00+00:00,Melbourne VIC (Hybrid),Government - State (Government & Defence),Full time,"$138,631 - $185,518 Per Annum + Superannuation","Company description:



About Us

The Department of Transport and Planning oversees key planning, transport and land use policy decisions and management across the State. A life-cycle approach to planning, building, connecting and sustaining communities means our people can come together to; improve services, deliver sustainable projects, focus on customer engagement, streamline regulatory approval pathways, facilitate community consultation and better realise local economic opportunities for more liveable communities across Victoria.

Network Design and Integration delivers transport priorities through the planning, development and maintenance of an integrated pipeline of projects and strategic initiatives that provide safe, efficient and sustainable outcomes to all Victorians. We're focused on outcomes that deliver more choice, connections and confidence in our travel, ensuring the whole transport network works as one to deliver better services and outcomes.



Job description:



About the Role

The Manager, Investment Modelling, Analytics & Insights Assurance leads a team that reviews and assures investment modelling activities across DTP and its franchisees for both rail and road assets. The role oversees the evaluation of modelling artefacts, data quality, franchisee reports, and asset condition data, and produces regular assurance reports. It also develops and maintains modelling processes, supports multidisciplinary asset projects, coordinates assurance compliance, and drives continuous improvement and roadmap development for analytics and insights models.

To access the Position Description, please click here.

Position Outcomes / Accountabilities

Effective Lifecycle Planning and Cost Analysis - As the functional lead of the Investment Analytics and Insights Assurance team, manager is accountable for developing and sustaining investment analytics and assurance capabilities across rail and road networks to enable DTP to be informed custodian of the rail and road infrastructure.
Assurance and Reporting - Manager assurance is accountable for reviewing the rail operator and road infrastructure asset investment models, conducting periodic evaluations in line with contractual requirements. as well as internal department operating requirements. Where appropriate, findings were used to inform and enhance the department's own models.
Leadership - Liaise with Transport Services regarding the expected delivery, assurance and close out of artefact and data provided by Franchisee. Manager will be leading the embedment and provide oversight of assurance practices across the wider investment Modelling, Analytics & Insights Team.
Stakeholder Liaison and Management - The Manager builds a strong and effective working relationship with stakeholders (including other business areas, MR5 contract assurance team, heavy rail and light rail operators.
Continuous Improvement Strategy and Culture - Manager successfully foster a culture of engagement, participation and shared understanding across different stakeholders in relation to continuous improvement assurance practices that aligned with the priorities of the Asset Intelligence department.

Key Selection Criteria

The DTP is seeking a leader with strong stakeholder management and impactful communication skills to guide complex engagements and provide high-level advice to diverse audiences. The role requires a forward-thinking professional who drives innovation, continuous improvement and evidence-based problem solving, while demonstrating strong commercial acumen and effective team management. Applicants should bring accomplished data literacy, including developing data models and translating insights into decisions, along with applied digital and technological capability to support modern tools and processes.

Qualifications and Experience

Mandatory

Tertiary qualification in engineering, asset management or an equivalent qualification.
Extensive demonstrated experience in asset management, Insights Analytics and life cycle planning
Demonstratable experience in leading a team

Desirable

Demonstrated experience in change management.
Demonstrated experience in systems engineering

Culture Value

We welcome applicants from a diverse range of backgrounds representing the community that we serve, including veterans, parents, carers, First Peoples, people with disability, multicultural, multifaith and LGBTIQA+ individuals.

As an equal opportunity employer, we are committed to fostering a safe, inclusive, and high-performance culture. Through shared actions and behaviours aligned with our strategy and direction, we empower our people to thrive and meaningfully contribute to the department's goals.

What we offer

Meaningful work making Victorian communities more accessible and liveable
Professional growth and development opportunities across the department and the wider Victorian Public Services
A hybrid working model focused on collaboration and teamwork
Optimal work-life balance initiatives including flexible working arrangements
Opportunity to work across multiple urban and suburban hubs
We prioritise the development of a safe and inclusive culture

Pre-employment checks and employment conditions

All new appointments to the department will be subject to a National Criminal Records Check, Misconduct Screening, and a Qualification Check where there is a requirement for a mandatory qualification. Information provided to the Department of Transport and Planning will be treated in the strictest confidence consistent with the requirements of the Privacy and Data Protection Act 2014.

Applicants must be an Australian Citizen, Permanent Resident or hold a valid work permit or visa necessary for the nature of the position.

Recipients of Victorian Public Service (VPS) voluntary departure packages should note that re-employment restrictions apply.

Non-VPS applicants will be subject to a probation period of six months.

How to Apply

Click the ‘Apply' button to be redirected to our recruitment platform, where you may need to create an account to submit your application. If you encounter any issues, refer to our Quick Reference Guide for step-by-step instructions.

Applications close at 11:59 pm on Wednesday 10 December 2025.

Please include both your resume and a cover letter. All applications must be submitted via the online portal, we're unable to accept email or manual submissions.

For further information about the role, please contact Raman Pelia, Senior Manager Investment Modelling, Analytics & Insights via 0449 944 391 or Raman.Pelia@transport.vic.gov.au

Important Information:

If you require any adjustments to fully participate in the recruitment process, or need the advert or attachments in an accessible format (e.g., large print), please contact us by phone or email. We're here to support you."
88592588,EL1 - Senior Data Analyst,On Q Recruitment Pty Ltd,https://www.seek.com.au/job/88592588?type=standard&ref=search-standalone&origin=jobCard#sol=b07652ffff557120234ae044e74b1c4badc8b8ca,6h ago,6.0,2025-11-18T02:00:00+00:00,Sydney NSW (Hybrid),Government - Federal (Government & Defence),Contract/Temp,,"About the Agency
 
This Federal Government agency plays a vital role in shaping aged care policy and funding frameworks across Australia. Through data-driven insights and innovative solutions, they ensure transparency, sustainability, and quality care for older Australians.
 
About the Role

EL1 Senior Data Analyst - Aged Care 
12-month labour hire contract (with strong potential to extend through 2027/2028)
Classification: EL1
In this role, you'll lead analytical initiatives that strengthen aged care accommodation policy and compliance. Working closely with the Director and internal teams, you'll design data solutions, improve reporting processes, and provide expert advice to inform strategic decisions.
 
Key Responsibilities

Design and implement data solutions using MS Excel to meet operational needs.
Analyse and interpret data holdings from MS Access databases to answer policy questions.
Create continuity tools - develop policies and procedures for replicating queries and formulas post-contract.
Enhance analytical frameworks for improved price comparison and reporting.
Produce technical papers and reports for advisory committees and executive briefings.
Provide expert advice across the Aged Care Accommodation section and broader policy branch.
About You
 
To be eligible, you must be an Australian Citizen and demonstrate:

Strong technical and analytical skills in mathematics, data analysis, and interpretation.
Experience with SAS, SQL, MS Excel, or Python (MS Access optional).
Ability to communicate complex technical issues clearly to non-technical audiences.
Excellent organisational skills and ability to manage competing priorities.
Qualifications in mathematics, statistics, or related fields (highly regarded).
 
Why Join?

Influence aged care systems that impact Australians nationwide.
Work in a collaborative, purpose-driven environment.
Enjoy flexible arrangements and opportunities for professional growth.
 
How to Apply? Apply directly through Seek.com.  For more information about this role, contact Donna Knight, dknight@onqrecruitment.com.au"
88592222,Meter Data Analyst,Origin,https://www.seek.com.au/job/88592222?type=standard&ref=search-standalone&origin=jobCard#sol=8bcce76f3569256194afa80e2de3ee1cc600d160,6h ago,6.0,2025-11-18T02:00:00+00:00,Melbourne VIC,Business/Systems Analysts (Information & Communication Technology),Full time,,"Join a team that's All Kinds of Useful

At Origin, being useful is more than a tagline - it's how we approach work every day. As a collective, we're a team that thrives on finding better ways, working together, and owning our impact. From powering homes to delivering award-winning internet and helping to lead Australia's energy transition. If you're driven by purpose and excited to be part of something bigger, we'd love to have you on the journey.

The Role

The Analyst is part of the Billing and Metering operations team and reports to the Market Data- Team Leader. The Market Data Analyst is responsible for proactively managing performance of third-party suppliers, managing and reviewing data exceptions and understanding metering regulations, contractual and industry requirements. This is for Electricity, Gas & Hot Water.


Responsibilities:

Build and manage strong relationships with third party suppliers to improve service levels and drive performance associated with meter data, standing data and services
Build and maintain strong relationships with internal stakeholders
Monitor and validate incoming meter data to ensure volumes and quality conform with market requirements
Utilise reporting to identify performance trends from third parties and develop strategies for improvement
Undertake special data analysis assignments to support Meter Data as well as other stakeholders
Provide support with Business Improvement initiatives
Identify and take action to correct errors
Respond to enquiries from downstream and other users relating to meter and standing data
Carry out root cause analysis of exceptions and implement required solutions to minimise or eliminate exceptions numbers
CAD related actions to ensure our CAD obligations are met



About You
To be considered for the role you will have:

At least 2 years' experience in the Energy Industry
Experience dealing with third parties, in particular service performance.
At least 2 years' experience in data analytics
Ability to understand and apply Energy Market systems rules and regulations, including, Metrology, Meter Data, B2B transactions and MSATS.

Origin - Where good change happens

At Origin, we're powered by people who believe in creating change.


We are committed to fostering a diverse, gender equitable workforce, where everyone is welcome, and all applications are evaluated on merit and potential. We encourage applications from Aboriginal and Torres Strait Islander Peoples, people living with disabilities, culturally diverse people, any stage in life, people with intersex variations and people within LGBTQ+ communities, including trans and gender diverse.


Enjoy a challenging career in an exciting industry where you can grow and explore your potential. If you think you have transferable skills, an appetite to learn and would be a great fit, we'd love to hear from you.


Here's a little about us: https://www.originenergy.com.au/about/careers/

Background checks may be required to determine your suitability for this position as part of the recruitment process and during your employment. These checks may include police checks, AusCheck, medical assessment and/or drug and alcohol testing.

Please note unsolicited CVs from agencies will not be accepted.

Origin recognises Aboriginal and Torres Strait Islander Peoples as the Traditional Custodians of country throughout Australia, and we pay our respects to Elders past, present and future."
88591913,Senior Lead Business Analyst - Dynamics 365,Private Advertiser,https://www.seek.com.au/job/88591913?type=standard&ref=search-standalone&origin=jobCard#sol=b2b662194ac224166670e1134c41ca523fdfdcbd,6h ago,6.0,2025-11-18T02:00:00+00:00,Canberra ACT (Hybrid),Business/Systems Analysts (Information & Communication Technology),Contract/Temp,,"About the Role
Join a high-impact Federal Government digital program as a Senior Lead Business Analyst. You will play a key role in driving major digital initiatives, leading discovery, analysis, and solution design within a multi-disciplinary team. This is an exciting opportunity to contribute to nationally significant digital transformation work starting January 2026.

About the Opportunity
As the Lead Business Analyst, you'll collaborate with product, delivery, architecture, business and technical teams to shape solutions, drive clarity in requirements, support testing, and ensure successful delivery across a dynamic program of work.

Key Responsibilities

Lead analysis activities across multiple digital products.

Facilitate workshops with internal/external stakeholders to explore pain points, opportunities, and solution directions.

Produce essential project artefacts: user stories, process maps, blueprints, journey maps, personas, functional specs.

Drive requirement clarity, manage changes, and ensure alignment with program objectives.

Support solution design aligned to enterprise architecture, data, information management, and security needs.

Work closely in a multi-disciplinary team including Solution Architect, Product Manager, Delivery Manager, BA, developers, and testers.

What We're Looking For
Essential:
✔ 5+ years senior-level business analysis experience
✔ Strong stakeholder management, negotiation & problem-solving skills
✔ Exceptional communication skills (written & verbal)
✔ Experience producing BA artefacts, process maps, requirements, user stories, acceptance criteria, business cases

Desirable:
✓ Experience with Microsoft Dynamics 365 CRM
✓ Experience using Miro, Azure DevOps, or similar tools

Additional Requirements:

Must hold, or be able to obtain, Baseline security clearance

Hybrid work (ACT/NSW)

Senior/EL1 equivalent

6-month contract + 6-month extensions (up to 12 additional months)

Start date: 5 January 2026

If you are a Senior BA ready to step into a lead role in a major government program, we'd love to hear from you. Apply today."
88590558,Data Analyst – Energy & Emissions Reporting,NES Fircroft,https://www.seek.com.au/job/88590558?type=standard&ref=search-standalone&origin=jobCard#sol=da5d9727872f795edb3f1e3c01a2b333c6f1ac8e,6h ago,6.0,2025-11-18T02:00:00+00:00,"Docklands, Melbourne VIC (Hybrid)","Analysis & Reporting (Mining, Resources & Energy)",Full time,$75 – $90 per hour,"Due to recent growth, our global energy client is seeking a Data Analyst to support their energy and emissions reporting systems and help turn complex operational data into clear, actionable insights.

About the role

In this role you will:

Support and administer the SQL-based energy and emissions reporting database

Develop and implement program and configuration changes to reflect evolving regulations and equipment

Build robust data quality checks to support annual audits and compliance

Document database work processes and maintain clear technical records

Improve reporting processes and dashboards (incl. Power BI) to support field operations, corporate reporting and leadership decision-making

Contribute to team goal setting, planning and budgeting, and play an active role in a strong team culture of care




Key stakeholders

You’ll work closely with:

Engineering and other technical teams

Safety, Health & Environment colleagues

Operations and Maintenance personnel and contractors

Regulators, auditors and other external stakeholders




About you

You will bring:

A Bachelor’s degree in a relevant discipline

4+ years’ experience with accounting or data management systems

Strong data analytics skills, including validation, auditing and interpretation

Familiarity with National Greenhouse and Energy Reporting Scheme (NGERS) requirements

Exposure to oil and gas operations (highly regarded, not essential) and the ability to understand engineering concepts behind the data

Proven ability to coordinate with IT and technical teams to resolve system issues and implement changes

Strong organisational skills, able to deliver to deadlines and adapt to changing priorities

Proficiency in Microsoft Office and Power BI

Excellent written and verbal communication skills, with the ability to produce clear technical and business documentation"
