Job ID,Job Title,Company,Detail URL,Posted Label,Hours Old,Posted Datetime (Local),Location,Category,Work Type,Salary,Ad Text
89195298,Digital Project Manager / Business Analyst - Produxiom + FoodLegal,FoodLegal Pty Ltd,https://www.seek.com.au/job/89195298?type=standard&ref=search-standalone&origin=jobCard#sol=7f9cbc3b9aaddb421d2a98a175a53d1d4c83ca23,2h ago,2.0,2025-12-17T05:00:00+00:00,Melbourne VIC (Hybrid),Business/Systems Analysts (Information & Communication Technology),Full time,,"About the Role

We're looking for a hands-on Digital Project Manager / Business Analyst to lead the delivery and continuous improvement of digital platforms across Produxiom, our SaaS compliance platform, and FoodLegal, our specialist regulatory law firm, operating in a startup-style environment within an established business.

This role sits between business, technology, and compliance. You'll translate business and regulatory needs into clear technical requirements, manage digital initiatives end-to-end, and work closely with developers and stakeholders to deliver practical, scalable solutions.

This is a great opportunity for someone who enjoys ownership, thrives in a fast-moving environment, and wants to grow into a senior digital or product leadership role.

Key Responsibilities

Manage digital projects from discovery through to delivery

Gather, analyse, and document business and regulatory requirements

Translate requirements into functional specs, workflows, and user stories

Coordinate developers and vendors to manage priorities, timelines, and releases

Support testing, QA, and user acceptance testing

Act as the primary BA for the Produxiom platform, identifying workflow and usability improvements

Support customer onboarding and implementation

Manage and improve digital tools used across the FoodLegal practice

Maintain clear documentation, process maps, and training materials

Identify opportunities for automation, efficiency, and innovation

Support basic information security and access controls

About You

You're structured, curious, and comfortable working between technical and non-technical teams. You enjoy turning complexity into clarity and taking responsibility for delivery.

You'll likely have:

Experience as a Digital Project Manager, Business Analyst, or similar

Strong skills in requirements gathering and process mapping

Experience working with developers or technical teams

Excellent communication and stakeholder management skills

A proactive, problem-solving mindset

Experience in the following is highly regarded:

SaaS platforms

FMCG, retail, food manufacturing, or regulated industries

Compliance, workflow, or operational systems

Experience with AI tools, automation, or data-driven workflows

Agile / PM certifications (e.g. AgilePM, Scrum, PRINCE2)

Why Join Us

Real ownership and visibility in a growing SaaS business

Exposure to innovative technology, compliance, and legal workflows

Supportive, collaborative, and genuinely positive team culture

Clear growth pathway into senior digital or platform roles

Great Melbourne CBD location with flexible hybrid working

Location: Melbourne CBD (Hybrid)
Employment Type: Full-time
Reporting to: CEO"
89194978,Finance Business Partner - Temp to Perm,TOM,https://www.seek.com.au/job/89194978?type=standard&ref=search-standalone&origin=jobCard#sol=5c472ba022cd02092c8a0719813c8fc5af2e2731,2h ago,2.0,2025-12-17T05:00:00+00:00,Perth WA (Hybrid),Analysis & Reporting (Accounting),Contract/Temp,"$155,000 – $170,000 including super per year","Strategic, front-line finance role with senior stakeholder exposure. Large, ASX listed company.

Excellent platform to progress into senior commercial or finance leadership roles.

3 month Fixed term contract with a strong possibility of permanency.

The Opportunity
This is a high-impact Senior Financial Analyst role supporting a large, asset-intensive operations portfolio within a critical national infrastructure business. Embedded in the operations team, you will partner closely with senior leaders to drive planning, performance analysis and strategic decision-making across a growing asset base.

Key Responsibilities

Partner with executives and senior operational leaders to provide commercial insights and influence decisions.

Lead budgeting, forecasting and long-term planning, challenging assumptions and key drivers.

Deliver monthly performance reporting with clear, value-added commentary.

Analyse asset and project performance to identify trends, risks and opportunities.

Support business improvement and growth initiatives through robust financial analysis.

Drive continuous improvement in forecasting, reporting and data quality.

Collaborate across Finance to leverage systems, tools and technical expertise.

About You

Strong experience in financial analysis, forecasting and performance reporting in asset-intensive environments.

Advanced modelling and systems capability (e.g. Power BI, Adaptive, Workday or similar).

Confident business partner with strong communication and stakeholder management skills.

Degree-qualified in Finance, Accounting, Economics or similar (energy or infrastructure exposure advantageous).

Next steps:

If the role interests you, please click on the 'Apply' button now and share your latest CV. Alternatively, reach out to me for a confidential career conversation:

E: nuwan@tompeople.com

M: 0430 681 219"
89194826,Lead Data Business Analyst,StraightUp,https://www.seek.com.au/job/89194826?type=standard&ref=search-standalone&origin=jobCard#sol=e80288ea21c4c724ea95648e4adaf6f26ed90957,2h ago,2.0,2025-12-17T05:00:00+00:00,Sydney NSW (Hybrid),Business/Systems Analysts (Information & Communication Technology),Contract/Temp,"Up to $1,000. daily rate","StraightUp is urgently seeking a Lead Data Business Analyst for a 10 month contract position in Sydney. The successful candidate will lead a CRM migration project which is part of a large transformation program of work lasting several years.

Active Security clearance is required (any level, Baseline minimum) and therefore Australian Citizenship is also required.

We are looking to conduct interviews before the Christmas break, starting Thursday 18th December and Friday - with a planned start date of 5th January 2026.

Desired experience & responsibilities 

Experience as Data Business Analyst or Technical Business Analyst
Technical leadership experience of teams of 4+ technical experts e.g. Engineers, Testers, Architects
Knowledge and skill sets associated with data analysis, data modelling, data profiling, cleansing and data migration activities is essential
Ability to convert the high-Level Business requirements into User Stories and Acceptance Criteria and proven knowledge in working in Agile Methodology
High competence in SQL, experience with technologies such as Microsoft Power BI, AWS, Databricks is highly advantageous 

Please apply if you are interested and believe you fulfil the above criteria."
89194429,Lead Data Scientist (EL1 equivalent),Cox Purtell Staffing Services,https://www.seek.com.au/job/89194429?type=standard&ref=search-standalone&origin=jobCard#sol=70b45bf50d8d81c6988c1f5274b8c085802ce87e,2h ago,2.0,2025-12-17T05:00:00+00:00,Sydney NSW (Hybrid),Business/Systems Analysts (Information & Communication Technology),Contract/Temp,EL1 Level rates,"Lead Data Scientist

Australian Citizen + Baseline Security Clearance REQUIRED

Before anything else:
👉 You must be an Australian Citizen and hold (or be eligible for) Baseline Security Clearance.
👉 Onshore only. No overseas work arrangements.

Why this role exists

This is for senior data scientists who want to stay hands-on, work on meaningful, high-impact problems, and influence real decisions - without managing large teams or getting buried in bureaucracy.

You'll work with large-scale administrative data, apply advanced modelling, and turn complex questions into clear, defensible insights that matter.

What you'll be doing

Leading advanced data analysis and modelling in secure environments

Writing clean, modular, well-documented Python/R code

Working with modern data platforms (including Databricks)

Translating ambiguous questions into structured analytical approaches

Communicating insights clearly to technical and non-technical audiences

Mentoring peers and lifting overall data capability - without direct reports

What we're looking for

Senior, hands-on Lead Data Scientist experience

Strong Python or R skills (PySpark highly regarded)

Solid SQL and data engineering capability

Advanced statistical, economic or quantitative modelling experience

Comfort working in secure, governed data environments

Clear communicator who enjoys collaboration and influence

Post-graduate qualifications in a relevant discipline are essential.

Locations considered

You can be based in any of the following Australian locations:

Canberra ACT
Sydney NSW
Newcastle NSW
Orange NSW
Melbourne VIC
Bendigo VIC
Adelaide SA
Darwin NT
Perth WA
Hobart TAS
Brisbane QLD

Hybrid working is supported, with some on-site presence expected.

The kind of person who thrives here

You enjoy solving hard problems, care about code quality, and like seeing your work inform real-world decisions. You don't need a big title or team - just interesting challenges and smart people around you.

Contract details

12-month contract - EL1 equivalent rates

Strong likelihood of extension

Senior, outcome-focused engagement

Interested?

If this sounds like your kind of work - and you meet the citizenship and clearance requirements - send through your CV for a confidential discussion."
89193880,Senior Energy Analyst,Vinova,https://www.seek.com.au/job/89193880?type=standard&ref=search-standalone&origin=jobCard#sol=a3798c04f734c3f65b3ba04cd99f05324b6ada2c,3h ago,3.0,2025-12-17T04:00:00+00:00,Melbourne VIC (Hybrid),"Power Generation & Distribution (Mining, Resources & Energy)",Full time,$180000.00 - $220000.00 p.a. + + equity,"This role puts you at the centre of how large scale energy assets make commercial decisions in Australia's electricity markets. Your analysis will directly influence optimisation strategy, trading outcomes and long term product direction. You will work on high stakes, real world problems using live market data, gaining deep exposure to batteries, renewables and wholesale markets while building a profile as a trusted energy market expert within a fast growing climate technology business.

The role?

Vinova are working with a leading, Silicon Valley-backed energy technology scale-up that is building its Melbourne based team as it expands across Australia's energy markets. This role sits close to the core optimisation and engineering functions and works directly with senior leaders, engineers and commercial stakeholders. You will provide market insight, analytical depth and commercial context that shapes how optimisation systems operate across live energy assets.

What you will be doing?

Analyse wholesale electricity market behaviour to support optimisation and commercial strategy
Build and maintain detailed energy market analysis using Python and large datasets
Identify high value opportunities across batteries, renewables and trading activity
Partner with engineers to inform forecasting, optimisation and control logic

What are we looking for?

Strong experience analysing the NEM
Proven background in energy market analysis, trading support or commercial analytics
Advanced data analysis skills using Python and libraries such as pandas
Experience working with large, complex time series energy datasets
Strong understanding of energy market rules, pricing drivers and risk
Experience querying databases using SQL or similar tools

What makes you stand out?

Postgraduate qualifications in engineering, economics, statistics or a related field
Ability to design experiments and analytical frameworks for strategy decisions
Experience building automated reports, dashboards or market monitoring tools
Strong communication skills with the ability to translate analysis into clear recommendations

The opportunity:

Hybrid working in a Melbourne based team
High impact role influencing live energy assets and revenue outcomes
Ground floor opportunity within a growing international climate tech business
Strong career progression and path to leadership
Join a well funded international energy technology business operating at the intersection of software, data and energy markets.
This team value independent thinking, precision and commercial impact, and are building a high calibre local team with genuine influence over product and strategy.

If you are interested in this position please apply here or contact Vinova for a confidential discussion."
89193837,Senior Data Analyst,Recruitment Hive,https://www.seek.com.au/job/89193837?type=standard&ref=search-standalone&origin=jobCard#sol=0c1cfe6adc178bc735fc4f126b6664648fc8f38b,3h ago,3.0,2025-12-17T04:00:00+00:00,Canberra ACT (Hybrid),Database Development & Administration (Information & Communication Technology),Contract/Temp,$110 - $130 - inc Super - Weekly Pay Options,"Canberra, Barton. WFH Hybrid
12 + 6 + 6 + 6 month contract (NV1 security clearance required) 
Purview, Azure Data Factory, Profisee, ER Studio, Erwin (Desired) 

Our client, an independent Federal agency in charge of organising, conducting and supervising Australian elections, are Seeking the experience of a Senior Data Analyst to provide actionable insights, ensuring data quality, and enabling evidence-based decision-making throughout the software development lifecycle.

Responsibilities and Duties 

Develop and maintain automated reports and dashboards to monitor key metrics.
Design, plan, and manage data migrations, including risk assessment, mapping, testing, and documentation to ensure successful transfer of data between systems.
Provide subject matter expertise, helping to design and build new systems to perform analytics and detection of non-compliance in a regulatory context.
Support workflow automation and troubleshoot data-related integration issues.

Skills / Experience 

Proven experience as a data analyst, with strong technical skills in designing data models, developing databases, and using data mining and segmentation techniques. Able to write data queries, create reports, and clearly present findings;
Strong analytical skills to collect, organise, analyse, and accurately interpret large datasets, identifying trends, patterns, and actionable insights;
Expertise in developing dashboards and data visualisations using Power BI, Tableau, or similar BI tools;
Qualifications in Mathematics, Economics, Computer Science, Information Management or Statistics (Desired);
Experience using reporting and statistical software, databases, and programming (SQL, Python, R, or ETL frameworks) for extracting, manipulating, automating, and analysing large datasets (Desired);
Knowledge or experience working with Microsoft DevOps (Desired).

How to Apply

For a copy of the full job description, including the application instructions, please get in touch with Daniel at Recruitment Hive by clicking the Quick Apply button.  Alternatively, you can reach Daniel on (02) 6299 1006 to discuss further.

Please note that applications close on Tuesday the 6th of January 2026 at midday. Recruitment Hive welcome late applications to be considered for future opportunities.

Job ID: DE663777 | LH-05225

We Value Diversity

The Recruitment Hive is a proud Equal Opportunity Employer. We recognise the value of diverse perspectives and experience and are committed to an inclusive workplace where everyone feels valued and respected for who they are. We encourage people with disability, indigenous, veterans and people of all backgrounds and abilities to express their interest in this"
89192985,Business Analyst,Launch Recruitment Pty Ltd,https://www.seek.com.au/job/89192985?type=standard&ref=search-standalone&origin=jobCard#sol=3c063c94bcdaa382697a88c0cf64b82913d13b41,3h ago,3.0,2025-12-17T04:00:00+00:00,Sydney NSW (Hybrid),Business/Systems Analysts (Information & Communication Technology),Contract/Temp,,"We are seeking an experienced Business Analyst to join a busy insurance environment on an initial 3-month contract. This role requires someone who can hit the ground running, wrap up documentation, and drive clear, practical outcomes across claims automation and reporting initiatives.

You will work closely with local stakeholders and the international head office, so strong communication and documentation skills are essential.

About the Role

You will support a claims dashboard initiative focused on improving how claims are received and processed, including:

Mapping current state to future state claims processes
Supporting an automation project (broker notifications through to the core system)
Defining scope, priorities, timelines and resourcing with SME teams
Identifying training requirements and impacted user groups
Supporting the rollout plan across multiple business lines
Producing clear documentation, reporting and artefacts to support delivery
You will also support the business side of a Snowflake reporting launch, including:

Gathering and documenting reporting requirements
Producing a reporting requirements document (not hands-on implementation)
Supporting testing activities (internal testing, test criteria, and external/UAT support)
Working closely with technical stakeholders while remaining non-technical in delivery
What We're Looking For

Strong experience with process mapping, requirements gathering and documentation
Experience working on automation or automation-enabled initiatives
Ability to translate technical concepts into clear, non-technical documentation and training materials
Highly organised, outcome-focused and able to deliver in a fast-paced environment
Exposure to reporting platforms such as Snowflake
A self-starter who can work independently and deliver outcomes in a busy team
A strong critical thinker who can ask the right questions and connect the dots"
89192861,Senior Data Analyst,Elysium Digital,https://www.seek.com.au/job/89192861?type=standard&ref=search-standalone&origin=jobCard#sol=d4cd13fb67f935388450780f0734c5c1d2dc6be2,3h ago,3.0,2025-12-17T04:00:00+00:00,Canberra ACT (Hybrid),Business/Systems Analysts (Information & Communication Technology),Contract/Temp,,"We are seeking a Senior Data Analyst to work within a multidisciplinary data team to collect, analyse, and interpret data that informs product design, development, and delivery.

This role supports the team by providing actionable insights, ensuring data quality, and enabling evidence-based decision-making throughout the software development lifecycle.

You MUST hold an active Baseline security clearance.

Estimated start date
Tuesday, 27 January 2026
  
Initial contract duration
ASAP until 31 December 2026
  
Extension term details
Up to 3 options not to exceed 18 months
  
Location of work
ACT
  
Working arrangements
Hybrid
  
You will preferably perform the role in Canberra. - Hybrid working arrangements (i.e. a combination of onsite attendance at a local office and remote working) will be considered against operational requirements.

Applicants in other locations within Australia may be considered at the discretion of the Hiring Manager.
  
Maximum hours
40 hours per week
  
Security clearance
Must be able to obtain Negative Vetting Level 1
  
Key duties and responsibilities

Collaborate with business stakeholders and cross functional teams to define requirements for data products, analytics, and reporting dashboards.
Gather, clean, and analyse data from various systems to generate actionable insights.
Develop and maintain automated reports and dashboards to monitor key metrics.
Design, plan, and manage data migrations, including risk assessment, mapping, testing, and documentation to ensure successful transfer of data between systems.
Provide subject matter expertise, helping to design and build new systems to perform analytics and detection of non-compliance in a regulatory context.
Support workflow automation and troubleshoot data-related integration issues.
Provide strategic recommendations and support process improvements based on data analysis.
Perform additional duties or assume responsibility of functions as directed from time to time. 
The Must Haves:  

Proven experience as a data analyst, with strong technical skills in designing data models, developing databases, and using data mining and segmentation techniques. Able to write data queries, create reports, and clearly present findings.
Strong analytical skills to collect, organise, analyse, and accurately interpret large datasets, identifying trends, patterns, and actionable insights.
Expertise in developing dashboards and data visualisations using Power BI, Tableau, or similar BI tools.
Ability to work in a team environment delivering a high level of customer service, with the ability to build strong working relationships and trust with clients, stakeholders and senior management
Excellent communication skills, with the ability to present complex technical findings clearly to non-technical stakeholders.  
The Nice To Haves:  

Qualifications in Mathematics, Economics, Computer Science, Information Management or Statistics
Experience using reporting and statistical software, databases, and programming (SQL, Python, R, or ETL frameworks) for extracting, manipulating, automating, and analysing large datasets.
Knowledge or experience working with Microsoft DevOps is highly desirable.
Experience using any of the following software (Purview, Azure Data Factory, Profisee, ER Studio, Erwin)
  
You MUST be an Australian Citizen and be willing to obtain an NV1 Security Clearance to be considered for this position.

Only shortlisted candidates will be contacted for this role.

For more information contact Mitchell on 0425 269 780"
