Job ID,Job Title,Company,Detail URL,Posted Label,Hours Old,Posted Datetime (Local),Location,Category,Work Type,Salary,Ad Text
87907158,Senior Business Analyst,Water and Catchments - DEECA,https://www.seek.com.au/job/87907158?type=standard&ref=search-standalone&origin=jobCard#sol=d2e7703fdcb8f62aee3a5f5a2416a4d4631fd858,4h ago,4.0,2025-10-16T04:00:00+00:00,Melbourne VIC (Hybrid),"Business/Systems Analysts (Information & Communication Technology)
Government - State (Government & Defence)",Full time,"$138,630 - $185,518 + super","Company description:



Department of Energy, Environment and Climate Action



Job description:



The Senior Business Analyst will play a key role within the Register and Monitoring Services Branch, working alongside a highly skilled group of Senior BAs with deep expertise in Victoria's Water Entitlement Framework. This role is responsible for defining business and data requirements, mapping business processes, and specifying data entry form and workflow behaviours. The Senior Business Analyst will also develop test cases and acceptance criteria to guide developers and cloud engineers, ensuring the VWR platform is accurate, efficient, and aligned with regulatory and business needs.

Specialist/Technical Expertise/Qualifications

Mature experience in gathering requirements, producing detailed specification documents and testing protocols
and their application within a business transformation context (e.g. 8 years in relevent roles, or similar
demonstrable experience).
Mature experience in stakeholder consultation and facilitation with a track record in delivering quality solutions to a range of stakeholders in both a strategic and operational capacity (e.g. 8 years in relevent roles, or similar
demonstrable experience).
Ability to rapidly absorb, learn and deliver quality specifications, business and services models.
Strong experience with Agile/Scrum project delivery methodologies.
Knowledge and/or experience with the Victorian Water Entitlement Framework
Knowledge and/or experience in the application of technology to water resource management, preferably within a Victorian context; experience working with MS Dynamics highly desirable.

This is a fixed term position available until 31 May 2027. The work location for this position is flexible within Victoria with hybrid work arrangements available.

To be considered for this position, applicants are encouraged to submit a resume and cover letter (no longer than 2 pages) summarising their skills and relevant experience.

Please refer to the Key Selection Criteria provided in the Position Description, including the mandatory requirements.

How to Apply:

If you are a current DEECA employee, please apply via DEECA Careers.

Click the ‘Apply' button and you'll be redirected to a new platform and create an account.

Applications close 11.59pm on Wednesday, 29 October 2025.

All applications must be submitted through the online portal. We are unable to consider email or manual applications at this time.

Other relevant information:

Preferred candidates will be required to undertake pre-employment screening, including a Declaration and Consent form and a Nationally Coordinated Criminal History Check.

To be eligible for appointment to this role, applicants will possess corresponding work rights for the advertised employment period. Appointment to an ongoing position is only available to an Australian/New Zealand citizen or an Australian Permanent Resident.

A Diverse, Inclusive and Flexible Workplace

DEECA welcomes applicants from a diverse range of backgrounds and we focus on the essential requirements of the job and being consistent and fair in our treatment of all applicants. We also understand that a balanced life is important to our employees. Talk to us about our flexible options such as working some days from home, starting early or late, working part time, job sharing or accessing paid or unpaid leave. For more information visit applying for a role with us."
87906283,Senior Data Architect,Aspirante,https://www.seek.com.au/job/87906283?type=standard&ref=search-standalone&origin=jobCard#sol=01f55714150e6d933c331514572d86cde7cf76b0,4h ago,4.0,2025-10-16T04:00:00+00:00,Melbourne VIC (Hybrid),Architects (Information & Communication Technology),Full time,,"Senior Data Architect
Are you passionate about architecting to support AI solution needs?
Have you migrated legacy to modern platforms?
Lead, develop, implement enterprise data strategy
Establish data models, governance frameworks and architectural standards
Enable high quality, secure and accessible data across the business
Super interesting project
Have you worked with Microsoft Fabric?
Great team and culture
Start ASAP – Melbourne
Hybrid
Great $$$
We’re looking for a Senior Data Architect to design and drive modern, cloud-based data solutions that enable smarter, faster, and more connected decision-making across the organisation.

You’ll be the key technical leader defining how data is structured, managed, and delivered. Working across cloud platforms and enterprise systems, you’ll architect scalable, secure, and future-ready data ecosystems that empower analytics, AI, and digital innovation.

Defining and delivering enterprise data architecture and strategy you will also be designing end-to-end solutions across data platforms, integration layers, and analytics environments. This will include building frameworks for data governance, modelling, lineage, and quality. Collaborating with engineering and business teams to implement best practices you will champion modern data approaches and enjoy working with the team.

With expertise in migrating from legacy to new cloud data platforms (Azure, AWS, GCP, or Snowflake) you will have great experience with data modelling, pipeline design, and metadata management, with the ability to translate strategy into practical, scalable data solutions.

If you are looking for your next exciting project, in a great team with AI innovation, then hit the apply button now."
87904519,Senior Business Analyst - Cyber Security,Perigon Group Pty Limited,https://www.seek.com.au/job/87904519?type=standard&ref=search-standalone&origin=jobCard#sol=b97bc304779cc438e897299b0b210637c9732ff9,5h ago,5.0,2025-10-16T03:00:00+00:00,Brisbane QLD (Hybrid),Business/Systems Analysts (Information & Communication Technology),Full time,,"About the Role
A leading cyber security uplift program is seeking a Senior Business Analyst to drive delivery across several key streams, including Identity & Access Management and Security Operations. This role offers a blend of technical, business, and stakeholder engagement in a highly visible and strategic initiative. You'll work closely with technical teams, program leadership, and business stakeholders to define, translate, and embed change across a complex technology environment.

Key Responsibilities

Lead end-to-end business analysis across cyber security projects
Elicit and document business, stakeholder, and technical requirements
Translate business needs into actionable cyber solutions and system specifications
Facilitate workshops, develop artefacts, and support delivery teams
Maintain strong stakeholder engagement and ensure benefits realisation
About You

5+ years in senior business analysis roles, ideally in cyber security environments
Proven experience in IAM, security operations, and cyber uplift initiatives
Skilled in stakeholder engagement across complex organisations
Strong capability in workshop facilitation, documentation, and delivery frameworks
Proficient in JIRA, Confluence, and adaptable to agile, waterfall or hybrid delivery
For more information or a confidential discussion, please apply."
87904053,Principal Data Engineer,Ampersand,https://www.seek.com.au/job/87904053?type=standard&ref=search-standalone&origin=jobCard#sol=26189e876812410c0e3145a09c6e4b5d41926270,5h ago,5.0,2025-10-16T03:00:00+00:00,Sydney NSW (Hybrid),Engineering - Software (Information & Communication Technology),Contract/Temp,"$1,200/day plus super","Pay rate: $1,200/day plus super
Contract length: Until 30th Jan 2026 (possible extension)
Location: Sydney CBD / WFH

About the Role

An exciting temporary opportunity has arisen for a Principal Data Engineer to join a fast-paced and innovative team within a government digital technology environment.
  
You will play a key role in designing, building, and monitoring data pipelines that capture and process telemetry from connectivity devices. Your work will directly support the delivery of accurate, actionable insights through dashboards and reports that help stakeholders make informed decisions.

Key Responsibilities

Design, build, and enhance data pipelines to efficiently capture telemetry from connectivity units.
Develop and publish dashboards and reports to provide clear visibility of device performance.
Create technical documentation to support data integration, knowledge sharing, and best practices.
Interact with APIs to pull information streams and progress data into final storage for downstream reporting.
Skills and Experience Required

Strong Python skills (including PySpark) with hands-on experience in building data pipelines.
Intermediate to advanced experience with Databricks, including Unity Catalog and Delta Live Tables.
Advanced experience with RESTful APIs, managing client credentials via Python.
Expertise in CI/CD best practices, implementing continuous integration and deployment pipelines.
End-to-end development experience, overseeing processes from development to production.
Excellent communication skills, able to explain technical concepts to a variety of audiences.
Self-motivated, collaborative, and customer-focused, with the ability to deliver high-quality work independently.
Desirable skills:

SQL
MS Graph API
If this role sounds like a great fit, apply now! Please note that only applicants with full Australian work rights will be considered."
87903860,Senior Reporting Systems Specialist,Michael Page,https://www.seek.com.au/job/87903860?type=standard&ref=search-standalone&origin=jobCard#sol=8a450de93aeb76a3c91924c7927df8539f38b711,5h ago,5.0,2025-10-16T03:00:00+00:00,"Port Macquarie, Port Macquarie & Mid North Coast NSW",Other (Information & Communication Technology),Full time,,"Are you an experienced professional in analytics looking to work in the energy and natural resources industry? Join a leading organisation as a Senior Reporting Systems Specialist in Sydney, where you'll play a pivotal role in enhancing reporting systems and driving data-driven insights.

Client Details

This organisation is a well-established player in the energy and natural resources industry, known for its focus on innovation and operational excellence. As a large organisation, it offers a stable yet progressive environment, providing opportunities to work on impactful projects.

Description

Develop and maintain reporting systems to ensure accurate and timely data insights.
Collaborate with internal stakeholders to gather reporting requirements and deliver tailored solutions.
Optimise existing analytics processes to enhance efficiency and reliability.
Provide technical expertise on reporting tools and platforms to support decision-making.
Ensure data integrity and compliance with internal and external standards.
Generate detailed reports and dashboards for senior management and other departments.
Stay updated with industry trends and recommend improvements to reporting practices.
Support the training and upskilling of team members in reporting tools and methodologies.

Profile

A successful Senior Reporting Systems Specialist should have:

A strong background in analytics and reporting, preferably in the energy and natural resources industry.
Proficiency in reporting tools and platforms, such as Power BI, Tableau, or similar.
3+ year experience in the Azure Suite
Strong communication skills to liaise with various stakeholders.
Experience in managing data-driven projects and delivering actionable insights.

Job Offer

Location: Port Macquarie
Opportunities for professional growth and development within the analytics department.
Supportive team culture fostering innovation and collaboration.
Additional benefits including competitive leave entitlements and flexible working arrangements.

If you're ready to take the next step in your career as a Senior Reporting Systems Specialist, apply today!

To apply online please click the 'Apply' button below. For a confidential discussion about this role please contact Hima Arafath on +61282218122."
87903732,Portfolio Manager,The University of Western Australia,https://www.seek.com.au/job/87903732?type=standard&ref=search-standalone&origin=jobCard#sol=bf68b73f2b4154932ea0abc7ea6f86622319f0f2,5h ago,5.0,2025-10-16T03:00:00+00:00,"Crawley, Perth WA (Hybrid)",Programme & Project Management (Information & Communication Technology),Full time,"$160,962 - $167,203 p.a. plus 17% superannuation.","Be the strategic heartbeat of our technology investments and make a real impact in UWA’s transformation journey.
Oversee a diverse portfolio of programs and projects, ensuring alignment with business goals, optimising resource allocation, and driving measurable value. This is not just a governance role—it’s a leadership opportunity to shape how technology fuels UWA’s transformation journey.
Full-time (1.0 FTE) appointment on an ongoing basis.
Base salary range: $160,962 – $167,203 p.a. plus 17% superannuation.

About the area

UWA is making significant investments in Information and Technology Services to enable its strategic direction and goals.  UWA is looking to utilise technology advancements to expand its services and create new and innovative teaching and research models.

The IT Delivery Enablement unit is accountable for managing and delivering the IT Programs and Projects Portfolio on behalf of the University.

What you’ll do

Lead the planning, prioritisation, and execution of the IT project portfolio across multiple business units. Partner with senior stakeholders to align the technology investments with strategic objectives
Monitor performance, risks, and benefits realisation across the portfolio. Provide transparent reporting and insights to Steering Committees and executive leadership. Provide transparent financial reporting on behalf of the CIO and the IT business unit.
Governance and stewardship of the project delivery frameworks, portfolio management processes and systems and continuous improvement.

About you

Proven experience managing complex IT portfolios in enterprise environments including development of frameworks & processes to drive project prioritisation, governance and benefits realisation.
Proven experience with portfolio management tools and reporting (e.g., Altus, Planview, Clarity).
Exceptional stakeholder engagement and communication skills with the ability to influence and foster positive stakeholder relationships at all levels of the University and negotiate competing priorities whilst always remaining fully customer focused.
Demonstrated ability to contribute to long-term planning and key strategic direction.
Tertiary qualifications or demonstrated equivalent competency. Relevant certifications (e.g., PfMP, PMP, SAFe, ITIL) are a plus.

Special Requirements

A current National Police Clearance Certificate.
Financial Background Checks.

Position description:  POSITION DESCRIPTION Portfolio Manager (521188).docx

To learn more about this opportunity, please contact Rachael Hansom at rachael.hansom@uwa.edu.au

How to apply

Please apply online via the Apply Now button. The content of your Resume and Cover Letter should demonstrate how you meet the selection criteria.

Please note: Unsolicited applications from recruitment agencies will not be accepted outside of formal channels.

Closing date: 11:55 PM AWST on Thursday 30th October 2025

This position is only open to applicants with relevant rights to work in Australia.

About the University

The University of Western Australia (UWA) is ranked among the top 100 universities in the world and a member of the prestigious Australian Group of Eight research intensive universities. With a strong research track record, vibrant campus and working environments, there is no better time to join Western Australia’s top university.

Learn more about us.

Our commitment to inclusion and diversity

UWA is committed to a diverse workforce and an equitable and inclusive workplace. We are committed to fostering a safe environment for all, including Aboriginal and Torres Strait Islander people, women, those from culturally and linguistically diverse backgrounds, the LGBTIQA+ community, and people living with disability.

If you require any reasonable adjustments, we encourage you to advise us at the time of application. Alternatively, you can contact us for assistance during the recruitment process.

If you have queries relating to your application, please contact the individual named in the advertisement. Alternatively, please contact the Talent team at people@uwa.edu.au with details of your query. To enable a quick response, please include the 6-digit job reference number."
87774141,Principal Consultant - Climate Risk and Resilience,Anthesis Australia Pty Ltd,https://www.seek.com.au/job/87774141?type=standard&ref=search-standalone&origin=jobCard#sol=b502544ec7273a9e4a8d75779b52255486eebcb5,6h ago,6.0,2025-10-16T02:00:00+00:00,Melbourne VIC (Hybrid),Environment & Sustainability Consulting (Consulting & Strategy),Full time,,"About us

Anthesis is the sustainability activator. Proud to be a B Corp, we seek to make a significant contribution to a world which is more resilient and productive. We do this by working with cities, corporates, investors and other organisations to drive sustainable performance. We develop financially driven sustainability strategies, underpinned by technical expertise and delivered by innovative collaborative teams across the world. 

Anthesis has clients across all industry sectors and supports some of the world’s largest multinationals. The company brings together 1,300+ experts operating in 42 countries around the world and has offices in Australia, Brazil, Canada, China, Colombia, Finland, France, Germany, Ireland, Italy, Dubai, the Philippines, Portugal, Spain, South Africa, Sweden, the UK, and the US. 

At Anthesis Group, we are truly committed to putting people and our planet at the heart of all we do. 

About the role 

We are seeking a Principal Consultant for our Climate Risk and Resilience team in Australia focused on guiding clients to comply with the Australian Sustainability Reporting Standard (ASRS) Standard 2 (AASB S2), as well as other regional APAC climate related reporting regimes like ISSB.  A critical skill sought is the ability to evaluate and analyse climate related transition risks and opportunities for clients across multiple sectors including energy, retail, financial institutions, and manufacturing.  

This role is client-focused and requires technical project management and management of direct reports. This hire will sit within Anthesis’ APAC Climate Risk and Resiliency team, but collaborate closely with our decarbonisation, ESG, and mandatory reporting teams. Anthesis is a global advisory, and our skilled people have opportunities to be deployed dynamically beyond their home countries and our clients often span the globe. 

Responsibilities fall into three major areas: 

Client & Project Delivery  

Project Management – managing the delivery of agreed consulting engagements / projects on time, on budget, and to high standards of quality. 

Expert input and QA – reviewing project work and providing expert viewpoint and quality assurance on deliverables as needed. 

Client Relationship Building – earning the confidence and trust of client teams and representing our direct clients’ interests effectively inside their organisations. 

Deliverable Drafting & Presentation – preparing and delivering high quality reports, presentations, and sometimes workshops in line with project scope. 

Business Development  

Leading the development of proposals on assessing climate risk and opportunities, climate transition plan, resilience strategies and climate-related reporting, and contributing to the presentation and conversion of these opportunities, in collaboration with the guidance and support of colleagues. 

Service development - developing or contributing to the development of new service offerings and/or streamlining and improving existing service offerings including creating delivery and proposal templates, providing training and acting as internal expert on a specific service. 

Contributing to the development of Anthesis’ thought leadership and marketing materials in relation to climate change and associated reporting. 

Organisational & Personal Development  

Training & Personal Development – using the ACE (Anthesis Centre of Excellence) learning and development platform and guided by your line manager. 

Line Management – supporting one or two more junior colleagues to guide and manage their growth and performance within Anthesis. 

Strategic & Organisational Initiatives – contributing to important internal initiatives, proposition development and innovation. 

Required Skills & Experience  

A degree/relevant qualification in a related field (sustainability/climate, finance, enterprise risk management, etc.) 

At least 5 years of experience in management, sustainability, or legal consulting, or in a related consulting discipline such as innovation, organizational design, or change management. Alternatively, experience in a relevant function or field within a private or government organisation may be relevant. 

A passion for sustainability and an interest in being at the forefront of sustainability and sustainable finance.  

An understanding of global climate science and international decarbonisation scenarios. 

Experience in delivering transition and physical climate risk and opportunity assessments for clients.  

Curios, open minded and enthusiastic with clear ability to collaborate and work well with a wide range of people on a global basis.  

Familiarity with reporting frameworks such as ASRS AASB S2, TCFD, CSRD, CSDDD, ISSB, or other related standards. 

Drafting reports and presentations that convey key messages, inform strategic decision-making and deliver impact-led conclusions. 

Ability to analyse, write, and advise on highly technical economic, regulatory, and sustainability-related subjects. 

Ability to respond positively to pressure and take a flexible approach to the dynamic, fast moving sustainability reporting sector.  

Strong working familiarity with MS Office Suite is required, with high levels of numeracy and good Excel programming and workbook skills preferred. 

Relevant Skills & Experience  

A strong understanding of accounting principles, financial reporting, and ESG integration into financial statements.  

Experience developing climate transition plans.  

A strong understanding of associated disciplines relating to ASRS compliance such as GHG inventory, target setting, and financial quantification.   

Enterprise Risk Management including practices, and policies to analyse and report enterprise risks, to manage risks according to an enterprise risk management framework, and compliance with applicable regulations, rating agency standards. 

What we offer you:  

Five weeks paid annual leave. 

Opportunity to be mentored by leading experts in the field in a supportive learning environment. 

Opportunity for travel and get out in the field. 

Best in class employee assistance program (EAP) program for you and your immediate family. 

Flexible working hours and hybrid working environment. 

Exposure to diverse industries and projects within the fields of carbon, energy and nature-based solutions. 

Positive workplace culture and a like-minded team. 

Opportunity to develop the skills to launch your career in this emerging area."
