Job ID,Job Title,Company,Detail URL,Posted Label,Hours Old,Posted Datetime (Local),Location,Category,Work Type,Salary,Ad Text
88586949,Support Data & Analytics Engineer,EG Australia,https://www.seek.com.au/job/88586949?type=standard&ref=search-standalone&origin=jobCard#sol=41e02c24876086c61cbb893af869c185f79201d5,9h ago,9.0,2025-11-17T23:00:00+00:00,"North Sydney, Sydney NSW (Hybrid)",Engineering - Software (Information & Communication Technology),Full time,,"Support Data and Analytics Engineer - 6 month Contract 

Flexible work from home arrangements

Location: North Sydney, 2060




ABOUT EG

Ideas are becoming a reality across the EG Australia national network as we deliver a consistent retail strategy in specialist forecourt retailing to our customers. We continue to build and grow, supported by the knowledge and success of EG Group a creative and innovative global retail operation servicing over 6,500 forecourts in 9 countries across Europe, North America and Australia.




ABOUT THE ROLE

As a Support Data & Analytics Engineer, you’ll provide essential reporting and data support for 500+ stores and key business units, including Finance, Operations, Fuel Pricing, Merchandising, Business Assurance, and People & Culture. You’ll manage and resolve ServiceNow support tickets by identifying root causes, re-running pipelines, validating data quality, and working with upstream system owners to fix data or logic issues.

You’ll also perform analytical investigations to detect issues, anomalies, and trends, collaborating closely with the wider EG Australia Support Team to ensure accurate and reliable information management.




RESPONSIBILITIES IN A SNAPSHOT:

Reporting into the Head of Information Management you will:

Monitor and action support tickets daily in the ServiceNow queue, along with investigating the underlying trends and anomalies

Liaise with internal users and escalate more complex issues to senior engineers or development teams

Processing ensuring all data processing is completed in a timely manner to ensure downstream reporting and analytics are up to date

Design, test and implement effective and scalable data pipelines, leveraging cutting-edge tools such as LucidCharts (to design), SQL (to build) and Azure Data Factory (to schedule)

Design, test and implement effective and scalable data pipelines in Azure Data Factor

Enhance and maintain data storage and processing solutions, across data warehouses and data lakes using Azure.

Automate data analysis and reporting processes, utilising various tools and scripts

Support data governance through implementing best practices around code documentation, naming conventions, data glossaries and data mapping

Partner with stakeholders to translate complex business problems into fit-for-purpose and scalable data pipelines and data models, to enable fast and efficient data-driven decision-making




WHAT ARE WE LOOKING FOR?

A Bachelor’s degree in Data Engineering, Computer Science, or a related field

4 years of experience in a data engineering or analytics role, with a strong foundation in working with complex data systems

Strong problem-solving and analytical skills, with a natural curiosity for digging into data and identifying solutions

Excellent communication and presentation skills, with the ability to engage and manage stakeholders effectively

A proactive and collaborative approach, you work well independently and as part of a team

Proficiency in Snowflake and advanced SQL scripting, along with intermediate skills in a programming language such as Python

Hands-on experience with ETL and scheduling tools like Azure Data Factory, Azure Logic Apps, PowerAutomate, or similar platforms

A solid understanding of data modelling principles, practices, and methodologies

Experience creating and maintaining technical documentation, standards, and best-practice guidance

Demonstrated expertise in database design, Master Data Management (MDM), and building high-performance, scalable data pipelines




WHAT’S IN IT FOR YOU?

An opportunity to play an integral role in driving efficiency and profitability for EG Australia.

Competitive salary package and employee discounts.

Mix of office & working from home flexibility with access to employee well-being programs.

Work with cutting edge analytics & AI tools across Azure, Snowflake and DataIKU.

Equal opportunity workplace with a commitment to diversity & inclusion and gender-diverse policies.

 

Be part of the team shaping operations for EG Australia. Apply Now"
88586772,Principal Strategy Advisor,Department of Transport and Planning,https://www.seek.com.au/job/88586772?type=standard&ref=search-standalone&origin=jobCard#sol=ccacca2cfb921daddb6b14af59a8645cbc8ff63b,9h ago,9.0,2025-11-17T23:00:00+00:00,Melbourne VIC,Government - State (Government & Defence),Full time,"VPS 6 $138,631 - $185,518 plus superannuation","Company description:



About us
We create thriving places and connected communities. We bring together transport, planning, land use, precinct and policy functions in a single department to deliver the best outcomes for Victorians.


Together with our portfolio agencies, we are responsible for planning, building, operating and +maintaining Victoria's transport, planning and land services for use by all.


We foster a safe, inclusive and constructive place to work.


Integrated Strategy is a Division within the Office of the Secretary, which provides oversight to policy change and operates as a policy coordination and strategy function within DTP. Integrated Strategy works with external stakeholders and across the Department to co-design policies and strategies to respond to current and future challenges.



Job description:



About the role
This role is in a newly created Strategy Branch in the Integrated Strategy Division of the Department. The purpose of the Branch is to lead longer term strategy work for the Department. Reporting to the Director, the Principal Strategy Advisor will be part of a small team that together with other members of the Integrated Strategy Division will work with leaders from across DTP on high priority strategy topics identified by DTP leadership.


The Principal Strategy Advisor will take a leading role on strategic workstreams through facilitating workshops, designing and executing cross departmental engagement approaches, structuring complex problems and fully owning the delivery of work against them spanning work planning, analysis, synthesising and end product creation.

Key Selection Criteria
The role requires demonstrated leadership in critical thinking, problem solving and project delivery, with the ability to analyse complex issues in a broader organisational context, develop effective solutions and translate strategic direction into successful programs and initiatives. Strong data literacy is essential, including the ability to design data collection and analysis approaches that support informed, predictive decision-making. The position also demands a future-focused mindset, highly effective communication skills and the ability to build a collaborative culture across internal and external stakeholders.

To access the Position Description, please click here.

Position accountabilities
The Department of Transport and Planning is seeking an experienced and influential Principal Strategy Advisor to play a key role in shaping strategic direction across Victoria's transport system. This senior position is responsible for guiding major strategic work, leading complex analysis and ensuring the department's priorities are clearly defined, well-evidenced and aligned with broader organisational goals.


In this role, you will work closely with senior leaders to distil diverse inputs into clear strategic focus areas. You will scope, research and complete complex qualitative and quantitative analysis to inform high-quality written strategy products that support long-term decision-making. Your ability to synthesise information, think critically across multiple time horizons and translate insights into impactful strategy documents will be central to your success.


The role also involves managing projects that underpin the development and implementation of key strategic products. You will coordinate timelines, monitor progress, identify risks and proactively provide solutions, ensuring the Strategy Director is kept informed of critical milestones and challenges. Your leadership will help embed strategic outcomes across the department, ensuring they translate into real and enduring impact.


This is an opportunity to influence State-wide strategic priorities and contribute to shaping the future of transport and planning in Victoria. If you are a strategic thinker with strong analytical capability, excellent stakeholder skills and a commitment to delivering high-quality work, we encourage you to apply.


Qualifications and experience
Mandatory
- Tertiary qualification or extensive experience in an analytical or technical field. (mandatory)
- Experience working with complex and disparate data sets to draw strategic insights (mandatory)
- Exposure to problem structuring and analytical approaches (mandatory)

Desirable
- Knowledge and experience in Transport and/or Planning (desirable)

Culture Value
We welcome applicants from a diverse range of backgrounds representing the community that we serve, including veterans, parents, carers, First Peoples, people with disability, multicultural, multifaith and LGBTIQA+ individuals.


As an equal opportunity employer, we are committed to fostering a safe, inclusive, and high-performance culture. Through shared actions and behaviours aligned with our strategy and direction, we empower our people to thrive and meaningfully contribute to the department's goals.


What we offer
Working at the Department of Transport and Planning provides people with the opportunity to contribute to creating thriving places and connected communities for all Victorians.


For further details please refer to Careers at the Department of Transport and Planning.


Pre-employment checks and employment conditions
All new appointments to the department will be subject to a National Criminal Records Check, Misconduct Screening, and a Qualification Check where there is a requirement for a mandatory qualification. Information provided to the Department of Transport and Planning will be treated in the strictest confidence consistent with the requirements of the Privacy and Data Protection Act 2014.


Applicants must be an Australian Citizen, Permanent Resident or hold a valid work permit or visa necessary for the nature of the position.


Recipients of Victorian Public Service (VPS) voluntary departure packages should note that re-employment restrictions apply.

Non-VPS applicants will be subject to a probation period of six months.


How to apply
Click the ‘Apply' button to be redirected to our recruitment platform, where you may need to create an account to submit your application.

If you encounter any issues, refer to our Quick Reference Guide for step-by-step instructions.


Applications close at 11.59pm on Tuesday, 2nd December 2025.

Please include both your resume and a cover letter. All applications must be submitted via the online portal, we're unable to accept email or manual submissions.

For further information about the role, please contact Jules Flynn - Executive Director, Integrated Strategy via jules.flynn@transport.vic.gov.au.

Important Information:
• If you require any adjustments to fully participate in the recruitment process, or need the advert or attachments in an accessible format (e.g., large print), please contact us by phone or email. We're here to support you."
88586378,Business Analyst,IXOM Operations Pty Ltd,https://www.seek.com.au/job/88586378?type=standard&ref=search-standalone&origin=jobCard#sol=51c410dde758888ef87cb4a010c8b18aa0100c2f,9h ago,9.0,2025-11-17T23:00:00+00:00,Melbourne VIC,"Analysis & Reporting (Manufacturing, Transport & Logistics)",Contract/Temp,,"IXOM plays a vital part in the lives of tens of millions of people every day. We're the experts behind the scenes, ensuring safe and reliable access and helping industries, businesses, and local communities thrive.


Our products, services and solutions are used across many end markets, including dairy, agriculture, viticulture, electricity, steel, food and beverage, pulp and paper, mining and construction, and water treatment (just to name a few).


We are supported by over 1,300 people globally and our operations span across four continents and nine countries, with headquarters in Melbourne, Australia.





About your role

Reporting to the Head of Business Process Data & Analytics within the Technology & Transformation (T&T) team, the Business Process Analyst will be instrumental in driving meaningful change across IXOM's internal operations. This role is all about uncovering opportunities—identifying and validating process challenges, facilitating stakeholder workshops, and conducting current state assessments to pave the way for smarter, more efficient ways of working.

If you're passionate about process excellence, thrive in collaborative environments, and love turning complexity into clarity, this is your chance to make a lasting impact.

Key Responsibilities

Drive Process Optimisation: Analyse existing processes to identify opportunities for simplification, standardisation, and automation.
Lead Continuous Improvement: Initiate and support process improvement initiatives that enhance efficiency and support strategic goals.
Engage Stakeholders: Facilitate workshops and act as a key liaison between business units, the Technology & Transformation team, and Organisational Change Management.
Document and Communicate Clearly: Develop and maintain comprehensive process documentation, SOPs, and training materials to support change adoption.
Support Project Delivery: Align process work with project timelines and objectives, providing business analysis support and ensuring timely execution.

Who are we looking for?

Bachelor's degree in business Analytics, Business Process Management, Business Management or a related field.
Relevant business process improvement related qualifications including Six Sigma or similar
Proven experience as a Business Analyst or a suitable management role, with a focus on business improvement and optimisation.
Analytical Thinking: Ability to analyse complex processes and identify areas for improvement.
Communication: Strong verbal and written communication skills to effectively interact with stakeholders at all levels.
Attention to Detail: Meticulous attention to detail in process documentation and analysis.
Adaptability: Ability to adapt to changing business needs and priorities.
Strong analytical and problem-solving skills, with a keen understanding of business processes.
Familiarity with process mapping.
Familiarity with process mapping standards and tools/technologies (e.g. Signavio) an advantage
Ability to work collaboratively in a team-oriented environment.
Experience participating in projects and supporting deliverables, timelines, and teams.
Understanding of automation and standardisation principles in business processes.

Benefits at IXOM


For a start, you'll work for a large global organisation, where you'll not only earn a competitive salary, but you'll also have access to an Employee Assistance Program, a recognition program, and a range of health and wellness benefits and discounts.

Our wellbeing program is second to none, and we offer a range of education assistance and learning resources, as well as secondment and promotion opportunities to help you grow both personally and professionally.

We support what's important to you by promoting workplace giving, diversity and providing volunteering leave, and, of course, we offer flexible working wherever possible.

To Apply

If this sounds like you, we'd love to hear from you!

Our Process

At IXOM we are committed to employing individuals who align with our values and meet the requirements of the role. As part of the recruitment process, there are a number of checks which may be conducted to demonstrate applicants' suitability for a role including police / criminal background checks, medical, drug and alcohol testing, and reference checks.

Diverse candidates have diverse needs. During your recruitment journey, information will be provided about adjustment requests. If you require additional support before submitting your application, please contact our Talent Acquisition team."
88586182,Senior Investment Analyst - Fixed Income,HESTA Super Fund,https://www.seek.com.au/job/88586182?type=standard&ref=search-standalone&origin=jobCard#sol=effbda39f04d9f5c217a06ad3eef339811206426,10h ago,10.0,2025-11-17T22:00:00+00:00,Sydney NSW (Hybrid),Funds Management (Banking & Financial Services),Full time,,"Careers with Impact

More than one million Australians trust HESTA with their money. HESTA is a top-performing industry super fund working for real-world impact. We use our expertise and influence to deliver strong long-term returns while accelerating our contribution to a more sustainable world.

HESTA is also an inspiring and rewarding place to work. That's because what we do makes a difference to the lives of our members. The people who work at HESTA are not only exceptional at what they do, they're focused on living and creating a strong organisational culture. We're an industry super fund dedicated to the people who keep our communities going. People who provide some of the best health, education and community services in the world are HESTA members - and we are proud to serve them.





Bring your authentic and passionate self to this exceptional role #careerswithimpact

Please note this role could be based in Sydney or Melbourne.


As the Senior Investment Analyst - Fixed Income, you will support the Defensive Assets team in the implementation and oversight of HESTA's internal Fixed Income, Cash and Enhanced Cash portfolio management activities.

Reporting to the Portfolio Manager - Fixed Income, you will be involved in portfolio management support, including portfolio construction, risk management, and trade idea generation based on quantitative analysis. Leading quantitative research initiatives, you will develop and refine investment processes while identifying new portfolio construction opportunities through data-driven analysis.

Your role will encompass risk management and compliance responsibilities, ensuring adherence to investment mandates and contributing to our risk management framework. You will design and implement quantitative models for interest rate and credit analysis, while creating and maintaining portfolio optimization tools.

About You

Essential for this role is experience in fixed income portfolio management combined with skills and experience in Debt Capital Markets and in the practical application of quantitative methodologies and techniques to Fixed Income Portfolio Management and Trade Execution.

The ideal candidate will possess qualifications in Finance, Actuarial Studies, Econometrics or related fields, along with intermediate to advanced skills in Python and/or R. Required experience includes financial modelling, yield curve analysis, portfolio construction, derivatives trading, relative value analysis and risk management in a Portfolio Management or Dealing Room environment. You will have well developed sector knowledge of defensive asset classes (credit, debt, cash) and FX and experience in portfolio construction and risk management.

Benefits that matter and make a difference for our employees


o Leave for those moments that matter, an additional 6 days of leave at the end of year, up to 6 days paid volunteer leave, gender neutral paid parental leave of 20 weeks, Gender Affirmation leave, reproductive health and wellbeing leave, Cultural and Ceremonial leave. Access your LSL after 3 years, take AL at half pay, and purchase up to 2 weeks additional leave (just to name a few!).
o Your Professional development matters, up to $5k per year professional development and up to 8 days professional development leave, HESTA scholarships and free access to a range of premium learning tools.
o Your health and wellbeing matters, free annual flu shots and skin checks, incredible social events throughout the year and a comprehensive employee assistance program available 24/7.
o Your financial wellbeing matters, 15% super, financial planning support, end of year payment for all Enterprise Agreement-covered employees, incentivised Employee Referral Program and novated lease options.

We celebrate, value and include people of all backgrounds, genders, identities, cultures and abilities. We welcome and support applications from First Nations people, physically, neuro or culturally diverse, LGBTQI+, and people of any age. We are proud to be WGEA accredited as an Employer of Choice for Gender Equity.


We want all candidates to feel safe, included and provided with the best opportunity to thrive, if you require reasonable adjustments during your application or throughout the recruitment process, please reach out to a member of the Talent team careers@hesta.com.au and we'll call you to discuss.


Please note: Applications via recruitment agencies will not be accepted for this position





New opportunity to work across Internally Managed Fixed Income, Credit and Cash portfolios at a major super fund





Flexible Hybrid Working

Enhanced Leave Entitlements"
88585610,Process Analyst,Launch Recruitment Pty Ltd,https://www.seek.com.au/job/88585610?type=standard&ref=search-standalone&origin=jobCard#sol=7b1904a6735400db92181d0d206afa00dc16d23e,10h ago,10.0,2025-11-17T22:00:00+00:00,Melbourne VIC (Hybrid),Business/Systems Analysts (Information & Communication Technology),Contract/Temp,Daily Rate - $700 inclusive of Super,"Process Analyst 
 
Project Overview:
Our client in the leisure space is transitioning from its legacy on-premise Opera PMS (v5.6) to Oracle's Opera Cloud platform across 10 Club and Resort properties, including Opera Sales & Catering (S&C) for Conference & Events. This migration will modernize operations, reduce on-premise infrastructure, and enable industry-standard features.

Role Details

Location: Melbourne, Victoria
Contract: 6-Month Contingent
Work Model: Hybrid (3 days in-office)
Key Responsibilities

Analyse and document current-state business processes and define future-state workflows aligned with Opera Cloud capabilities.
Collaborate with delivery teams to ensure process changes are implemented effectively during system configuration and migration.
Conduct impact assessments for process changes across hospitality operations and Conference & Events.
Support testing activities by validating process alignment during SIT and UAT phases.
Facilitate workshops with stakeholders to confirm process requirements and resolve gaps.
Develop process documentation, SOPs, and training materials to support operational readiness.
Identify risks and dependencies related to process changes and escalate as needed.
Skills & Experience

Strong background in business process analysis and modelling (BPMN or similar).
Experience in hospitality or leisure industry systems, ideally PMS platforms.
Ability to manage stakeholder engagement and drive consensus on process changes.
Familiarity with cloud migration projects and integration considerations.
Proficiency with Jira, Confluence, and process modelling tools (Visio, draw.io).
Agile delivery experience and ability to work in fast-paced environments."
