Job ID,Job Title,Company,Detail URL,Posted Label,Hours Old,Posted Datetime (Local),Location,Category,Work Type,Salary,Ad Text
89854741,Strategy Lead,Enertia Talent,https://www.seek.com.au/job/89854741?type=standard&ref=search-standalone&origin=jobCard#sol=3a39fda00c693c8cef58715c30f6ffc0db03533b,5h ago,5.0,2026-01-22T01:00:00+00:00,Sydney NSW,Strategy & Planning (Consulting & Strategy),Full time,,"About YOUR New Employer:

This energy organisation plays a crucial role in Australia’s clean energy future. They deliver complex energy solutions across the country to support the transition to cleaner, more sustainable energy. With an expanding strategic agenda, they are now seeking a Strategy Lead to help shape the company’s plan moving forward and lead high impact initiatives.

About YOUR New Role:

This role will report into the Strategy Director, and as the Strategy Lead, you will:

Contribute to the design and refinement of the company’s 10 year strategic roadmap
Build strong stakeholder engagement to secure alignment and drive execution of strategic priorities
Analyse internal data, market trends, competitor activity, and emerging risks to generate meaningful insights that inform strategic decisions.
Lead the end-to-end corporate strategic planning process across all business units
Develop and implement high-impact strategic initiatives that drive organisational performance
Track and report on key business KPIs and progress toward long-term strategic objectives
About YOU:

You have a strong background in strategy, gained through a top tier consulting firm (MBB or Tier 1) or an inhouse corporate strategy role. You’re comfortable working in fast paced environments and enjoy breaking down complex problems into clear, practical outcomes.
  
You’ll bring:

8-10 years’ experience in corporate strategy, strategic analysis, or strategy consulting, ideally gained within an MBB or Tier 1 consulting environment
Exposure to energy, infrastructure, utilities, or other capital-intensive industries is highly regarded
Strong problem solving and analytical skills, with experience working with large and complex data sets
Clear and structured communication skills, with the ability to turn analysis into practical recommendations
Experience in presenting to senior leaders and supporting executive and board level decisions
This rapidly expanding company offers a clear pathway for career growth and the support needed to help you achieve both your personal and the organisation’s objectives.
  
If the opportunity to play a key role in shaping the future success of this impressive business is of interest, hit the Apply Now button or contact Sefa Prasad (0483 945 772) or David Smith (0414 439 786)."
89835213,Data Engineer,READY MANAGEMENT SOLUTIONS PTY LTD,https://www.seek.com.au/job/89835213?type=standard&ref=search-standalone&origin=jobCard#sol=d2fcf665e174fb88a4a5fb6021e2a8de33721064,5h ago,5.0,2026-01-22T01:00:00+00:00,Melbourne VIC (Hybrid),Engineering - Software (Information & Communication Technology),Full time,"$120,000 – $150,000 per year","The role of Data Engineer will be a key contributor to the migration of our client's reporting platform, focusing on back-end systems and data infrastructure. This role is responsible for ensuring the smooth integration and processing of large-scale data, building robust data pipelines, and creating scalable data products to support multiple applications across the company. The Data Engineer will collaborate with various departments to implement and maintain high-performance data systems that empower business users with actionable insights. Responsibilities also include optimizing data workflows, driving innovation in data engineering processes, and ensuring data integrity throughout the platform migration.




Main responsibilities:

· Collaboration: Partner with cross-functional teams to understand their data needs and design solutions that streamline data flows and integration across multiple applications.

· Semantic Model & KPI Definitions: Build and maintain a comprehensive semantic model, working closely with stakeholders to define and standardize KPIs that align with business objectives and reporting requirements.

· Platform Migration: help with back-end migration efforts, ensuring that all data pipelines, storage solutions, and processing systems are transitioned efficiently and without disruption to business operations.

· Data Pipeline Development: Design, build, and maintain scalable and efficient data pipelines that ensure accurate and timely data delivery to support business intelligence tools and applications.

· System Optimization: Continuously optimize and monitor back-end systems, databases, and data workflows to maintain high performance and cost-efficiency.

· Data Integration: Ensure seamless integration of data from various sources into centralized platforms, enabling comprehensive reporting and analysis capabilities.

· Problem-Solving: Leverage data engineering expertise to troubleshoot issues, optimize performance, and solve complex challenges related to data storage, processing, and accessibility.

· Innovation & Collaboration: Work closely with the Data & IT teams to explore new technologies and methodologies, driving innovation in the company's data engineering practices and supporting evolving business needs.




Requirements:

Must have

University Degree (Data Engineering, Information Systems, or a related field)

3+ years in a data engineering or similar role, with demonstrated success in supporting data transformation and migration projects, ideally from legacy systems to modern data platforms

Proven track record in supporting data transformation projects, nice to have would be migrating from legacy systems to modern BI tools like Power BI

Technical Skills:

Data Transformation: Strong experience in ETL/ELT processes, data modeling, and reporting in Microsoft environment (SSIS, Azure DataFactory, Synapse, Fabric)

Power BI Semantic Model: Proven ability to create and maintain a comprehensive analytical data models, specifically in Power BI and/or Microsoft SQL Server Analysis Services (SSAS), including KPI definitions and metric standardization to meet reporting requirements

SQL Proficiency: Proficient in SQL (any dialect) for data manipulation, transformation, and analysis.

DAX Proficiency: Proficient in DAX language for Analysis Services/Power BI.

Data Pipelines: Experience building and optimizing data pipelines for large-scale data processing.

Cloud Experience: Familiarity with cloud environments such as Azure, with a focus on tools like Synapse Analytics

Ability to analyze both structured and unstructured data, with a proactive approach to identifying and solving data issues

Effective communication skills to collaborate with stakeholders across departments, strong problem-solving abilities, and a commitment to data quality and accuracy

English at business level

Visa sponsorship is available for candidates without existing Australian work rights

Nice to have

· Experience with SSRS and SSIS, or similar reporting and integration tools

· Hands-on experience with BI tools like Power BI, with a strong understanding of KPI definitions and dashboard creation"
89854565,Senior Portfolio Analyst (Credit Risk),Optus,https://www.seek.com.au/job/89854565?type=standard&ref=search-standalone&origin=jobCard#sol=df54976cebf408955114d80b47abf79ec56d9329,5h ago,5.0,2026-01-22T01:00:00+00:00,"Macquarie Park, Sydney NSW (Hybrid)",Other (Science & Technology),Full time,,"Optus is an Australian telecommunications company, delivering more than 11 million services to our customers every day across mobile, broadband, and digital solutions.

Join our Billing & Credit team within Group Finance, where we ensure customers across all Optus segments experience simple, accurate and secure billing and payments. As a key contributor to this high‑performing function, you'll help champion our customers through better onboarding, clear billing experiences and strong financial controls.

As the Senior Portfolio Analyst, you'll use your analytical expertise to build insightful reporting, drive automation & self-serve, , improve credit risk oversight, and support risk‑aware decision‑making. You'll analyse complex data, develop dashboards and KPIs, streamline processes, and collaborate across teams to deliver actionable insights that enhance performance, reduce risk and improve outcomes for both customers and the business.

What you'll be doing

Lead the creation and automation of high‑quality reporting and analytics solutions for to monitor controls across the E2E credit management & credit lifecycle across all channels and all systems to support adherence to credit risk internal policies, regulatory requirement, compliance & governance requirements, and to manage overall credit risk performance.
Deliver actionable insights by analysing trends, building forecasting models and translating complex performance data into clear opportunities that drive improved business outcomes.
Partner with stakeholders by leading performance discussions, managing deliverables, and translating complex analytical and financial insights into clear, actionable business impacts.
Collaborate across Optus to align reporting solutions with enterprise data standards, while sharing expertise and best practices to uplift capability across teams.
Ensure data accuracy and governance by maintaining a clean reporting catalogue, data library, standard operating procedures, enforcing consistent definitions and methods, and building strong data models.

What makes you perfect for the role?

Degree in business, finance, statistics or related field, with telco experience valued.
5+ years in data analytics with strong skills in data modelling, integration, visualisation and advanced SQL across large datasets.
Proficient with BI tools (Tableau, Cognos, Alteryx), advanced Excel/VBA, and experienced in data quality, lineage and ETL processes.
Solid background in credit risk, billing or financial reporting, with the ability to translate policy and regulatory requirements into actionable, compliant insights.
High proficiency in Excel (financial analysis and modelling), PowerPoint, and complex database work.
Excellent communication and presentation skills, with the ability to simplify complex insights for senior stakeholders.

Optus is a place where we let you do you. We offer a range of benefits including:

Competitive remuneration and employee discounts. Make life easier (and more affordable) with $80 monthly credit and 25% off Optus products and unique shopping discounts with our retail partners.
Flexible working arrangements with opportunities to work three days in the office, two days remote or home.
Vibrant and collaborative office campus that includes cafes, convenience store, chill out zones, GP, post office, gym and on-site childcare centre.
Competitive leave policies, including additional 'Connected' days to focus on culture, family, health, community, or whatever's important to you.
We support growing families with inclusive, carer-neutral paid Parental Leave of up to 16 weeks.
Direct your own development and build future-ready skills with Optus U's industry-focused micro-credentials, developed with La Trobe and Macquarie Universities.
Build meaningful connections through employee-led networks and diversity initiatives including Culture Connect, Elevate Women, Disability Network and Express Yourself (LGBTQIA+).
Put your wellbeing first with free access to counselling and support services, 24/7 — in-person, by phone, SMS, or video.

At Optus, we are strengthened by others and that means valuing diversity and saying ‘yes' to embracing individual differences. We are committed to ensuring that our application process provides an equal employment opportunity to all job seekers, including individuals from diverse gender, cultural and linguistic backgrounds, individuals with a disability, individuals identifying as being part of the LGBTQIA+ community, individuals who may have served in the armed forces or who identify as Aboriginal and/or Torres Strait Islander. We also want to do our best to make our recruitment process inclusive.

If you require any adjustments or accessibility support to participate fairly and equitably in the recruitment process, please email AccessibleRecruitment@optus.com.au or call 1800 309 170. We're here to help. When you contact us, please advise your preferred method of contact and we will be in touch within 48 hours.

For more information on Diversity, Inclusion & Belonging at Optus, please visit https://www.optus.com.au/about/inclusion-diversity."
89854547,"Principal Advisor, Strategic Insights",Department of Premier and Cabinet,https://www.seek.com.au/job/89854547?type=standard&ref=search-standalone&origin=jobCard#sol=93b441fdd17058314a49774e10a8cf7580ad0be3,5h ago,5.0,2026-01-22T01:00:00+00:00,Brisbane QLD,"Policy, Planning & Regulation, Government - State (Government & Defence)",Full time,"$147,769 to $156,144 p.a.","About us:
For more than 165 years, the Department of the Premier and Cabinet has been building the foundations of Queensland. As the central policy agency for the Queensland Government, our people influence and impact the work at the core of our state's public sector.

The Strategic Insights unit equips the Queensland Government with forward-looking insights, uncovering emerging opportunities and risks, empowering decision-makers to create a brighter future. Our mission is to discover the new the opportunities of tomorrow, while exploring and identifying new insights to address the challenges of today.

How you'll contribute:
As a senior team member, you will lead research, develop strategic insights, implement foresights and futures methodologies, and deliver high quality briefs. In this role, you will:
• Mentor team members in strategic thinking, frameworks and processes.
• Use your extensive professional networks while continuing to build strong stakeholder relationships.
• Lead trends scanning, secondary research, and expert consultations to inform evidence-based reporting.
• Facilitate workshops, engage with the community, and influence executives through high-level discussions and engaging presentations.
• Manage projects to deliver high-quality outputs with speed and efficiency.
• Communicate complex ideas with clarity and influence.

What you'll bring to the role:
Due to the critical nature of this role and its proximity to central government decision making, you will have the following attributes:
• History of high performance and productivity.
• Attention to detail and commitment to quality.
• Agility to adapt rapidly to changing priorities.
• Experience working in a fast-paced, dynamic environment.
• High-level, professional communication skills.
• Positive and open-minded with commitment to a growth mindset.
• Visionary and future focused.

Candidates with a background working in a central agency, consulting, commercial strategy or in fast-paced, high-performing teams will be highly regarded.

Why Join Us?
At DPC, you'll be part of a team that leads and connects the public sector, delivering outstanding advice and services that impact Queensland's future. It's in your hands.

How to apply:
Please provide a one-page cover letter outlining your interest and suitability for the role and a tailored resume highlighting your relevant work experience. Further information on the responsibilities of the role is in the role description. You are strongly encouraged to review the applicant guide prior to applying. DPC is committed to working with you to discuss adjustments to ensure you can best
demonstrate your suitability for the role. If you would like to discuss the role or would like additional support/adjustments during recruitment, please contact Kathy Benson on Ph: 0438 663 857.

Applications to remain current for 12 months.

Job Ad Reference: QLD/676607/26

Closing Date: Friday, 06 February 2026"
89854484,Senior Finance Analyst - Customer Operations,AGL,https://www.seek.com.au/job/89854484?type=standard&ref=search-standalone&origin=jobCard#sol=73075bad75c7e75637eaabef67e903d5ea068a08,6h ago,6.0,2026-01-22T00:00:00+00:00,Melbourne VIC (Hybrid),Analysis & Reporting (Accounting),Full time,,"Join the change. Electrify your future!

We've been proudly Aussie since 1837, always finding new ways to innovate in energy and essential services. Now, we're moving towards a sustainable future through electrification and investing in renewable energy-and we'd like you to join us. Whether you're on-site, in the office, or somewhere in between, you'll find opportunities to grow your career here. You'll work with a team that's passionate about powering Australian lives, in a culture that values inclusivity, respect, and learning. Help us create a cleaner energy future, and we'll back you every step of the way as you build your career.


About the role

An exciting new position has become available for a Senior Finance Analyst to join our team and partner with our Customer Operations portfolio.

You will have the opportunity to provide expert financial and commercial advice and analytical support focusing on budgeting and forecasting, reporting, analysis and month end. You will own the detailed processes supporting the successful delivery of the budget/forecast within Customer Markets Operations, including meeting with key business stakeholders and ensuring key targets are clear, well understood and owned by the business.

Key Accountabilities

​Assist in the preparation and delivery of monthly and quarterly management reporting.
Provide high-quality quantitative and qualitative analysis of the Customer Markets Operations financial and operational results.
Detailed analysis of financial and operational performance and developing the insights underpinning target setting.
Identify and implement ways to improve the reporting of financial and operational information to management.
Provide appropriate specialist input to support key finance and business stakeholders.
Attend townhalls and leadership team meetings to deliver finance updates.


What You'll Bring

Relevant demonstrated analytical accounting / finance experience in a similar role.
Tertiary qualification in Business, Commerce or Economics.
CA / CPA qualifications are highly desired.
Demonstrated experience in providing financial analysis support to business management.
Demonstrated commercial acumen to understand the dynamics of a complex industry.
Ability to understand, utilise and improve sophisticated accounting and reporting systems.
SAP business planning and consolidation experience is desirable.
A motivated, proactive and professional attitude, high accountability, and ability to work collaboratively with others


Inclusion at AGL

At AGL, we value diversity and welcome applicants from various backgrounds, including Aboriginal and/or Torres Strait Islander peoples, individuals with disabilities, culturally diverse individuals, and members of the LGBTQ+ community. AGL is dedicated to maintaining a diverse workforce and encourages applicants to share their lived experiences.
We offer reasonable adjustments throughout the recruitment process and respect the privacy of those who choose not to disclose. To learn more visit: www.agl.com.au/careers

AGL is proud to be a WORK180 Endorsed Employer for All Women.

Our pre-employment screening process includes a Nationally Coordinated Criminal History Check and a medical assessment if necessary.
The information provided as part of your application to AGL will be managed in accordance with the AGL Privacy Policy.
AGL does not accept agency submissions unless approval has been granted by a member of the Talent Acquisition team. Candidates submitted by an agency without approval will not be considered by AGL."
89854248,Change Analyst,Emanate Technology Pty Ltd,https://www.seek.com.au/job/89854248?type=standard&ref=search-standalone&origin=jobCard#sol=601242b0f49238fb6f7b2cad17847ebe68c37dc2,6h ago,6.0,2026-01-22T00:00:00+00:00,Brisbane QLD (Hybrid),Programme & Project Management (Information & Communication Technology),Contract/Temp,AUD 750 - 850 per day,"Change Analyst – CRM Implementation

Initial 6 month contract + possible extension
Brisbane CBD
Hybrid and flexible working available

Join a transformation program focused on improving wellbeing and injury management outcomes.

Emanate Technology is partnering with a leading Queensland organisation to find a proactive Change Analyst to support meaningful change that strengthens frontline capability, streamlines processes, and enhances customer and employee experiences.

The Change Analyst is responsible for supporting Change Managers in the delivery of change management activities across the project and program portfolio, to ensure our people are ready to accept and adopt change, so that project and program outcomes are achieved and return on investment is maximised.

What you’ll be doing
Work within the Change Management Framework to implement change management activities across the organisation’s portfolio and opportunity lifecycle
Support Change Managers in the delivery of change management activities across multiple, concurrent projects and/or programs within a delivery workstream
Work with the project team, business leaders and employees to conduct change analyses and impact assessments to identify and quantify change impacts, risk and issues
Provide insight and input into change planning, to ensure change management activities help the business mitigate change impacts in a pragmatic and fit-for-purpose manner
Liaise with project and business stakeholders and collaborate with internal centers of excellence to deliver stakeholder engagement, communication, implementation and training activities
Develop effective change reporting and documentation of analysis and planning activities
Utilise measurement systems to track adoption, utilization and proficiency of change projects and initiatives
Support the Culture & Change team to enhance organizational change maturity by participating in change communities of practice and participating in other team-based and organizational activities as required.

What you need to bring
 
Extensive experience supporting change management activities on complex, high impact projects and programs
Experience relevant to supporting technology / digital based project change is desirable but not essential
Understanding of contemporary change management tools, techniques, and methodologies
Strong stakeholder management, engagement and relationship building skills including the ability to work in partnership with other change professionals, the project team and business centers of excellence
High level conceptual and analytical skills with the capacity to develop solutions for a range of complex issues

Bonus points for…
Background in financial services, insurance, or health sectors
CRM implementation experience
Exposure to wellbeing or organisational culture programs
Strength in facilitation, co-design, or communication planning
Ability to present findings and reports to senior stakeholders
Understanding of human-centred design and continuous improvement principles

For a confidential discussion, or for more information please contact Erin Howell on erin.howell@emanatetechnology.com.au.



We are an inclusive employer committed to fostering a diverse and accessible workplace. We encourage applications from Aboriginal and Torres Strait Islander peoples, people with disabilities, LGBTQIA+ individuals, people of all ages, and those from culturally and linguistically diverse backgrounds."
89853470,"BI Developer - Business Intelligence, ETL, Tableau",Robert Walters,https://www.seek.com.au/job/89853470?type=standard&ref=search-standalone&origin=jobCard#sol=0b83fc70d42409d7ca7809c6307454ed906e4e00,6h ago,6.0,2026-01-22T00:00:00+00:00,Sydney NSW (Hybrid),Developers/Programmers (Information & Communication Technology),Contract/Temp,850,"Contract role, high view of extension
DWH, ETL, SQL, Power BI/ Tableau dashboard building
Hybrid working arrangements, CBD based

Overview

Seeking an experienced BI Developer to join a high-performing data and analytics team. You will work with high-volume, highly complex datasets from multiple sources, design scalable ETL pipelines, well-governed data models, and intuitive dashboards that enable data-driven decision-making in a regulated environment.

Key Responsibilities

Design, develop, and maintain enterprise-grade BI solutions, dashboards, and reports using large and complex datasets
Translate business requirements into robust data models, semantic layers, and visualisations
Work with structured and semi-structured data from multiple sources including core banking systems, data warehouses, and data lakes
Optimise SQL queries, data models, and BI performance for high-volume, high-availability environments
Implement data validation, reconciliation, and error-handling to ensure data accuracy and completeness

Key Requirements

5+ years Proven experience as a BI Developer or Analytics Engineer in large, data-intensive environments
Strong SQL expertise with experience working on complex datasets to develop and maintain end to end BI solutions
Hands-on experience developing advanced Tableau/ Power BI dashboards, creating reusable datasets, certified data sources, and well-defined metrics
Strong hands-on experience designing and supporting ETL/ELT pipelines
Work directly with business stakeholders to gather requirements, iterate on solutions, and deliver high-impact insights

Aboriginal and Torres Strait Islander Peoples are encouraged to apply.

To apply please click apply or call Christina Tran on 02 8289 3127 for a confidential discussion."
