Job ID,Job Title,Company,Detail URL,Posted Label,Hours Old,Posted Datetime (Local),Location,Category,Work Type,Salary,Ad Text
90152411,Senior Analyst / Manager - Capital & Provision Reporting,Lanson Partners,https://www.seek.com.au/job/90152411?type=standard&ref=search-standalone&origin=jobCard#sol=e7027b12a9aac7b54cbb628d46462391b7016777,1h ago,1.0,2026-02-05T05:00:00+00:00,Sydney NSW (Hybrid),Analysis & Reporting (Accounting),Full time,"Salary of $130,000 - $160,000 plus bonus","Senior Analyst / Manager – Capital & Provision Reporting

Are you ready to step into a role where your analysis genuinely shapes business decisions and regulatory outcomes?

This is a rare opportunity to join a high-performing Treasury function within a leading financial services organisation. The team sits at the centre of the business, influencing how capital, provisions, liquidity and risk are managed across a diverse banking and financial services portfolio.

You’ll work alongside smart, collaborative people who value clear thinking, curiosity and impact — in an environment where ideas are encouraged and expertise is trusted.

The opportunity as a Senior Analyst / Manager, you’ll play a key role in regulatory capital and financial provision reporting across a broad product suite.

You’ll be responsible for delivering high-quality monthly, quarterly and annual analysis, ensuring complex regulatory and risk concepts are translated into clear, meaningful insights for senior stakeholders.

This is a role for someone who enjoys getting close to the detail and stepping back to see the bigger picture.

You’ll synthesise large datasets, contribute to the evolution of capital, provision and loss modelling frameworks, and support commercial decision-making while balancing risk and regulatory requirements.

You’ll collaborate closely with teams across Treasury, product, credit risk, regulatory data, technology, finance and risk — gaining deep exposure to how a modern, technology-driven bank operates.

What you’ll be doing?
Owning and delivering regulatory capital and financial provision reporting
Producing clear, insightful analysis for business and regulatory stakeholders
Interpreting complex technical and modelling outputs for non-technical audiences
Supporting the development and enhancement of capital, provision and loss models
Applying strategic and commercial thinking to risk and business opportunities
Working collaboratively across multiple teams to drive accurate, timely outcomes
What you’ll bring?
Qualifications in finance, accounting, business, quantitative disciplines or similar
3–6 years’ experience in credit risk, capital, provisioning or financial reporting
Exposure to regulatory capital frameworks and/or financial provision standards
Strong data and analytical capability, ideally with R and/or SQL experience
Commercial mindset, sharp problem-solving skills and strong attention to detail
Excellent communication skills and confidence engaging with senior stakeholders
Why join?

You’ll be part of a supportive, inclusive and intellectually curious environment where careers are built with intention. The organisation is known for investing in its people, encouraging diverse perspectives, and offering meaningful opportunities to grow — both technically and professionally.
Flexible working, strong learning and development support, generous leave options and wellbeing benefits are all part of the package, alongside the chance to work on complex, high-impact problems that really matter."
90151221,SAP Master Data Specialist,Crystalise,https://www.seek.com.au/job/90151221?type=standard&ref=search-standalone&origin=jobCard#sol=e9759659111a539d9206b46dc83a4b4523200c26,2h ago,2.0,2026-02-05T04:00:00+00:00,Perth WA,"Oil & Gas - Operations (Mining, Resources & Energy)",Contract/Temp,,"Crystalise is a leading asset management provider, seeking technically oriented professionals with experience in Oil & Gas master data management to join our team in Perth CBD. The ideal candidate will have hands-on experience with maintenance/reliability tools, data cleansing/analytics and SAP PM.

Duties and Responsibilities:

SAP PM and MM experience is essential

Create, update, and modify materials master data in line with organizational standards, ensuring compatibility with SAP uploads.

Cleanse and enhance data to meet required standards.

Collaborate with internal teams, operators, suppliers, and manufacturers to understand material requirements and secure necessary data for maintenance activities.

Report on data improvement initiatives and progress, including managing SAP uploads.

About You:

A minimum of 5 years’ experience in SAP master data management within the Oil & Gas industry.

Experienced in Master Data requirements

Proficient working knowledge of SAP MM and proficiency in Microsoft Office suite.

Exceptional attention to detail.

Proficient in using MS Excel and advanced Excel tools / functions

Experienced with reading process drawing such as PFD’s / P&ID’s

Full working rights in Australia and residence within the Perth region."
90151144,Finance Business Analyst,Aurecon,https://www.seek.com.au/job/90151144?type=standard&ref=search-standalone&origin=jobCard#sol=b2098de76fd10b4c1b3b46ce674e90dca085a833,2h ago,2.0,2026-02-05T04:00:00+00:00,Brisbane QLD,Analysis & Reporting (Banking & Financial Services),Full time,,"Finance Business Analyst | Brisbane


Shape smarter decisions. Power better outcomes.

What kind of world do you want to help create?

At Aurecon, we don't just design and deliver infrastructure - we help shape futures. And behind every great project is smart, confident decision-making powered by insight. That's where you come in.


As a Finance Business Analyst, you'll sit at the heart of the business, partnering with Regional and Functional Leaders to turn complex financial data into clear, actionable insights. You'll influence strategy, strengthen performance, and help our teams deliver meaningful outcomes for clients and communities.

What you'll do


Be a trusted advisor to Regional and Functional Leadership, providing financial insight that drives operational and strategic decisions
Lead forecasting and budgeting processes aligned to regional business plans and priorities
Own accuracy and governance across revenue recognition and portfolio-level financial outputs
Deliver high-quality analysis and reporting that tells the story behind the numbers
Champion data integrity, continuously improving the quality, transparency and usability of financial information
Enhance dashboards, tools and analytics to support smarter, faster decision-making
Translate financial frameworks into practical, value-adding operational processes

What you'll bring


5+ years' experience in a finance or business analyst role, ideally within professional services, consulting or a client-focused environment
Strong financial, accounting and business analysis expertise, with advanced modelling and reporting capability
Proven experience in forecasting, budgeting and revenue recognition
Confidence partnering with senior stakeholders and influencing outcomes
A sharp eye for detail, balanced with the ability to think strategically and see the bigger picture
Qualifications such as CPA, CA, CFA or MBA (desirable, not essential)


Why Aurecon?
You'll be part of a collaborative, values-driven organisation where your ideas matter, your growth is supported, and your work has real impact. We offer flexible working, meaningful career development, and the opportunity to work alongside talented people who genuinely care about shaping what's next.

If you're ready to turn insight into impact, we'd love to hear from you."
90150860,Senior Business Analyst,Brighter Super,https://www.seek.com.au/job/90150860?type=standard&ref=search-standalone&origin=jobCard#sol=c5f3a78ac56206b42211e4f0ecb8187d7fad07b2,2h ago,2.0,2026-02-05T04:00:00+00:00,Brisbane QLD (Hybrid),Business/Systems Analysts (Information & Communication Technology),Contract/Temp,,"About Brighter Super:
At Brighter Super it’s all about the personal connections, guiding our members to retire confidently as a member first fund – we live by the philosophy that our members come first in everything we do. Since 1965, we have been a trusted and reliable provider of investment, advice and insurance services. We’re a 100% member-owned, Queensland-based, open superannuation fund, built on the foundation of three funds (LGIASuper, Energy Super and Suncorp Super) where we manage more than $37 billion in retirement savings for over 348,000 members. Our members come from our foundation industries of government, finance, electrical and energy sectors, alongside a diverse cross-section of the wider community.

Our Brighter Super team is essential to our success, embodying our core values of Aspiring for our members, Unlock innovation, Performance with purpose, and Winning together. We value every Brighter team member – Brighter people, Brighter futures, Brighter together.  This commitment fosters a supportive and collaborative work environment where each individual is empowered to thrive. Together, we are building a brighter future.
  
About your new Role: 
Your role sits within Brighter Super’s Portfolio department and reports directly to the Head of Portfolio. This role is critical to delivering fund-wide programs and cross-functional projects that will support the delivery of our strategic plan. This role is reliant on strong key business stakeholder relationships to support the development and analysis of user-centric business requirements under the EPMO at Brighter Super.

Develop strong working relationships with business stakeholders at all levels across all Business Units and Support functions.
Identify gaps and improvements to our current business analysis methodologies ensuring alignment to our Governance and delivery management frameworks, practices and processes.
Document high-level requirements, user stories and detailed acceptance criteria.
Facilitate requirements workshops with internal and external teams, showcase and UAT sessions.
Conduct training sessions with stakeholders and end users and prepare training and supporting documentation.
Raise and support mitigation and resolution of risks and issues using established tools and frameworks.
About You: 
You bring proven experience as a confident and capable Business Analyst, with experience within the Financial Services sector. Your skill set allows you to analyse complex problems, translate business needs into clear requirements, and contribute effectively to strategic and operational improvements. You are an experienced and confident BA with experience within the Financial Services Sector:

Facilitated workshops and are very confident in your own presentation skills
Proven ability to successfully validate and document requirements for developers and testers in form of epics, features and user stories.
Extensive experience in working in Agile environments with a cross functional team
Ability to work autonomously in an environment with shirting priorities and timelines
Why choose Brighter Super:  
We pride ourselves on being a great place to work, where you matter!  Here are some things that you will be able to enjoy; 

Workplace flexibility, with the option to work up to 50% of your week from home
Up to 18 weeks paid parental leave + super  
Purchased leave
Career pathways
Reward and recognition program
Employee Assistance Program
Holistic benefits and well-being offer through Perkbox

If you know that you are a “Bright Person” and are seeking a “Brighter Future”, please apply now!"
90149522,Multiple Lead Vulnerability Assessor & Multiple Senior Vulnerability Assessor,TLS Consulting Pty Ltd,https://www.seek.com.au/job/90149522?type=standard&ref=search-standalone&origin=jobCard#sol=2eac41df4bdce6635266e3cb61c814f14b643729,2h ago,2.0,2026-02-05T04:00:00+00:00,Canberra ACT,Security (Information & Communication Technology),Contract/Temp,$140 – $170 per hour,"Multiple Senior Vulnerability Assessors

Role Overview

Vulnerability Assessors identify, assess and prioritise threat vulnerabilities identified through penetration testing and report findings to improve security architecture and enhance risk awareness.

Australian Signals Directorate (ASD) requires multiple APS 6 equivalent Senior Vulnerability Assessors (encompassing Security Specialists; Security Engineers) to fill positions across the agency. 

In addition to filling current vacancies, a merit pool will be created for future positions that may arise within 12 months of RFQ close date. 

Please apply only if you fit the following criteria:

Clearance: This RFQ is for NV2 and TSPV cleared candidates only. 

Location of work: QLD, ACT, VIC

Working arrangements: Onsite

Suitable candidates will be required to undergo ASD's Organisational Suitability Assessment (OSA) prior to commencement and ASD will then allocate successful candidates to business areas based on operational needs. Additional information on the OSA can be found: https://www.asd.gov.au/careers/how-apply/candidate-information

Key duties and responsibilities

Include but not limited to:

Perform forensically sound security investigations on a wide array of assets and devices that directly relate to security infrastructure; in accordance with established procedures. 

Conduct investigations which may be as the result of a security incident or by direction of senior leadership. 

Assess and explain threat profiles of a variety of electronic devices.

Communicate and provide advice and guidance on strategies to improve ASD ICT security and mitigate risk of devices compromising that security. 

Interpret and comply with relevant policy governing ICT security in ASD; both internal and whole of government, including legislation that underpins digital security and online privacy. 

Evaluate and assist with the application and compliance of security controls and review information systems for actual or potential security vulnerabilities. 

Use appropriate system design methods, tools and techniques selecting appropriately from predictive (plan-driven) approaches or adaptive (iterative/agile) approaches and ensure they are applied effectively. 

Design, code, verify, test, document, amend and refactor complex programs/scripts as required. 

Technical skills

Certification in CREST Registered Penetration Tester or CREST Registered Threat Intelligence Analyst desirable.

About the organisation

The Australian Signals Directorate is a statutory agency in the Defence portfolio that defends Australia against global threats and advances our national interests through the provision of foreign signals intelligence, cyber security and offensive cyber operations as directed by the Australian Government.

Criteria

The buyer has specified that each candidate must provide a response to each criterion. Each response is limited to 3000 characters.

Essential criteria

1.Demonstrated experience in undertaking threat intelligence/modelling tasks or threat assessments.

2.Experience undertaking penetration testing and providing insights into vulnerabilities, effectiveness of defences and mitigating controls.

3.Experience in the creation and maintenance of executive and/or business reporting relating to threat assessment analysis and mitigation strategies.




Multiple Lead Vulnerability Assessors

Role Overview

Vulnerability Assessors identify, assess and prioritise threat vulnerabilities identified through penetration testing and report findings to improve security architecture and enhance risk awareness.

Australian Signals Directorate (ASD) requires multiple EL1 equivalent Lead Vulnerability Assessors (encompassing Security Specialists; Security Engineers) to fill positions across the agency. 

In addition to filling current vacancies, a merit pool will be created for future positions that may arise within 12 months of RFQ close date. 

Please apply only if you fit the following criteria:

Clearance: This RFQ is for NV2 and TSPV cleared candidates only. 

Location of work: QLD, ACT, VIC

Working arrangements: Onsite

Suitable candidates will be required to undergo ASD's Organisational Suitability Assessment (OSA) prior to commencement and ASD will then allocate successful candidates to business areas based on operational needs. Additional information on the OSA can be found: https://www.asd.gov.au/careers/how-apply/candidate-information

Key duties and responsibilities

Include but not limited to:

Lead and perform forensically sound very complex security investigations on a wide array of assets and devices that directly relate to security infrastructure; in accordance with established procedures. 

Accountable to conduct investigations which may be as the result of a security incident or by direction of senior leadership. 

Assess and explain very complex threat profiles of a variety of electronic devices.

Lead analytical processes to identify and recommend actions to maintain and improve the integrity of ICT infrastructure. 

Communicate and provide authoritative advice and guidance on strategies to improve ASD ICT security and mitigate risk of devices compromising that security. 

Interpret and comply with relevant policy governing ICT security in ASD; both internal and whole of government, including legislation that underpins digital security and online privacy. 

Evaluate and assist with the application and compliance of security controls and review information systems for actual or potential security vulnerabilities. 

Adapt and adapt appropriate system design methods, tools and techniques selecting appropriately from predictive (plan-driven) approaches or adaptive (iterative/agile) approaches and ensure they are applied effectively. 

Review and make recommendations and assess and manage associated risks of others' systems designs to ensure selection of appropriate technology; efficient use of resources; and integration of multiple systems and technology. 

Design, code, verify, test, document, amend and refactor complex programs/scripts as required. 

About the organisation

The Australian Signals Directorate is a statutory agency in the Defence portfolio that defends Australia against global threats and advances our national interests through the provision of foreign signals intelligence, cyber security and offensive cyber operations as directed by the Australian Government.

Criteria

The buyer has specified that each candidate must provide a response to each criterion. Each response is limited to 3000 characters.

Essential criteria

1.Demonstrated experience in undertaking complex threat intelligence/modelling tasks or threat assessments.

2.Experience undertaking penetration testing and providing insights into vulnerabilities, effectiveness of defences and mitigating controls.

3.Experience with impact analysis on systems designs, including the evaluation of software, to ensure adherence to standards.

4.Experience in the creation and maintenance of executive and/or business reporting relating to threat assessment analysis and mitigation strategies."
90149425,Senior AI Engineer,Experis AU,https://www.seek.com.au/job/90149425?type=standard&ref=search-standalone&origin=jobCard#sol=00697d1de46a4cde082c2e5ae2a424fc641ffc98,2h ago,2.0,2026-02-05T04:00:00+00:00,Canberra ACT (Hybrid),Engineering - Software (Information & Communication Technology),Contract/Temp,,"Job details

The AI Engineer is primarily responsible for the design, development, testing and deployment of AI models and algorithms. The role works in collaboration with data scientists to define stakeholder requirements and deliver high quality, user centred solutions.

Key duties and responsibilities

Key duties and responsibilities for the role include:

Lead the design, engineering and deployment of data science and AI solutions in collaboration with data professionals, digital professionals and end users.
Architect, build and manage cloud infrastructure using Infrastructure as Code while ensuring appropriate security controls and scalability.
Drive strategic projects involving data ingestion and curation, exploratory data analysis, natural language processing, use of generative AI including agent based generative AI, predictive and prescriptive modelling, deployment of self service solutions and ad hoc data science products.
Prototype and develop engineering solutions at short notice for high priority data science and AI projects.
Coordinate and collaborate with other teams to build internal capability and establish or adopt standards and procedures across the development product life cycle.
Use customer centred approaches to design and prototype new technologies, tools and methods.
Work with IT service providers to specify requirements and support the establishment and upgrade of on premises and cloud infrastructure and tools.
Work closely with business users and IT service providers to select suitable technologies to deliver, manage and improve data science and AI solutions.
Key capabilities
Experience leading data, AI and cloud engineering work within the public sector or a complex multi stakeholder environment.
Experience establishing and maintaining rapport with clients and suppliers, including where there are no pre existing relationships.
Experience designing, implementing and managing relational databases such as Teradata, BigQuery or equivalent platforms.
Experience designing and implementing CI CD pipelines, monitoring systems, containerisation, orchestration and automation.
Experience working in Agile or other iterative delivery environments, including DevOps.
Experience designing and managing cloud infrastructure in Azure, AWS or Google Cloud.
Demonstrated ability to conduct independent research, address knowledge gaps and adopt emerging technologies to deliver innovative solutions.
Strong written and verbal communication skills, with the ability to translate technical concepts for non technical audiences.
Desirable experience
Experience implementing engineering solutions for generative AI including agent based solutions, prompt engineering and AI output evaluation.
Experience deploying open weight large language models, fine tuning them and integrating them with web applications via APIs.
Understanding of AI ethics, bias, risk and output evaluation frameworks.
Experience using Python based generative AI libraries such as Hugging Face Transformers, OpenVINO, Unsloth, llama cpp python, DSPy and PyTorch.
Experience working with structured and unstructured data, and strong data engineering capability for building reliable ETL pipelines.
* Experience using a business intelligence tool such as Power BI.
About the team

The Data Science Section is a central analytics unit within a large Australian Government portfolio, providing data science, analytics and engineering expertise across a broad range of business areas. The team contributes to organisational priorities through:

Delivering data driven insights to support strategic and operational decision making.
Identifying inefficiencies and optimisation opportunities to improve processes and resource allocation.
Applying predictive analytics to support risk identification and proactive planning.
Driving innovation through research and adoption of modern data science and AI techniques.

The team leads the integration of artificial intelligence and machine learning into business processes to support improvements in:

outcomes and accessibility for service recipients
system efficiency and sustainability
evidence base for policy development
efficiency in service delivery
About the organisation

The Data and Analytics Branch provides the evidence base to inform policies, programs and services through the safe and effective use of data. The broader division focuses on research, evaluation, innovation and analytics to support integrated, evidence based policy responses to current and future challenges.

Criteria

Each candidate must provide a one page pitch of up to 5000 characters addressing all criteria.

Essential criteria
Technical ability to design, develop, test and deploy AI engineering solutions.
Ability to work with stakeholders to identify requirements and develop appropriate solutions.
Ability to work collaboratively within a team and communicate effectively with non technical stakeholders.



Linda Jona
Consultant

Let's connect

ManpowerGroup is committed to being a Diversity Confident Recruiter and encourages applications from people from a diverse range of backgrounds, including people with a disability. Please indicate your preferred method of communication in your resume and please let us know if you require any reasonable adjustments should you be contacted for an interview.

Aboriginal and Torres Strait Islander people are encouraged to apply.

By submitting your resume and other personal information with this application you are consenting to this information being collected in line with our privacy policy. Follow the link to learn more - www.manpowergroup.com.au/privacy-policy

State: QLD, licensee/s Manpower Services (Australia) Pty Ltd, LHL-02026-D5L4Q. State: QLD, LHL-02014-Y5F6D. State: SA, licensee/s Manpower Services (Australia) Pty Ltd, LHS 288856"
