Job ID,Job Title,Company,Detail URL,Posted Label,Hours Old,Posted Datetime (Local),Location,Category,Work Type,Salary,Ad Text
89864949,Senior Business Analyst,Technology One Limited,https://www.seek.com.au/job/89864949?type=standard&ref=search-standalone&origin=jobCard#sol=a6a8efaab0b0cc7d2511b9595b276a40d4f6ac10,1h ago,1.0,2026-01-22T05:00:00+00:00,Brisbane QLD (Hybrid),Business/Systems Analysts (Information & Communication Technology),Full time,Competitive Remuneration & Benefits,"At TechnologyOne, we are dedicated to transforming the way organisations manage their Payroll functions through innovative software solutions. Our commitment to delivering exceptional value to our clients drives us to continuously improve and expand our offerings. Join us in shaping the future of Payroll technology.

Reimagine Payroll. Drive Innovation. Reduce Risk.

Step into a pivotal role shaping the future of payroll As a Senior Business Analyst at TechnologyOne, you'll deliver on the strategic direction of a modern, cloud-native platform that's transforming how councils and universities manage their workforce.

This is about creating intelligent, AI-driven payroll automation that replaces outdated, error-prone processes. You'll work at the forefront of innovation, embedding regulatory intelligence, streamlining compliance, and delivering frictionless payroll operations at scale.

If you're currently navigating legacy systems, consultancy roadmaps, or patchwork automation - this is your chance to drive real change, reduce payroll risk, and build a product that's redefining trust in public sector payroll.

Key Responsibilities:

Be a thought leader in the payroll domain, with a strong emphasis on regulatory impacts, change, and market trends affecting Local Government and/or Education sectors.
Actively engage with customers, consulting, sales and support to gather market intelligence and customer feedback to inform global product design.
Join customer forums and industry events, contributing thought leadership and gathering direct insights Payroll Professionals to inform the product roadmap in Local Government and Education.
Work across time zones to ensure regional priorities are effectively scoped and delivered.
Undertake internal change activities to support new capabilities - enabling consulting, presales, and customer success teams with product awareness and knowledge.
Drive external product awareness with customers and industry partners, ensuring clear communication of roadmap direction and product enhancement timelines.


What We're Looking For...

Understanding of Payroll complexity in Local Government, and/or Higher Education institutions.
Proven ability to engage with customers to gather requirements, deliver presentations and manage customer expectations.
Experience and understanding of regional data privacy requirements for management of people data.
A focus on delivering customer value.
A passion for technology and a drive to improve user experiences, with enthusiasm for defining and delivering Artificial Intelligence automation for Payroll processes.



Why Join us?

Help us redefine payroll software for Local Government and Education.

TechnologyOne is proud to be an Equal Opportunity Employer who values diversity and an inclusive workplace. We aim to recruit a diverse range of people with a diverse range of talents to help us to deliver on our mission to better our community. If you meet several of the requirements (and not all), we still encourage you to submit your application.

We pride ourselves on providing our people with earned recognition through talent mapping and career progression, competitive salaries and having a supportive tribe environment.

Our core values and culture unleash the boundless potential of creativity, innovation and the entrepreneurial spirit within our people.

When you experience Life at TechnologyOne you'll see that our team enjoys an extensive array of benefits, including foundation charity activities, which all cultivate a vibrant workplace our people are very proud to be involved with.

Benefits…

Competitive remuneration package
Hybrid working options as standard
Additional leave via our Purchase Leave program
Foundation (volunteer days 2.5 per annum)
Free LinkedIn Learning - professional development platform with access to thousands of courses for TechnologyOne employees (full access licence)
Opportunities for professional development and career advancement.
Access to our industry leading Employee Share Plan

Who we are… TechnologyOne (ASX: TNE) is Australia's largest enterprise software company and one of Australia's top 100 ASX-listed companies, with locations across six countries. We provide a global SaaS ERP solution that transforms business and makes life simple for our customers. Our deeply integrated enterprise SaaS solution is available on any device, anywhere and anytime and is incredibly easy to use. Over 1,200 leading corporations, government agencies, local councils and universities are powered by our software.

For more than 36 years, we have been providing our customers with enterprise software that evolves and adapts to new and emerging technologies, allowing them to focus on their business and not technology."
89864893,Senior Data Scientist,Mansell Taylor Consulting,https://www.seek.com.au/job/89864893?type=standard&ref=search-standalone&origin=jobCard#sol=87939fd4b9433f014bd3a27bb25b75acadeab6b7,1h ago,1.0,2026-01-22T05:00:00+00:00,Brisbane QLD (Hybrid),"Mathematics, Statistics & Information Sciences (Science & Technology)",Full time,,"We’re recruiting a Senior Data Scientist to join a large, consumer-focused organisation with 10+ years of transactional data and a major data platform transformation underway. This is a hands-on role in a mature environment where you will work on the design, build, refresh, and validation of predictive models that directly inform commercial decisions across customer acquisition, retention, cross-sell, and revenue growth.

You will work closely with senior stakeholders to ensure insights are actionable, explainable, and commercially valuable. This role suits someone who enjoys working in Python, partnering with the business, and seeing their work influence real outcomes.

What You’ll Be Doing

Build, refresh, and maintain predictive models (classification, regression, propensity, forecasting)
Translate complex modelling into clear commercial recommendations
Partner with Marketing, Commercial, Finance, and Operations teams
Validate models and ensure statistical robustness
Identify and leverage new data sources as platforms evolve
Support experimentation, testing, and uplift of decision accuracy
Contribute to future capability uplift as the data science function grows

What We’re Looking For

5+ years’ hands-on data science experience in industry (not academia)
Strong Python capability (pandas, numpy, sklearn, or similar)
Experience working with large transactional customer datasets
Proven ability to deliver commercially relevant insights
Confidence in explaining models, assumptions, and outcomes to non-technical stakeholders

Nice to Have (Not Essential)

Experience in B2C, subscription, retail, gaming, loyalty, or telco
Exposure to near-real-time analytics environments
Experience working with LLMs in workflow optimisation
Experience with modern analytics platforms and APIs

Salary

Competitive package and benefits on offer. This is a hybrid role, two days working from office a week.

How to Apply

Apply via Seek or contact Jelissa Taylor for a confidential discussion."
89864869,Systems & Improvement Lead,UGL - Services - Utilities O&M,https://www.seek.com.au/job/89864869?type=standard&ref=search-standalone&origin=jobCard#sol=f4b441ebaede804ad4490f6d7ef42e92173fdd33,1h ago,1.0,2026-01-22T05:00:00+00:00,Sydney NSW,Business/Systems Analysts (Information & Communication Technology),Full time,,"When you join UGL, you will collaborate with some of the Australias most talented experts to help shape the nation. With opportunities to work on large-scale projects from start to finish, you will have the space to grow your skills, pursue your passion, and be supported in creating a career journey that aligns with your aspirations and lifestyle.

UGL Utilities Operations & Maintenance business is a trusted provider of essential services across power, water, and gas sectors. With a strong reputation and long-standing contracts in power distribution, transmission, and water operations and maintenance, we are poised for significant growth.


About the role

The Systems & Improvement Lead plays a key role in ensuring operational efficiency across UGL Services by supporting, enhancing, and deploying digital and business systems. The role gathers stakeholder requirements, documents processes, manages system rollout projects, and provides ongoing support to operational teams. It contributes to continuous improvement initiatives that enable safer, better, faster, and more efficient ways of working across contracts.

This position will be based at our North Sydney office.

Key responsibilities

Gather, analyse, and translate stakeholder requirements into actionable system or process designs.

Document business processes and system workflows using clear process maps.

Maintain accurate and current documentation for operational systems.

Project manage the rollout of digital systems, including planning, design, development, testing, deployment,and handover to operations.

Work collaboratively with IT, Operations, and program stakeholders to ensure successful delivery within agreed timelines and budget constraints.

Support change management activities, including communications, training, and adoption planning.

Provide user support, troubleshooting, and system guidance to operational teams.

Coordinate updates, enhancements, and configuration changes in line with business needs.

Monitor system performance and proactively identify improvement opportunities.

Identify and document improvement opportunities across systems, workflows, and operational processes.

Support teams in applying improved ways of working that deliver measurable operational value.

Contribute to national or contract-level improvement initiatives as required.

Lead or support system related components of new contract mobilisations, ensuring readiness of digital tools, data, and processes.

Liaise with internal and external stakeholders to ensure smooth transition into operations.

About You

Minimum 5 years in a systems, process improvement, or similar role

Experience within construction, utilities, services, or project‑based environments

Proficiency with MS Office, SharePoint, Teams, Power BI, Power Apps, Power Automate, and Visio.

Experience with SAP, SAP Field Service Management (FSM), and Cognito Forms (desirable).

About UGL

As a member of the CIMIC Group of companies, we value diversity in our team’s backgrounds, ideas, work styles.

We are an Equal Opportunity Employer and strongly encourage applications from women, people with disabilities, Aboriginal & Torres Strait Islander people, mature aged workers and individuals from culturally diverse backgrounds.

What we offer

Enjoy a hybrid work arrangement working from home 1-2 days per week.

Benefit from 16 weeks of paid primary parental leave.

Complimentary salary continuance insurance.

Discounted Medibank health insurance.

Shape your career with an Individual Development Plan.

Participate in our Wellness Program with AIA Vitality.

Access our OneRewards Discount Program.

How to apply 

If this role sounds like you, please click on the apply button and follow the prompts. We will get in touch if you are shortlisted for this opportunity.

Please note: As part of the recruitment process, relevant screening checks will be conducted. These may include reference checks, verification of the right to work in Australia, a national criminal history check, anti-money laundering checks, and a pre-employment medical assessment (including drug and alcohol screening).

Job Ref 266396"
89864792,Senior Platform Manager - Data & Visualisation - Hawthorn East,Coles,https://www.seek.com.au/job/89864792?type=standard&ref=search-standalone&origin=jobCard#sol=a53137c5aef5992b2310491b75ebdb705f962d8b,1h ago,1.0,2026-01-22T05:00:00+00:00,"Hawthorn East, Melbourne VIC (Hybrid)",Management (Information & Communication Technology),Full time,,"We've been trusted to serve Aussie communities since 1914 and grown to become a top 30-listed on the ASX with 120,000 team members and a portfolio of iconic brands. At Coles Group, you'll not only get to make a difference to millions of Aussie lives—you'll also get to see your impact.

 

About the team

 

As the way Australians shop continues to evolve, our Data and AI Team keep Coles at the forefront of modern retail. We combine data, artificial intelligence, and applied engineering to reimagine how our stores, supply chain, and digital channels operate — creating smarter, more connected, and seamless experiences for our customers and team members.

 

Operating as a centralised development and enablement function within Coles Technology, the team unites product, engineering, and platform capabilities to deliver the intelligence layer of the enterprise. We serve every part of Coles — from computer vision applications that enhance in-store experiences and reduce loss, to forecasting, optimisation, and decision-support solutions that drive efficiency, accuracy, and agility across our supply chain, retail operations, and corporate functions.

 

The scale and impact of this work are significant. Coles serves millions of customers each week across more than a thousand stores nationwide, and our AI and data capabilities provide the intelligence that underpins how we plan, move, sell, and serve. By combining deep data capability with applied AI and modern engineering, we’re enabling Coles to become a truly AI-enabled enterprise, transforming how we operate and how Australia shops every day.



About the role

 

As Senior Platform Manager for Data and Visualisation, your primary function will be to define and lead the enterprise data and visualisation platform strategy whilst overseeing delivery of scalable, secure, and governed data platform capabilities.

 

Key responsibilities will include

 

Drive implementation of modern cloud-native data architecture (Azure, Snowflake, Databricks, etc.)
Ensure platform reliability, scalability, and compliance with SLA commitments
Lead enterprise-wide visualisation strategy (Power BI, Tableau, etc.)
Champion self-service analytics and consistent data storytelling
Provide functional leadership to Platform and Governance Managers
Embed ""governance by design"" into platform engineering
Act as key interface between business teams and technology delivery squads
Ensure alignment with enterprise data, security, and AI/ML platform strategies
Evaluate, select and integrate modern data tools and technologies
Oversee CI/CD, DevOps and automation practices for data pipelines and dashboards
Ensure strong data lifecycle management across ingestion, storage, access, and usage

 

 

About You and Your Skills

 

10+ years in data platform, analytics or architecture roles
5+ years in senior data platform or engineering leadership
Proven delivery of enterprise-scale data and BI platforms (cloud/on-prem)
Experience managing cross-functional teams including engineers, governance, and DevOps
Strong background in visualisation tools (Power BI, MicroStrategy)
Hands-on expertise in cloud platforms (Azure), Snowflake, Databricks, Oracle
Experience building CI/CD pipelines for data and dashboard deployments
Proven data governance, metadata, and compliance expertise
Skilled in stakeholder management across business and technology functions
Proficient in SQL and programming languages (Python, Scala, Java)
Familiar with Agile, product delivery models, and hybrid team structures

 

Skills and Qualifications

 

Deep expertise in modern data platforms, BI architecture, and visualisation tooling
Strong knowledge of distributed systems (Spark, Kafka) and orchestration tools (Control M, ADF, Airflow)
Ability to influence and align senior stakeholders across tech and business
Excellent communication and data storytelling skills
Knowledge of data security, access control, and regulatory compliance
Strong understanding of DevOps for data engineering

 

Education

Bachelor's or Master's Degree in Computer Science, Engineering, Mathematics, or a related field.

 

Please note that we are seeking a candidate with deep experience in data platforms and proven people‑leadership capabilities, including leading leaders. Strong communication skills are also essential.

 



What’s in it for you?

 

Flexible working options: We know that work is only one part of your life, so we actively encourage a positive work-life balance and provide hybrid working options to help you achieve it.
Office perks: Take advantage of our gym facility and fitness classes, free parking, BBQ area, mini-Coles supermarket, fooderie hub where you can sample new products before they hit the shelves, school holiday program and so much more when you come in.
Discounts: Eligible team members receive 5% discount all year round on your Supermarket and Liquor online and in-store purchases. We also offer additional periods of double discount (10%) at various times throughout the year. As well as hotdeals exclusive to team members that translate into additional savings.
Reward through recognition: Give and receive recognition, linked to our Coles values, through our digital recognition platform ‘mythanks’. You can accumulate points to redeem in the online shop for exciting gifts and electronic gift cards from an extensive range of retailers.
Opportunities for learning and development: No matter where you start within our diverse business, you’ll have experiences, exposure, and education to satisfy you. Discover and explore a variety of career development programs and job-specific training.
Paid parental leave: We understand how important your life outside work is and offer permanent team members paid parental leave to support you in balancing work and family.
Investment in your future: Our annual team member share plan offer allows eligible team members to make regular pre-tax salary sacrifice deductions to purchase Coles Group shares.

 

About the recruitment process

 

We’re continuing to build a gender equitable team, and a culture that is just as diverse, inclusive and welcoming as the communities we serve. We are committed to creating a workplace that is safe and respectful for our team. We encourage applications from people of all ages, cultures (including Aboriginal and Torres Strait Islander peoples), abilities, sexual orientation and gender identities.

 

We’re happy to adjust our recruitment process to support candidates with disability. For further information and additional contact details visit the ‘Our Recruitment Process’ section of our careers site or email inclusionrecruitment@coles.com.au

 

Job ID: 175403

 

Employment Type: Full time"
89864780,EL1 Research / Program Manager,Randstad - Public Sector,https://www.seek.com.au/job/89864780?type=standard&ref=search-standalone&origin=jobCard#sol=77d2a4e4beeb3d7a6db8824255f639c26568a839,1h ago,1.0,2026-01-22T05:00:00+00:00,Sydney NSW (Hybrid),Government - Federal (Government & Defence),Contract/Temp,Up to $100 p.h. + plus superannuation,"Randstad is partnering with a major Federal Government Body to recruit a strategic EL1 Research & Program Manager.

This isn't just a data role; it is a pivotal position within the Market Research Unit (MRU). You will be responsible for providing the evidence base that drives national public health behavior change campaigns. You will work where data meets creativity, ensuring every government message is underpinned by robust behavioral insights.

Position Overview

Pay Rate: $85 - $105 per hour + super

Location: Hybrid (Sydney or Canberra)

Contract Length: 6 months

The Campaign & Research Cycle

Campaign Strategy & Design: Manage behavioral research projects that define target audiences and inform the strategic direction of public health campaigns.
Concept Testing: Project manage external consultants to test campaign creative and messaging, ensuring they resonate with the public before launch.
End-to-End Procurement: Lead the procurement of research services, ensuring the department partners with the best market research and behavioral agencies.
Stakeholder Liaison: Act as the key advisor to internal Comms and Policy teams, translating complex research findings into clear, actionable campaign recommendations.
Campaign Evaluation: Oversee post-campaign analysis and reporting to measure the effectiveness of behavior change initiatives.
High-Level Briefing: Prepare Ministerial correspondence and government briefings that justify campaign expenditure based on research evidence.
Key Responsibilities


Strategic Research Management: Proven experience managing research projects that inform large-scale communication or social marketing campaigns.
Behavioral Science Expertise: Strong understanding of how to apply behavioral insights and psychological theories to public health behavior change.
Procurement & Contract Mastery: Demonstrated ability to manage external research vendors and navigate complex government procurement frameworks.
Influence & Communication: Ability to ""tell the story"" of the data, influencing senior stakeholders and the Director of the MRU with high-level reports and infographics.
How to Apply

If you have a background in market research, behavioral economics, or evidence-based communications, we encourage you to apply.

At Randstad, we are passionate about providing equal employment opportunities and embracing diversity to the benefit of all. We actively encourage applications from any background."
89864405,Business Analyst – Underwriting & Operations,MFTE Staffing Services,https://www.seek.com.au/job/89864405?type=standard&ref=search-standalone&origin=jobCard#sol=0e2e23f7f6312523736091cb674d58ad30efc564,1h ago,1.0,2026-01-22T05:00:00+00:00,Sydney NSW (Hybrid),Business/Systems Analysts (Information & Communication Technology),Full time,"$130,000 – $160,000 per year","Business Analyst – Underwriting & Operations

Sydney CBD | Hybrid | Permanent (Contract considered)

A growing Australian insurance organisation is investing in the uplift of its underwriting and operational capabilities. The focus is on improving workflow management, reporting, and operational visibility to better support underwriting performance and day-to-day decision-making.

We’re looking for an experienced Business Analyst to work closely with underwriting and operations teams to help design, rebuild, and improve workflows and reporting, with a strong focus on Power BI.

The Role

This is a hands-on BA role, embedded within the business, where you’ll help turn operational priorities into practical processes, reporting, and insights.

You’ll work directly with underwriting and operations stakeholders to:

Understand current workflows and operational challenges

Help redesign workflow management and reporting

Define clear requirements and support delivery

Improve visibility and performance across underwriting operations

Key Responsibilities

Partner with underwriting and operations teams to understand and improve end-to-end workflows

Gather and document business and functional requirements

Design and support delivery of underwriting and operational reports and dashboards in Power BI

Define KPIs and metrics that support underwriting performance and operational management

Support change delivery, including stakeholder engagement and UAT activities

What We’re Looking For

Essential:

Proven experience as a Business Analyst within the insurance industry

Strong understanding of underwriting and insurance operations

Experience working with Power BI (requirements, dashboards, reporting)

Strong requirements gathering and stakeholder engagement skills

Practical, delivery-focused mindset

Desirable:

Exposure to insurance products and product lifecycle

Experience supporting operational improvement initiatives

Background working in regulated environments

Familiarity with workflow or case management systems

Why Apply

High-visibility role working closely with underwriting and operations

Opportunity to materially improve business workflows and reporting

Permanent role preferred, with flexibility to consider contract

Sydney CBD location with hybrid working"
