Job ID,Job Title,Company,Detail URL,Posted Label,Hours Old,Posted Datetime (Local),Location,Category,Work Type,Salary,Ad Text
90144915,Senior Peoplesoft Analyst,Peoplebank Australia VIC,https://www.seek.com.au/job/90144915?type=standard&ref=search-standalone&origin=jobCard#sol=23059de5ee652dd90156ac51352a5d79800e7cee,4h ago,4.0,2026-02-05T02:00:00+00:00,Melbourne VIC (Hybrid),Consultants (Information & Communication Technology),Contract/Temp,"AUD 900 - 1200 per day, Hybrid work situation","We are seeking an experienced Senior PeopleSoft Analyst to join a high-performing team, supporting and enhancing PeopleSoft platforms across the full technology stack. This role is ideal for someone with extensive industry experience who is customer-focused and excels at stakeholder engagement.

You will play a key role in providing end-to-end PeopleSoft support, contributing to solution design and delivery, and ensuring system stability and continuous improvement. The role requires strong hands-on experience across upgrades, testing, payroll support, and PeopleSoft configuration and development.

Key Responsibilities:
Provide end-to-end support across the full PeopleSoft technology stack
Lead and support PUM and PeopleTools upgrades
Develop and maintain PeopleCode and PeopleSoft configurations
Convert pay practices and business requirements into PeopleSoft solutions
Create, coordinate, and lead SIT and UAT testing, including defect management
Support payroll processing, pay runs, and exception clearing
Provide PeopleSoft reporting and user access management
Ensure audit readiness, compliance, and system governance
Support ITIL-aligned service management processes
Work within Agile delivery environments
Support and integrate clocking / time and attendance solutions
About You:
Proven experience in a Senior PeopleSoft Analyst or similar role
Strong technical knowledge of PeopleSoft, including PeopleTools and PeopleCode
Hands-on experience with upgrades, testing, and payroll-related support
Excellent stakeholder engagement and communication skills
Customer-focused, proactive, and able to work across technical and business teams
This is an excellent opportunity to work in a complex environment where your PeopleSoft expertise will have real impact.

Please Apply and call on 0380807264 for more information.


Peoplebank and Leaders IT are committed to creating a diverse and inclusive workplace where everyone belongs. We welcome applications from people of all backgrounds, identities, and experiences. If you need adjustments to the recruitment process due to your circumstances, please let us know—we’re here to support you."
90144391,AI Knowledge Base Engineer,NTT Ltd,https://www.seek.com.au/job/90144391?type=standard&ref=search-standalone&origin=jobCard#sol=615e6f0f755d69fd97a661373dca608920f77249,5h ago,5.0,2026-02-05T01:00:00+00:00,Sydney NSW (Hybrid),Consultants (Information & Communication Technology),Contract/Temp,,"Role Title: AI Knowledge Base Engineer
Location: Sydney (preferred) or Melbourne
Start Date: ASAP
Duration: Initial 4‑month contract with high possibility for extension.
Working Flexibility: Hybrid

NTT Data is seeking a Knowledge Base Engineer to support the build and enhancement of an enterprise-grade, GA‑safe Knowledge Base. This role focuses on ingesting, structuring, tagging, and optimising large volumes of content to enable high‑quality semantic search, retrieval, and grounding. You will work closely with technical and compliance teams to ensure the KB is accurate, structured, compliant, and ready for downstream AI systems.

Is innovation part of your DNA? Do you want to enable a connected future for people, organizations, and society? Join our growing global NTT team and you’ll be part of the world’s largest ICT company (by revenue). We’ve combined the capabilities of 28 remarkable companies to become one, leading technology services provider. Together, we help our people, clients, and communities do great things with technology to create a more secure and connected future. We employ 40,000 people across 57 countries. By bringing together the world’s best technology companies and emerging innovators, we work together to deliver sustainable outcomes to businesses and the world. Innovation is part of our DNA. We believe it’s key to what makes us different. So, we strive to move forward, challenge the status quo, and drive excellence through the technologies we integrate and the services we deliver around the world. The result is connected cities, connected factories, connected healthcare, connected agriculture, connected conservation, connected mobility, and connected sport. Together we enable the connected future.

Key Responsibilities

Build and harden an enterprise-grade, GA‑safe knowledge base
Ingest and structure content from multiple internal and external sources
Implement semantic search pipelines using NLP and vector databases
Define KB schema, metadata models, tagging logic, and filtering rules
Collaborate on the creation of ground‑truth answers and golden datasets
Optimise retrieval quality, coverage, and compliance
Ensure all KB components support safe and auditable AI use

Skills & Experience

Strong background in NLP, semantic search, and vector search technologies
Previous experience with content ingestion, ETL, and data engineering
Exposure to finance, wealth, or superannuation environments advantageous
Hands‑on experience designing structured knowledge bases or information architectures
Ability to identify, classify, and tag risky or compliance‑sensitive content
Strong analytical, documentation, and metadata modelling skills

Questions? Reach out: kumar.kuchipudi@global.ntt





Join our growing global team and accelerate your career with us. Apply today.

For more information about this or other opportunities, please contact Kumar Kuchipudi. Please quote our job reference number 665181.

About us

NTT Ltd. is a leading global technology services company. Working with organizations around the world, we achieve business outcomes through intelligent technology solutions. For us, intelligent means data driven, connected, digital and secure. As a global ICT provider, we employ more than 40,000 people in a diverse and dynamic workplace that spans 57 countries, trading in 73 countries and delivering services in over 200 countries and regions

NTT is proud to be an equal opportunity employer with a global culture that embraces diversity. We are committed to providing an environment free of unfair discrimination and harassment. We do not discriminate based on age, race, color, sex, religion, national origin, disability, pregnancy, marital status, sexual orientation, gender reassignment, veteran status, or other protected category."
90144246,Senior Customer Insights Analyst,TripADeal,https://www.seek.com.au/job/90144246?type=standard&ref=search-standalone&origin=jobCard#sol=218fde009891ab13b5b235267ecd27e572e92134,5h ago,5.0,2026-02-05T01:00:00+00:00,"Kingscliff, Lismore & Far North Coast NSW",Business/Systems Analysts (Information & Communication Technology),Full time,Competitive salary + super + Qantas Benefits,"uThe Opportunity

The Senior Customer Insights Analyst serves as the primary analytical engine for TripADeal, reporting directly to the Chief Customer Officer (CCO). The role is responsible for transforming raw customer data into actionable insights across Marketing, Digital Product, and CX. By monitoring the end-to-end customer journey, you will identify opportunities to optimise marketing spend, improve digital conversion, and enhance service delivery to meet strategic business goals.

Organisational Structure

The Senior Customer Insights Analyst reports directly to the Chief Customer Officer (CCO) and operates as a key individual contributor. The role serves as a cross-functional hub, collaborating internally with the Senior Leadership Team, Marketing, Digital Product, Sales & Service, IT, Finance, and the Qantas Data and Analytics team.

This permanent full-time position is 100% onsite working from our Byron Bay HeadQuarters or Varsity Lakes Gold Coast office (minimum 1-day per fortnight in HQ), working Monday to Friday, 8-4pm or 9-5pm - you choose!

A Day in the Life
Deep-dive into data sets from Marketing, Digital Product, and CX to identify performance gaps and trends.
Campaign Analysis and New Repeat Customer deep-dives.
Track website and app performance to find technical or UX friction points that impact customer conversion.
Execute attribution modelling and cohort analysis to help the Marketing team optimise their channel mix and acquisition costs.
Mine ""Voice of Customer"" (VoC) and NPS data to provide a factual basis for service recovery and loyalty programs.
Enhance and update the ""Customer 360"" dashboard suite to ensure senior leadership has ""no-fluff,"" high-confidence data for daily decisions.
Work closely with the Senior Leadership Team and internal teams to align on strategic KPIs, with occasionally Qantas catch ups.
To be a Front Running Candidate
5+ years in a data-heavy role specifically focused on customer behaviour or marketing performance.
Expert skills in SQL for data extraction and mastery of visualisation tools like Tableau, Power BI, or Looker.
Strong technical understanding of GA4 and its integration with CRM data.
Desirable experience within the travel or e-commerce sectors, particularly with high-consideration digital purchase journeys.
Desirable experience with a MMM SAAS platform.
Demonstrated ability to translate complex, technical data into simple, actionable insights for non-technical teams.
The successful candidate will be required to undergo a Qantas background check
Why TripADeal?
Competitive salary package, training & career progression
Fun, casual work environment where shoes are optional
Flexible work hours
Regular social get togethers
Additional Paid Leave at selected Length Of Service milestone achievements
Staff travel discounts on air travel, accommodation and holidays
$1,040 per annum of Subsidised gym memberships & corporate Fitness Passport access
Novated leasing and salary packaging available
Employee Assistance Program
Savings and discounts on groceries, shopping, entertainment, and more
Volunteer leave as part of giving back to the local community to give back to the local community
Generous parental leave support program with paid superannuation during paid & unpaid parental leave

Be part of a company that is one of a kind in its culture, spirit and passion. Join a proud & growing team that offers quality, hassle free & affordable travel experiences.

See your next destination as Senior Customer Insights Analyst for TripADeal? Your future pathway is just one click away. Apply now!"
90144215,Lead Systems Analyst,Whizdom,https://www.seek.com.au/job/90144215?type=standard&ref=search-standalone&origin=jobCard#sol=33103c8c4527678dd434a9c5e6544dd08c81eaa9,5h ago,5.0,2026-02-05T01:00:00+00:00,Canberra ACT (Hybrid),Business/Systems Analysts (Information & Communication Technology),Contract/Temp,AUD 130 - 150 per hour,"Seeking a Lead Systems Analyst with a minimum of 5-years systems analyst experience working on cyber security initiatives.
Job details

The Department utilises both cloud and on-prem services, and is uplifting its cyber security posture. A multi-year ICT program has been established to facilitate this objective. A (Systems Analyst) is required to assist with developing detailed mapping documentation to enable cloud migrations. The Systems Analyst will work closely with business units located both domestically and internationally to achieve this objective. The analyst will need to work with internal and external stakeholders (e.g. software vendors) to facilitate automated workflows between dependant systems.

Key duties and responsibilities

The Department requires an ICT infrastructure systems analyst to do the following tasks as part of a multi-skilled team environment:

Examine existing analysis and mapping frameworks to determine if cyber security posture improvements and operational gains are possible,
Liaise, and document learnings, based on discussions with a variety of organisational stakeholders who are located domestically and internationally,
Consolidate and define organisational groups and roles in a format that supports automated migrations,
Develop efficient operating models that work effectively in a distributed, security focused environment,
Facilitate market approaches based on defined criteria,
Collaborate with third-party engineering teams, and internal technical teams, to implement detailed business requirements, and
Assist with transition to service documentation (e.g. standard operating procedures, knowledge base articles).
Essential criteria

A minimum of 5-years systems analyst experience.
High-level interpersonal and written communication skills.
Demonstrated ability to perform analysis and produce deliverables based on existing analysis frameworks.
Proven ability to develop functional and non-functional requirements for large-scale ICT infrastructure projects.
Experience developing documentation to support competitive market approaches.
An understanding of cloud-based services and their interaction with on-prem services. • Ability to produce operating models that work in a distributed, security focused organization. • Collaborate with the third-party engineering teams and internal technical resources to implement business requirements.
Desirable criteria

Experience developing requirements for cloud services.
Experience working on cyber security initiatives.
Contract: 12 Month Contract with 2 x 12 months extension  

Security Required: NV1 Security Clearance required

Location- Canberra based - Hybrid option available - (typically 3 days in the office and 2 days from home) to be negotiated with the successful candidate. Interstate / remote working arrangements will only be considered if a suitable Canberra based candidate cannot be identified. 

How to Apply - Please upload your resume to apply. Candidates will need to be willing to undergo pre-employment screening checks which may include, ID and work rights, security clearance verification and any other client requested checks

Closing date:  Thursday 18 February 2026

Call Joanne Finchett on 0480 002454 or email Joanne@whizdom.com.au for any further information"
90143730,Senior Risk & Governance Specialist - Technology,Insignia Financial Ltd,https://www.seek.com.au/job/90143730?type=standard&ref=search-standalone&origin=jobCard#sol=b2f6bbcaa7322b3d1cf17aeddae15b8bb9a4d78f,5h ago,5.0,2026-02-05T01:00:00+00:00,Melbourne VIC (Hybrid),Compliance & Risk (Banking & Financial Services),Full time,,"Company description:



Insignia Financial Limited is an Australian financial services company which offers a range of products and services including financial advice, superannuation, investment management and trustee services



Job description:


Own the risk game.
Put your stamp on AI and data governance
Your expertise, your influence, your legacy

The opportunity to join our team

We're looking for a first-line technology risk senior specialist to partner with our Data Automation & AI business unit and to ensure innovation moves swiftly and responsibly. If you thrive on solving complex problems, building trusted relationships, and turning ambiguity into clear, actionable controls, this role is for you.

As we scale data and AI across the enterprise, your mission is to embed practical, business-aligned risk and governance, from data lifecycle and privacy to AI transparency and control testing, so teams can deliver responsibly and confidently. You'll work closely with senior leadership, understand their priorities, and help them navigate incidents, issues, and controls with clarity and confidence.

This is your chance to shape how we build and scale responsible AI and data practices, collaborate with experts in privacy, governance, and control testing, and make a big impact in a fast-moving environment. You'll join an enthusiastic, supportive team with a strong culture, enjoy autonomy to shape the role and make it your own, and work across the entire enterprise for huge exposure and influence. Plus, you'll have the opportunity to mentor, influence frameworks, and leave your mark.

Key Responsibilities:

Advise on data risk and technology governance controls aligned to frameworks and regulations (APRA CPS 230/234, CPG 235)
Implement risk uplift programs and embed data governance practices across Technology
Assess and monitor risks for data-driven and AI-enabled initiatives; manage incidents and issues
Establish and advise on AI governance frameworks, transparency, and emerging regulations
Develop key risk indicators and metrics for AI and data risks
Mentor junior team members and collaborate with privacy, technology governance, and control testing teams

What you will bring

Proven risk/compliance experience in 1st line technology risk (financial services preferred)
Strong knowledge of APRA requirements and data governance frameworks
Experience with data lifecycle management, retention, and quality controls
Ability to analyse complex data/AI risk scenarios and provide actionable recommendations
Exceptional stakeholder engagement and communication skills, including board-level reporting
Interest in AI, automation, and bots; ability to work autonomously and in a team

Find the better way

What gets us excited about working here? Helping people feel good about their money as one of Australia's leading financial wellbeing organisations. From those starting out to those retiring. As your team, we'll show up for you and together we will create financial wellbeing for every Australian. Because we know people who are confident about their financial future live better lives.

If this sounds like your kind of career, you sound like our kind of person. With us, you'll do work that builds your technical know-how and challenges our entire industry to move forward. Along the way, you'll be free to explore new ideas and technology, solve problems in a team, and independently to get great things done. Around here, we like to call it ""putting our fingerprints on the future"".

People-inspired tech

Deep expertise combined with creativity can take on the trickiest of problems. Join our team of brilliant minds and mentors as we explore our way to innovation and apply technology in more human ways than ever.

To Apply

Read more here about why you should join our team.

Applicants will be required to provide evidence of their eligibility to work in Australia, and at a minimum be required to undertake police and basic credit checks as a condition of employment.

Please note that applications from agencies will not be considered at this time.

We acknowledge and celebrate the richness that individual differences bring to our team. If you need assistance or an adjustment during the application process, please reach out and let us know."
90142779,Security Data Senior Consultant,Emanate Technology Pty Ltd,https://www.seek.com.au/job/90142779?type=standard&ref=search-standalone&origin=jobCard#sol=edf9226523b121b603ed43dc165e307b695069b5,6h ago,6.0,2026-02-05T00:00:00+00:00,"Watson, Canberra ACT",Business/Systems Analysts (Information & Communication Technology),Contract/Temp,,"Senior Security Data Pipeline & SIEM Engineer (NV1 Required)

Location: Canberra
Engagement: Contract
Clearance: Active NV1 Security Clearance

A major program of work is underway to uplift security telemetry, log rationalisation, and SOC onboarding capabilities across a large, complex environment. We’re seeking an experienced Security Data Pipeline, SIEM & Data Engineering Specialist to join the team and help deliver scalable, modern, and cost efficient security data architectures.

This role is ideal for a senior engineer who thrives in high volume data environments, understands modern security logging ecosystems, and can design and optimise pipelines that support next generation SOC operations.

What You’ll Be Doing


Designing and implementing advanced security data pipelines (Cribl, Splunk DMX, Kafkabased).
Architecting and optimising Security Data Lakes (AWS Security Lake, Snowflake, Delta Lake, Microsoft Fabric).
Configuring and managing SIEM platforms such as Splunk ES or Microsoft Sentinel.
Developing log rationalisation, enrichment, suppression, and parsing strategies.
Building scalable ingestion frameworks, schema management, and ETL/ELT processes.
Enabling federated search and cross platform analytics across SIEM and data lake environments.
Supporting SOC onboarding, including SOAR, threat intel, and case management integrations.
Conducting performance benchmarking, readiness assessments, and architecture validation.
Producing documentation, runbooks, and knowledge transfer materials.
What You Bring


Active NV1 Security Clearance (essential).
5+ years in security engineering, SIEM engineering, or security data platforms.
Strong data engineering experience across log ingestion, transformation, and distributed systems.
Hands on expertise with at least one major pipeline technology (Cribl Stream, Splunk DMX, Fluentd, Logstash).
Experience with modern data lakes (AWS Security Lake, Snowflake, Delta Lake, Microsoft Fabric).
Proficiency with SIEM platforms such as Splunk ES or Microsoft Sentinel.
Strong scripting/automation skills (Python, SQL, PowerShell).
Familiarity with cloud platforms (AWS, Azure, GCP).
Experience with SOC onboarding workflows, SOAR, ticketing, and threat intelligence integrations.
Excellent communication and documentation skills.



We are an inclusive employer committed to fostering a diverse and accessible workplace. We encourage applications from Aboriginal and Torres Strait Islander peoples, people with disabilities, LGBTQIA+ individuals, people of all ages, and those from culturally and linguistically diverse backgrounds."
