Job ID,Job Title,Company,Detail URL,Posted Label,Hours Old,Posted Datetime (Local),Location,Category,Work Type,Salary,Ad Text
87588883,"Power BI Specialist (D365, .NET)",Dynamo Recruitment,https://www.seek.com.au/job/87588883?type=standard&ref=search-standalone&origin=jobCard#sol=11b6e3574c1e26b61fe13800af46b0f38ca34603,7h ago,7.0,2025-10-02T01:00:00+00:00,Sydney NSW,Developers/Programmers (Information & Communication Technology),Full time,,"Our client, a reputable Australian organisation, is seeking a talented BI Specialist to join their growing team. This is a permanent role based onsite in the South Western Suburbs of Sydney.
 
The main purpose of the role is to develop and support the BI reporting capability for the organisation and its subsidiaries.

We are seeking a specialist with strong expertise in Power BI, data architecture, and reporting optimisation to review, streamline, and migrate a large suite of reports. This role will ensure reporting assets are efficient, secure, and aligned with modern data platform best practices.
 
Responsible for:

Design, develop, and maintain integrations with external systems via APIs.
Implement and manage ETL (Extract, Transform, Load) processes to efficiently move and transform data.
Administer and maintain Microsoft Synapse and associated storage solutions.
Develop, optimize, and maintain SQL queries, stored procedures, functions, and triggers.
Analyse and interpret data from multiple sources to uncover trends, insights, and opportunities.
Build, maintain, and optimize dashboards, reports, and data models in Microsoft Power BI.
Support analysts in developing and refining Power BI reports.
Present data-driven findings and recommendations to customers and internal stakeholders.
Continuously enhance reporting processes to improve accuracy, efficiency, and reliability.
Contribute to process improvements, system enhancements, and delivery of business initiatives within agile frameworks.
Implement and manage user access controls for reports and report contents.
Collaborate with business users to gather requirements and translate them into effective visual reporting solutions.
Schedule, publish, and manage report delivery in Power BI Service, including data refresh schedules.
Identify, document, and communicate data quality issues to analysts and relevant business stakeholders
Technical Skills and Qualifications:

Bachelor's degree in IT or equivalent. 
5+ years of relevant work experience in analytics, business intelligence, or insights.
Advanced skills in MS Synapse, API connection , SQL with proven experience working on complex queries and data models.
Proficiency with data visualisation tool Power BI and Fabric.
Utilise tools such as SQL (Azure SQL Database), Fabric & Power BI to perform analysis and create reporting solutions.
Proficiency in MS Excel to analyse advanced Excel functions as input to the design of BI solutions.
Proven ability to deliver high-quality, accurate, and reliable reporting solutions.
Consistent success working effectively in dynamic, fast-paced environments.
Excellent communication skills, with the ability to translate complex data insights for both technical and non-technical audiences.
Desirable Skills:

Food distribution / Manufacturing environment.
Experience with BI in the context of MS Dynamics, Odoo or any other ERP.
Any software development experience, for example with .NET.
Please apply for more details and a confidential chat :)"
87588456,Senior CIRT Analyst,Computershare Ltd,https://www.seek.com.au/job/87588456?type=standard&ref=search-standalone&origin=jobCard#sol=934a19af5b30cda85d174f8ecf37c2e29699ccf0,8h ago,8.0,2025-10-02T00:00:00+00:00,"Abbotsford, Melbourne VIC (Hybrid)",Other (Information & Communication Technology),Full time,,"Location : Melbourne Yarra Falls or Sydney City (Hybrid)

This is a hybrid position based either in our Sydney or Melbourne Yarra Falls location. We're committed to your flexibility and wellbeing and our hybrid strategy currently requires three days a week in the office, giving you the option to work remotely for some of your working week. Find out more about our flexible work culture at computershare.com/flex.

We give you a world of potential

Computershare has an exciting opportunity for a permanent full-time Senior CIRT Analyst to join our Computershare Shared Services (CSS) team within our Global Information Security (GIS) department.

A role you will love

As a Senior CIRT (Cyber Incident Response Team) Analyst, you will play a critical hands-on role within the Cyber Defence team, responsible for leading complex incident investigations, building and tuning threat detection capabilities, and mentoring SOC Analysts to support global 24/7 operations. In this role, you will act as the primary escalation point for incidents that exceed Tier 1/2 capabilities and ensures operational continuity outside of Security Operations leadership working hours. This includes close collaboration with teams like Security Engineering, Threat Intelligence, the NOC and Incident Management to manage and resolve cyber security incidents to competition.

Alongside our colleagues in Security Engineering, which drives strategic control implementation, you will be focused on the operational and tactical build out of threat detection and response. You will proactively translate real-world threats and attack behaviours into effective detection logic across SIEM and EDR platforms, conduct targeted threat hunts and help embed high-confidence detection into playbooks and response workflows, supporting our Incident Detection and Response Capability.

Our Senior CIRT Analysts are regionally aligned in a follow-the-sun model including positions in the Americas, EMEA and APAC. They have a global presence, but also regional expertise, working alongside and advising our regional CISO teams on regional compliance and reporting requirements from a technical perspective.



Other key responsibilities include:

Act as the senior escalation point for complex or high-severity incidents.
Lead incident response lifecycle from detection through to post-incident review.
Perform high level forensic analysis across cloud, endpoint and network data.
Develop and execute hypothesis driven hunts across available telemetry.
Use results to identify gaps or refine detection logic.
Build, tune, and document detection logic in Sentinel, Defender, CrowdStrike and other platforms.
Translate threat intelligence into rules and analytics to support incidents.
Maintain and execute MITRE ATT&CK coverage plans.
Design and improve operational playbooks and SOAR workflows.
Implement response logic for recurring incident types.
Support the development of SOC Analysts by providing escalation support, training and structured feedback.


What will you bring to the role?

Flexibility to work an on-call rotation which will include some weekends and public holidays (current schedule is 1 week every 6 weeks but is subject to change)
Proven experience in SOC, IR or similar roles with demonstrable in threat hunt or tier 3 response
Experience building detection logic and analytics rules (e.g. KQL, Sigma)
Deep understanding of MITRE ATT&CK, threat actors, and attack chains
Strong verbal and written communication skills including report writing skills, the ability to brief groups of people and the ability to translate technical terms into easy-to-understand concepts for non-technical colleagues
Experience in financial services, aviation, government or other regulated industries

Bonus points if you have:

GIAC certifications (e.g. GCIA, GCIH, GNFA, GMON, GCFA), Microsoft SC-200, AZ-500 or equivalent
Experience with Sentinel, Defender and CrowdStrike
Strong scripting knowledge (PowerShell, python etc)
Knowledge of Security Frameworks including SOC2, ISO 27001 and NIST
Active geopolitical awareness
Bachelor's degree or a master's degree in a relevant field

Rewards designed for you

Flexible work to help you find the best balance between work and lifestyle.

Health and wellbeing rewards that can be tailored to support you and your family.

Invest in our business by setting aside salary to purchase shares in our company, and you'll receive a company contribution as well.

Extra rewards ranging from recognition awards and team get togethers to helping you invest in your future.

And more. Ours is a welcoming and close-knit community, with experienced colleagues ready to help you grow. Our careers hub will help you find out more about our rewards and life at Computershare, visit computershare.com/careershub.

A company to be proud of

We're a global leader in financial administration with over 12,000 employees across more than 22 different countries. At Computershare, it's more than just a job, our open and inclusive culture means that we will help you to grow, to move forward and make the most of our world of opportunities.

Fairness and culture

We're dedicated to providing you with the opportunity to succeed on your own merits, starting from the application process and continuing throughout your career with us. Our goal is to create an environment where everyone feels valued, to remove barriers and obstacles and ensure equal opportunities for all. For support with accommodations or adjustments during our recruitment process please visit computershare.com/access for further information."
87588153,Principal Remote Sensing Analyst,Ecocene Pty Ltd,https://www.seek.com.au/job/87588153?type=standard&ref=search-standalone&origin=jobCard#sol=083ef753d7d2b8eb95f86efdc1b8a99cd8d5e504,8h ago,8.0,2025-10-02T00:00:00+00:00,"East Perth, Perth WA (Hybrid)","Environmental, Earth & Geosciences (Science & Technology)",Full time,,"Our Company

At Ecocene, we believe that meaningful environmental change starts with passionate people who are committed to protecting and restoring our natural world.

We're a forward-thinking ecological services and technology company delivering measurable biodiversity and ecosystem restoration outcomes. Our mission is to empower organisations and communities with the expertise and intelligent solutions needed to protect and restore nature at scale.

About Ecocene Intelligence

Ecocene Intelligence is our cutting-edge data technology division that transforms complex ecological information into actionable insights through our flagship Ecoda platform. This cloud-based solution integrates remote sensing data and field observations using advanced analytics, streamlining biodiversity monitoring, compliance reporting, and environmental decision-making for projects of any scale. We're building Ecoda to democratise biodiversity monitoring and empower teams worldwide on their journey toward nature positive outcomes.

The Role

Ecocene Intelligence is seeking a Principal Remote Sensing Analyst to be part of its team, leading Ecocene Intelligence projects, developing new remote sensing products and overseeing the refinement of our remote sensing data processing pipeline. The Principal Remote Sensing Analyst will also train and mentor analysts and collaborate closely with Ecocene Expertise’s Earth Observation team.

About You

As part of the team, you’ll play a critical role in a rapidly growing, high-tech startup, solving real problems every day – and having fun while you’re at it. You will be well supported by other experts in remote sensing, specialists in various fields of environmental science and a team of analysts and field scientists.

You’ll be supervising the processing of a variety of remote sensing data to produce meaningful metrics which enable our customers to better manage their environment and report to government regulators.

You will provide technical leadership on remote sensing in the design and delivery of projects, undertake research and development in collaboration with peers and build skills and capacity within the team of remote sensing analysts and data scientists. 

You’re a collaborative team player and thrive on working closely with people from all levels of the business.

Your Skills

An undergraduate degree in a relevant scientific field that incorporates significant geospatial coursework or a relevant Bachelor’s degree with postgraduate qualification in geospatial science - examples of relevant degrees include (but are not limited to): geospatial science, environmental science, geography, data science

Deep expertise in remote sensing data processing and analysis

Well-developed leadership skills with an ability and willingness to train and mentor others

A focus on quality control and data assurance

Exceptional research, analysis and problem-solving skills

An ability to enthusiastically contribute, work effectively with people from all levels of business, and enjoy being part of a team

Excitement for helping people use data and technology to solve environmental issues

Why Join Ecocene?

When you join Ecocene Intelligence, you become part of a rapidly growing, high-tech startup at the forefront of environmental innovation. Every day brings meaningful challenges where you'll work with cutting-edge tools, from remote sensing and AI-driven analytics to sophisticated ecological monitoring systems, while making a tangible contribution to a more sustainable future.

You'll collaborate with a passionate, talented team that values both positive environmental outcomes and an engaging work culture. Together, we're not just building technology; we're creating solutions that help restore the planet.

Our Values

Ecocene empowers everyone to approach, own, and solve problems creatively. Our Values provide the foundation for the way in which we work, with all employees actively incorporating them into their everyday roles.

We pursue excellence – We’re passionate people committed to delivering outstanding results

We tackle the challenge together – We pitch in, support and encourage each other to deliver as a team

We adapt on demand – We’re responsive to change, and ready to pivot to put it at our advantage

We stay grounded – We keep it real, communicating openly, honestly and with trust

We operate with respect – We act with integrity, take accountability and treat people with respect

Ecocene is for everyone, so come as you are. Diversity makes our team more creative, fun, and effective, so bring your whole self to the application process, and we will too!

Benefits of Joining Ecocene

Professional development budget

Employee Assistance Program

Hybrid work arrangements

Fantastic culture and social events

Being part of building a natural future

How to Apply

In addition to your CV, please provide a cover letter addressing the skills and experience criteria (maximum 400 words), suitable start date in 2025 and salary expectations.

To apply for this position, please click the “Quick apply” button.  Applications close 1 November 2025.  We reserve the right to withdraw this advertisement as soon as we have found a suitable candidate.  

For further information or a position description, please contact Sherry-ann on (08) 9421 9600.

Please note that:

Applicants must have the right to work in Australia

Due to the volume of candidates applying for Ecocene vacancies only shortlisted applicants will be contacted

Ecocene handles recruitment internally and this vacancy is not open to Recruitment Agencies"
87587957,Business Intelligence Developer,Michael Page,https://www.seek.com.au/job/87587957?type=standard&ref=search-standalone&origin=jobCard#sol=c043e26c32807ee73c8521199fca0544e369c5c5,8h ago,8.0,2025-10-02T00:00:00+00:00,Perth WA (Hybrid),Developers/Programmers (Information & Communication Technology),Contract/Temp,$90 - $105 p.h.,"Join a leading organisation in the Energy & Natural Resources industry as a Business Intelligence Developer. This temporary role in Perth WA will see you creating and maintaining data-driven solutions to support decision-making processes.

Client Details

This large organisation operates within the Energy & Natural Resources sector, providing essential services and products to a global market. They are known for their commitment to technological innovation and operational excellence.

Description

* Design and develop PowerBI dashboards and reports to provide actionable insights to stakeholders

* Analyse data and identify trends, patterns, and outliers to provide insights to stakeholders

* Develop and maintain data visualisation standards and best practices to ensure consistency across dashboards and reports

* Communicate insights and recommendations to stakeholders in a clear and concise manner

* Continuously evaluate and improve the effectiveness of dashboards and reports to meet stakeholder needs

* Establish and uphold data governance standards to ensure data quality and integrity.

* Strong attention to detail and ability to work with complex datasets

* Excellent communication and interpersonal skills to work with cross functional teams

* Familiarity with agile methodologies and project management tools

Profile

A successful Business Intelligence Developer should have:

* Bachelor's degree in computer science, Data Science, or related field

* 3 to 5 years of experience in data visualisation, analytics, or related field

* Expertise in PowerBI dashboard creation and customisation

* Experience with integrated data lakes and data warehousing systems

* Strong SQL skills and ability to write complex queries for data retrieval

* Familiarity with data modelling and ETL processes

* Experience with Power automate

* Ability to work with large datasets and analyse data to provide insights

* Knowledge of data visualisation principles and techniques to effectively communicate insights to stakeholders

* Keen problem-solving aptitude and ability to work independently as well as collaboratively

Job Offer

Hourly rate ranging from $86 to $106 AUD, based on experience.
Opportunity to work with cutting-edge technology in the Energy & Natural Resources sector.
Flexible temporary contract arrangement to suit your needs.
Engaging and supportive work environment in Perth WA.

This is your chance to make a meaningful impact while advancing your career in technology. If you are excited to take on this Business Intelligence Developer role, we encourage you to apply today!

To apply online please click the 'Apply' button below. For a confidential discussion about this role please contact Daniel Gonzalez on +61 8 9215 9520."
87587754,Project Manage / Business Analyst,Morgans Financial Limited,https://www.seek.com.au/job/87587754?type=standard&ref=search-standalone&origin=jobCard#sol=f6b6661569c93403da99b656d3bd64dc36324e2d,8h ago,8.0,2025-10-02T00:00:00+00:00,Brisbane QLD,Business/Systems Analysts (Information & Communication Technology),Full time,,"About Morgans:

Morgans is Australia’s largest full-service stockbroking and wealth management network providing a range of wealth management, investment advice and corporate finance services. We pride ourselves on our people, expertise, core values, and diversity.

The Opportunity:

Are you a dynamic and driven individual with a passion for managing the end-to-end lifecycle of projects? Morgans is seeking a talented Project Manager / Business Analyst to join our iServices Department and lead a diverse range of strategic initiatives over the next 2–3 years. This hands-on, multi-faceted role spans the full project lifecycle—from feasibility and initiation through to implementation—while also applying business analysis expertise. You’ll collaborate with cross-functional teams, engage stakeholders, and ensure solutions are user-centric, efficient, and aligned with business goals.

Benefits:

Eligible to participate in bonus scheme
Learning and development opportunities including Morgans' Mentoring program
Discounted financial services, health care, gym memberships & more
Positive impact on the community through the Morgans Foundation and paid volunteer days

What you will be doing:

Lead small to medium-sized, complex projects using Agile and DevOps methodologies.
Develop project documentation including initiation plans, schedules, and budgets.
Manage stakeholder relationships and ensure clear communication of project progress.
Apply modern user-centred design practices including wireframing and iterative solution design.
Coordinate and manage testing activities including UAT and defect tracking.
Ensure project outputs are delivered on time, within scope and budget, and meet quality standards.
Create process maps, use cases, and design/flow documentation to support solution development and stakeholder understanding.

What you will bring:

Strong communication skills with the ability to connect and engage with stakeholders at all levels.
Proven experience in project management and business analysis within complex environments.
Business acumen and stakeholder engagement are valued more highly than deep technical expertise (though technology skills are still important).
Experience in simplifying systems and processes to improve user experience through human-centred design.
Proficiency in Agile methodologies and modern project tools.
Experience in user-centred design and testing coordination.
Ability to work both independently and collaboratively in high-pressure environments.

Desired:

Experience in financial services or understanding of financial products.
Familiarity with testing tools and techniques.
Tertiary qualifications in IT, finance, or related disciplines.

Yes, I want to apply!

If you are interested in this role and would like to join the Morgans team, please click apply and submit your cover letter and resume. We believe in creating opportunities for everyone and welcome applications from people with diverse backgrounds and experiences. We can’t wait to hear from you!"
87587728,AI Enablement Lead,CircuIT Recruitment Group,https://www.seek.com.au/job/87587728?type=standard&ref=search-standalone&origin=jobCard#sol=557f1438ba623152700d21e0a0b8ef31ad4f7077,8h ago,8.0,2025-10-02T00:00:00+00:00,Melbourne VIC (Hybrid),Business/Systems Analysts (Information & Communication Technology),Full time,,"AI Enablement Lead 
 
Our client is looking to maximise the deployment of AI  across their organisation. This newly created role reporting to the CPTO and will ensure AI capabilities are effectively embedded into existing SaaS application infrastructure, improving productivity, decision-making, and customer experiences.

You'll lead a cross-functional squad and be responsible for driving operational efficiency and delivering measurable business value through AI.
  
What you'll do:

Define and oversee the AI roadmap, ensuring alignment with business objectives
Assess current SaaS applications and identify opportunities to integrate and optimise AI
Evaluate AI vendors, tools, and platforms to maximise ROI and scalability
Establish frameworks for AI deployment, governance, and continuous improvement
Lead a cross-functional AI squad across Product, Engineering, Data, Marketing, Operations, and Customer Service
Act as a bridge between business stakeholders and technical teams, ensuring practical adoption and measurable impact
Build awareness and capability within teams through training, playbooks, and best practice enablement
Drive AI-led personalisation across offers, promotions, and loyalty programs to improve customer engagement and conversion
Optimise marketing technology stack integrations and implement AI-based strategies to improve targeting efficiency
Design and deploy AI use cases that streamline workflows, reduce manual effort, and unlock efficiency
Implement ethical, secure, and compliant AI practices aligned with regulatory and industry standards
Define and track KPIs that measure AI's impact on operational, financial, and customer outcomes
What you need:

Strong background in AI, data, and SaaS application ecosystems
Proven track record of leading cross-functional programs or squads
Experience driving digital transformation and AI enablement within enterprise SaaS environments
Excellent stakeholder management and communication skills
Strong understanding of AI governance, ethics, and compliance
Experience with marketing technology platforms such as HubSpot, Amplitude, Algolia, Optimizely (desirable but not mandatory)
Familiarity with ROI measurement frameworks and marketing efficiency strategies (desirable)
What success looks like:

AI adoption roadmap across SaaS applications and marketing stack
Documented frameworks for responsible AI deployment and risk governance
Personalisation and ROI improvement frameworks across marketing and customer journeys
Trained cross-functional squad and internal champions driving AI adoption
The opportunity:

Permanent Opportunity
Salary: 170K + Superannuation
Hybrid working arrangement (3 days in the office)
Benefits include a strong culture that rewards high performers
If this sounds like you, please apply to the link below."
