Job ID,Job Title,Company,Detail URL,Posted Label,Hours Old,Posted Datetime (Local),Location,Category,Work Type,Salary,Ad Text
87616788,Senior Business Analyst,SGS Australia Pty Ltd,https://www.seek.com.au/job/87616788?type=standard&ref=search-standalone&origin=jobCard#sol=fbbb2b1b0a9a6ec9ad2bc8d20f7f74a09713162a,1h ago,1.0,2025-10-03T00:00:00+00:00,"Perth Airport, Perth WA",Analysis & Reporting (Accounting),Full time,Competitive Salary,"Company Description

SGS Australia is a leading provider of Testing, Inspection, and Certification services, supporting multiple industries across the country with trusted expertise and technical excellence. Backed by SGS’s global legacy of over 140 years, we operate one of the largest networks of accredited laboratories and field facilities in Australia, with a network of more than 50 offices and laboratories and over 1,400 employees across Australia. We are accredited by NATA and ISO 9001, ensuring our services meet both Australian and international standards.

Job Description

We are seeking an experienced Senior Business Analyst to join our Perth team. This role will play a pivotal part in designing and driving integration strategies across business functions, ensuring smooth alignment between entities during mergers and acquisitions.

Key Responsibilities include however not limited to:

Partner with the management team to design and implement integration strategies.

Develop and manage detailed integration project plans, timelines, and deliverables.

Coordinate with HR, IT, Finance, and Operations to align resources and activities.

Gain a strong understanding of both SGS and acquired entity’s business and functional areas.

Engage senior leadership, managers, and employees through regular updates to maintain transparency.

Address cultural and organizational differences to support smooth collaboration.

Identify potential risks and develop mitigation strategies.

Lead collaboration across Finance, Procurement, HR, and Business Analytics to integrate key systems, including:

           Financial reporting systems for group analysis and reporting

            PBI reporting tools

Use project management tools and metrics to monitor milestones and adjust plans.

Prepare and present integration status reports to senior leadership.

Analyze financial and operational data to identify improvement opportunities.

Track and report on synergies, value creation, and business case delivery.

Oversee month-end close processes, ensuring accuracy and timeliness.

Skills, Knowlege and Experiences

The ideal candidate will have a:

Degree in Business Management, Accounting, or relevant discipline.

Chartered Accountant (CA) or Certified Practising Accountant (CPA) preferred.

Minimum 5 years’ experience in M&A integration or a related field.

Proven track record of managing complex integration projects.

Strong project management and change management skills.

Comprehensive understanding of finance practices and processes.

Ability to work both autonomously and collaboratively with diverse teams.

Additional information

WHY WORK FOR SGS?

Working at SGS means joining an innovative, Global company. Here are some of the benefits to working for SGS. 

•    As a company, we have embraced the shift to flexible work
•    Sustainability is embedded in our culture and the way we do business
•    Paid parental leave
•    Paid time for volunteering day and blood donations
•    Corporate health & wellbeing offers
•    Ongoing learning & development 
•    Career development opportunities (Nationally and Globally)
•    SGS Rewards: Our employee benefits platform with access to retail and online discounts and cashback

COME TO WORK AND BE 100% YOU
SGS Australia supports a diverse workforce, we encourage applications from people of all ages, nationalities, abilities, and cultures – including Aboriginal and Torres Strait Islander peoples, the LGBTQI+ community and people living with disability. Providing employment opportunities for Aboriginal and Torres Strait Islander people is an important part of our SGS Reconciliation Action Plan (RAP). We truly believe the diversity among us will continue to foster a strong, innovative, and forward-thinking workplace.
SGS Australia acknowledges and pays respect to the past, present and future Traditional Custodians and Elders of this nation and the continuation of cultural, spiritual, and educational practices of Aboriginal and Torres Strait Islander peoples."
87616607,Insights Business Partner,Suncorp,https://www.seek.com.au/job/87616607?type=standard&ref=search-standalone&origin=jobCard#sol=08e1856d917058f11f355dc63fbb794baf084524,1h ago,1.0,2025-10-03T00:00:00+00:00,Sydney NSW (Hybrid),Workers' Compensation (Insurance & Superannuation),Full time,Attractive salary + bonus + great benefits,"Lead strategic insights for business impact
Sydney/Brisbane/Perth CBD location, hybrid working with flexible leave options
Career growth in a purpose-led analytics team
Permanent role

About the role:

Turn data into decisions that matter. Join a collaborative analytics team driving performance across Workers Compensation and Commercial lines. As an Insights Business Partner, you’ll deliver performance intelligence that supports strategic decisions across Commercial & Personal Injury. You’ll work closely with senior leaders to uncover trends, risks, and opportunities that improve outcomes.

What you’ll do:

Deliver insights that guide strategic and operational decisions
Partner with senior leaders to analyse performance and drive improvement
Present trends and recommendations in monthly performance reviews
Provide ad-hoc analysis to support key business decisions
Build trusted relationships across C&PI and supporting teams
Identify emerging trends and recommend actions for improvement

What you’ll bring:

Minimum 5 years in performance analytics or decision-making roles
Strong stakeholder engagement and influencing skills
Proficiency in tools like SQL, Power BI, Tableau, and Excel
Ability to translate complex data into clear insights
Experience in Workers Compensation or insurance is a plus
A mindset for continuous improvement and innovation

What you’ll enjoy:

Access our award-winning Shine platform – your central hub for exclusive perks, wellbeing support, career development, and recognition.

Hybrid working, flexible leave, 20 weeks paid parental leave
Paid study support, career breaks, and referral bonuses
Wellbeing coaching, Employee Council, and EAP access
Discounts at 400+ retailers, insurance savings, and gym memberships
Paid volunteer leave, donation matching, and emergency response leave
Performance-based bonuses and Suncorp shares
Inclusive policies and employee resource groups

Explore our full benefits: www.suncorpgroup.com.au/careers/benefits

At Suncorp, we’re committed to creating a diverse, accessible, and inclusive culture. If you need more information, support or adjustments during the recruitment process or in the workplace, please contact annette_frasca@suncorp.com.au for a confidential conversation."
87616427,Finance Process & UAT Specialist,Ethos BeathChapman,https://www.seek.com.au/job/87616427?type=standard&ref=search-standalone&origin=jobCard#sol=e245e9e3d934300ffca22c090b44df1d5fce7e68,1h ago,1.0,2025-10-03T00:00:00+00:00,Sydney NSW (Hybrid),Analysis & Reporting (Accounting),Contract/Temp,"$140,000 - $160,000 + Super (pro rated)","We are partnering with a leading insurance group undertaking one of the largest finance transformation programs in the market. This multi-year initiative is reshaping the organisation’s finance, reporting, and controls landscape, underpinned by new systems and process design.

We are seeking a Finance Process & UAT specialist to play a critical role in supporting finance workstreams across process re-design, testing and business readiness.

Key Responsibilities:
Partner with Finance SMEs and project teams to map and document end-to-end finance processes.
Conduct process analysis to identify impacts, risks and improvement opportunities.
Support User System Acceptance Testing (UAT) activities, including test planning, execution, issue tracking and resolution.
Collaborate with business and technology stakeholders to ensure requirements are clearly defined and embedded into design and testing outcomes.
Provide high-quality reporting and updates to Finance Transformation leadership.
Contribute to business readiness and change activities to ensure smooth adoption of new processes and systems.
Skills & Experience
CPA/CA qualified or equivalent finance background.
Strong experience in finance process design and documentation.
Hands-on experience with User Acceptance Testing (UAT) within large system or ERP transformations.
Excellent stakeholder engagement and communication skills, with the ability to liaise across Finance, IT and project teams.
Prior experience in large-scale transformation within insurance or financial services highly regarded.
What’s on Offer
High-profile transformation program with a leading insurance group.
Initial 6 month contract opportunity with potential to extend.
Hybrid working environment with CBD office presence.
Chance to influence finance processes and systems that will shape the organisation’s future.
If you are a finance professional with transformation and UAT experience and enjoy working in complex, fast-paced environments, we’d love to hear from you."
87615340,SMS Business and Reporting Specialist,Melbourne Polytechnic,https://www.seek.com.au/job/87615340?type=standard&ref=search-standalone&origin=jobCard#sol=c4450429bd9a57be987955e9e1f8bb64ca7308d1,2h ago,2.0,2025-10-02T23:00:00+00:00,"Preston, Melbourne VIC (Hybrid)","Business/Systems Analysts (Information & Communication Technology)
Other (Education & Training)",Contract/Temp,"$140,000 – $150,000 per year","Vacancy Number: 143

Position Title: SMS Business and Reporting Specialist

Employment Status: Fixed Term Contract (1 January 2026 - 28 August 2026)

Department: ED People and Student Success

Location: Preston

Award Classification: Melbourne Polytechnic Academic Professional Staff Agreement

Salary: $140,000 - $150,000 per annum plus superannuation

Hours per Week: 38

Applications Close: Sunday 19 October 2025




Why Join Us

Melbourne Polytechnic has been a leader in practical, real-world education since 1912. We offer:

Industry-led, hands-on training

Inclusive, future-focused environments

A strong commitment to staff wellbeing

A culture built on curiosity, collaboration, and care




About the Role

Melbourne Polytechnic is seeking a dynamic SMS Business and Reporting Specialist to support the effective delivery of reporting strategy and automation for the new Student Management System (SMS). This is a great opportunity to contribute to strategic projects, drive operational improvements, and support collaborative team success in a purpose-driven environment.




Key Responsibilities

Lead and manage the reporting work stream deliverables for the SMS implementation project

Develop and implement a comprehensive reporting strategy

Reconcile and catalogue all operational and management reporting requirements

Deliver detailed reporting specifications, including prototype reports and dashboards

Collaborate with internal and external stakeholders to develop and test reports

Provide documentation, training, and post-go-live support

Contribute to project planning, data migration, testing, and change management




Skills and Experience Required

Tertiary qualifications in Project Management, Business, IT, or equivalent experience

Strong stakeholder engagement and communication skills

Extensive knowledge of SMS and CRM capabilities in the education sector

Proven experience in delivering complex projects on time and within budget

Proficiency in project management methodologies and tools

Analytical mindset with strong organisational skills and attention to detail

Ability to work under pressure and adapt to changing priorities




Additional Requirements

Successful candidate will be required to provide:

A valid Victorian Employee Working with Children Check (WWCC)

A National Police Check

How to Apply

Click Apply to submit your application through Melbourne Polytechnic’s careers portal. There, you will be able to view the full Position Description and upload your documents.

Please:

Complete all pre-screening questions

Upload your CV and a brief cover letter (maximum 2 pages) outlining how your skills, experience, and personal attributes align with the Key Skills and Experience in the PD

If applying for a teaching role, upload combined copies of your relevant qualifications and provide your USI VET Transcript (if available):

Include the transcript link (from your USI Student Portal) in your coverletter, and upload the transcript PDF under thequalifications section

File Requirements:

Each file must be under 2MB. PDF is preferred (Word .doc or .docx also accepted). Avoid special characters in filenames (e.g., ! @ # % *).

Selection Process

Our process includes:

An interview (in-person or via Microsoft Teams)

Reference checks

Employment and qualification verification

Questions?

Contact: Recruitment Team

Email: recruitment@melbournepolytechnic.edu.au

Diversity and Inclusion

Melbourne Polytechnic is an equal opportunity and child-safe employer. We strongly encourage applications from Aboriginal and Torres Strait Islander peoples, people with a disability, people from diverse cultural backgrounds and gender identities.




Recruitment Agencies

Melbourne Polytechnic manages all recruitment directly. We do not accept unsolicited applications from agencies unless engaged through the State Purchasing Contract and with prior written approval."
87615253,Loyalty Strategy Specialist,Virgin Australia,https://www.seek.com.au/job/87615253?type=standard&ref=search-standalone&origin=jobCard#sol=6f83781718515f64ad84b2a043f4befff7432b1a,2h ago,2.0,2025-10-02T23:00:00+00:00,Sydney NSW (Hybrid),Strategy & Planning (Consulting & Strategy),Full time,,"Step into an exhilarating journey with Velocity Frequent Flyer Virgin Australia’s award-winning loyalty program with over 13 million Members and counting. We make rewards fast and meaningful — from dream holidays and upgrades to retail, fuel, and everyday perks.

Velocity is all about smart, simple, and speedy rewards. As part of our vibrant team, you’ll help deliver unforgettable value to millions of Australians — all while enjoying the perks of working for one of the country’s most loved travel brands.

 

As the Loyalty Strategy Specialist, you’ll help shape the future of Velocity Frequent Flyer by designing and delivering strategies that bring our Member Value Proposition to life. Working closely with senior leaders, you’ll use insights, data, and market intelligence to create innovative and compelling propositions that deepen Member engagement and drive long-term growth.

If you’re a strategic thinker with a passion for Member centricity and creating customer-first propositions that deliver commercial impact, this role will give you the platform to make a real difference.

 

In addition, you will:  

Translate business strategy into Member-focused propositions that drive engagement, retention, and lifetime value.
Apply design thinking principles to uncover unmet needs and shape differentiated loyalty experiences.
Use data, analytics, and Member feedback to uncover opportunities and shape innovative loyalty offerings.
Build and deliver business cases that demonstrate clear value for both Members and the business.
Collaborate with Commercial, Digital, and Technology teams to deliver compelling member and program propositions.  
Contribute to loyalty innovation projects, exploring new ways to reward and engage Members.
Provide insights and recommendations to senior leadership, influencing investment and direction.
Support cross-functional programs that deliver personalised, rewarding Member journeys.
Stay across competitor and market trends to ensure Velocity remains differentiated and ahead of the curve.
ds to ensure Velocity remains differentiated and ahead of the curve.

 

You’ll be great in this role if you:

A degree in Business, Commerce, Marketing, or a related field.
3–5 years’ experience in strategy, consulting, customer experience, or loyalty.
A track record of delivering insights-led strategies that improved customer or Member outcomes.
Strong analytical skills, with experience in frameworks like CLV, NPS, CVP development, or segmentation.
Commercial acumen with the ability to link Member initiatives to measurable business value.
A collaborative, innovative mindset with the confidence to influence senior stakeholders.
Experience in loyalty or aviation (desirable but not essential).

 

What you’ll get from us:

We’re committed to looking after you, with some of the best benefits and conditions in the industry – including (but not limited to):

Heavily discounted air travel for you and your loved ones (including $1000 worth of travel credits per year)
Flexible working arrangements (including work hours and work from home)
Discounts on travel insurance, car hire, accommodation and experiences worldwide
Discounted Virgin Australia Lounge Membership
Hospitality, retail, technology, beauty services and wellness discounts
Wellness support, including the Converge digital wellbeing platform
A comprehensive Employee Assistance Program, which offers confidential coaching and support from qualified professionals for all aspects of life – physical, mental, social and financial
Dress for Your Day – enjoy the freedom to wear whatever is appropriate for the type of work you do and the day you have ahead of you

 

Equality rules:

We’re all individuals. We love that. That’s why we encourage applications from Indigenous Australians, people with disability, those from diverse cultural backgrounds, our friends in the LGBTQIA+ community, and anyone else who wants to join our family. 

Ready to apply? We’re ready to hear from you. Apply now."
87615021,Senior Business Analyst,Robert Half,https://www.seek.com.au/job/87615021?type=standard&ref=search-standalone&origin=jobCard#sol=ebb7095273719dbded85bd112f5c7706f24cd2f9,2h ago,2.0,2025-10-02T23:00:00+00:00,Sydney NSW,Business/Systems Analysts (Information & Communication Technology),Full time,$150k - $170k p.a.,"The Company

The organisation is a private credit institution undergoing digital and operational transformation.

The Role

You will play a key role in shaping and delivering business and technology initiatives, including process optimisation, system enhancements and considerable uplift in the organisations lending platform.

Your Profile

- Experience as a business analyst in financial services

- Strong ability to analyse complex business problems and develop effective solutions

- Excellent verbal and written communication skills to interact with stakeholders at all levels

- Proficiency in business analysis and project management tools and methodologies

Apply Today

Please send your resume by clicking on the apply button.

Reference Number: (06800-0013310504)

By clicking 'apply', you give your express consent that Robert Half may use your personal information to process your job application and to contact you from time to time for future employment opportunities. For further information on how Robert Half processes your personal information and how to access and correct your information, please read the Robert Half privacy notice: https://www.roberthalf.com/au/en/privacy. Please do not submit any sensitive personal data to us in your resume (such as government ID numbers, ethnicity, gender, religion, marital status or trade union membership) as we do not collect your sensitive personal data at this time."
87614972,Business Analyst - Superannuation,Robert Half,https://www.seek.com.au/job/87614972?type=standard&ref=search-standalone&origin=jobCard#sol=9e3aa6a87e3926bd34729f05062dd2d61a1205d2,2h ago,2.0,2025-10-02T23:00:00+00:00,Sydney NSW (Hybrid),Business/Systems Analysts (Information & Communication Technology),Full time,$140k - $160k p.a. + Super,"Newly created job for a Business Analyst with expertise in the Superannuation industry.

The project you will be working on will be focused on data integrity and remediation.

This role blends deep analytical capability with technical skills and project leadership to ensure the Fund delivers accurate member-focussed outcomes, with the Business Analyst responsible for interrogating problem spaces, documenting findings and deliver project outcomes in line with regulatory requirements, member expectations, and our organisational strategy.

Skill set / Experience needed -

Proven background working as a Business Analyst in the Superannuation domain or a regulated financial services environment
Project experience across data integrity and/or remediation
Experience partnering with internal risk, technology and data, and operations teams and external providers including the Administrator to ensure data lineage, quality, integrity and risks are understood and embedded into solution designs
RG146 accreditation (or willing to undertake) (desired)
Strong knowledge of superannuation operations and regulatory obligations preferred, with industry qualifications (RG146 or equivalent) highly regarded
Strong analytical and problem-solving skills, with proficiency in data analysis (SQL, Excel, or BI tools) desirable
Solid understanding of systems integration, data flows and operational processes desirable
Excellent skills in stakeholder management and facilitating discussions across various levels of seniority
Collaborative and pragmatic mindset, with the ability to build and maintain strong working relationships with colleagues, clients, and key stakeholders
Ability to balance detail-oriented analysis with delivery-focussed project oversight
Ability to work within a self-directed culture and navigate ambiguity
Possess intermediate to advanced level skills, knowledge and experience in the practical application of Microsoft Office applications including but not limited to SQL, Word, Excel, PowerPoint, SharePoint and Outlook.
A broad understanding of business and information technology including database management.

This role will start as a 12 month fixed term contract with the view to make it permanent thereafter.


The client offers a very flexible workplace, 1-2 days in office per week.

Reference Number: 06800-0013310513

This is a hybrid position - 1-2 days in office per week.

By clicking 'apply', you give your express consent that Robert Half may use your personal information to process your job application and to contact you from time to time for future employment opportunities. For further information on how Robert Half processes your personal information and how to access and correct your information, please read the Robert Half privacy notice: https://www.roberthalf.com/au/en/privacy. Please do not submit any sensitive personal data to us in your resume (such as government ID numbers, ethnicity, gender, religion, marital status or trade union membership) as we do not collect your sensitive personal data at this time."
