Job ID,Job Title,Company,Detail URL,Posted Label,Hours Old,Posted Datetime (Local),Location,Category,Work Type,Salary,Ad Text
87614716,Commercial Finance Analyst,RECODE GROUP,https://www.seek.com.au/job/87614716?type=standard&ref=search-standalone&origin=jobCard#sol=62e4873a5c364985de7fb2a0ff54479fb66f2ba7,3h ago,3.0,2025-10-02T22:00:00+00:00,"Parramatta, Sydney NSW",Analysis & Reporting (Accounting),Contract/Temp,Excellent day rate on offer; Genuine temp to perm,"ASSIGNMENT:
Genuine temp to perm opportunity. 4-6 month contract engagement to start with.
 
SALARY:
Impressive day rate on offer. Immediate start is preferred.
 
LOCATION:
Sydney - Parramatta Surrounds. Free parking available on-site. You ideally have a drivers license and your own vehicle as the location is not close to public transport.
 
ABOUT THE COMPANY:
We have been exclusively retained by a high growth Australian manufacturer who is a specialist within their industry and are recognised as one of the market leaders in their field.
 
With a prominent brand and instant recognition, they possess over 50 years of experience and have significant presence across NSW. They have built one of the best reputations and brands within the market through their high-quality service offering and genuine focus on customer experience. Through this, they have created an amazing culture of collaboration and true alignment of values evident from their consistently high eNPS and average retention of staff of more than 5+ years.
 
Servicing thousands of customers across the region, this organisation has a strategic vision to double in size over the next 3-5 years.
 
ABOUT THE ROLE:
Reporting to a highly influential CFO, this FP&A Analyst will support the delivery of major finance objectives as the organisation aims to continue its growth journey. The FP&A Analyst will act as a true partner and 2IC to the CFO and Executive Leadership Team to provide ongoing strategic support, change management, transformation and efficiency improvements. The ideal candidate will also be responsible for leading and driving new improvements across reporting, FP&A and best in class processes.
 
As the FP&A Analyst, you will take full ownership for the strategic delivery of business results. The FP&A Analyst has primary day-to-day responsibility for supporting business strategies to add value beyond finance across a broad range of stakeholders and providing leadership to the finance team. The key success factor will be your ability to business partner to deliver key results and improvements.
 
This role not only requires an excellent technical and analytical mind but also someone that can think outside of the box and not be afraid to challenge the status quo.
 
KEY RESPONSIBILITIES:
Reporting to the CFO and working in partnership with the senior leadership team, your key responsibilities will include:

Act as a true partner to the Executive Leadership Team to support business strategy and financial direction;
Financial Planning & Analysis – manage and oversee the commercial planning and reporting function including budgeting, forecasting and annual planning process ensuring strategic alignment to business objectives as well as partnering with cross functional leaders across the organisation;
Business Performance Analysis - Provide insights and build business acumen through analysis of data to support commercial decision making;
Commercial management - pro-actively driving risk & opportunity analysis, volume rate mix analysis, contract negotiation, trading terms, financial modelling and business cases;
Assess financial performance across the business to devise and refine key deliverables and KPIs to meet financial objectives;
Spearhead improvements and best practise across finance transformation including new reporting, systems and processes;
Work closely with leadership team on long term strategic business plans;
Be a key project lead for driving continuous improvement initiatives across the finance group.
 
SKILLS AND EXPERIENCE:
You are CA/CPA qualified with a strong passion for business and transformation. You have demonstrated achievements and track record in driving best practise across FP&A, reporting and systems.
 
Overall, you have a vision to fast track your career towards a true leadership role within the next few years by proving yourself in a broad finance role in a fast-growing high performing organisation.
 
You will bring to the role strong commercial acumen, vision for growth, and a passion for best in class processes. You will have a track record of adding value through an absolute understanding of key business drivers; the capacity to drive change; and the ability to influence performance.
 
This is a mid-sized high growth business therefore, you must display the hunger, energy and drive that you are willing to be hands-on, not afraid of a challenge whilst having the gravitas to communicate and influence an impressive Executive Leadership team.
 
Culture fit is key, our client is a privately owned, high growth business. The FP&A Analyst needs to have immediate credibility and be able to earn the trust and confidence of the CFO, COO, CEO, the broader finance team and the executive leadership team. You will demonstrate proven commercial acumen and strategic thinking supported by a high level of competency in finance management. You will have significant experience in working with, advising and/or supporting senior leaders.
 
In addition, you will have:

Solid accounting foundations.
Commercial finance acumen with a proven track record of actively driving commercial agendas across the business.
Experience implementing, delivering and managing new systems and reporting tools.
Intermediate/Advanced excel and modelling skills.
Highly developed written & verbal communication skills with the ability to effectively manage a wide range of key stakeholders.
Pro-active and customer focused mind set.
The ability to work under pressure and manage conflicting priorities.
Key eye for detail and the ability to thrive in a fast paced environment.
Superior stakeholder management, including advanced influencing and negotiation skills.
 
BENEFITS AND PERKS:
This organisation will provide the right analyst the opportunity to build the FP&A pillar for the group and be instrumental in growing the enterprise value for the group. In addition, other key benefits include:

Outstanding opportunity to partner with a prominent CFO, CEO and Executive Leadership team and prove yourself in a highly successful fast growth organisation;
Access to an inspirational leadership team who have been awarded and recognised as some of the best in the industry;
Work for a leader who lives and breathes their purpose and values in everything they do having also been recognised in the industry for top class leadership;
Opportunity to be part of a service consumer category that you will love and be proud about;
Be part of a highly engaged, winning team with a genuine positive culture;
Highly strategic and commercial role with longer term future development pathways;
Own the FP&A finance function providing you with unlimited opportunity to make a difference. The destiny is truly in your hands;
A workplace that's strongly focused on customer experience and on the well-being and happiness of its staff.
 
APPLY:
If you are ready to RECODE your career, please apply clicking the link and send your resume in word format. For a confidential discussion, please reach out to Richard Skaf directly on richard.skaf@recodegroup.com.au.
 
FOLLOW US:
Follow Recode Group on LinkedIn and visit www.recodegroup.com.au for further information and for other interesting job opportunities."
87614221,Senior Acquisition Analyst - Build to Rent,Mirvac,https://www.seek.com.au/job/87614221?type=standard&ref=search-standalone&origin=jobCard#sol=c58272d9b3f1a3907a986ef19c711ebac28b405a,3h ago,3.0,2025-10-02T22:00:00+00:00,Sydney NSW (Hybrid),"Commercial Sales, Leasing & Property Mgmt (Real Estate & Property)",Full time,,"Mirvac is a brand that creates and curates better experiences. We are more than developers or builders - we are visionaries, and our ability to see the world differently drives us to be bold, embrace innovation and diversity, and lead with optimism.

As creators of positive change, we see each new project as an opportunity to leave a lasting legacy, delivering enduring value for all Australians. We focus on sustainability, innovation, and shared value, to return benefits to our customers, partners, investors, and communities.

Join us as we work towards building the imagine nation.

At Mirvac, we know that it's our people, their passion and expertise and the exceptional experiences we create for our audience, that defines us.

Your opportunity

As the Senior Acquisition Analyst - Build to Rent, you will be reporting to the National Acquisition Manager (BTR) - New Business. Primarily support the Build to Rent New Business team to execute strategy and key deliverables through feasibility and investment modelling and analysis, keeping abreast of market transactions and underwrite assumptions

Your responsibilities will include:

Build and maintain financial models underpinning new business opportunities and investment strategies. This includes building development and investment models, running various scenarios to test different strategies and producing succinct summaries of the results.
Ensure that each financial model is logic and in line with industry practice
Keep abreast of market developments and valuation assumptions and practices.
Drive optimisation of the financial outcomes, assessing options and recommending strategies which underpin value and achieve a ""highest and best use"" analysis and best-case scenarios.
Perform project level budgeting and forecasting in coordination with the transaction feasibility models.
Understanding of cash and capital impacts of all major decisions and investments.
Ensure modelling is undertaken in a manner consistent with the transaction structure.
Research and analyse demographic, economic, and planning data to support strategic site selection
Prepare competitor analyses and market intelligence reports.
Work collaboratively with the broader Mirvac business particularly development, construction and operations to ensure robust cashflow management and forecasting in place, building an improved focus on cashflow outcomes.
Manage the successful transition and handover of transaction modelling to development, investment and operations as applicable.
Prepare project new business and scenario analysis and conduct ad hoc scenario modelling and analysis where required.
Assist in preparing investment committee papers, presentations and supporting documentation.
Support senior team members in liaising with internal and external stakeholders including capital partners.

Your point of difference

At least 4+ years analytical experience working as an analyst within the property or capital markets industry, preferably within a development or capital transactions environment
Strong financial background
Experience in building, amending and testing of financial models
Experience or knowledge of development and investment with an understanding of relevant accounting principles
Experience in preparing reports and presentations to be delivered to a range of stakeholders
High level communication (written and verbal) and stakeholder management skills
Well-developed analytical and problem-solving skills
Strong financial modelling skills in Excel and comfort with large datasets
Understanding of property valuation methodologies and investment metrics
Strong research, analytical, and report-writing skills
Self-motivated and inquisitive

All of these attributes are preferred, if you think you may be the right fit for the role please still apply"
87614136,FP&A Analyst,Vivi International Pty Ltd,https://www.seek.com.au/job/87614136?type=standard&ref=search-standalone&origin=jobCard#sol=c5a0623a362f8a4cb81a5340ca7a29763c844921,4h ago,4.0,2025-10-02T21:00:00+00:00,"South Yarra, Melbourne VIC (Hybrid)",Analysis & Reporting (Accounting),Full time,,"Who is Vivi 

Vivi is the only wireless screen mirroring and digital signage tool designed for education. We help IT help teachers help students with classroom technology that enhances collaboration, control, and creativity.  

Vivi exists because we all had that one teacher who changed our life, who went above and beyond to serve as a role model and sage. They guided discussion, connected with their students on a personal level, were just as engaging and entertaining as they were educational, and they created a dynamic learning environment by constantly involving students.

Those teachers are the masters of the social classroom. Personalised learning environments have been proven to deliver better educational outcomes for individuals through increased participation and engagement. To successfully create such an environment requires a fluid, visual dialogue between teacher and student. This is why Vivi exists. Vivi is used by over 825,000 teachers and students around the world and is setting out to disrupt the enormous education industry with our high-growth, ambitious, and creative team. In this rapidly evolving technology landscape, Vivi is always looking for new ways to disrupt the classroom experience, enhance customer experiences and expand globally.

Opportunity Overview: 

The FP&A Analyst will play a critical role in driving financial planning, budgeting, forecasting, and performance analysis across the business. The role works closely with stakeholders across Product, Sales, Customer Success, Marketing, Operations, Human Resources, and Executive Leadership to turn data into insight—and insight into action.

This is a high-impact role where financial expertise and business acumen will help shape key decisions as we scale our operations and product offerings.

This role is hybrid and is 3 days/week in-office at our South Yarra location. 

What you will do:

Collaborate with department heads to influence commercial decisions and drive profitability

Provide financial guidance on pricing, product launches and go-to-market strategies

Translate complex financial data into clear, actionable insights for non-finance stakeholders

Lead budgeting, modeling, and forecasting across different departments

Deliver monthly reporting packs with variance analysis and executive commentary

Build dynamic financial models to support scenario planning and investment decisions

Analyse key SaaS metrics including ARR, MRR, churn, CAC, LTV, and NRR

Partner with Sales and Marketing to assess campaign ROI and customer acquisition efficiency




What you will need:

You’re not just good with numbers—you’re curious about what they mean. You ask ‘why’ and ‘what if’ to turn data into decisions

CA/CPA qualified

5+ years' experience in FP&A, commercial finance, or business partnering roles

Prior exposure to SaaS, tech, or subscription-based business models highly desirable

Strong financial modelling skills

Demonstrated ability with BI tools and dashboard creation

Exceptional communication skills and ability to present to the Executive Team

Commercial mindset with a passion for data-driven strategy

Vivi is an equal opportunity employer. This means we are committed to recruiting, training, compensating and promoting our employees regardless of Race, Color, Ancestry, National Origin, Religion, Creed, Age, Disability, Sex, Gender, Sexual Orientation, Gender Identity, Gender expression, Medical condition, Genetic Information, Marital status, or Military or Veteran status. As an education technology organization, we are dedicated to reflecting the diversity, multiculturalism, and inclusion found in our consumers, employees, and partners. Inclusion is at the heart of what we do, from the way we craft our job descriptions to the values we champion daily."
87611403,Senior Business Analyst - FinOps,Suncorp,https://www.seek.com.au/job/87611403?type=standard&ref=search-standalone&origin=jobCard#sol=9c5a2cdf2a3fe1f60c37663c395111ba67caadf4,11h ago,11.0,2025-10-02T14:00:00+00:00,Brisbane QLD (Hybrid),Business/Systems Analysts (Information & Communication Technology),Full time,Competitive Salary + Bonus + 50% WFH,"Must have experience or certification in FinOps
Strong understanding of financial principles and experience working in finance-related roles or environments.
Hybrid working model, supportive and collaborative culture.

 Overview of the role

This is a fantastic time to be joining Suncorp as the industry goes through significant change. As a result, we are seeking a proactive and detail-oriented Senior Business Analyst to support the establishment and ongoing operations of our new FinOps Centre of Excellence (CoE). This role will play a key part in driving cloud financial accountability and operational efficiency across the organisation.

You will have the opportunity to join our large Analysis Chapter that supports a variety of medium to large scale programs across the Suncorp Group. The Chapter consists of around 280 like-minded analysts, where ideas and best practice are shared via masterclasses and knowledge sharing. You will support projects being delivered in a continuous delivery model (Agile) and supporting the platform.

Suncorp is proud of our fantastic culture where you will be supported in your career development.

 What you’ll do:

Build strong relationships through engagement with colleagues, and stakeholders across Business and Technology.
Document current and future state processes and identify opportunities for improvement.
Use information gathering techniques to proactively discover requirements and synthesise information accurately, completely, and coherently.
Work collaboratively with delivery teams and business stakeholders to gather, validate and document business requirements and develop recommendations and solutions that meet business and customer needs.
Raise, and support mitigation and resolution of, risks and issues using established tools and frameworks were applicable.
Create detailed user stories (in JIRA) to support delivery.
Mentor/train team members; participate and contribute to business analyst chapter and/or forums providing insights and thought leadership
Suncorp offers a hybrid way of working where you will be expected to be in the office approx. 2 days per week.

 

What you’ll bring:

FinOps Knowledge: Experience or certification in FinOps practices is highly desirable
Cloud & Container Technologies: Familiarity with cloud platforms (e.g., AWS, Azure, GCP) and/or containerisation technologies
Financial Acumen: Strong understanding of financial principles and experience working in finance-related roles or environments.
Minimum 5 years Business Analysis experience in a project/delivery orientated role, from a large organisation.
Minimum 3 years’ Agile, Lean and waterfall experience including knowledge of Agile practices, workshops, and Agile ceremonies facilitation.
Must be able to translate and understand business and technical requirements and provide appropriate alternatives and solutions to meet those requirements.
Strong stakeholder engagement, relationship management and influencing skills including experience in dealing with various stakeholders.
Strong team player with a positive attitude, willingness to learn and desire to make a difference.
Must be able to manage multiple complex initiatives with competing deadlines.

 

What we can offer you:

Discounts and offers on a range of retail favourite stores as well as insurance products.
A range of flexible working and leave options, including 20 weeks paid parental leave, 4 weeks paid secondary carer parental leave and unlimited paid emergency response leave.
Invest in your brighter future with ongoing study support and career development programs.
Give back to our communities with payroll giving, donation matching and paid volunteer leave.
Prioritise your work/life balance with our robust employee assistance program and dedicated employee council.

 

About Suncorp:

For over 100 years Suncorp has been driven by our guiding Purpose – to build futures and protect what matters. To ensure we deliver on that Purpose, we’ve made a commitment, built on trust, empowerment, and flexibility – to help our people unlock their full potential and unleash their best and brightest selves. With the backing and support of some of the most trusted names in insurance, the Suncorp family provides our people with every opportunity to grow their career as they make a meaningful difference for our customers and our communities. We’re excited about what we can achieve together, working every day to be better, do more and realise the future we want to see just beyond the horizon.

 

If this opportunity sounds like the challenge you have been looking for, please apply online today. Applications sent directly via email will not be accepted.

 

Employee benefits | Suncorp Group

At Suncorp we believe we are our best when our workforce is as diverse, talented and passionate as the communities in which we live and operate, and where our people feel included, valued and connected. We are passionate about inspiring our people by creating a diverse, accessible, and inclusive culture, offering flexible work, career development and internal mobility, and building connected relationships amongst our team members and with our customers.

If you require any support and adjustments to participate equitably in our recruitment process or in the workplace, we encourage you to contact melissa.turkington@suncorp.com.au for a confidential conversation."
