Job ID,Job Title,Company,Detail URL,Posted Label,Hours Old,Posted Datetime (Local),Location,Category,Work Type,Salary,Ad Text
89191859,Head of Finance Systems & Data Analytics,RACV,https://www.seek.com.au/job/89191859?type=standard&ref=search-standalone&origin=jobCard#sol=55a0e038cbf50bb85fba4bec762a74d7591efda1,4h ago,4.0,2025-12-17T03:00:00+00:00,Melbourne VIC (Hybrid),Systems Accounting & IT Audit (Accounting),Full time,,"Melbourne, Victoria | RACV Head Office
Permanent Full Time | Hybrid Working (4 days a week in office)
A Competitive Salary | Discounts on Selected RACV Products
New Senior Finance Leadership role – a rare opportunity to build something exceptional

RACV is one of Australia’s most trusted organisations, providing a diverse range of services across motoring, insurance, travel, leisure, and home. With a strong legacy of innovation and a member-first ethos, we are seeking a strategic and technical leader to drive the future of our finance technology ecosystem.

About the Opportunity

We are seeking  a seasoned finance systems leader who thrives in ambiguity and excels at building capabilities from the ground up. With the introduction of Oracle Fusion Cloud ERP, we need a resilient, adaptable leader to establish the foundations, governance and team that will define our finance technology future.

As Head of Finance Systems and Data Analytics, you’ll be Oracle Fusion System Owner, you will be the gate-keeper of our new platform, standing up frameworks, building your team to lead the solution design, governance, and operational health of our core finance technology.

You will also be accountable for establishing and operating the Finance Data Governance Framework, ensuring every financial record is accurate, trusted, and transformed into timely, actionable insights.

Reporting to the GM Finance Transformation, this is a critical, hands-on leadership role that requires deep technical expertise in finance systems and a proven ability to lead finance data strategy in a complex, multi-system enterprise. This is an opportunity to make your mark and be part of an exciting finance transformation.

Come along for a new journey

You will partner closely with Finance, Technology, and the PMO to deliver scalable, future-ready systems. What makes this role exciting:

Build from the ground up: Establish the new Finance Systems team that will manage and support a suite of finance systems in the CFO division. 
Shape the future: You’re not inheriting legacy constraints; you’re designing the blueprint for finance technology at one of Australia’s most trusted organisations
Develop your team; Recruit, coach and build a high performing team with specialist skills in Oracle Fusion and data analytics
Be the gatekeeper: Own system integrity, controls and compliance while balancing the agility needed to support evolving business needs.
Navigate complexity: Work across Finance, Technology, business units and external partners, pivoting as priorities shift and requirements emerge.

Your main focus areas include:

Finance System Ownership & Configuration Leadership

Act as the Oracle Fusion System Owner, accountable for the operational system health, configuration governance, and quarterly updates.
Exercise functional design authority for all Oracle Fusion configurations, extensions, security, and integration design.
Own and govern the single Finance integration catalogue, data flows, and error-handling standards.
Direct all build, functional testing, regression testing, and release management activities for projects and quarterly updates.

System Support & Administration

Own the Finance Systems Health & Performance Dashboard and associated SLAs (availability, incident response, error rates).
Act as the Finance escalation owner for P1/P2 incidents, coordinating rapid resolution with Technology and AMS partners.
Govern segregation-of-duties, access controls, data privacy, and lead functional contribution to disaster recovery and cyber assurance testing.
Manage licensing consumption and optimisation of all finance systems.

Finance Data Governance & Master Data Stewardship

Establish, chair, and evolve the Finance Data Governance Council, policies, and operating rhythm, ensuring alignment with enterprise standards.
Define and maintain the single source of truth for finance data definitions, data glossary, ownership, and data lineage.
Own and govern the creation, maintenance, and decommissioning of all finance master data (Chart of Accounts, cost centres, suppliers, etc.).
Direct continuous data quality monitoring, root-cause analysis, and cleansing programs.

Finance Reporting & Analytics Strategy

Own the finance reporting and analytics roadmap (including Fusion Data Intelligence, OTBI, FRS, Oracle Analytics Cloud, and future data platforms).
Deliver and govern self-service analytics capabilities for Finance and approved business consumers.
Partner with the Enterprise Data, Strategy & Analytics team to ensure finance data assets are catalogued, discoverable, and reusable.

Stakeholder and People Leadership

Lead, coach, and develop a high-performing team, fostering innovation and professional growth.
Act as the key liaison for finance system vendors, consultants, and implementation partners.
Collaborate effectively with the Finance Leadership Team, Technology, Legal, and Business Units to embed data governance and align systems with strategic goals.

What you’ll need to be successful

Tertiary qualification in Accounting, Information Systems, or a related field.
10+ years' extensive experience managing finance systems and integrations in a complex, multi-system environment.
Proven track record of delivering at least two full-cycle ERP implementations or major cloud migrations as functional lead.
Deep functional understanding of core financial processes (GL, AP, AR, budgeting, reporting, procurement).
Deep understanding of financial data models, ERP structures, and reporting processes.
Proven ability to design and implement data governance frameworks and controls.
Excellent stakeholder management, leadership, and communication skills.

Highly Desirable

Experience in managing Cloud ERP and EPM, ideally Oracle Fusion.
Postgraduate qualification or professional certification (MBA, CPA/CA, CDMP, DAMA).
Experience with modern integration patterns (API frameworks) and analytics tools (Power BI, Tableau).

There’s so much on offer when you join RACV with benefits including

Our flexible and informal work environment which helps bring balance between work and home.
Generous discounts on home and car insurance policies and RACV roadside care
Great discounts across all RACV resorts
Discounts from corporate partners that are updated monthly.

Our difference

At RACV, we believe that maintaining a diverse and inclusive workplace is an important element in our continued success. We want our people to feel welcome, supported and appreciated for who they are and what they bring to our business. If you require any reasonable adjustments to the recruitment process and/or the role, please let our Talent Acquisition Team know.

Application process  

You can learn more about the RACV at careers.racv.com.au 

Applicants will be required to provide evidence of their eligibility to work in Australia, and consent to a criminal record check. 

At RACV, we believe that maintaining a diverse and inclusive workplace is an important element in our continued success. We want our people to feel welcome, supported and appreciated for who they are and what they bring to our business. If you require any reasonable adjustments to the recruitment process and/or the role, please let our Talent Acquisition Team know."
89197545,Lead Innovation Business Analyst,Rabobank,https://www.seek.com.au/job/89197545?type=standard&ref=search-standalone&origin=jobCard#sol=7509561c6351add829a80a2f7ea9159dff1bca5e,4h ago,4.0,2025-12-17T03:00:00+00:00,Sydney NSW,Business/Systems Analysts (Information & Communication Technology),Full time,,"Job Title
Lead Innovation Business Analyst Job Description


Authorisation/Sign-Off Levels: 
Quantitative Information:
• Nil Policy and Decision-Making Freedom:
• Oversight of Innovation Program Business Analysts.
• Anticipate and act on customer needs quickly and effectively.
• Create an environment of accountability.
Key Relationships:
Internal
• Sales & Marketing Innovation Team, Product Owner & Development squads
• Sales & Marketing Innovation Leadership team
• CPO Product Leads & Product Owners
• COO Domain, including Business Analysts, Developer peers
• Country Banking Leadership team AU & NZ
• Heads of Relationship Management & Area Managers
• Country Banking Branch Staff AU & NZ 
• General Manager Business Development
• Business Development Team
• Marketing team AU & NZ
• Deposits team AU & NZ
• Regional Call Centre
• Legal, Risk & Compliance AU & NZ
• Global IT, Analytics (Head Office)

External
• Clients
• External partners and suppliers
Key Performance Indicators (KPIs):
• Feedback from Program Business Lead, Product Owner and team members, other Product Owners and IT teams, Business SMEs and stakeholders, systems users including Country Banking Australia and New Zealand frontline and marketing staff.
• Delivery of specifications enabling effective business outcomes.
• Successful implementation of digitalisation and processes.
• Ability to influence and motivate as appropriate.
• Ability to manage relationships at all levels.
• A desire to promote innovation and continuous improvement.
• Demonstrate and promote general risk management awareness and practices, including ensuring that employees adhere to Rabobank policies, procedures and values."
89190511,Business Intelligence Developer,Morgans Financial Limited,https://www.seek.com.au/job/89190511?type=standard&ref=search-standalone&origin=jobCard#sol=d01e180b43b80c260773e89a8203c96c09083ba3,4h ago,4.0,2025-12-17T03:00:00+00:00,Brisbane QLD,Other (Information & Communication Technology),Casual/Vacation,,"The Opportunity

Morgans is seeking a dynamic Business Intelligence Developer to join our iServices team. In this role, you’ll deliver modern data solutions to support strategic decision-making, including implementing a cloud data platform (FiveTran, DBT, Snowflake, PowerBI, Salesforce), enabling enterprise reporting, and building automated data warehousing. You’ll apply advanced SQL and modelling techniques—Relational, Dimensional, DataVault, Salesforce Object Model, PowerBI Tabular, and DAX—while documenting data definitions and providing backup support to the BI team. This is a great opportunity for a proactive professional passionate about turning data into actionable insights.

What you will be doing

Deliver major project outcomes within agreed timeframes and quality standards.
Collaborate with developers, project managers, and business analysts to design, maintain, and enhance BI applications.
Develop and maintain change control and testing processes for data models and databases.
Produce ad-hoc queries, reports, and curated datasets to meet business needs.
Identify opportunities to improve data delivery, capture, and business processes through technical solutions.
Document data definitions and ensure clarity for stakeholders.
Provide support for the smooth operation of the iServices team as required.

What you will bring

5+ years’ experience in data-related projects (BI, data management, migrations, or database development).
Strong SQL skills, including complex functions, scripts, stored procedures, views, and triggers.
Expertise in data modelling (Relational, Dimensional, DataVault) and database design best practices.
Experience with data analysis, reporting, and PowerBI (including Tabular models and DAX).
Familiarity with software development lifecycle, DBT or similar BI automation tools, and Azure DevOps.
Demonstrated experience (Minimum 2 years) in modern cloud data platform (FiveTran, DBT, Snowflake, PowerBI)
Strong analytical, problem-solving, and attention-to-detail skills.
Excellent communication and interpersonal skills with the ability to work collaboratively.
Self-motivated with effective prioritisation and deadline management.

Desirable

Experience with Snowflake, Salesforce, FiveTran, JAMS scheduling.
Programming skills in C# and PowerShell.
Exposure to Agile/SCRUM methodologies and finance industry.
Tertiary qualification in IT or related discipline.

About Morgans

Morgans is Australia’s largest full-service stockbroking and wealth management network providing a range of wealth management, investment advice and corporate finance services. We pride ourselves on our people, expertise, core values, and diversity.

Yes, I want to apply!

If you are interested in this role and would like to join the Morgans team, please click apply and submit your cover letter and resume.

We believe in creating opportunities for everyone and welcome applications from people with diverse backgrounds and experiences. We can’t wait to hear from you!

Benefits

Eligible to participate in bonus scheme.
Learning and development opportunities including Morgans' Mentoring program.
Positive impact on the community through the Morgans Foundation and paid volunteer days."
89190379,Customer and Market Insights Manager,Energy Power Systems,https://www.seek.com.au/job/89190379?type=standard&ref=search-standalone&origin=jobCard#sol=e4d5a8e7d48402e13c38c6625a20c59b4af496f4,4h ago,4.0,2025-12-17T03:00:00+00:00,"Mulgrave, Melbourne VIC (Hybrid)",Market Research & Analysis (Marketing & Communications),Full time,,"Energy Power Systems Australia (EPSA) is an authorised supplier of Cat® power systems in Australia, PNG, and the Solomon Islands. As a leading provider of sustainable energy solutions, EPSA provides new and used engines, generators, batteries, and hybrid energy systems for a broad range of industries. We also specialise in rental solutions for power generators, compressors, and temperature control systems. We are committed to providing our customers with the sustainable power they need, leading the way for renewable energy with Cat® Hybrid Energy Systems incorporating battery energy storage.

At Energy Power Systems Australia (EPSA), we keep the country moving. From powering major infrastructure projects to delivering reliable energy solutions for mining, construction, and industry.

Now, we’re seeking a Customer & Market Insights Manager to join our team at the Mulgrave head office. This is your opportunity to lead customer and market intelligence, deliver actionable insights, and shape strategic decisions that drive EPSA’s growth.

This role offers a hybrid working arrangement, with regular collaboration at our Mulgrave head office.




Why you’ll love this role:

Lead the development and execution of customer and market insights strategy for a dynamic, future-focused business.

Drive continuous improvement in data analytics, reporting, and research practices.

Collaborate with senior management, commercial, and sales teams to influence strategic decisions.

Own market research, customer segmentation, competitor analysis, and trend forecasting.

Influence business planning and growth initiatives with data-driven recommendations.

Competitive salary and a culture that values safety, accountability, and excellence.

Career development opportunities in a leading energy solutions provider.




What you’ll be doing (but not limited to!):

Develop and deliver EPSA’s customer and market insights strategy.

Analyse market trends, customer behaviour, and competitor activity to identify opportunities.

Design and implement research projects, including customer satisfaction and market analysis.

Provide actionable insights through dashboards, reports, and presentations to senior stakeholders.

Support pricing, segmentation, and commercial strategies with robust data analysis.

Monitor industry developments and economic indicators impacting key sectors (resources, utilities, defence).

Drive continuous improvement in analytics and reporting frameworks.

Ensure compliance with corporate governance, policy, and risk controls.


What makes you successful:

Proven experience (ideally 7+ years) in customer experience, customer insights, or service design within complex B2B environments.

Demonstrated ability to design and manage customer research programs, including Voice of Customer (VoC), journey mapping, and segmentation initiatives.

Strong analytical and storytelling skills—able to translate qualitative and quantitative data into meaningful insights and strategic action.

Experience with market intelligence, competitor analysis, and leveraging market segmentation data to inform business decisions.

High-level influencing skills and the ability to work across silos to embed customer-first thinking.

Familiarity with CX measurement frameworks (e.g., NPS/NLS, customer journey maps, VoC strategies).

Excellent stakeholder engagement and communication skills, with the ability to present insights clearly to senior leaders.

Strong project management capability, with a track record of delivering enterprise CX initiatives on time and on budget.

Tertiary qualifications in Marketing, Business, Economics, or a related discipline are highly regarded.

Experience in the energy, industrial, or related sectors is desirable.


Why work with us? Here are some of the benefits of working for EPSA: 

Seamless Onboarding Experience: Start strong with our centralised induction program at our Mulgrave (VIC) head office, designed to set you up for success. 

Celebrate You: Enjoy paid leave on your birthday and take time to give back with volunteer leave. 

Exclusive Discounts: Access a wide range of retail discounts, plus special pricing on CAT® merchandise and health insurance. 

Drive Your Way: Take advantage of our vehicle novated lease options to make your commute more rewarding. 

Support for Families: We offer paid parental leave to support you during life's most important moments. 

Refer & Be Rewarded: Earn generous rewards through our team member referral program. 

Grow with Us: Upskill with job-relevant education support, including access to Cat® University and other learning & development opportunities. 

Recognition Matters: Be celebrated through our Employee Recognition Program and Service Awards. 

Wellbeing First: Access confidential support anytime through our Employee Assistance Program (EAP). 


Ready to shape the future of customer experience and market intelligence at EPSA?

If you’re passionate about turning insights into action and want to make a real impact in a dynamic, solution-oriented business, we’d love to hear from you."
89190353,Business Analyst - Superannuation,Robert Half,https://www.seek.com.au/job/89190353?type=standard&ref=search-standalone&origin=jobCard#sol=d2d1fd018931142c16023dd74c724b1f076f1ff9,4h ago,4.0,2025-12-17T03:00:00+00:00,Sydney NSW (Hybrid),Business/Systems Analysts (Information & Communication Technology),Full time,$150k - $170k p.a. + Super,"Newly created job for a Business Analyst with expertise in the Superannuation industry.

The project you will be working on will be focused on strategic initiatives - impact assessments, policy review, governance analysis.

The Business Analyst responsible for interrogating problem spaces, documenting findings and deliver project outcomes in line with regulatory requirements, member expectations, and our organisational strategy.

Skill set / Experience needed:

Proven background working as a Business Analyst in the Superannuation domain or a regulated financial services environment
Project experience across strategy and/or transformation
Experience working with CxO level stakeholders to gather requirements re policy and governance changes
Experience conducting change impact assessments on policy and governance frameworks
Any experience on merger / de-merger projects would be beneficial
Strong knowledge of superannuation operations and regulatory obligations preferred, with industry qualifications (RG146 or equivalent) highly regarded
Excellent skills in stakeholder management and facilitating discussions across various levels of seniority
Collaborative and pragmatic mindset, with the ability to build and maintain strong working relationships with colleagues, clients, and key stakeholders
Ability to balance detail-oriented analysis with delivery-focused project oversight
Ability to work within a self-directed culture and navigate ambiguity
Possess intermediate to advanced level skills, knowledge and experience in the practical application of Microsoft Office applications including but not limited to SQL, Word, Excel, PowerPoint, SharePoint and Outlook.
A broad understanding of business and information technology including database management.

This role will start as a 12 month fixed term contract.


The client offers a very flexible workplace, 1-2 days in office per week.

Reference Number: 06800-0013352902

By clicking 'apply', you give your express consent that Robert Half may use your personal information to process your job application and to contact you from time to time for future employment opportunities. For further information on how Robert Half processes your personal information and how to access and correct your information, please read the Robert Half privacy notice: https://www.roberthalf.com/au/en/privacy. Please do not submit any sensitive personal data to us in your resume (such as government ID numbers, ethnicity, gender, religion, marital status or trade union membership) as we do not collect your sensitive personal data at this time."
89187671,AI / LLM Data Scientist - Leading Consultancy,Bluefin Resources Pty Limited,https://www.seek.com.au/job/89187671?type=standard&ref=search-standalone&origin=jobCard#sol=49ded409d11be0d4b2b1580d5f8e6669669bdda4,6h ago,6.0,2025-12-17T01:00:00+00:00,Sydney NSW (Hybrid),Analysts (Consulting & Strategy),Full time,AUD 130000 - 150000 per annum,"AI / LLM Data Scientist - Leading AI Consultancy 
Location - Sydney only (2 days max in the office, rest from home!) - no remote / overseas options!

Ready to make an impact with AI? Join a leading AI consultancy where innovation, impact, and cutting-edge tech come together. The AI team is a powerhouse of designers, developers, data scientists, and analysts delivering next-gen digital products and AI solutions across various industries. They are growing rapidly and looking to hire AI passionate data scientists in thier team!!

About the role

As an AI Data Scientist you’ll design and develop AI-driven products and solutions that transform how their clients work and create measurable outcomes. You’ll work with cross-functional teams, mentor junior data scientists, and drive the adoption of modern AI and ML practices.

What you’ll do

Collaborate with teams to scope and design AI solutions.
Develop algorithms to extract, clean, and normalise large-scale data.
Build, test, and deploy models and pipelines (RAG, LLM workflows, VectorDBs) at scale in Azure.
Write clean, efficient, production-ready code.
Contribute to forums and communities, sharing best practice.
Mentor and coach junior talent.
What we’re looking for

Minimum 3-5+ years' experience working across end to end Data Science projects with hands-on experience in AI/ RAG/ LLM/- previous experience working in the consulting sector a big plus!
Strong Python development with modern LLM/ML frameworks.
Expertise in LLM prompting, workflows, and agentic systems a big plus!
Experience with VectorDB (Azure AI Search, pgVector, etc.).
Knowledge of ML models, CNNs, RNNs, NLP, and CV good to have.
Proven hands-on experience with RAG pipelines a big plus!
SQL and Vector DB expertise, plus cloud development (Azure - highly recommended). 
Strong critical thinking, collaboration, and communication skills.
Tech stack & extras
Good to have experience in - Git, Docker, microservices, ReactJS/NodeJS, observability standards (OpenTelemetry), message-queueing (Kafka/RabbitMQ), data pipelines at scale, and Agile delivery.

Why us?

At this leading AI consultancy, you’ll join a diverse, inclusive environment that champions creativity and innovation. They offer flexible work, world-class development opportunities, mentoring, and wellness benefits—so you can thrive personally and professionally.

Please apply on-line or for more information please contact Kausty Mahajan at Bluefin Resources on 02 9270 2603."
