Job ID,Job Title,Company,Detail URL,Posted Label,Hours Old,Posted Datetime (Local),Location,Category,Work Type,Salary,Ad Text
89725982,Senior Data Scientist (LLMs),Virgin Australia,https://www.seek.com.au/job/89725982?type=standard&ref=search-standalone&origin=jobCard#sol=759d2c9c3f334b608786d1db0580166721b887a0,3h ago,3.0,2026-01-15T23:00:00+00:00,Brisbane QLD (Hybrid),"Mathematics, Statistics & Information Sciences (Science & Technology)",Full time,,"Full-time, Brisbane or Sydney based hybrid role

Hello. We’re Virgin Australia. We’re the airline that’s always done things a little different. Our way. The Virgin way. We’re on a mission to make flying better than ‘nice’. And to do that, it takes a team of talented people who are passionate about customer experience, doing the right thing always, with a focus on safety – in the air, on the ground and in our workplaces. A team who values real diversity and inclusion, in a big brand with big ambitions.

What you’ll be doing

As a Senior Data Scientist specialising in the application of Large Language Models, you’ll design and deliver production-ready LLM-based systems that solve real business problems. This role combines deep expertise in Applied AI with the practical engineering skills that are needed to build, evaluate and optimise LLM-based solutions.

Key responsibilities include:

Design end-to-end LLM-based solutions including retrieval, prompting, fine-tuning, and tool/API integration.
Build and iterate on retrieval-augmented generation pipelines (document ingestion, embeddings, vector search, reranking, context assembly).
Design and implement agentic workflows for multi-step reasoning and tool usage.
Write production-quality Python code to integrate LLM systems into business applications and workflows.
Optimise systems for latency, reliability, and cost using caching, batching, and inference optimisation.
Design evaluation frameworks for non-deterministic outputs (correctness, groundedness, reasoning coherence).
Analyse model failures and implement improvements based on error patterns and feedback loops.
Stay current with advances in LLMs, agentic systems, and retrieval techniques; translate research into production patterns.
Collaborate with security, compliance, and platform teams for responsible AI alignment.

You’ll be great in this role if you have…

A bachelor’s degree or higher in computer science, data science, software engineering, or related discipline (or equivalent experience).
Formal training or postgraduate study in machine learning, deep learning, NLP, or large language models.
Experience building, deploying, and operating production-grade ML or AI systems (not just prototypes).
Hands-on experience with LLMs in applied settings (RAG, tool-calling, multi-step reasoning workflows).
Experience designing evaluation approaches for non-deterministic systems.
Strong software engineering skills in Python for production-quality code.
Ability to design end-to-end LLM systems including orchestration and integration with external tools.
Knowledge of optimisation techniques such as fine-tuning, distillation, and inference efficiency improvements.
Experience with observability practices (structured logging, tracing, dashboards) and managing cost/latency trade-offs.
Ability to clearly explain technical concepts and trade-offs to non-technical audiences.
Exposure to travel, transport, or other complex operational industries (desirable).

We’re committed to looking after you, with some of the best benefits and conditions in the industry – including (but not limited to):

Discounted flights for you and your loved ones (including $1000 worth of travel credits per year)
A flexible, hybrid work style. Work from home or the office, adapt your location to suit your style and needs
One of Brisbane’s most admired head office locations, with South Bank train station, a supermarket, pharmacy, and lunch options downstairs plus a 5-minute walk to the Busway, a rooftop restaurant and onsite gym (with a low membership fee) and South Bank Parklands just across the road
Discounts on travel insurance, lounge membership, car hire, accommodation, and experiences worldwide
Cheaper hospitality, retail, technology, beauty and wellness services
Free counselling and access to a wellbeing app to support your physical, mental, social and financial health
‘Dress for Your Day’ – enjoy the freedom to wear whatever makes you feel great for the type of work you do and the day you have ahead of you.

When everyone is included, everyone wins

We’re all individuals. And we love that. That’s why we encourage applications from Indigenous Australians, people with disability, those from diverse cultural backgrounds, our friends in the LGBTQIA+ community, and anyone else who wants to join our family.

Ready to apply?

We’re ready to hear from you. Apply now."
89725972,"Senior Manager, Data Science",Lanson Partners,https://www.seek.com.au/job/89725972?type=standard&ref=search-standalone&origin=jobCard#sol=2b7d7450484c2eea3adb4a5de40b2100c5bef5b7,3h ago,3.0,2026-01-15T23:00:00+00:00,Sydney NSW (Hybrid),Management (Information & Communication Technology),Contract/Temp,$200k-$230k base plus super plus bonus,"Lead the AI strategy behind large-scale customer experiences. Drive experimentation, advanced ML and Generative AI to deliver measurable commercial impact.

This leadership role sits within a high-performing Data & AI function, partnering closely with Product and Engineering to solve complex, real-world problems at scale.

What you’ll do
Lead and grow a high-impact team of Data Scientists
Own the end-to-end design, deployment and optimisation of AI & ML models
Champion experimentation to accelerate insight and innovation
Embed ethical, explainable and auditable AI governance
Partner with Product and Engineering to operationalise models at scale
Apply Generative AI to improve productivity and decision-making
What you’ll bring
Strong background in Data Science, Machine Learning and AI
Proven leadership of AI/ML initiatives delivering measurable outcomes
Deep hands-on experience across the full model lifecycle
Experience establishing AI governance, risk and MLOps practices
Collaborative, people-first leadership style
Practical experience applying Generative AI in production environments

Please reach out to Matthew Nicholas for more information about this position. Email address is matthew@lansonpartners.com."
89725954,Aeromedical Data Scientist,Department of Defence,https://www.seek.com.au/job/89725954?type=standard&ref=search-standalone&origin=jobCard#sol=5d052f455076b4f1f5d75d1b8e386b2e2818c083,3h ago,3.0,2026-01-15T23:00:00+00:00,"Edinburgh, Adelaide SA","Air Force, Government - Federal (Government & Defence)",Full time,"$95,187 - $108,734 (APS 6) + Super","The Role

The RAAF Institute of Aviation Medicine (IAM) is seeking a Data Scientist to join the Aeromedical Analysis and Decision Support (AADS) Team. 

This offers the opportunity to support Defence aviation through the production of aeromedical guidance tailored to provide aviation safety stakeholders with information to support decision making in areas related to human performance, aeromedical hazards, and aviation safety.

Working in an organisation that values innovation, you collaborate with uniformed and civilian aviation medicine and human factors specialists to provide timely and appropriate evidence-based guidance. 

In your role as Data Scientist, you will form part of a small close-knit team to perform data processing and analysis to contribute to team outputs, and within scope of expertise undertake data collection and analysis, and written advice for directed tasking, encompassing; psychological, human factors, physical, and physiological dimensions of the aviation domain related to human performance, safety, and operational capability.

About our Team

Institute of Aviation Medicine is the Australian Defence Force centre of excellence in aviation medicine and human factors, dedicated to providing specialist guidance and expert advice across the three services as follows:

Aviation medicine and human factors;
Human-systems integration and ergonomics; 
Interface between aircrew and life-support systems;
Hazard analysis and advice in assessment/management of risks arising from human physiology, ergonomics, anthropometry, medical factors, or human performance limitations; 
Assessing likelihood and consequence of medical hazards in aircrew and controllers, and working with risk-holders within a harmonised Defence risk-management system;
Applying a structured approach to problem definition and providing evidence-based recommendations to support decision-makers. 

This exciting and rare opportunity to grow your career in a supportive environment, will allow you to be integral to a team significantly contributing to Defence aviation capability and risk management.

Our Ideal Candidate

To succeed in the role, you will have the demonstrated ability to:

Plan, provide advice, and deliver critical complex review activities, 
Manage concurrent activities with competing priorities within the direction established by Institute of Aviation Medicine;
Demonstrate effective verbal and written communication skills which enable you to positively liaise with internal and external stakeholders as required;
Manage workflows and resources, prepare work area and team plans detailing measurable milestones and expected outcomes within specified deadlines;
Apply the principles of problem definition and scientific method as the foundation of a problem-solving framework, and the ability to analyse and interpret data to develop evidence-based, meaningful and relevant recommendations;
Apply scientific principles to problem definition, data analysis, and generation of evidence-based recommendations;
Proficiently use advanced features of Microsoft Software and statistical analysis software.

Application Closing Date: Sunday 1 February 2026

For further information please review the job information pack, reference AF/09967/25 on https://defencecareers.nga.net.au/?jati=FFA35A26-2D80-ACEF-9AD8-EC92C3CAF342"
89725795,Engineering Manager - Hawthorn East,Coles,https://www.seek.com.au/job/89725795?type=standard&ref=search-standalone&origin=jobCard#sol=22dac799a626f7a458573ef8fa31c2e12aa9d50f,3h ago,3.0,2026-01-15T23:00:00+00:00,"Hawthorn East, Melbourne VIC (Hybrid)",Management (Information & Communication Technology),Full time,,"We’ve been proudly serving Australian communities since 1914 and have grown to become a top 30-listed company on the ASX with a portfolio of iconic homegrown brands. At the heart of our continued success is over 115,000 team members working across the country, all contributing to bringing our customers smiles. You’ll not only get to see your work make a difference, you’ll be part of a team working together to help Australians eat and live better every day.

 

About the team

 

As the way Australians shop continues to evolve, our Data and AI Team keep Coles at the forefront of modern retail. We combine data, artificial intelligence, and applied engineering to reimagine how our stores, supply chain, and digital channels operate — creating smarter, more connected, and seamless experiences for our customers and team members.

 

Operating as a centralised development and enablement function within Coles Technology, the team unites product, engineering, and platform capabilities to deliver the intelligence layer of the enterprise. We serve every part of Coles — from computer vision applications that enhance in-store experiences and reduce loss, to forecasting, optimisation, and decision-support solutions that drive efficiency, accuracy, and agility across our supply chain, retail operations, and corporate functions.

 

The scale and impact of this work are significant. Coles serves millions of customers each week across more than a thousand stores nationwide, and our AI and data capabilities provide the intelligence that underpins how we plan, move, sell, and serve. By combining deep data capability with applied AI and modern engineering, we’re enabling Coles to become a truly AI-enabled enterprise, transforming how we operate and how Australia shops every day.



About the role

 

As an Engineering Manager, you'll lead a domain-specific, multi-disciplinary team comprised of data, machine learning, DevOps and software engineers to deliver on our data and AI roadmap. You'll be responsible for ensuring that AI and data engineering efforts deliver measurable business value, through agile ways of working and a focus on engineering practises.

 

You’ll work alongside curious, likeminded individuals across Coles who are passionate about AI innovation and experimentation, in an inclusive environment that values different perspectives and approaches to problem-solving.

 

Key Impact and Responsibilities

 

The Engineering Manager leads the design, development, and delivery of complex, scalable AI/ML and data solutions. Projects can range from computer vision applications that enhance in-store experiences to forecasting, optimisation, and decision-support solutions that drive efficiency across our supply chain and retail operations.

 

You will take a product led approach to engineering, partnering with Product Managers, Architects, Security, and other technology partners to delivery on the strategic roadmap. 

 

You’ll lead and grow a high-performing team and drive delivery excellence by:

 

Leading the design and development of complex, scalable, high-performance AI/ML and data solutions that deliver measurable business outcomes
Partnering with Product Managers to translate business objectives into data and AI solutions through prioritisation, planning, and managing competing resource demands
Collaborating with technology partners across architecture, security, and other technology teams to drive delivery outcomes
Defining modern engineering practises, embedding them in the team and their ways of working, and embarking on a journey of continuous improvement. Constantly reflecting on ways of working to drive increased delivery outcomes
Implementing modern DevOps practices, CI/CD, and robust QA processes that enable continuous, iterative, and reliable value delivery
Recruiting, mentoring, and retaining top-tier engineering talent through structured career development programs and clear progression paths, providing coaching, mentoring and upskilling
Fostering a culture of experimentation and continuous improvement, encouraging the exploration of new tools, technologies, and strategies

 

About You and Your Skills

 

We’re looking for an Engineering Manager with experience managing product led ML and/or data engineering teams.

You'll bring the ability to institute change and uplift ways of working, driving cultural and technical transformation within the engineering team. Educating, coaching and upskilling your team, and providing opportunities for continuous learning will be integral to your role. You'll define modern engineering practices, embed them in the team, and foster a culture of continuous improvement.

You'll have experience working in product-led organisations focused on continuous iteration and value delivery. This will be reflected in your experience with Agile delivery models, building software and ML/AI solutions following a modern SDLC built around automation and CI/CD.

 

Further, you’ll have:

 

Proven experience in the data and AI domain, particularly in building, developing, and supporting production-grade AI solutions
Demonstrated ability to lead and manage multi-disciplinary teams (including ML Engineers, Software Engineers, and Data Engineers) while collaborating effectively with partners such as product managers, security specialists, and architects
Strong product mindset, with the capability to translate business objectives into practical, scalable technical solutions

 

While our technology stack is constantly evolving, at present it consists of:

 

Cloud Platform: Azure (AKS, Foundry, AML)
Infrastructure & DevOps: Docker, Terraform, Azure DevOps, CI/CD pipelines
Languages: Python, R, TypeScript (React)
Data Engineering: DataBricks, Snowflake, DBT
Machine Learning: PyTorch, scikit-learn, MLOps practices
AI Frameworks: LangChain, Semantic Kernel
Development Practices: Agile, GitOps, CI/CD, IaC, Microservice Architecture

 

We recognise that candidates will bring diverse combinations of skills and experience. While experience with these specific tools is valuable, we're equally interested in your ability to learn, adapt, and lead teams through technological change. We encourage you to apply if you have experience with similar tools and are passionate about technology, innovation, and developing high-performing engineering teams.

 

Additionally, we are not just looking for someone with technical or leadership skills and expertise, we value cultural fit and we value diversity in the team in the pursuit of excellence and innovation.

 

General Skills

 

Building strong collaborative relationships and effectively communicating technical concepts across teams with diverse backgrounds and skillsets
Passionate about developing engineers and sharing best practices in software development, data engineering, and MLOps
Comfortable with agile ways of working, balancing the need for quality with near-term business benefit
Demonstrating empathy and strong interpersonal skills, with a genuine interest in people growth and career development
Good understanding of software architecture and enterprise integration patterns

 

 



What’s in it for you?

 

Flexible working options: We know that work is only one part of your life, so we actively encourage a positive work-life balance and provide hybrid working options to help you achieve it.
Office perks: Take advantage of our gym facility and fitness classes, free parking, BBQ area, mini-Coles supermarket, fooderie hub where you can sample new products before they hit the shelves, school holiday program and so much more when you come in.
Discounts: Eligible team members receive 5% discount all year round on your Supermarket and Liquor online and in-store purchases. We also offer additional periods of double discount (10%) at various times throughout the year. As well as hotdeals exclusive to team members that translate into additional savings.
Reward through recognition: Give and receive recognition, linked to our Coles values, through our digital recognition platform ‘mythanks’. You can accumulate points to redeem in the online shop for exciting gifts and electronic gift cards from an extensive range of retailers.
Opportunities for learning and development: No matter where you start within our diverse business, you’ll have experiences, exposure, and education to satisfy you. Discover and explore a variety of career development programs and job-specific training.
Paid parental leave: We understand how important your life outside work is and offer permanent team members paid parental leave to support you in balancing work and family.
Investment in your future: Our annual team member share plan offer allows eligible team members to make regular pre-tax salary sacrifice deductions to purchase Coles Group shares.

 

About the recruitment process

 

We’re continuing to build a gender equitable team, and a culture that is just as diverse, inclusive and welcoming as the communities we serve. We are committed to creating a workplace that is safe and respectful for our team. We encourage applications from people of all ages, cultures (including Aboriginal and Torres Strait Islander peoples), abilities, sexual orientation and gender identities.

 

We’re happy to adjust our recruitment process to support candidates with disability. For further information and additional contact details visit the ‘Our Recruitment Process’ section of our careers site or email inclusionrecruitment@coles.com.au

 

Job ID: 174591

 

Employment Type: Full time"
89724745,Senior Machine Learning Engineer,"Talent – Specialists in tech, transformation & beyond",https://www.seek.com.au/job/89724745?type=standard&ref=search-standalone&origin=jobCard#sol=725d806a27791d8d30e082e3416f64d77e45a9cb,4h ago,4.0,2026-01-15T22:00:00+00:00,"Surry Hills, Sydney NSW (Hybrid)",Developers/Programmers (Information & Communication Technology),Contract/Temp,,"Senior Machine Learning Engineer
Initial 6-Month Contract
Surry Hills, Sydney - Hybrid Work Model

About the Role
The Data and Insights Branch is seeking an experienced Senior Machine Learning Engineer to lead the design, development, and deployment of advanced AI and machine learning solutions that support our agency's strategic goals. This pivotal role will drive data-driven decision-making and deliver innovative, ethical AI capabilities within a secure, compliant environment.

As an EL1 ML Engineer, you will provide technical leadership, collaborate with DVA data professionals, and ensure the implementation of robust, scalable, and responsible machine learning solutions across the organisation. Initially, you will focus on understanding and leveraging the GovAI platform and the existing AWS DVA/Services Australia environment, with a key role in supporting DVA's Cloud Roadmap.

Eligibility Criteria

Australian Citizen
Ability to obtain and maintain a minimum Baseline security clearance

Key Responsibilities

Design and develop machine learning models and algorithms for complex datasets
Build and maintain end-to-end ML pipelines for training, testing, and deployment
Optimize models for performance, scalability, and accuracy in production settings
Collaborate with data scientists, engineers, and stakeholders to translate requirements into technical solutions
Ensure compliance with Australian Government security frameworks (ISM, PSPF) and uphold ethical AI principles
Implement monitoring and maintenance processes, including data drift detection and model lifecycle management
Provide technical guidance, mentorship, and capability development within the team
Stay informed of emerging ML technologies and industry best practices

Essential Skills & Experience

Proven experience in machine learning engineering within complex environments
Proficiency in Python and ML frameworks such as TensorFlow, PyTorch, Scikit-learn
Strong background in data engineering, feature engineering, and model optimization
Experience with ML Ops tools and practices (Kubeflow, MLflow, Airflow)
Hands-on experience with cloud platforms (AWS, Azure, GCP) and containerization (Docker, Kubernetes)
Excellent problem-solving skills, with the ability to manage multiple priorities
Strong communication skills and ability to engage stakeholders effectively

Join Us
If you're passionate about leveraging AI to make a meaningful impact and meet the above criteria, we want to hear from you!

How to Apply:
Please submit your CV and cover letter in Word format by clicking the ""APPLY NOW"" button below or email your application to anna.au@talentinternational.com."
