Job ID,Job Title,Company,Detail URL,Posted Label,Hours Old,Posted Datetime (Local),Location,Category,Work Type,Salary,Ad Text
87913282,Senior Business Analyst,DIGIT Group,https://www.seek.com.au/job/87913282?type=standard&ref=search-standalone&origin=jobCard#sol=5e944cdbd10e7727d1e100435ba1ce6a0b433470,1h ago,1.0,2025-10-16T07:00:00+00:00,"Hawthorn East, Melbourne VIC",Business/Systems Analysts (Information & Communication Technology),Full time,,"About the role

Reporting to the IT Project Manager, you will provide end-to-end business analysis activities through IT transformation and strategic programs, with immediate focus on a HRIS and Payroll systems overhaul.

What you'll be doing

Providing an assessment of 'current state' and determine needs, and what is 'future state'

Facilitating workshops and eliciting feedback to refine and validate business requirements

Collaborating with cross-functional teams to understand business requirements and translate them into functional/technical specifications

Conducting in-depth analysis of existing systems, processes and data to identify opportunities for improvement

Documenting and communicating complex information in a clear and concise manner for stakeholders at all levels

Participating in RFP/vendor selection processes

Participating in the full software development lifecycle, from planning to deployment, and business process mapping activities

What we're looking for

You are a seasoned Senior IT Business Analyst, able to impact immediately

Critically, you have previously worked as a Business Analyst on a large complex HRIS and/or Payroll transformation initiative - ideally end-to-end

Proficient in business process mapping, requirements gathering and documentation

Exceptional analytical and problem-solving skills with the ability to think strategically

Strong communication and stakeholder management skills, with the ability to present complex information effectively

Comfortable working in a hybrid Agile and Waterfall approach - 'fit for purpose'

Fluency in the use of Jira and Confluence

Six-Sigma or Change Management skills are advantageous

What we offer

Our client is committed to providing their employees with a supportive and fulfilling work environment. As a Business Analyst, you will have access to a range of benefits, including:

Opportunities for career development and professional training

A stable long-term portfolio of projects, offering longer-term career opportunity and pathway

Exposure to contemporary technology and work practices

A warm and collaborative business environment with an inclusive culture

About us

Our client is a well-established health sector company and employs almost 2,000 staff across 20 sites. They are undergoing significant business transformation leading to IT and digital transformation, with the view of providing integrated and exceptional customer experience along with a high performing organisation. Join them and be a part of their exciting journey!

Apply now for this exciting Business Analyst opportunity via the recruitment firm DIGIT Group"
87911438,Management Consultant,Liberty IT Consutling Group pty ltd,https://www.seek.com.au/job/87911438?type=standard&ref=search-standalone&origin=jobCard#sol=6224129bb0e5fe0b9470a7c2135fb8f17309ff92,1h ago,1.0,2025-10-16T07:00:00+00:00,Sydney NSW (Hybrid),Management & Change Consulting (Consulting & Strategy),Full time,,"Company Description

Liberty IT Consulting Group is one of Australia's finest technology consulting firms that is different, by design. Founded on principles of Quality, Experience, and Ethics, Liberty combines hundred’s of years of collective experience with a commitment to hard work, authenticity, and a unique working culture. Unlike larger consulting firms, Liberty works for the client, focusing on delivering high quality outcomes in Financial Services. Placing emphasis on technology and business program delivery, project assurance, and a variety of services including project management, business analysis, engineering, PMO, organisation design, strategy, business change management, and solution architecture. We are proud to be different and uphold the highest standards of customer satisfaction, value and integrity.

Role Description

This partner-level is a hybrid role located in Sydney, NSW Australia for a very senior management consultant. We are seeking an experienced consultant to lead complex, high-impact consulting engagements across strategy, transformation, and business performance in Financial Services and technology. The successful candidate will work closely with executive stakeholders to shape strategic direction, deliver operational improvements, increase productivity, and drive sustainable business outcomes. This role requires a proven track record in consulting for major corporations, people leadership skills, business development, relationship management, account management, public speaking skills and thought leadership, particularly in Financial Services.

Key Responsibilities

1. Client Engagement & Delivery

Lead end-to-end delivery of complex consulting engagement across multiple business domains.

Influence strategy, project budget, scope, timelines, resource plans, and delivery methodologies.

Serve as a trusted advisor to C-level clients, providing actionable, evidence-based insights.

Ensure quality assurance and alignment of deliverables within client expectations.

2. Strategy & Transformation

Develop and implement enterprise-wide transformation strategies (digital, operational, organisational).

Translate high-level business vision and objectives into tangible, achievable transformation roadmaps.

Oversee change management, operating model redesign, and process optimisation.

3. Team Leadership & Capability Building

Mentor, coach, and develop junior and mid-level consultants.

Build high-performing, cross-functional teams and foster a culture of collaboration and excellence.

Promote internal knowledge sharing, IP development, and capability uplift.

4. Business Development

Lead proposal development and pitch presentations for new business opportunities.

Build and maintain long-term client relationships.

Identify cross-sell and up-sell opportunities across service lines.

5. Thought Leadership

Be one of the firm's ambassador 

Represent the firm at industry events, conferences, and panels.

Publish white papers, blogs, and articles to shape market conversations.

Stay ahead of market trends, disruptions, and regulatory shifts.

Required Experience & Qualifications

10+ years of management consulting experience with at least 5 years in a senior role.

Proven delivery of large-scale transformation or strategy engagements.

Deep industry expertise in Financial Services.

Strong business acumen with demonstrated success in client acquisition and retention.

Experience managing P&L, client portfolios, or regional practice areas is highly regarded.

Skills & Competencies

Passionate for success and quality

Strategic thinker with strong analytical and problem-solving capabilities.

Exceptional stakeholder engagement and interpersonal skills.

Strong leadership presence and ability to influence at the executive level.

Excellent written and verbal communication.

Commercially savvy with strong negotiation and deal-closing skills.

Education & Certifications

Bachelor's degree in Business, Finance, Engineering, Technology, HR, Marketing or related field (required).

MBA or equivalent postgraduate qualification (highly preferred).

Relevant industry certifications (e.g., PMP, Lean Six Sigma, Agile) advantageous.

Remuneration

Competitive base salary + performance bonuses.

Profit sharing (for Partner-level roles).

Benefits package including [superannuation, expenses]."
87912823,Project Manager - Data & AI,UpperGround by Hudson,https://www.seek.com.au/job/87912823?type=standard&ref=search-standalone&origin=jobCard#sol=f358eb4b68984fcdc3c02f6c48f79199b1d3b7d6,1h ago,1.0,2025-10-16T07:00:00+00:00,Brisbane QLD (Hybrid),Programme & Project Management (Information & Communication Technology),Contract/Temp,"AUD 149 per hour, inc super","Project Manager – Digital & AI Initiatives

A large Queensland Government department is seeking a Project Manager to lead the delivery of innovative digital and data-driven projects. This role will drive transformation initiatives that enhance customer service, modernise systems, and enable smarter use of information and emerging technologies across government.

Why Apply:


Lead high-impact digital and AI projects delivering modern government services.


Collaborate with senior stakeholders, data specialists, and vendors to achieve innovation outcomes.


Work in a forward-thinking team driving digital transformation across Queensland.


Key Responsibilities:


Lead and manage project planning, delivery, and reporting to ensure successful outcomes.


Manage relationships with internal and external stakeholders to support collaboration across agencies.


Oversee risk, change, and quality management to ensure projects meet agreed outcomes.


Monitor project benefits, schedules, dependencies, and budgets, ensuring strong governance and accountability.


Lead vendor engagements and contract management, ensuring services align with program objectives.


Facilitate project assurance and continuous improvement activities to uplift delivery maturity.


Skills & Experience:


Demonstrated experience managing digital transformation, systems development, or systems integration projects.


Proven ability to lead Agile project delivery and apply modern project management methodologies.


Strong stakeholder engagement and communication skills, with the ability to influence and build partnerships.


Experience managing budgets, teams, and vendor contracts across complex environments.


Strong strategic thinking and problem-solving skills, with a focus on delivery outcomes.


Relevant qualifications or certifications in Agile, project management, or digital delivery highly regarded.


Pre-employment screening including a criminal history check is required.


 

To apply please email Dalton.Dalley@hudson.com quoting REF #247059. Applications close 23/10/2025.


Diversity, Equity & Inclusion at Hudson
Hudson is committed to helping you find a workplace where you feel respected, supported, and free to thrive. We welcome applications from all backgrounds, identities, and lived experiences—because when different voices come together, amazing things happen.

Casual Loading 
Please note for all Australian based contract and temporary roles only, the pay rate is inclusive of mandatory 25% casual loading. This excludes permanent and fixed term roles."
87912744,Senior Insights Manager,Manassen Foods Australia Pty Ltd,https://www.seek.com.au/job/87912744?type=standard&ref=search-standalone&origin=jobCard#sol=f328f8213e2d4e95a7f2f5acb84a1bea4dc5841d,1h ago,1.0,2025-10-16T07:00:00+00:00,"Eastern Creek, Sydney NSW (Hybrid)",Market Research & Analysis (Marketing & Communications),Full time,,"Drive the next wave of growth at Manassen Foods by bringing world-class food brands into the Australian market.

At Manassen Foods, we’re more than just a food distributor—we’re brand builders at heart. With one of the most diverse FMCG portfolios in Australia, we work with leading local and global partners to deliver innovation and commercial growth.

Are you a looking to further your career in FMCG? At Manassen Foods, we're on a mission to build the strongest portfolio of food brands in the country—and our Senior Insights Manager will be at the heart of it.

We are seeking a Senior Insights Manager reporting to our Head of Category, you’ll will be the engine room of data-led decision-making working at the intersection of category, marketing, revenue growth and brand strategy.

You will lead the development of category growth drivers—particularly for our Core portfolio—drawing on internal analytics and external research to inform our category growth strategies which will intersect with innovation, brand strategy, sales strategy and customer engagement.

Why Join Us?

Be the champion of household brands Australians trust.

Gain exposure to all aspects of FMCG marketing, from strategy to execution.

Enjoy autonomy, clear strategic and commercial impact

Join a high-performing, collaborative team in a growing FMCG business

Collaborate with passionate, high-performing teams in a hybrid work environment Mondays, Tuesdays and Thursdays in the office - we’re based in Western Sydney

Make a genuine impact on brand growth and commercial success.

Enjoy many employee discounts and variety of other discounts and benefits

What you'll be doing

Lead development of category growth drivers embedding these into brand planning, channel strategies and customer presentations

Insight generation and storytelling through analytical support for brand strategy, NPD pipeline decisions, pricing, promotions etc.

Data management and visualisation from major data sources (Circana, Quantium), building intuitive dashboards and reports.

External research and thought leadership driving and coordinating research, shopper deep dives, monitoring trends and forward-looking insights

Team leadership and stakeholder engagement with one team member and a variety of internal and external stakeholders

What you'll bring

Extensive experience in insights, category development or commercial analytics in FMCG or related industries

Proven ability to lead both data analysis and insight storytelling at a strategic level

Experience with platforms such as Circana, Nielsen, Quantium, Power BI, and Excel

Strong working knowledge of category strategy, growth drivers, and shopper behaviour

Experience in working with external research partners and methodologies

Commercial acumen and the ability to work cross-functionally with senior stakeholders

A tertiary qualification in Marketing, Business, Analytics or a related field

If you are insights driven and ready to take the next step marking a mark on iconic Australian brands, apply now to join Manassen Foods."
87912530,Senior Data Analyst (Investments),Davidson,https://www.seek.com.au/job/87912530?type=standard&ref=search-standalone&origin=jobCard#sol=50d4db7af068a17c0ea5d37beec7df83d4b13d41,1h ago,1.0,2025-10-16T07:00:00+00:00,Melbourne VIC (Hybrid),Database Development & Administration (Information & Communication Technology),Contract/Temp,$1k - $1100 p.d. + Initial 12 month contract,"The Opportunity

A leading financial services organisation is undertaking a major global transformation of its investment operating model, focused on modernising foundational data platforms and performance systems. This 12-month contract offers the chance to join the Melbourne-based Data team and play a key role in implementing and governing critical investment performance systems, starting with the Accounting Book of Records (ABOR).


The Role

You'll contribute to the rollout and optimisation of investment performance systems and data governance frameworks, collaborating across local and global teams.


Support implementation of performance systems and data governance setup
Conduct current state analysis and contribute to future state roadmapping
Collaborate with global stakeholders and external vendors
Manage data transformation and reporting across investment portfolios
Support performance and attribution reporting processes
Assist with establishing governance across data lineage, metadata, and stewardship


About You

You're a skilled investment data professional with strong technical ability and financial services experience.


Proven background in superannuation, asset management, or APRA-regulated markets
Experience with investment platforms (e.g. CRD, FactSet, Bloomberg, State Street Alpha)
Strong skills in SQL and Python (essential)
Exposure to Databricks, AWS, or Azure (advantageous)
Expertise in data transformation and performance reporting
Comfortable engaging with global teams and external vendors


The Benefits

Initial 12-month contract
Hybrid working from Melbourne office (preference, will consider Sydney)
Competitive daily rate


How to Apply

Please apply with current resume in Microsoft Word format only (.doc or .docx). If you would like to have a confidential discussion, please reach out quoting reference JN -102025-41590. Want to know more about Davidson? Visit us at www.davidsonwp.com"
87912066,Project Manager -Data and Artificial Intelligence,"Talent – Specialists in tech, transformation & beyond",https://www.seek.com.au/job/87912066?type=standard&ref=search-standalone&origin=jobCard#sol=05a290e2dc6227f56bbb7f23a919eaa32a2c4a31,1h ago,1.0,2025-10-16T07:00:00+00:00,Brisbane QLD,Other (Information & Communication Technology),Contract/Temp,,"6 Month Contract
Brisbane Based Role
Up to $1200 Per Day

We're seeking an experienced Project Manager to lead digital, systems, and transformation initiatives that leverage data and artificial intelligence to deliver smarter, customer-focused government services. This role is ideal for a strategic and delivery-focused professional who thrives in fast-paced environments and is passionate about using technology to improve service outcomes for Queenslanders.

Key Responsibilities

Lead and manage complex digital and transformation projects, ensuring delivery on time, within budget, and aligned to strategic objectives.
Experience delivering large scale data and AI solutions
Build and maintain strong stakeholder relationships across internal teams and external partners to drive collaboration and innovation.
Oversee project planning, governance, and assurance activities, ensuring compliance with project management frameworks.
Manage financials, budgets, and vendor engagements to support project success.
Champion change management, continuous improvement, and agile delivery principles.
Monitor and report on project benefits, schedules, dependencies, and risks.

You'll bring:

Proven experience in agile project management and delivery of greenfield or transformation initiatives.
Hands-on experience in digital solutions, systems integration, or customer experience programs.
Strong negotiation, consultation, and facilitation skills.
Excellent communication skills with the ability to influence and manage diverse stakeholders.
Demonstrated ability to manage budgets, people, and processes across multiple projects.
Strategic thinking, adaptability, and a results-driven approach.

To be considered for this role, click Apply Now"
87911898,BA Practice Lead/Manager,Aurec,https://www.seek.com.au/job/87911898?type=standard&ref=search-standalone&origin=jobCard#sol=a724ab2c3a367d9ec3afc844a18b5e8c6ce2f213,2h ago,2.0,2025-10-16T06:00:00+00:00,Melbourne VIC (Remote),Programme & Project Management (Information & Communication Technology),Contract/Temp,,"12-month CONTRACT with potential extension

Remote work with travel to Darwin, NT, required for one week each month

Travel expenses, accommodation, and meals will be provided

Daily rate: Open to discuss


ROLE OVERVIEW
We are seeking an experienced BA Practice Lead/Manager to play a pivotal role in connecting business leaders with delivery outcomes. This position will manage and guide a pool of Business Analysts (typically 6+) while building strong, trusted relationships with senior stakeholders across the organisation. Operating at the leadership group level, you will partner closely with the Change and Training Lead to ensure alignment of initiatives and drive business engagement strategies. This role requires someone who thrives on collaboration, enjoys rolling up their sleeves, and is passionate about building capability while gaining a deep understanding of business operations.


WHAT YOU'LL BE DOING
Lead and manage a team of Business Analysts, providing coaching, direction, and support.
Develop and maintain strong partnerships with senior leaders, acting as the primary point of contact for business engagement.
Collaborate with the Change and Training Lead to align stakeholder engagement strategies with organisational objectives.
Build and maintain capability maps to support business functions and future planning.
Actively participate in operational activities to understand processes, challenges, and improvement opportunities.
Drive consistency and best practices across analysis and engagement activities.
Champion open communication, ensuring stakeholder expectations are managed and met effectively.

MORE ABOUT YOU

Proven experience in stakeholder engagement, business partnering, or a similar leadership role.

Strong people management skills, ideally with experience leading a pool of Business Analysts.

Exceptional relationship-building and communication skills, with the ability to influence at senior leadership levels.

Hands-on approach with a willingness to engage directly with business operations rather than focusing solely on team management.

Experience in building capability frameworks, business capability maps, or similar tools.

Ability to work collaboratively with change, training, and delivery functions to achieve successful outcomes.

Positive, proactive attitude with a passion for driving engagement and delivering business value.

If this opportunity aligns with your expertise and aspirations, please apply! Please feel free to reach out directly to Muneem Meah at muneem.meah(at)aurec.com, should you have any questions!


Only shortlisted candidates will be contacted!"
