Job ID,Job Title,Company,Detail URL,Posted Label,Hours Old,Posted Datetime (Local),Location,Category,Work Type,Salary,Ad Text
90476167,Head of Data & AI,IMB Limited,https://www.seek.com.au/job/90476167?type=standard&ref=search-standalone&origin=jobCard#sol=658fd31f04f56ef0bd8972dc0e3d06be836d8160,4h ago,4.0,2026-02-21T00:00:00+00:00,Sydney NSW,Architects (Information & Communication Technology),Full time,,"Shape how a member-owned bank uses data and AI to do the right thing at scale
Highly reputable and trusted brand and Employer of Choice for Gender Equality
Competitive salary package on offer to attract the very best 

We are now seeking a Head of Data & AI to lead strategy, governance and delivery, turning data into trusted insights and responsible AI into real business and member outcomes.

About the role

Reporting to the Chief Digital Officer, this role is about building foundations that last, not running one-off programs. You will shape how data and AI are prioritised, governed and delivered across the bank, working closely with Technology, Digital, Transformation, Business leaders and the Executive Data & AI Committee.

You’ll balance ambition with pragmatism, delivering value incrementally while embedding strong risk, privacy and ethical guardrails in line with APRA and Australian regulatory expectations.

A clear, enterprise-wide data and AI strategy aligned to IMB’s business priorities and member outcomes
Prioritisation of high-value use cases across customer insights, risk, operations and decision-making
Embedded governance across the full lifecycle  from idea to production to retirement
Sustainable in-house capability, supported by partners where appropriate
A multidisciplinary team of data engineers, analysts, scientists and architects
A modern data and analytics ecosystem across AWS, Microsoft (including Power BI/Azure) and IBM DataStage

What you’ll bring

Senior leadership experience building data, analytics and AI capabilities within financial services or regulated environments
Strong technical grounding across cloud platforms, data engineering, analytics and machine learning
Deep understanding of data risk, privacy and AI governance, with the confidence to advise executives on trade-offs and investment decisions
A collaborative, pragmatic leadership style — able to influence, simplify and deliver
A commitment to ethical, responsible and transparent use of data and AI

Why IMB?

IMB Bank is a leading customer-owned bank offering a full range of products and services in both retail and business banking. Our purpose is to provide simple, competitive, and authentic banking to help our customers and communities be better off and we’ve doing that for over 145 years. An award-winning and growing organisation, we’ve donated more than $13 million through our Community Foundation to over 1100 projects in our communities.   

IMB benefits include:

Great training and onboarding 
Genuine career pathways and opportunity to accelerate your skills and experience
A supportive culture that actively promotes diversity and inclusion and the wellbeing of our employees 
Designated wellbeing days
Friendly and professional team environment
Product concessions
Purchased leave options

Apply now by visiting imbcareers.com.au and follow the prompts. Application close date 27th February 2026."
90474285,"AI/ML Consultant, Professional Services, Google Cloud",Google,https://www.seek.com.au/job/90474285?type=standard&ref=search-standalone&origin=jobCard#sol=643eeb8f50e42d86ce04a383c1256b4377b7cc88,13h ago,13.0,2026-02-20T15:00:00+00:00,Sydney NSW (Hybrid),Architects (Information & Communication Technology),Full time,World Class Benefits,"At Google, we have a vision of empowerment and equitable opportunity for all Aboriginal and Torres Strait Islander peoples and commit to building reconciliation through Google’s technology, platforms and people and we welcome Indigenous applicants. Please see our Reconciliation Action Plan for more information.

Minimum qualifications:

Bachelor's degree or equivalent practical experience.
5 years of experience in managing project and delivering technical solutions.
Experience in one or more discipline areas: machine learning, recommendation systems, natural language processing, computer vision, pattern recognition, or artificial intelligence.

Experience with technical client service (e.g., consulting experience).
Preferred qualifications:

Experience in systems design with ability to architect and explain data analytics pipelines and data flows.

Experience designing and deploying with one or more from the following technologies: TensorFlow, Spark ML, CNTK, Torch, Caffe, Scikit-learn.

Experience building cloud-based conversational AI solutions.
Experience with generative AI products, technologies, or infrastructure.
Experience in a statistical programming language like R or Python and applied machine learning techniques (e.g., dimensionality reduction strategies, classification, and natural language processing frameworks).
Excellent communication, written, presentation and problem-solving skills.
About the job
The Google Cloud Consulting Professional Services team guides customers through the moments that matter most in their cloud journey to help businesses thrive. We help customers transform and evolve their business through the use of Google’s global network, web-scale data centers, and software infrastructure. As part of an innovative team in this rapidly growing business, you will help shape the future of businesses of all sizes and use technology to connect with customers, employees, and partners.

As an Artificial Intelligence/Machine Learning (AI/ML) Consultant, you will work directly with Google’s most customers on critical projects to help them transform their businesses using AI/ML technologies. You will help our customers to develop, deploy, and manage custom AI solutions in production using Google Cloud technologies. You will provide technical project management, consulting and technical aptitude to customer engagements while working with client executives and key technical leaders to deploy solutions on Google Cloud Platform. You will also work closely with key Google partners currently servicing accounts to scope engagements, manage programs, deliver consulting services, and provide technical guidance and best practice expertise. You will possess a background in developing AI solutions, applying key industry tools, techniques, and methodologies. You will know how to navigate ambiguity, and you will be a technical expert in your field, and you can deliver customer success. You will have excellent client-facing communication and project management skills.Google Cloud accelerates every organization’s ability to digitally transform its business and industry. We deliver enterprise-grade solutions that leverage Google’s cutting-edge technology, and tools that help developers build more sustainably. Customers in more than 200 countries and territories turn to Google Cloud as their trusted partner to enable growth and solve their most critical business problems.

Responsibilities

Work with customer technical leads, client executives, and partners to scope, manage and deliver successful implementations of Cloud AI solutions, becoming a trusted advisor to decision makers throughout the engagement.
Propose solution architectures and manage the deployment of cloud based machine learning solutions according to customer requirements and implementation best practices.
Work with internal specialists, Product, and Engineering teams to package approaches, best practices, and lessons learned into thought leadership, methodologies, and published assets.
Interact with Sales, Partners, and customer technical stakeholders to manage project scope, priorities, deliverables, risks and issues, and timelines for successful client outcomes.
Travel approximately 30% of the time for client engagements.
Google is proud to be an equal opportunity workplace and is an affirmative action employer. We are committed to equal employment opportunity regardless of race, color, ancestry, religion, sex, national origin, sexual orientation, age, citizenship, marital status, disability, gender identity or Veteran status. We also consider qualified applicants regardless of criminal histories, consistent with legal requirements. See also Google's EEO Policy and EEO is the Law. If you have a disability or special need that requires accommodation, please let us know by completing our Accommodations for Applicants form."
