Job ID,Job Title,Company,Detail URL,Posted Label,Hours Old,Posted Datetime (Local),Location,Category,Work Type,Salary,Ad Text
86867986,Senior Data Analyst/ Developer - Power BI,The Recruitment Company,https://www.seek.com.au/job/86867986?type=standard&ref=search-standalone&origin=jobCard#sol=7e87636cc7472ac749bb1aafb5bb8a99d8eb4660,18h ago,18.0,2025-09-01T03:00:00+00:00,Sydney NSW (Hybrid),Developers/Programmers (Information & Communication Technology),Contract/Temp,Daily Rate Contract with a friendly team!,"We’re looking for a hands-on, business-savvy Senior Data Analyst / Developer to join a high-impact team at a major Australian brand undergoing big changes in how data supports decisions — especially in Pricing, Sales, and HR.


This isn’t just another reporting role — we need someone who can work consult with the business & translate messy, complex business needs into clear, actionable insights. You’ll sit close to the business, work with execs, and help untangle some big commercial challenges. 


6-month daily rate contract initially – possibility to extend. Hybrid working enviroment.

What You’ll Be Doing

•    Own end-to-end data solution development – from understanding the problem to delivering insights that influence decisions
•    Build and optimise Power BI dashboards with real business impact
•    Work closely with stakeholders across Sales, Pricing, and HR
•    Support projects such as HR analytics, pricing frameworks, and centralised reporting

You’ll Bring

•    Strong Power BI skills (data modelling, DAX, visual storytelling)
•    Solid SQL experience
•    Experience integrating with SAP systems (SAP BW, core modules or SAP HANA a plus)
•    Bonus: Azure Data Factory, Snowflake, or modern data architecture knowledge
•    Clear communication skills – you’re not just building reports, you’re consulting 
•    Comfort navigating senior stakeholders, running meetings, and challenging business assumptions
•    A natural curiosity – you ask the right questions and look beyond the brief

Why Join?

•    You’ll be part of a tight-knit team (mix of engineers, analysts, and developers)
•    Direct access to decision-makers who care about what data can do
•    Real opportunity to influence how data shapes the business
•    High visibility across strategic projects (not BAU reporting)

If you’re a doer who thinks, a builder who asks questions, and a communicator who translates tech to value, then we’d love to hear from you.
To be considered please click APPLY, interviews this week."
86872833,Customer Insights & Strategy Manager,Energy Power Systems,https://www.seek.com.au/job/86872833?type=standard&ref=search-standalone&origin=jobCard#sol=1d6d5528aea2ff045eea78700cdfe122197cbff0,16h ago,16.0,2025-09-01T05:00:00+00:00,"Mulgrave, Melbourne VIC (Hybrid)",Market Research & Analysis (Marketing & Communications),Full time,,"Energy Power Systems Australia (EPSA) is the authorised supplier of Cat® power systems in Australia, PNG, and the Solomon Islands. As a leading provider of sustainable energy solutions, EPSA provides new and used engines, generators, and hybrid energy systems for a broad range of industries. We also specialise in rental solutions for power generators, compressors, and temperature control systems. We are committed to providing our customers with the sustainable power they need. with leading the way for renewable energy with Cat® Hybrid Energy Systems incorporating battery energy storage.

We’re driven by innovation, customer focus, and a commitment to shaping the future of power. As we continue to grow, we’re looking for a Customer Insights & Strategy Manager who can turn data into direction and strategy into action.

About the Role

This is a unique opportunity to influence business decisions and drive customer-focused strategies across our organisation. In this role, you will lead the way in understanding our customers’ needs, behaviours, and experiences, translating insights into strategies that shape our service delivery and future growth.

You’ll work closely with senior leaders and cross-functional teams to:

Unlock insights through advanced data analysis, Power BI reporting, and system mapping.

Shape customer strategy by identifying trends, opportunities, and challenges that guide decision-making.

Support the delivery of the customer experience roadmap aligned with Strategy 29, ensuring key initiatives are delivered to schedule and budget.

Champion customer centricity across EPSA by embedding a deep understanding of customer behaviour into strategic plans.

Support commercial outcomes through data-driven recommendations that balance customer needs with business performance.

About You

You’re commercially savvy, analytically sharp, and customer obsessed. You know how to navigate data systems, uncover insights, and tell the story behind the numbers. You’re confident presenting to stakeholders and influencing decisions at all levels.

We’re looking for someone with:

Proven experience in customer insights, strategy, or analytics roles.

Strong commercial acumen and ability to connect data to business outcomes.

Advanced skills in Power BI, data insights, and system/process mapping.

Deep understanding of customer behaviour and how it drives business success.

Exceptional communication and stakeholder engagement skills.

What we offer:

Focus on internal promotion and development.

Employee Recognition Program and Service Awards.

Birthday leave - a day off for your birthday!

Volunteer leave - support your local community.

Job-relevant education assistance including Cat® University.

Employee Referral Bonus Scheme.

Employee Assistance Program

Ready to power up your career?
Apply today and join a company where your energy and ambition can truly shine."
86865610,Senior Commercial Analyst,4DTalent,https://www.seek.com.au/job/86865610?type=standard&ref=search-standalone&origin=jobCard#sol=9dfcc381cff0b1163262cf10d63409ca7c30e25b,19h ago,19.0,2025-09-01T02:00:00+00:00,Sydney NSW (Hybrid),Analysis & Reporting (Accounting),Contract/Temp,"$130,000 - $150,000 + superannuation","About the client

This organisation is a large global FMCG & Retail-focused business that has experienced sustained growth in recent years. With a clear expansion plan for the next 3-5 years through both organic and inorganic growth, this business is well set up to support your career. With it being an international company, training and development are second to none, and future international mobility for high performers is supported.

About the role

This role will act as a key commercial business partner, supporting strategic decision-making through high-impact reporting, forecasting, and analytical support. It's ideally suited to a commercially astute finance professional who thrives on solving complex business problems and driving insight-led outcomes in a fast-moving environment.

Key responsibilities include:

Lead budgeting, forecasting and planning across different business areas
Provide insights and scenario analysis to support key commercial decisions
Assist with major projects such as investments, strategic planning, and business growth
Build and maintain financial models and support the development of business cases
Play a role in M&A activity and help integrate newly acquired businesses
Manage regular performance reporting using tools like PowerBI and TM1
Work closely with senior leaders and help non-finance teams understand financial information
Contribute to team development by mentoring colleagues and improving finance processes
About you:

You're either a passionate Commercial Analyst / Senior Commercial Analyst who is immediately available or on a short notice period and is looking to progress their career, where your insights directly shape business performance.

You will also bring:

Strong experience in budgeting, forecasting, financial modelling, and full P&L ownership
Advanced Excel skills with proficiency in PowerBI, TM1 or similar reporting tools
Ability to turn complex data into clear insights and communicate across all levels of the business
CA or CPA qualified (or near completion) with strong stakeholder and business partnering skills
What’s on offer

Exposure to strategy, transformation, and operational decision-making
Opportunity to drive commercial performance across core sectors
Supportive, agile finance team invested in innovation
Flexible working arrangements
Close to public transport"
86879934,Senior Commercial Analyst,FourQuarters Recruitment,https://www.seek.com.au/job/86879934?type=standard&ref=search-standalone&origin=jobCard#sol=94bd127d1cf6881993beda6be76f37cda9ed26de,14h ago,14.0,2025-09-01T07:00:00+00:00,Sydney NSW (Hybrid),Analysis & Reporting (Accounting),Full time,$140K - $150K+Super,"Our client is a leading Australian FMCG Industry leader, they’re looking for a commercially minded Senior Analyst to partner with the sales & marketing team.  
This role is key in driving strategic initiatives, financial performance, top line growth, partnering with Senior stakeholders and executives, and supporting long term growth journey.  

Highlights: 

Partnering with Sales & marketing, drive Revenue Growth
Working closely with Executives, supporting strategic initiatives 
WFH flexibility, fantastic culture, Global Top Employer
Responsibilities:

Effective Finance business partnering, building close relationship to Divisional Operations Leaders and local Finance teams to add value and insight
P&L Management: Monitor Profit & Loss performance, offering insights for improvement.
Financial Analysis & Reporting: Conduct analysis, prepare reports, and present findings to senior management.
Process Improvement: Enhance financial processes to streamline reporting and forecasting.
Help to drive collaboration efforts between Sales, Finance and Operations, facilitating improved communication and collaboration, driving revenue growth initiatives

 
Qualifications:

CA or CPA qualifications 
FMCG/Manufacturing experience will be high regarded
3-5 years commercial experience.
Experience using Power BI preferred.
Strong analytical and problem-solving skills.
Excellent attention to detail and organizational skills.
Strong communications skills to build relationships with stakeholders
  
Interested?
A real opportunity to solidify a long-term career in a business which supports career growth, both locally and internationally.

If you’re interested in this opportunity and feel you’re the right fit please click “apply” or contact Sunny Chen at schen@fourquarters.com.au"
86879481,Senior Consultant - Business Intelligence (BI),FUJIFILM MicroChannel Services Pty Ltd,https://www.seek.com.au/job/86879481?type=standard&ref=search-standalone&origin=jobCard#sol=99fd685de0851e8f56c217b8fbe54d4b0a341c01,14h ago,14.0,2025-09-01T07:00:00+00:00,"North Sydney, Sydney NSW (Hybrid)",Consultants (Information & Communication Technology),Full time,,"About the Role
The purpose of the Senior Consultant is to drive multiple customer projects, providing expert-level consultations and support on Business Intelligence solutions.

We are looking for a skilled and client-focused Senior Consultant with technical and functional expertise. This role requires deep technical expertise in Microsoft Fabric and preferred knowledge of Solver xFP&A, and Qlik or similar, along with the ability to engage directly with customers to scope, design, and deliver tailored solutions.

What You'll Do

Design, implement, and support end-to-end solutions using Microsoft Fabric, Solver xFP&A, and Qlik.
Translate functional needs into technical specifications and solution architectures.
Ensure data integration, quality, and governance across platforms.
Lead workshops, training sessions, and knowledge transfer activities to empower client teams in using BI tools.
Provide strategic recommendations, actionable insights, and best practices to help clients align their corporate goals with key performance indicators (KPIs) and industry benchmarks.
Collaborate with internal teams, including data engineers, analysts, and project managers, to deliver high-quality BI solutions within project timelines and budget constraints.
Stay updated with emerging trends, tools, and technologies in BI, analytics, to continuously improve service offerings and deliverables.
Function as a trusted advisor to clients, build long-term relationships, and identify opportunities for additional consulting engagements or value-added services.
What You Need to Succeed 

Minimum 7 years’ experience working in multi-source data environments using ETL automations and data visualisation development and management.
Minimum 5 years’ experience with one or more components of the Microsoft BI toolset (Microsoft Fabric, DAX, SSIS, SSAS and others.)
Experience across other Business Intelligence technologies is highly preferred. 
Experience with Azure Data Services (Data Factory, Synapse, SQL Database) and Microsoft Fabric components (OneLake, Data Warehouse, Data Activator, etc.).
Proven ability to work directly with clients to scope, design, and deliver BI and analytics solutions.
Solid understanding of data modelling, ETL, and analytics best practices across diverse industries.
Strong communication, stakeholder engagement, and consulting skills.
Strong analytical skills, critical thinking abilities, and problem-solving capabilities with a focus on delivering actionable insights and recommendations. 
A Little Bit About Us
FUJIFILM MicroChannel is a multi-award-winning business solutions and technology provider, servicing mid-sized to large businesses, corporate divisions, government agencies, and enterprise organisations. Founded in 1995, FUJIFILM MicroChannel assists in clients to leverage technology for commercial success.

With outstanding credentials, an experienced team, and over 100+ Awards received from Microsoft, SAP, Sage, MYOB, Qlik and Körber, FUJIFILM MicroChannel is one of Australia’s most respected business solutions and technology providers. We sell and support world-class products from leading vendors; covering a full range of end-to-end operational and back-office systems.


If this is something you are interested in, please send through your resume and cover letter."
86862282,Senior Consultant - Business Intelligence (BI),FUJIFILM MicroChannel Services Pty Ltd,https://www.seek.com.au/job/86862282?type=standard&ref=search-standalone&origin=jobCard#sol=b167b95524a59c2395607439d27fc22d6878beff,21h ago,21.0,2025-09-01T00:00:00+00:00,Brisbane QLD (Hybrid),Consultants (Information & Communication Technology),Full time,,"About the Role
The purpose of the Senior Consultant is to drive multiple customer projects, providing expert-level consultations and support on Business Intelligence solutions.

We are looking for a skilled and client-focused Senior Consultant with technical and functional expertise. This role requires deep technical expertise in Microsoft Fabric and preferred knowledge of Solver xFP&A, and Qlik or similar, along with the ability to engage directly with customers to scope, design, and deliver tailored solutions.

What You'll Do

Design, implement, and support end-to-end solutions using Microsoft Fabric, Solver xFP&A, and Qlik.
Translate functional needs into technical specifications and solution architectures.
Ensure data integration, quality, and governance across platforms.
Lead workshops, training sessions, and knowledge transfer activities to empower client teams in using BI tools.
Provide strategic recommendations, actionable insights, and best practices to help clients align their corporate goals with key performance indicators (KPIs) and industry benchmarks.
Collaborate with internal teams, including data engineers, analysts, and project managers, to deliver high-quality BI solutions within project timelines and budget constraints.
Stay updated with emerging trends, tools, and technologies in BI, analytics, to continuously improve service offerings and deliverables.
Function as a trusted advisor to clients, build long-term relationships, and identify opportunities for additional consulting engagements or value-added services.
What You Need to Succeed 

Minimum 7 years’ experience working in multi-source data environments using ETL automations and data visualisation development and management.
Minimum 5 years’ experience with one or more components of the Microsoft BI toolset (Microsoft Fabric, DAX, SSIS, SSAS and others.)
Experience across other Business Intelligence technologies is highly preferred. 
Experience with Azure Data Services (Data Factory, Synapse, SQL Database) and Microsoft Fabric components (OneLake, Data Warehouse, Data Activator, etc.).
Proven ability to work directly with clients to scope, design, and deliver BI and analytics solutions.
Solid understanding of data modelling, ETL, and analytics best practices across diverse industries.
Strong communication, stakeholder engagement, and consulting skills.
Strong analytical skills, critical thinking abilities, and problem-solving capabilities with a focus on delivering actionable insights and recommendations. 
A Little Bit About Us
FUJIFILM MicroChannel is a multi-award-winning business solutions and technology provider, servicing mid-sized to large businesses, corporate divisions, government agencies, and enterprise organisations. Founded in 1995, FUJIFILM MicroChannel assists in clients to leverage technology for commercial success.

With outstanding credentials, an experienced team, and over 100+ Awards received from Microsoft, SAP, Sage, MYOB, Qlik and Körber, FUJIFILM MicroChannel is one of Australia’s most respected business solutions and technology providers. We sell and support world-class products from leading vendors; covering a full range of end-to-end operational and back-office systems.


If this is something you are interested in, please send through your resume and cover letter."
86866317,Senior Financial Analyst,Lynas Rare Earths Ltd,https://www.seek.com.au/job/86866317?type=standard&ref=search-standalone&origin=jobCard#sol=1230aaa7b74a9f4980ba3e4c088c2061cbcf6fb2,19h ago,19.0,2025-09-01T02:00:00+00:00,Perth WA,Analysis & Reporting (Accounting),Full time,,"Want to contribute to a sustainable future? Join Lynas Rare Earths as we embark on our Global expansion Journey – to help shape a new future.

Lynas Rare Earths was established as an ethical and environmentally responsible producer of rare earth materials and is the world’s only significant producer of separated rare earth materials outside of China, boasting a life of mine of more than 25 years, our materials are used in many future facing applications, including electronics, wind turbines and hybrid and electric vehicles.

Lynas employees work in an environment where safety is central to the role and support is always at hand. You will work as part of a smaller team so you can expect to build excellent connections with your supervisors and peers. We’re focused on creating an inclusive environment to allow our people to bring their best self to work because they feel safe, included and empowered. 

The Opportunity:

Lynas Rare Earths is currently seeking an experienced Senior Financial Analyst to join the team. In this exciting position, you will be responsible for preparing all reliable strategic financial advice, necessary financial statutory, regulatory or statistical reports, complete data analysis, forecasting of financial information and Performance Management reporting, whilst working closely with relevant stakeholders. The role is also accountable for managerial reporting, analysis, forecasting, budgeting and planning activities of operation relating to Finance for Operations.

As a highly valued member of the Lynas Rare Earths team, you will:

Lead the planning and budgeting process
Ensure the operations plan and budget is integrated and aligned with the Lynas Group business objectives. 
Provide financial guidance, insight and advise on financial impact
Regularly review and update full year forecast.  
Manage the delivery of monthly cost performance reports (including variance analysis)
Monitor and manage the operations cost management activities
Manage key stakeholder requirements, provide insightful reports / analysis for informed decision making
Identify trends in performance and implement recommended actions to improve performance in consultation with the Operations Team.
Review and identify opportunities for optimization of the management reporting processes (in terms of time, cost and risk) while ensuring accuracy and integrity of information.
Prepare rolling cash flow forecast and coordinate with Global Finance, Transactional Team and Treasury
Performs other duties of a similar or related level

What you will bring to the team:

Relevant experience across the full range of financial accounting activities - financial systems, internal controls and systems/process development in a commercial environment.
Team player with analytical, problem solving, communication, and interpersonal skills.
Familiarity with Enterprise Resource Planning (ERP) systems, such as Pronto, SAP.
Experience within the Resources sector (desirable)

 Qualifications and/or Skills:

Tertiary qualifications in Accountancy, Finance, or Commerce
Professional qualification and/or memberships such as Chartered Practicing Accountant (CPA), Association of Chartered Certified Accountants (ACCA), Certified Investment Management Analyst (CIMA) equivalent.
Valid and unencumbered Australian Driver’s license. 

We are committed to ensuring that our workplace is inclusive, where all our people feel that they belong, are valued, and respected.

We welcome and encourage applications from Aboriginal and Torres Strait Islander people, the LGBTI+ community, mature workers, as well as candidates with culturally diverse backgrounds."
