Job ID,Job Title,Company,Detail URL,Posted Label,Hours Old,Posted Datetime (Local),Location,Category,Work Type,Salary,Ad Text
89727850,Senior Integration Developer,"Talent – Specialists in tech, transformation & beyond",https://www.seek.com.au/job/89727850?type=standard&ref=search-standalone&origin=jobCard#sol=523038528cd6b085c7232e7a21d38b8068df9b25,1h ago,1.0,2026-01-16T01:00:00+00:00,"Melton, Melbourne VIC (Hybrid)",Developers/Programmers (Information & Communication Technology),Contract/Temp,,"6 Month Contract - Government Client
Melton Location - Hybrid Working Arrangement
Integration using Azure Integration Services

Our client is seeking a Senior Integration Developer to play a pivotal role in designing, delivering, and transitioning enterprise integrations into business-as-usual (BAU). This role sits at the intersection of architecture, delivery, operations, and stakeholders, acting as a key conduit between development teams, managed service providers (MSPs), and the business.

Key Responsibilities:

Align integration designs and implementations to the enterprise Architecture Framework and integration standards.
Act as a conduit between developers, MSPs, and business/BAU teams, ensuring clear communication and accountability.
Design, build, and support integrations using Azure technologies, including APIM, Logic Apps, and Function Apps.
Lead and support the transition from project delivery to BAU, ensuring documentation, monitoring, and support processes are in place.
Collaborate closely with DevOps teams to support CI/CD pipelines, monitoring, and operational best practices.

Skills & Experience:

Strong experience as a Senior Integration Developer in complex enterprise environments.
Hands-on expertise with Azure Integration Services (APIM, Logic Apps, Function Apps).
Experience working across project delivery and operational (BAU/Ops) models.
Solid understanding of DevOps practices, operational support, and production readiness.
Exposure to TechnologyOne integrations is highly desirable (nice to have).
Excellent communication and stakeholder management skills, with the ability to translate technical concepts for non-technical audiences.

What's in it for you:

6 Month Contract
Government Client
Melton Location - Hybrid Working Arrangement

Please apply today to secure an interview or for more information please contact Sarah Jordan on sarah.jordan@talentinternational.com"
89727824,Data Engineering Lead,FourQuarters Recruitment,https://www.seek.com.au/job/89727824?type=standard&ref=search-standalone&origin=jobCard#sol=265ccccdea0944480c8bd5650da07fa350dbdb53,1h ago,1.0,2026-01-16T01:00:00+00:00,Sydney NSW (Hybrid),Team Leaders (Information & Communication Technology),Full time,Up to $180K + Super + Bonus,"The Company:
An established and growing retail organisation is looking for a senior data engineer/lead to join a small data team and play an important role in executing on an established multi-year data strategy which includes several exciting data initiatives. Reporting directly into the CIO, you will be instrumental in enabling data-driven decision-making across the organisation that aligns with the business priorities.
  
You must be based in Sydney and able to work in the office a minimum of 3 days per week. This is a great growth opportunity for a senior data engineer looking to take the next step into a hands-on leadership role.
  
Key Priorities of the Role:

Build strong stakeholder relationships and be a trusted delivery partner by translating data into actionable insights that drive strategic decision making.
Collaborate cross-functionally to ensure data initiatives are aligned with business needs and integrated into operational workflows.
Design and build new innovative data capabilities whilst improving the existing data platforms and enhancing data quality, reliability and accessibility across core business functions.
Apply & develop your knowledge of emerging technologies and AI tools such as Claude, Snowflake Cortex, NLPs, LLMs & automation.
Work collaboratively with a hybrid internal and external data delivery team.
  
Your Skillset:

Minimum of 8+ years of data engineering experience, ideally from a Retail/FMCG industry background.
Hands-on experience with Snowflake DWH at an enterprise-scale (Databricks will be considered); Data lake architecture, real-time streaming and event-driven design.
Airflow, DBT, Python, CI/CD, PowerBI.
Experience in SQL, SSAS cubes & OLAP solutions is also highly regarded.
AI tools such as Claude, Snowflake Cortex & ML & NLPs.
Experience leading/mentoring of data engineers & management of external vendor(s).
Enjoy business partnering with key stakeholders and C-Suite - become a trusted advisor to multiple business & operational teams.
Drive innovation, continuous improvement, knowledge sharing & an openness to new technologies for process improvement and data delivery.
  
You must be Sydney based and hold Australian Citizenship or Permanent Residency to be considered for this role."
89727413,Data Engineer,TEG Pty Ltd,https://www.seek.com.au/job/89727413?type=standard&ref=search-standalone&origin=jobCard#sol=8d1ffb9df4502a526abbb31860ead058bf138f71,2h ago,2.0,2026-01-16T00:00:00+00:00,Sydney NSW (Hybrid),Engineering - Software (Information & Communication Technology),Full time,,"About Ticketek Entertainment Group​

Ticketek Entertainment Group is a global fan experience company that tickets, promotes and delivers live experiences impossible to forget.  In a distracted world where nothing beats real human moments, We makes life better live!

Our Group includes; our Fan Experience Platform (Ticketek) that sells tickets and provides value added services, Event promoting, with businesses across Sport (TEG Sport), Touring (TEG Touring) and Family Experiences (TEG Experiences) and our digital business (Ovation) which focuses on delivering seamless data-driven outcomes for our fans and partners.

About the Role: 

As a Data Engineer you will bring strong technical expertise in solution design, architecture, and coding to drive real outcomes in our data engineering initiatives. You will provide technical leadership, mentor junior engineers, and collaborate with Business and Product teams while continuously advancing your skills with the latest technologies and industry best practices.



Requirements



What does a day in the life look like?

Ensure adherence to data privacy, security, observability, and governance standards. 
Collaborate with architects and senior engineers to design resilient, high-performance data solutions. 
Build scalable data pipelines to ingest, process, and expose data using technologies like Snowflake, AWS Redshift, Kinesis, Lambda, DynamoDB, S3, Glue, Apache Storm, and others. 
Develop batch and streaming data solutions using Apache Kafka, Apache Spark, Airflow, and Delta Lake for real-time and scheduled data processing. 
Design and implement event-driven data architectures with streaming frameworks such as Kafka Streams and Kinesis Data Firehose. 
Implement Data Quality, Data Lineage, and Observability frameworks  
Build CI/CD pipelines using tools such as GitHub Actions, Terraform,  
Collaborate with Site Reliability Engineers to ensure stability and uptime of production pipelines and services. 
Continuously identify opportunities for performance improvement, cost optimisation, and process efficiency. 
Work with Data Scientists to ensure high-quality data for Machine Learning models and integrate them into production-ready pipelines. 
Responsible for technical delivery, proactively identifying risks and solutions, and coordinating with engineers, BAs, QAs, and Project Managers (PMs) to ensure successful execution of data initiatives.

About You 

Essential experience & skills

Undergraduate degree focused on Computer Science, Engineering, Data Science or a related discipline. 
7+ years of hands-on experience in data profiling, source-to-target mapping, ETL development, SQL optimisation, testing, and implementation. 
Proven experience delivering large-scale data ingestion, transformation, and processing using AWS technologies such as Kinesis, Athena, Redshift, DynamoDB, Lambda, and S3. 
Proficient with modern data platforms and tools including Snowflake, Databricks and Apache Storm. 
Strong experience working with relational databases (SQL) as well as NoSQL databases, particularly MongoDB. 
Proven ability to translate complex business requirements into technical solutions through effective cross-functional collaboration, strong communication skills, and adaptable problem-solving approach.
Exposure to CI/CD tools and practices, including Ansible, CloudFormation, Jenkins, and related automation technologies. 
Experience developing and deploying solutions on cloud platforms such as AWS, GCP, or Azure. 

Desirable experience & skills 

Jira / Confluence experience 
Experience consuming RET 
Experience to AI/ML technologies.  


Benefits



Here’s a taste of what TEG offers: 

Complimentary event tickets
Birthday and volunteering leave
Wellbeing discounts & flu vaccinations
Paid parental leave & free employee support (EAP)
Global rewards and recognition
Learning, development & career pathways
A diverse, inclusive, and passionate team

Equal opportunities

For more information about TEG please go to http://www.teg.com.au/ 

TEG is an equal opportunity employer committed to embrace diversity, respect, and care for our people and communities. 

If there are any adjustments that need to be made to ensure you have a fair and equitable experience in our recruitment process, please advise us when scheduling your interview. 

*Only direct applications will be considered. No recruiters please*"
89726729,Senior Data Engineer,Lanson Partners,https://www.seek.com.au/job/89726729?type=standard&ref=search-standalone&origin=jobCard#sol=a2ca4ba5995aa8bf35c7ae9612155f7fbfe90a5e,2h ago,2.0,2026-01-16T00:00:00+00:00,Sydney NSW (Hybrid),Database Development & Administration (Information & Communication Technology),Contract/Temp,"$1,100 per day","We’re working with a fast-growing financial services business building a modern data platform that underpins critical reporting, analytics and decision-making across the organisation.

This is a hands-on engineering role for someone who enjoys building things properly - clean pipelines, reliable data products and platforms that scale. You’ll work closely with both technology and business teams and play a part in rolling out AI-enabled capabilities as the platform evolves.

What you’ll be doing
Building and maintaining production-grade data pipelines using SQL and Python
Developing data models and transformations that are reliable, testable and easy to maintain
Implementing batch and streaming ingestion patterns on a cloud-based data platform
Improving platform foundations including CI/CD, infrastructure automation and monitoring
Supporting production systems, troubleshooting issues and keeping things running smoothly
Working directly with stakeholders to turn business requirements into practical solutions
Contributing to data quality, testing standards and documentation
Getting involved in AI and machine learning use cases, including LLM-based solutions
What we’re looking for
3–5 years’ experience in data engineering or software engineering
Strong SQL skills and solid Python experience
Exposure to modern data platforms and transformation frameworks
Good understanding of cloud environments (AWS preferred) and DevOps practices
Comfortable working in a fast-paced, delivery-focused environment
Clear communicator who can work across technical and non-technical teams
Curiosity and interest in AI, even if it’s not your core background yet
Nice to have
Experience with streaming, orchestration or infrastructure-as-code tools
Hands-on exposure to AI/ML or LLM-powered applications
Background in financial services or other regulated industries
For more information please reach out to Matthew Nicholas. Email address is matthew@lansonpartners.com."
89726255,Senior AI Analyst,Virgin Australia,https://www.seek.com.au/job/89726255?type=standard&ref=search-standalone&origin=jobCard#sol=0a1b1ba60a57ab20156569faf375fc1d61119d7b,3h ago,3.0,2026-01-15T23:00:00+00:00,Sydney NSW (Hybrid),Business/Systems Analysts (Information & Communication Technology),Full time,,"Full-time role that can be based out of our Brisbane or Sydney office, with some flexibility to work from home

Hello. We’re Virgin Australia. We’re the airline that’s always done things a little different. Our way. The Virgin way. We’re on a mission to make flying better than ‘nice’. And to do that, it takes a team of talented people who are passionate about customer experience, doing the right thing always, with a focus on safety – in the air, on the ground and in our workplaces. A team who values real diversity and inclusion, in a big brand with big ambitions.

What you’ll be doing

As our Senior AI Analyst (Business Analyst - AI), you’ll support the identification, shaping and delivery of AI-enabled improvements across the organisation. Working under the direction of the AI Transformation Lead, this role supports discovery activities, maps processes and workflows, gathers requirements, and helps define AI use cases that improve productivity and reduce friction in day-to-day operations.

Key responsibilities include:

Engage with business teams to understand how work is currently performed and identify inefficiencies.
Run workshops and interviews with subject-matter experts to uncover problems suitable for AI-enabled improvement.
Map current-state processes and design future-state workflows showing AI-driven improvements.
Define clear AI use cases with expected benefits and success measures.
Translate business needs into structured requirements, user stories, and acceptance criteria.
Work closely with engineers, data scientists, and platform teams to clarify requirements and support solution design.
Assist delivery teams during implementation and participate in testing and validation activities.
Support creation of operational documentation and training inputs.

You’ll be great in this role if you have…

A bachelor’s degree in business, information systems, commerce, or a related discipline, or equivalent professional experience.
Strong analytical skills and structured problem-solving capabilities.
Ability to translate between business and technical teams effectively.
Working understanding of modern AI concepts such as LLMs, RAG and agent workflows (at a conceptual level).
Experience in process mapping, requirements definition and stakeholder engagement.
Excellent communication and collaboration skills.
Formal training or coursework covering foundational AI concepts.
Industry-recognised business analysis certifications such as CBAP, CCBA, or equivalent (desirable).

We’re committed to looking after you, with some of the best benefits and conditions in the industry – including (but not limited to):

Discounted flights for you and your loved ones (including $1000 worth of travel credits per year)
A flexible, hybrid work style. Work from home or the office, adapt your location to suit your style and needs
One of Brisbane’s most admired head office locations, with South Bank train station, a supermarket, pharmacy, and lunch options downstairs plus a 5-minute walk to the Busway, a rooftop restaurant and onsite gym (with a low membership fee) and South Bank Parklands just across the road
Discounts on travel insurance, lounge membership, car hire, accommodation, and experiences worldwide
Cheaper hospitality, retail, technology, beauty and wellness services
Free counselling and access to a wellbeing app to support your physical, mental, social and financial health
‘Dress for Your Day’ – enjoy the freedom to wear whatever makes you feel great for the type of work you do and the day you have ahead of you.

When everyone is included, everyone wins

We’re all individuals. And we love that. That’s why we encourage applications from Indigenous Australians, people with disability, those from diverse cultural backgrounds, our friends in the LGBTQIA+ community, and anyone else who wants to join our family.

Ready to apply?

We’re ready to hear from you. Apply now."
89726067,Data Engineer,"CitiPower, Powercor and United Energy",https://www.seek.com.au/job/89726067?type=standard&ref=search-standalone&origin=jobCard#sol=589723d1afcbf89d9a245e87457d0778ed24da05,3h ago,3.0,2026-01-15T23:00:00+00:00,Melbourne VIC (Hybrid),Engineering - Software (Information & Communication Technology),Full time,Competitive salary + Employee Benefits + Bonus,"About us

At United Energy, we’re proud to deliver electricity to 715,000 Victorian customers every day through our network of poles and wires. But more than that, we’re here to power communities, support local businesses and keep critical services running smoothly, we’re essential to them all – and none of this happens without our people. As Victorians electrify everything from homes to transport, we’re focused on ensuring our networks are ready to meet that demand. If you want to be part of something essential, be essential with us.

 

About the role

The role is for a Data Engineer responsible for building and maintaining robust, scalable ETL data pipelines that enable analytics, reporting, and operational functions for Smart Meter applications across Citipower, Powercor, and United Energy. The position is primarily on‑premise but includes opportunities to support AWS modernisation and help shape the future data platform.

 

Key responsibilities

Design, develop, and maintain scalable and fault-tolerant ETL and data pipelines (batch & stream) to ingest, transform, and load data into analytical data stores.

Design and implement automated data quality checks, data drift detection, and anomaly monitoring to ensure high-integrity data feeding analytics and operational reporting

Serve as the go to expert for data related incidents (pipeline failures, data latency, performance issues) and coordinate resolution with engineering, operations, and IT security teams.

Translate Smart Grid and operational data strategies into implementable data solutions, working across multiple business areas

Work collaboratively with analytics, business, and IT teams to translate requirements into secure, scalable, and supportable data solutions, in line with organizational security and governance standards

Provide cross division operational support for day-to-day needs

 

For more information on the role’s responsibilities, please click here to download the position description.

 

What you’ll need from day one

Strong working knowledge of SQL and relational databases, particularly PostgreSQL and Oracle

Experience with one or more ETL tools such as Pentaho, Oracle Data Integrator (ODI), Informatica or similar.

Experience with Python or similar scripting language for data processing and automation

Extensive experience in data analysis and data modelling, including extraction of data from core systems, data manipulation, and end-to-end solution design

Previous experience in the Utilities sector preferred not mandatory

Tertiary qualifications in Engineer or IT/Computer Science or business-related discipline (preferred)

If you believe you have what it takes but don’t meet every requirement—or if you’d like to discuss flexible working arrangements to meet the key responsibilities —we encourage you to get in touch.

 

Key Benefits

We’re proud to offer an inclusive, supportive workplace where everyone feels safe, valued, and empowered to grow. Some of our benefits include hybrid work options, purchased leave, 15 weeks of gender neutral primary parental leave, health and wellbeing subsidiary, career development and planning opportunities, and exclusive discounts. Visit our company website to learn more.

 

Diversity, Equity & Inclusion to support a fair workplace for all

We are committed to building a safe, inclusive, and supportive workplace where people of all genders, ethnicities, sexual orientations, abilities and ages are valued for who they are and empowered to do their best. Through our Diversity, Equity & Inclusion Strategy (DEI), Reconciliation Action Plans and initiatives like Women in Power and Sparkle, our LGBTQIA+ allies network, we’re working to create equal opportunities for all. We are proud to be a WORK180 Endorsed Employer for Women. Explore our partnership with Work180.

 

We welcome applicants from all backgrounds and experiences, and strongly encourage First Peoples, women, people from the LGBTIQA community, culturally and racially marginalised people and people with disabilities to apply. We recognise how people from marginalised groups can face extra barriers and self-select out of recruitment processes.  With this in mind, we’re committed to making reasonable adjustments to ensure a positive, barrier-free recruitment process.

 

What’s next

Submit your application via our careers’ website by 15 February 2026. To make a confidential reasonable adjustment query, please contact Nadya Kartika from the Talent team at careers@powercor.com.au

 

Beon, CitiPower, Powercor and United Energy recognise Australia’s Aboriginal and Torres Strait Islander Peoples as the First Peoples and Traditional Custodians of the lands on which we work. We pay our respects to Elders past and present and acknowledge their ancient and continuing connection to Country.

 

We are committed to creating a workplace where everyone feels valued, respected and supported to succeed. By making sure our workplace is physically and mentally safe, so that our people can be their authentic selves, share their unique perspectives and can thrive."
