Job ID,Job Title,Company,Detail URL,Posted Label,Hours Old,Posted Datetime (Local),Location,Category,Work Type,Salary,Ad Text
89197491,Senior Business Process Analyst,Experis AU,https://www.seek.com.au/job/89197491?type=standard&ref=search-standalone&origin=jobCard#sol=7b9e8295fbdd8f10aa4bd4f7e9e7f576dd97593d,1h ago,1.0,2025-12-17T06:00:00+00:00,Melbourne VIC (Remote),Business/Systems Analysts (Information & Communication Technology),Contract/Temp,,"We are seeking the services of a Senior Business Analyst, who brings expertise in Business Process Analysis for a long term contract role. This role will suit an autonomous worker, as you will be required to work remotely with occasion regional travel required.



Responsibilities


Collaborate with stakeholders to understand their needs and gather detailed business requirements.
Develop and document business process models to illustrate current and future states.
Propose and design technical and process solutions that meet business needs and objectives.
Communicate findings, recommendations, and project updates to stakeholders and executives.
Create detailed documentation of business requirements, processes, and solutions.



Required Skills and Experience


Strong Business Analysis experience
Deep understanding of business process documentation and analysis
Ability to capture pain points
Ability to create journey and data flow maps
Strong analytical skills, excellent communication



If this sounds like you, please apply now. No further information can be provided at this time, due to the festive period shut down, however applications will be reviewed, and shortlisted candidates will be contacted. Please note that this role has long term potential, requiring a January/February 2026 commencement, working remotely (with occasional travel to regional Victoria). Rate will be negotiated based on your experience.


Kate Graham
Project Services
Principal Recruitment Consultant
Let's Connect
https://www.linkedin.com/in/kategraham/
+61 3 9604 4230


ManpowerGroup is committed to being a Diversity Confident Recruiter and encourages applications from people from a diverse range of backgrounds, including people with a disability. Please indicate your preferred method of communication in your resume and please let us know if you require any reasonable adjustments should you be contacted for an interview.

Aboriginal and Torres Strait Islander people are encouraged to apply.

By submitting your resume and other personal information with this application you are consenting to this information being collected in line with our privacy policy. Follow the link to learn more - www.manpowergroup.com.au/privacy-policy

Experis Pty Ltd is a wholly owned subsidiary of ManpowerGroup

State: QLD, licensee/s Manpower Services (Australia) Pty Ltd, LHL-02026-D5L4Q. State: QLD, licensee/s Experis Pty Ltd, LHL-02014-Y5F6D. State: SA, licensee/s Manpower Services (Australia) Pty Ltd, LHS 288856"
89196531,Senior Manager - SAS and Power Apps/ Power Automate,Bluefin Resources Pty Limited,https://www.seek.com.au/job/89196531?type=standard&ref=search-standalone&origin=jobCard#sol=51ee1d69278392edf01364fad167f747f40cf2e9,1h ago,1.0,2025-12-17T06:00:00+00:00,Sydney NSW (Hybrid),Analysis & Reporting (Banking & Financial Services),Contract/Temp,"AUD 165000 - 175000 per annum, plus super + bonus","Senior Manager – SAS and Power Apps/ Power Automate 
12-Month Max Term Contract | Sydney | Flexible Working

Lead data integration and system uplift initiatives within a Non-Financial Risk environment, translating complex business and regulatory requirements into scalable SAS and SQL-based analytical solutions. Design and deliver automation and low-code solutions using Power Apps and Power Automate to streamline processes, improve data quality, and reduce operational risk.

We are seeking an experienced Senior Manager to support the uplift and management of downstream impacts from strategic data integration initiatives within a Non-Financial Risk and Compliance environment.

This role sits within a specialist NFR Systems team and is ideal for a technically strong professional with deep SAS, SQL, and Microsoft Power Platform expertise who enjoys translating complex business requirements into scalable, automated data and analytics solutions.

What you’ll do
Lead and support data integration and system uplift initiatives within a regulated NFR environment
Translate business and regulatory requirements into clear technical specifications and analytical solutions
Design, build, and maintain SAS-based data pipelines, transformations, and analytical workflows
Develop efficient and scalable SQL queries to support reporting, analysis, and data quality initiatives
Identify manual or repetitive processes and automate workflows using Power Automate to improve efficiency and reduce operational risk
Build and enhance Power Apps solutions to support business processes, controls, and reporting
Partner with stakeholders across risk, compliance, technology, and data teams to deliver outcomes aligned to strategic priorities
Improve data quality, governance, and operational resilience through automation and standardisation
What you’ll bring
5+ years’ experience in data analysis within Banking, Risk, Compliance, or another regulated environment
Strong hands-on experience with SAS for data manipulation, transformation, and analytics
Strong SQL skills with the ability to simplify complex problem statements into practical solutions
Proven experience across the Microsoft Power Platform, including:

Building advanced applications in Power Apps
Designing end-to-end automated workflows using Power Automate
Integrating with enterprise systems (databases, SharePoint, APIs, and internal platforms)
Strong communication and stakeholder engagement skills, with the ability to translate technical insights into clear, actionable business outcomes
A proactive, solution-oriented mindset with a passion for process improvement and automation
Why join us? You’ll be part of a collaborative and purpose-driven organisation focused on strengthening risk management, data quality, and operational efficiency.
We offer:

Flexible working arrangements to support work-life balance
A Sydney-based role with hybrid working options
Access to learning, development, and upskilling opportunities
A supportive environment that values collaboration, innovation, and continuous improvement
Please apply on-line or for more information please contact Kausty Mahajan at Bluefin Resources on 02 9270 2603."
89196523,Corporate Reporting and Analytics Manager,Fyfe Pty Ltd,https://www.seek.com.au/job/89196523?type=standard&ref=search-standalone&origin=jobCard#sol=7051abf6c6c877ca43aa1ae870638960ce371abb,1h ago,1.0,2025-12-17T06:00:00+00:00,Adelaide SA,Programme & Project Management (Information & Communication Technology),Full time,,"Fyfe is a multi-disciplinary consultancy providing comprehensive engineering, environmental, planning and surveying services throughout Australia. With over 1000 employees, Fyfe delivers projects with a wide range of clients in the Property & Infrastructure, Energy & Resources, Defence and Renewables sectors to provide high quality, commercially pragmatic solutions with a strong focus on client service and delivery.




About the Opportunity

Fyfe is looking for a high-impact Corporate Reporting and Analytics Manager who will sit at the heart of the business, turning complex project and financial data into clear, actionable insights that directly influence performance, client outcomes, and decision-making. This role owns the data-to-decision pipeline; driving smarter reporting, automation, and continuous improvement across a fast-moving, project-based environment. The role can be based in Melbourne, Brisbane or Adelaide. 

What will you be doing? 

Collaborate with internal stakeholders to understand business needs and deliver data-driven insights.

Extract and manage datasets from project management systems, acting as the central link to ensure consistent, accurate, and reconcilable data.

Develop and maintain KPIs, dashboards, and analytical reports to monitor performance across key client activities.

Lead or support automation and digitisation initiatives to enhance client analysis and reporting efficiency.

Deliver clear, customer-focused reporting, analysis, and insights that provide actionable guidance to management and internal stakeholders.

Interpret and transform large, complex datasets into meaningful and actionable insights; proficiency in financial reporting, accounts, and methodologies is advantageous.

Identify process inefficiencies and design improved future-state workflows.

Drive continuous improvement initiatives and support cultural change toward data-driven decision-making.

Your background and experience:

Ability to quickly learn project management systems and act as a key liaison between business unit teams and data outputs.

Tertiary qualifications in Business, Commence, Data Analytics, or a related field.

Strong financial modelling capability with advanced Excel skills; experience with Power BI, Power Query and/or SQL Server Databases is PREFERRED.

Demonstrated experience in financial analysis or commercial finance within project-based or complex operating environments.

Confident communicator with the ability to educate and influence non-financial stakeholders.

High attention to detail and accuracy, with the ability to perform effectively in a lean, fast-paced environment.

Previous experience in, and motivated by, working in a professional services environment. 

Why Fyfe:

We continue to work on our great culture to make it better

We listen to our people

A social, collaborative, and inclusive culture with a calendar full of social and networking events

We create your next opportunity to ensure we support your career development

Additional salary sacrificed purchased leave

Employee discounts with over 470 leading retailers, including fuel and grocery discounts.

Salary sacrifice novated lease, e-bikes/e-scooters and devices.




Fyfe embraces and fosters a culture that supports diversity, inclusion and respect, where people are empowered to fulfil their potential. We welcome people with diverse skills, experiences, perspectives and backgrounds. We are dedicated and committed to attracting and recruiting Aboriginal and Torres Strait Islander peoples and encourage applications from people with disability, people that identify as LGBTQIA+ and people from culturally and linguistically diverse backgrounds.

How to apply
If you believe you meet the above criteria and would like to join our successful finance team, click on the APPLY FOR THIS JOB button to submit your application.

Follow us on LinkedIn to keep up to date with our news and projects.

Please note only shortlisted candidates and those who are Australian Citizens, hold permanent residency will be contacted."
89196030,Senior/Lead data engineer,Billigence,https://www.seek.com.au/job/89196030?type=standard&ref=search-standalone&origin=jobCard#sol=be1fe25aaf526df7dbdbf491355448588f9639fb,1h ago,1.0,2025-12-17T06:00:00+00:00,Sydney NSW (Hybrid),Engineering - Software (Information & Communication Technology),Full time,,"About us: 
 
Billigence Pty Ltd is a specialist in the delivery of market-leading Business Intelligence and CRM solutions. Headquartered in Sydney, Australia and with offices in Prague, London, Frankfurt and Singapore our passion is data and our focus is the delivery of end-to-end solutions via a talented team of skilled professionals.  

We are partners with leading edge software platforms including Snowflake, dbt, Tableau, Alteryx, Collibra, and Salesforce.
  
What we are looking for:

We are seeking a Senior/Lead Data Engineer to join our growing Data Cloud Practice. You will work closely with our blue-chip banking clients.


Essential skills/experience required:

7-10+ years of experience across data engineering, cloud computing or data warehousing
Strong expertise in one or more of the following: Snowflake, Databricks, Redshift, Fabric, AWS, Azure, GCP, Cloudera or Teradata etc.
Willingness to up-skill in Snowflake if you do not have Snowflake experience
Strong data modelling experience & ETL processes
Strong expertise in SQL
Excellent communication skills, with the ability to collaborate across cross-functional teams and influence technical decisions.
Strong stake holder engagement skills/experience
Highly desirable:

Consulting experience
Design and architecture experience
Experience with dbt, Fivetran, Matillion
DevOps experience 
Experience with Python, Java, Scala nice to have.
Relevant certifications (SnowPro etc)
What’s in it for you?

Competitive salary + bonus
Opportunity to work on a variety of challenging projects
Be part of a global organisation.
Certifications provided
Learning & career growth opportunities.
Flexible, hybrid working model.
Company lunches & events.
Open, friendly team environment.
  
If this sounds like something you are interested in, please apply with your most up-to-date CV and we will be in touch!"
89195899,Associate Director - Performance Improvement,KordaMentha,https://www.seek.com.au/job/89195899?type=standard&ref=search-standalone&origin=jobCard#sol=a8cc2049e649fdf5479910c2b21cd83e27f0bcf6,2h ago,2.0,2025-12-17T05:00:00+00:00,Melbourne VIC,Management & Change Consulting (Consulting & Strategy),Full time,,"Company Description


For more than 20 years, KordaMentha has supported businesses through some of their most complex matters and opportunities. Founder owned and led; we are an advisory firm that helps corporations, financiers, lawyers, private investors and government clients to grow, protect and recover value.

That’s what we do, but it’s how we do this that makes us who we are.

Proudly independent, strategically local, and with a bias for action to get things done, we focus on doing what is right by our clients, our people, and the wider community. Our track record shows that we help navigate the best path forward in challenging times, and do so across cities, regions and territories.

In the most stressful or demanding environments, we continue to drive change where it really counts.

Job Description


Our Performance Improvement team is growing rapidly and is looking for a motivated Associate Director. As an Associate Director you will partner with clients on a diverse range of engagements from strategic reviews through to delivery of operational and financial performance improvement solutions. Specifically, you will:

collaborate with our team and clients to develop and deliver impactful engagements across a range of industries 
analyse financial information, identify issues and prepare recommendations for our clients 
assist clients to evaluate and understand the performance and position of their business; and
proactively create and implement solutions that are as varied as the challenges our clients face. 

This role works alongside Partners, with constant connections with clients and across the firm. You will enjoy:

Genuine exposure to senior leaders – you will provide support to the senior team members and will be relied on as a meaningful contributor.
Market leading engagements – we are brought in for complex engagements when significant value is at risk, whether it is financial, reputational or otherwise. Our clients are often at the most difficult crossroad in their history, and this makes the work important, interesting, and educational.
Meaningful work – our engagements are highly commercial, with an emphasis on developing impactful solutions to improve the bottom line and operations. As a team, our bias is towards rapid decision making and is grounded in deep analysis and learnings from client interactions.  

Qualifications


As an ideal candidate for this role, you will have:

Tertiary qualifications combined with 6-8 years’ experience, including experience in professional services.
An intellectually and commercially curious mindset to understand how businesses operate from the inside.
Experience in diagnosing and solving complex commercial issues.
Demonstrating attention to and passion for detail.
Strong financial and operational skills.
Strong analysis, financial modelling and / or report development skills.
Exceptional interpersonal & communication skills to influence stakeholders to successful outcomes.
A willingness to travel interstate as required.

Additional Information


At KordaMentha, we offer far more than just a job—we offer an opportunity to grow your career, expand your professional network, and make a tangible impact. As an integral part of our team, you'll collaborate closely with senior leaders in a firm that thrives on innovation and high-performance culture.

At KordaMentha, we believe there is strength in difference. Our entrepreneurial spirit expands the possibilities for action. We approach situations, challenges, and opportunities with optimism, curiosity, and diversity of thought. We seek novel solutions to problems and encourage unconventional and innovative approaches. 

Our team's diverse skillsets, backgrounds and experiences fuel KordaMentha's different mindset. We encourage candidates from all backgrounds to apply, recognising that talent and potential extend beyond traditional qualifications. Our selection process values diverse perspectives and considers each applicant's unique strengths and capabilities."
89195639,Senior Business Analyst – Digital,Lime Recruitment,https://www.seek.com.au/job/89195639?type=standard&ref=search-standalone&origin=jobCard#sol=0bb7591eb9352ab48202d977c72e6890651b5e2f,2h ago,2.0,2025-12-17T05:00:00+00:00,Brisbane QLD (Hybrid),Business/Systems Analysts (Information & Communication Technology),Contract/Temp,No contractor fees / two pay runs per week,"Senior Business Analyst – Digital

Contract to 30/06/2026

Brisbane CBD + WFH

Our client is undertaking a significant, enterprise-wide transformation program focused on modernising its technology landscape and improving how customers and stakeholders engage with the organisation. This multi-year initiative spans technology, operations, finance, risk, people, leadership and culture, and represents a major investment in future-proofing service delivery within a highly regulated environment.

As part of this broader program, a critical digital initiative is underway to deliver a new standalone, public-facing website by 30 June 2026. This work involves separating from a shared government platform, establishing a distinct digital environment and brand, and laying the foundations for a more complex digital portal to follow.

Key Responsibilities

Lead business analysis activities across a medium to large-scale website delivery

Establish and embed enterprise-level governance, requirements management, and delivery discipline

Translate business and digital experience needs into clear, actionable vendor deliverables

Facilitate workshops and engage stakeholders across technology, business and leadership groups

Support the creation of a distinct digital brand and user experience, not just technical outcomes

Contribute to delivery planning, risks, issues, and dependencies within a fixed-deadline environment

Support foundations for a subsequent, more complex digital portal build post-website launch

What We’re Looking For

10+ years’ experience operating as a Senior Business Analyst

Recent (within the last 5 years) experience delivering medium to large-scale digital or website projects

Strong understanding of digital experience, branding, and website capability

Experience working with DXP platforms (Sitecore experience preferred but not essential)

Strong facilitation, communication, and executive engagement capability

Why apply through Lime Recruitment?

Enjoy two pay runs per week without contractor fees. As a Queensland-owned agency, we offer personalised service and are a Tier 1 supplier to the Queensland Government. Awarded Australia’s top-performing small agency in 2021 and 2022, with a finalist spot in 2023. Partner with Lime for genuine, experienced, friendly recruiters dedicated to securing the best opportunities for you. Apply now or contact Daniel Keyte on 0433 013 200 or daniel@limejobs.com.au to find out more!"
89195416,Senior Commercial Manager | Strategy Focus,u&u. Recruitment Partners,https://www.seek.com.au/job/89195416?type=standard&ref=search-standalone&origin=jobCard#sol=51a957459da222fc826eccbec2345459567053ee,2h ago,2.0,2025-12-17T05:00:00+00:00,Sydney NSW,Strategy & Planning (Accounting),Full time,"$180,000 - $200,000 + Super + Bonus","u&u Recruitment are delighted to be partnering with a premier Fintech in their search for the next leader. This is a role where your models, insights and recommendations directly influence strategy, pricing decisions and long-term investment choices. You’ll sit at the intersection of finance, strategy and senior stakeholders, turning complexity into clarity and numbers into action. 
 
If you enjoy asking “what if?”, building compelling business cases, and being the person leaders trust when the decision actually matters, keep reading. 
 
In short you’ll be: driving better decisions through sharper commercial insight. 
 
More specifically, you will: 

Develop and shape pricing and commercial strategies, and track how they perform in the real world;
Build and run scenario models across portfolios, products and customers (because strategy is rarely linear);
Research, benchmark and challenge assumptions to support big-picture decisions;
Lead business case development, from feasibility through to stakeholder buy-in;
Support investment appraisal and benefits realisation, ensuring ideas deliver what they promise;
Provide deep financial analysis and storytelling that executives actually want to read;
Help design measurement frameworks so success can be tracked, not guessed;
Partner closely with stakeholders, acting as a trusted commercial advisor and sounding board; and
Support governance around pricing and investment decisions, without drowning anyone in process.
What you’ll bring:
 
You’re commercially minded, strategically curious, and comfortable operating in complexity. 
 
You’ll likely have: 

Strong experience in commercial finance, strategy, investment appraisal or financial analysis;
A track record of influencing decisions through clear modelling, logic and communication;
Confidence engaging senior stakeholders and translating numbers into plain English;
Solid grounding in pricing, business cases, benefits management and risk assessment; and
A relevant degree in Finance, Accounting or Business (professional qualifications welcomed).
Just as important as your CV: 

You enjoy solving ambiguous problems;
You can zoom out to strategy and dive into detail when needed; and
You care about impact, not just outputs.
Why this role? 

Because you want: 

Exposure to strategic, high-impact work;
A role where finance helps set direction, not just report on it;
Smart stakeholders who value commercial thinking; and
Variety, complexity, and problems worth solving.
If you’re ready to step into a role where your analysis shapes outcomes, we’d love to hear from you. 

How to Apply

For more information or a confidential discussion please call Ed Burgess at u&u on 02 8245 7916 quoting reference number 43670.
 
At u&u Recruitment Partners, we value diversity, equity and inclusion. We welcome applications from Aboriginal and Torres Strait Islander people, people with diverse cultural and linguistic backgrounds and people with disability.
 
Should you require reasonable adjustments or have a preferred method of communication throughout the recruitment process, we encourage you to make a request via adjustments@uandu.com or phone the above-mentioned u&u consultant to discuss. In response to these requests, we will collaborate closely with you to implement the appropriate adjustments.
 
Additionally, for a barrier-free and inclusive online experience, you can access u&u’s opportunities using accessibility software Recite Me at https://www.uandu.com/jobs.
 
Please submit your resume in Word format only."
