Job ID,Job Title,Company,Detail URL,Posted Label,Hours Old,Posted Datetime (Local),Location,Category,Work Type,Salary,Ad Text
89849841,Senior Analyst - Debt Advisory - Capital Markets Group,JLL,https://www.seek.com.au/job/89849841?type=standard&ref=search-standalone&origin=jobCard#sol=4ee66cc81d81423bd1fb8c51deefc71f61d01be3,1h ago,1.0,2026-01-21T20:00:00+00:00,Sydney NSW,Corporate Finance & Investment Banking (Banking & Financial Services),Full time,,"Join JLL's elite Capital Markets team and accelerate your career in Debt Advisory.




As a Senior Analyst in our Debt Advisory division, you'll work directly with our Executive Directors and Co-Heads of Debt & Structured Finance to execute complex finance transactions that define Australia and New Zealand's real estate finance landscape.




Key Responsibilities:

Execute debt placements and capital raising assignments for marquee clients

Build sophisticated financial models that drive investment and development finance decisions

Create compelling pitch materials and deliver presentations to financiers and clients 

Manage due diligence processes and coordinate with key stakeholders

Develop strategic client relationships and provide ongoing transaction support

Conduct market research and analysis that shapes industry strategies

Project manage the continuous improvement of team processes and best practices




Why Choose This Role: 




Professional Growth - Gain exposure to diverse asset classes and cutting-edge finance strategies while working on landmark transactions.


Expert Mentorship - Learn directly from industry leaders in our collaborative, high-performance environment.




Technology Advantage: Access AI-powered market intelligence and digital platforms that amplify deal exposure globally, providing tools that most competitors simply don't have.




Competitive Rewards – Competitive compensation package and career development opportunities.




What You Bring: 

Bachelor's degree in Finance, Economics, Real Estate, or related discipline

Proven experience in real estate finance, banking, or related field

Excel proficiency with strong financial modeling and valuation capabilities

Exceptional analytical thinking and problem-solving abilities

Outstanding written and verbal communication skills

Attention to detail and ability to manage multiple projects simultaneously

Ability to excel in a fast-paced, deadline-driven and collaborative environment




What JLL Can Offer You:

Premium office space and workplace perks. Enjoy all the complimentary barista beverages of your choice in a collaborative environment that supports your professional growth

Recognition benefits

Corporate discounts and offers

'You' Days

Health & Wellbeing programs

Learning & Development platforms

Mentorship from industry-leading professionals

Paid time off for volunteer work




As an organisation, we don’t just accept that we are a place of many different people, but we embrace it, we celebrate it, and we proactively support the needs that difference brings. JLL is committed to equal opportunity and building an inclusive workplace. This is why, for more than a decade, we continue to rank among the World’s Most Ethical Companies. We support applications from all underrepresented groups, including Aboriginal and Torres Strait Islanders, LGBT+, people with disability and people of all age, religions and race. We are dedicated to offering veterans from all ranks and services a successful civilian career as they transition out of the military. We recognise and appreciate the skills acquired in their service careers as vital and transferable to our workforce.




Apply today, quoting job reference number REQ471757."
89849070,"2 x Principal Advisor, Strategic Insights, Premier and Cabinet",Department of Premier and Cabinet,https://www.seek.com.au/job/89849070?type=standard&ref=search-standalone&origin=jobCard#sol=458b02f4436a75895578f801cdf2043d27d61c1f,4h ago,4.0,2026-01-21T17:00:00+00:00,Brisbane QLD,"Strategy & Planning (Consulting & Strategy)
Government - State (Government & Defence)","Full time, Part time",,"Are you curious, open-minded, responsive and agile? Do you have experience working collaboratively with senior stakeholders across government, academia and industry? This role could be for you. We are seeking a Principal Advisor, Strategic Insights, to play a key role in our Implementation Division in the Department of the Premier and Cabinet. Working at the heart of Queensland Government decision making, you will use your research, insights and foresight expertise; strong networks, communication skills and eye for detail to enhance delivery of current and future priorities. You will provide strategic insights and foresight to support proactive responses to emerging societal and economic shifts. If you have experience in horizon scanning, trends storytelling and research and strong presentation skills, this job is ideal for you.

About us:
For more than 165 years, the Department of the Premier and Cabinet has been building the foundations of Queensland. As the central policy agency for the Queensland Government, our people influence and impact the work at the core of our state's public sector.

The Strategic Insights unit equips the Queensland Government with forward-looking insights, uncovering emerging opportunities and risks, empowering decision-makers to create a brighter future. Our mission is to discover the new the opportunities of tomorrow, while exploring and identifying new insights to address the challenges of today.

How you'll contribute:
As a senior team member, you will lead research, develop strategic insights, implement foresights and futures methodologies, and deliver high quality briefs. In this role, you will:
• Mentor team members in strategic thinking, frameworks and processes.
• Use your extensive professional networks while continuing to build strong stakeholder relationships.
• Lead trends scanning, secondary research, and expert consultations to inform evidence-based reporting.
• Facilitate workshops, engage with the community, and influence executives through high-level discussions and engaging presentations.
• Manage projects to deliver high-quality outputs with speed and efficiency.
• Communicate complex ideas with clarity and influence.

What you'll bring to the role:
Due to the critical nature of this role and its proximity to central government decision making, you will have the following attributes:
• History of high performance and productivity.
• Attention to detail and commitment to quality.
• Agility to adapt rapidly to changing priorities.
• Experience working in a fast-paced, dynamic environment.
• High-level, professional communication skills.
• Positive and open-minded with commitment to a growth mindset.
• Visionary and future focused.

Candidates with a background working in a central agency, consulting, commercial strategy or in fast-paced, high-performing teams will be highly regarded.

Why Join Us?
At DPC, you'll be part of a team that leads and connects the public sector, delivering outstanding advice and services that impact Queensland's future. It's in your hands.

How to apply:
Please provide a one-page cover letter outlining your interest and suitability for the role and a tailored resume highlighting your relevant work experience. Further information on the responsibilities of the role is in the role description. You are strongly encouraged to review the applicant guide prior to applying. DPC is committed to working with you to discuss adjustments to ensure you can best
demonstrate your suitability for the role. If you would like to discuss the role or would like additional support/adjustments during recruitment, please contact Kathy Benson on Ph: 0438 663 857.

Applications to remain current for 12 months.

Job Ad Reference: QLD/676607/26

Closing Date: Friday, 06 February 2026"
89848400,Head of Design Research,Canva,https://www.seek.com.au/job/89848400?type=standard&ref=search-standalone&origin=jobCard#sol=4c109874e52ad4fb430da1b56947f3c3a4c94a33,5h ago,5.0,2026-01-21T16:00:00+00:00,Sydney NSW (Hybrid),Web & Interaction Design (Design & Architecture),Full time,,"Job Description


Hey, g'day, mabuhay, kia ora, 你好, hallo, vítejte!

Thanks for stopping by. We know job hunting can be a little time consuming and you're probably keen to find out what's on offer, so we'll get straight to the point.

Where and how you can work

Our flagship campus is in Sydney. We also have a campus in Melbourne and co-working spaces in Brisbane, Perth and Adelaide. But you have choice in where and how you work, we trust our Canvanauts to choose the balance that empowers them and their team to achieve their goals.

What you’d be doing in this role

As Canva scales change continues to be part of our DNA. But we like to think that's all part of the fun. So this will give you the flavour of the type of things you'll be working on when you start, but this will likely evolve.

At the moment, this role is focused on:
 

Team Lead - Lead, mentor, and grow the Design Research team—building research capability, fostering psychological safety, and developing consistent standards of excellence across evaluative and generative methods.

Future research - Craft and lead a design research strategy that informs product vision, company goals, and long-term opportunities in an AI era.

Close the Loop (evaluative) research - Drive streams of work to find and fix user issues across Canva’s product surfaces by identifying and close loops, and to ensure an objectively high quality bar

Self-serve research - Enable product teams to confidently conduct their own research through training, templates, and shared frameworks - while maintaining a strong quality bar

Sub-specialty lead - Evolve the Design Research sub specialty by strengthening methodologies, elevating craft standards, and integrating AI-assisted techniques that improve speed, quality, and scale.

Set and maintain a quality bar for design research - both via hands-on research, and coaching, training, processes, and oversight

Autonomy & Decision Making: Sets direction for the group with clarity and confidence, defining priorities and navigating trade-offs across multiple teams, while aligning to strategic direction

Lead communications to all relevant company goal stakeholders

Drive prioritisation so that this key resource is focused on the key priorities

Insight Impact, Measurement and Communication - define and measure research success metrics

Define and manage the research tool ecosystem - including AI-enabled platforms that improve insight generation, collaboration, and organisational understanding.

You're probably a match if:

You're a Seasoned leader with deep expertise across generative, evaluative, and mixed-methods research

Motivated by shaping product strategy, elevating research craft, and integrating emerging AI capabilities into meaningful practice

AI resesarch native, consistently learning and evolving skills as fast as the technology is unlocking capabilities

Skilled leader to ensure the team has the right strategy, quality bar, and delivery

Passionate about using research to drive business and product strategy to delight our community, from the most high level strategy all the way to specific product details

Strong stakeholder management and communications skills to partner with senior leaders and ICs across Product, Design, Engineering, and Data

Force multiplier to amplify the impact of research by unlocking Product teams across Canva to conduct their own research

What's in it for you?

Achieving our crazy big goals motivates us to work hard - and we do - but you'll experience lots of moments of magic, connectivity and fun woven throughout life at Canva, too. We also offer a range of benefits to set you up for every success in and outside of work.

Here's a taste of what's on offer:

Equity packages - we want our success to be yours too

Inclusive parental leave policy that supports all parents & carers

An annual Vibe & Thrive allowance to support your wellbeing, social connection, office setup & more

Flexible leave options that empower you to be a force for good, take time to recharge and supports you personally

Check out lifeatcanva.com for more info.

Other stuff to know

We make hiring decisions based on your experience, skills and passion, as well as how you can enhance Canva and our culture. When you apply, please tell us the pronouns you use and any reasonable adjustments you may need during the interview process.

We celebrate all types of skills and backgrounds at Canva so even if you don’t feel like your skills quite match what’s listed above - we still want to hear from you!

Please note that interviews are conducted virtually."
89848394,Health Data Informatics AI Team Lead,Children's Cancer Institute,https://www.seek.com.au/job/89848394?type=standard&ref=search-standalone&origin=jobCard#sol=78a247c5dd4d0d7b1e2efaefc8a92732220e6fc0,5h ago,5.0,2026-01-21T16:00:00+00:00,"Randwick, Sydney NSW",Clinical/Medical Research (Healthcare & Medical),"Contract/Temp, Full time",,"For over 40 years, our shared commitment to curing childhood cancer has united us. Together, we continue to accelerate the answers to make that possible.

To accomplish our vision, we’re seeking someone who lives our values: owning and delivering meaningful work, collaborating to drive impact, challenging the status quo to create a better future, and balancing logic with empathy. Let’s achieve more, together.

The Health Data Informatics & AI Team Lead will accelerate existing efforts within Children’s Cancer Institute Computational Biology Group to shape the next generation of AI-enabled health data solutions at Children’s Cancer Institute. This newly created role will guide the development of advanced AI systems for health data collection and harmonisation, rapid molecular reporting, tumour classification, and knowledge graph creation. These initiatives already underpin national-scale precision medicine programs and are critical for improving diagnostic accuracy, supporting translational research and enabling real-world data reuse. 

Beyond technical delivery, this role will provide strategic leadership: defining and executing our AI roadmap, expanding institutional capability in health data informatics, and driving the adoption of innovative approaches like LLMs, RAG, and generative AI. The Health Data Informatics & AI Team Lead will also build key partnerships with technology and research leaders to deliver scalable, ethical, and interoperable solutions, ensuring CCI remains at the forefront of digital health innovation.

To succeed you will have…

A PhD in Computer Science, AI, Bioinformatics, Computational Biology, Biomedical Engineering, or a closely related discipline, with demonstrated experience in regulated healthcare environments. 
CHIA (Certified Health Informatician Australasia) certification would be highly desirable
Proven track record of leading scientific or technical teams in a research-intensive environment. 
Demonstrated experience in applying AI/ML techniques to clinical or biomedical data, including multi-omic analysis. 
Experience in working with health data, clinical workflows, and medical research contexts. 
Experience in designing and conducting research experiments and contributing to intellectual property or scientific invention. 
Excellent communication and collaboration skills, including the ability to work effectively with clinical, technical, legal, and governance stakeholders. 
Experience building partnerships with technology or industry partners (desirable)

We will support you to be your best with benefits that include but are not limited to:

Working in a world-class, purpose-built facility, the only one in Australia dedicated to curing childhood cancer
Focus on employee wellbeing, including up to 5 gifted wellbeing days off (paid) per year
Access to Fitness Passport, with access to an extensive choice of fitness facilities across Sydney at discounted rates
Corporate discounts and discounts on education through UNSW

Join us to shape a future every child deserves and to find meaning in your own. Because together, we can cure every child of cancer. It’s not if, it’s when.

Additional information about Children's Cancer Institute can be found on our website at: https://www.ccia.org.au/jobs-study . We make hiring decisions based on your experience, skills and passion, as well as how you can enhance Children’s Cancer Institute and our culture.  We embrace diversity and encourage you to advise of any reasonable adjustments you may need during the recruitment process."
89847676,Data Modelling Lead,Virgin Australia,https://www.seek.com.au/job/89847676?type=standard&ref=search-standalone&origin=jobCard#sol=a06e01e5bbf095934b9123041a6326ed3a12bfa9,7h ago,7.0,2026-01-21T14:00:00+00:00,Sydney NSW (Hybrid),Engineering - Software (Information & Communication Technology),Full time,,"Hello. We’re Virgin Australia. We’re the airline that’s always done things a little different. Our way. The Virgin way. We’re on a mission to make flying better than ‘nice’. And to do that, it takes a team of talented people who are passionate about customer experience, doing the right thing always, with a focus on safety – in the air, on the ground and in our workplaces. A team who values real diversity and inclusion, in a big brand with big ambitions.

What you’ll be doing

At Virgin Australia, data is central to how we make decisions, serve our customers, and shape the future of our airline. We’re investing heavily in our Enterprise Data Platform (EDP) to ensure our data is trusted, well-defined, and ready to power analytics, AI, and commercial outcomes at scale.

As our Data Modelling Lead, you’ll play a critical role in building enterprise trust in data. You’ll design and govern business-aligned data models that underpin analytics, AI, and decision-making across the organisation — ensuring data is reliable, consistent, and genuinely understood by the business.

You’ll work closely with analytics, engineering, and business teams, treating data as a strategic asset and enabling faster, higher-quality insights across commercial, operational, and loyalty domains.

The preferred location for this role is Brisbane. We are open to a  Sydney base however some travel would be expected.

What you’ll be doing…,

Define and govern a single set of business definitions, relationships, and metricsOwn enterprise dimensional and semantic data models
Establishing modelling standards and patterns that teams can confidently reuse
Reduce ambiguity across commercial operational, and loyalty datasets
Enable scalable analytics through dbt, Databricks, and semantic layers (including administration and product ownership of support tools)
Partnering with engineers to ensure performant, reliable data structures
Treat the Enterprise Data Platform as a capability with clear road-maps, service levels and ownership
Translating business needs into robust data models
Coaching analysts and data scientists in effective modelling practices
Design data models suitable for GenAI, RAG, and metrics layers
Enable AI tooling such as Databricks Genie and ChatGPT Enterprise
Ensure data structures support long-term scalability and future innovation

You’ll be great if you have…

10+ Yrs experience in data, analytics, or data platforms roles
Strong dimensional modelling expertise (Kimball)
Hands-on dbt experience (Must have)
Advanced SQL skills (Must have)
Practical experience working in Databricks (Must have)
Experience in delivering enterprise-scale data solutions
Excellent stakeholder communication across technical and business audiences
Confidence to provide clear reasoning when challenging requirements
Tertiary qualification in data, technology, engineering, mathematics or related field

Desirable

Experience in airline, travel, or complex operational domain environments
Experience building semantic layers or enterprise metrics frameworks
Exposure to conceptual, logical, or ontology-based modelling
Experience supporting AI and advanced analytics information needs

We’re committed to looking after you, with some of the best benefits and conditions in the industry – including (but not limited to):

Discounted flights for you and your loved ones (including $1000 worth of travel credits per year)
A flexible, hybrid work style. Work from home or the office, adapt your location to suit your style and needs
One of Brisbane’s most admired head office locations, with South Bank train station, a supermarket, pharmacy, and lunch options downstairs plus a 5-minute walk to the Busway, a rooftop restaurant and onsite gym (with a low membership fee) and South Bank Parklands just across the road
Discounts on travel insurance, lounge membership, car hire, accommodation, and experiences worldwide
Cheaper hospitality, retail, technology, beauty and wellness services
Free counselling and access to a wellbeing app to support your physical, mental, social and financial health
‘Dress for Your Day’ – enjoy the freedom to wear whatever makes you feel great for the type of work you do and the day you have ahead of you.

When everyone is included, everyone wins

We’re all individuals. And we love that. That’s why we encourage applications from Indigenous Australians, people with disability, those from diverse cultural backgrounds, our friends in the LGBTQIA+ community, and anyone else who wants to join our family.

Ready to apply?

We’re ready to hear from you. Apply now."
