Job ID,Job Title,Company,Detail URL,Posted Label,Hours Old,Posted Datetime (Local),Location,Category,Work Type,Salary,Ad Text
90025653,Senior AI Engineer - Enterprise AI,Galileo Search,https://www.seek.com.au/job/90025653?type=standard&ref=search-standalone&origin=jobCard#sol=b56b6c2a8ce43cbb4dcb3d719cfa94c59d086bb9,4h ago,4.0,2026-01-30T03:00:00+00:00,Sydney NSW (Hybrid),Engineering - Software (Information & Communication Technology),Full time,Awesome Salary and Benefits,"Senior AI Engineer

Location Sydney (hybrid)
Team: AI Squad | IT
Reporting to: Group Manager – Data & AI

The opportunity: 
We’re looking for a Senior AI Engineer to design, build, and operate production-grade AI systems that deliver measurable business value. This role sits at the intersection of engineering excellence, applied AI, and real-world outcomes — not experiments for experiment’s sake.

You’ll work on modern AI solutions including LLMs, RAG, agents, and ML services, deployed at scale on Azure and Databricks, with strong governance, security, and operational discipline.

What you’ll be doing

Build and deploy AI services and APIs for inference and retrieval (LLMs, RAG, ML models, agents)
Develop data pipelines for training and retrieval with strong governance, privacy, and auditability
Contribute to the AI platform and MLOps toolchain (CI/CD for models, MLflow, feature stores, monitoring, rollback)
Translate business and product requirements into well-scoped technical deliverables
Write clean, well-tested code and contribute reusable components and patterns
Operate AI workloads in production with clear SLIs/SLOs (availability, latency, cost)
Apply security-by-design practices including prompt protection, content filtering, access controls
Maintain documentation, runbooks, and architectural decision records
What we’re looking for

Advanced engineering in Python and microservices, with expertise in cloud-native architecture on Azure.
Hands-on with Databricks (Delta, Unity Catalog, MLflow) and Azure OpenAI / Azure ML
Solid understanding of RAG patterns, tools/agents, and function calling
Strong data engineering fundamentals (batch & streaming pipelines, data quality, lineage)
Practical experience securing AI systems (privacy, prompt safety, auditability)
Ability to turn real customer problems into working AI solutions
Comfortable working in cross-functional teams and owning outcomes end-to-end
Nice to have

Azure, Databricks, or related certifications
Experience operating AI at enterprise scale
Background in regulated or data-sensitive environments
Why this role
Work on real, production AI in an enterprise environment — not demos
Strong focus on engineering quality, security, and operational excellence
Influence platform standards and reusable AI patterns
Clear connection between your work and business impact

Curious to know more? Apply today for a confidential discussion. We look forward to connecting with you"
90025197,Senior Engineer - Applied AINew,Culture Amp,https://www.seek.com.au/job/90025197?type=standard&ref=search-standalone&origin=jobCard#sol=5b7f54b4ecec6acbc79da8080964c56041541da9,4h ago,4.0,2026-01-30T03:00:00+00:00,Melbourne VIC,Engineering - Software (Information & Communication Technology),Full time,,"Join us on our mission to make a better world of work. 

Culture Amp is the world’s leading employee experience platform, revolutionizing how 25 million employees across more than 6,500 companies create a better world of work. Culture Amp empowers companies of all sizes and industries to transform employee engagement, drive performance management, and develop high-performing teams. Powered by people science and the most comprehensive employee dataset in the world, the most innovative companies including Canva, On, Asana, Dolby, McDonalds and Nasdaq depend on Culture Amp every day.

Culture Amp is backed by leading venture capital funds and has offices in the US, UK, Germany and Australia. Culture Amp has been recognized as one of the world’s top private cloud companies by Forbes and most innovative companies by Fast Company.

For more information visit cultureamp.com.

How you can help make a better world of work

We're looking for a Senior Engineer to join the AI Research & Experience team, helping build AI Coach - Culture Amp's contextually-aware AI system that integrates survey insights, performance management, and interpersonal dynamics to deliver personalized support to organizations, teams, and individuals at scale.

You'll work at the intersection of applied AI research and product engineering, translating cutting-edge techniques into production systems that genuinely improve how people experience work. This isn't a research lab - you'll be shipping features that solve real customer problems. 

What you'll do

Staying up to date with current research, literature and provider offerings. 
Design, implement and evaluate areas and features of our multi-agentic platform and systems using modern frameworks (e.g., LangGraph) for stateful, multi-turn coaching conversations.
Advise, help build, and orchestrate data pipelines that unify fragmented workplace data (surveys, goals, performance reviews, feedback, 1-1 notes) into coherent coaching context
Translate customer requirements into technical solutions - working backwards from user needs to system design. Creating technical documentation to support literacy, technical transfer and engineering practice.
Partner closely with product, design, and people science to ensure the features developed are fit for purpose, and in-line with the existing product expectations to ensure seamless partnership transfer of technology.
Contribute to evaluation frameworks and bias testing to meet enterprise requirements for transparency and fairness
Build cutting-edge, working prototypes, integrated into our environments which validate new approaches and accelerate learning.
What we're looking for


Must Haves:

Proven commercial experience taking ML/AI systems to production.
Strong technical writer and communicator
Full stack software development experience, ideally Python, React, PGVector
Strong software engineering fundamentals - you write clean, tested, maintainable code. 
You leverage Software development AI tooling effectively.
Experience with LLM application development (prompt and context engineering, RAG, agent architectures)
Hands-on experience designing and integrating data pipelines - you're comfortable moving data across systems, working within rigorous security standards, handling messy real-world inputs, and building robust orchestration
A pragmatic, solution-focused mindset - you evaluate new technology through the lens of ""does this scalably solve the problem?"" not ""is this technically interesting?""
You fit our values with the proactivity to take risks, and the humility to learn in public. You take pride in your work and its successful utilisation, stability, extendability and maintainability. 

Strong signals:

Experience at startups or founding teams - comfortable with ambiguity and fast iteration
Postgraduate degree (Masters or PhD) in Machine Learning, Computer Science, Applied Mathematics, or related quantitative field
Evidence of taking cutting-edge (relevant) techniques from paper to production
Experience with evaluation/benchmarking frameworks for AI systems
Experience integrating scalable solutions such as advanced Speech-to-Text (STT) and Text-to-Speech (TTS) pipelines (e.g., Whisper, ElevenLabs) with streaming capabilities
Experience implementing GraphRAG or Knowledge Graphs (e.g., Neo4j)

Bonus:

Familiarity with people analytics, HR tech, or behavioral science applications
Contributions to data ethics, algorithmic fairness, or responsible AI initiatives
Open source contributions or public technical writing
Why join AIRX


You'll work at scale on hard problems that matter - building AI that helps organizations develop their people, improve feedback culture, and foster the conditions for sustainable high performance. Our approach is deeply informed by Culture Amp's people science research. You'll be surrounded by talented and passionate advocates for humanity and cutting edge AI in the world of work.

We believe that our employees are the heartbeat of our success. We're committed to fostering a work environment that truly cares for and develops its people, and creates lasting positive impact. In addition to providing a competitive compensation package, some of the key benefits we offer are: 

Employee Share Options Program: We empower you to be an owner in Culture Amp and share in our success
Programs, coaching, and budgets to help you thrive personally and professionally
Access to external providers for mental wellbeing and coaching support to sustain the wellbeing, safety and development of our people
Monthly Camper Life Allowance: An automatic allowance paid out each month with your pay - you can spend it however you like to help improve your experience and life outside work
Team budgets dedicated to team building activities and connection
Intentional quarterly wellbeing pauses: A quarterly company-wide shutdown day in each region to to collectively pause, reset and focus on restoration and rest, without having to tap into individual vacation time
Extended year-end breaks: An extended refresh period at the end of year
Excellent parental leave and in work support program available from day 1 of joining Culture Amp
5 Social Impact Days a year to make a positive impact on the community outside of work
MacBooks for you to do your best & a work from home office budget to spend on setting up your home office
Medical insurance coverage for you and your family (Available for US & UK only) 

Additionally, we don't just focus on our internal community; we believe in creating a better world of work for all. We're committed to diversity, equity, and inclusion, with Employee Resource Groups and ally communities in place. 

We have a strong commitment to Anti-Racism, and endeavor to lead by example. Every step we make as a business towards anti-racism is another step we can take to support our customers in making a better world (of work). You can see our current commitments to Anti-Racism here."
90025193,Senior Engineer - Applied AINew,Culture Amp,https://www.seek.com.au/job/90025193?type=standard&ref=search-standalone&origin=jobCard#sol=e10ec91b9319311f9fb67c3a52e87cfe739cca26,4h ago,4.0,2026-01-30T03:00:00+00:00,Sydney NSW,Engineering - Software (Information & Communication Technology),Full time,,"Join us on our mission to make a better world of work. 

Culture Amp is the world’s leading employee experience platform, revolutionizing how 25 million employees across more than 6,500 companies create a better world of work. Culture Amp empowers companies of all sizes and industries to transform employee engagement, drive performance management, and develop high-performing teams. Powered by people science and the most comprehensive employee dataset in the world, the most innovative companies including Canva, On, Asana, Dolby, McDonalds and Nasdaq depend on Culture Amp every day.

Culture Amp is backed by leading venture capital funds and has offices in the US, UK, Germany and Australia. Culture Amp has been recognized as one of the world’s top private cloud companies by Forbes and most innovative companies by Fast Company.

For more information visit cultureamp.com.

How you can help make a better world of work

We're looking for a Senior Engineer to join the AI Research & Experience team, helping build AI Coach - Culture Amp's contextually-aware AI system that integrates survey insights, performance management, and interpersonal dynamics to deliver personalized support to organizations, teams, and individuals at scale.

You'll work at the intersection of applied AI research and product engineering, translating cutting-edge techniques into production systems that genuinely improve how people experience work. This isn't a research lab - you'll be shipping features that solve real customer problems. 

What you'll do

Staying up to date with current research, literature and provider offerings. 
Design, implement and evaluate areas and features of our multi-agentic platform and systems using modern frameworks (e.g., LangGraph) for stateful, multi-turn coaching conversations.
Advise, help build, and orchestrate data pipelines that unify fragmented workplace data (surveys, goals, performance reviews, feedback, 1-1 notes) into coherent coaching context
Translate customer requirements into technical solutions - working backwards from user needs to system design. Creating technical documentation to support literacy, technical transfer and engineering practice.
Partner closely with product, design, and people science to ensure the features developed are fit for purpose, and in-line with the existing product expectations to ensure seamless partnership transfer of technology.
Contribute to evaluation frameworks and bias testing to meet enterprise requirements for transparency and fairness
Build cutting-edge, working prototypes, integrated into our environments which validate new approaches and accelerate learning.
What we're looking for


Must Haves:

Proven commercial experience taking ML/AI systems to production.
Strong technical writer and communicator
Full stack software development experience, ideally Python, React, PGVector
Strong software engineering fundamentals - you write clean, tested, maintainable code. 
You leverage Software development AI tooling effectively.
Experience with LLM application development (prompt and context engineering, RAG, agent architectures)
Hands-on experience designing and integrating data pipelines - you're comfortable moving data across systems, working within rigorous security standards, handling messy real-world inputs, and building robust orchestration
A pragmatic, solution-focused mindset - you evaluate new technology through the lens of ""does this scalably solve the problem?"" not ""is this technically interesting?""
You fit our values with the proactivity to take risks, and the humility to learn in public. You take pride in your work and its successful utilisation, stability, extendability and maintainability. 

Strong signals:

Experience at startups or founding teams - comfortable with ambiguity and fast iteration
Postgraduate degree (Masters or PhD) in Machine Learning, Computer Science, Applied Mathematics, or related quantitative field
Evidence of taking cutting-edge (relevant) techniques from paper to production
Experience with evaluation/benchmarking frameworks for AI systems
Experience integrating scalable solutions such as advanced Speech-to-Text (STT) and Text-to-Speech (TTS) pipelines (e.g., Whisper, ElevenLabs) with streaming capabilities
Experience implementing GraphRAG or Knowledge Graphs (e.g., Neo4j)

Bonus:

Familiarity with people analytics, HR tech, or behavioral science applications
Contributions to data ethics, algorithmic fairness, or responsible AI initiatives
Open source contributions or public technical writing
Why join AIRX


You'll work at scale on hard problems that matter - building AI that helps organizations develop their people, improve feedback culture, and foster the conditions for sustainable high performance. Our approach is deeply informed by Culture Amp's people science research. You'll be surrounded by talented and passionate advocates for humanity and cutting edge AI in the world of work.

We believe that our employees are the heartbeat of our success. We're committed to fostering a work environment that truly cares for and develops its people, and creates lasting positive impact. In addition to providing a competitive compensation package, some of the key benefits we offer are: 

Employee Share Options Program: We empower you to be an owner in Culture Amp and share in our success
Programs, coaching, and budgets to help you thrive personally and professionally
Access to external providers for mental wellbeing and coaching support to sustain the wellbeing, safety and development of our people
Monthly Camper Life Allowance: An automatic allowance paid out each month with your pay - you can spend it however you like to help improve your experience and life outside work
Team budgets dedicated to team building activities and connection
Intentional quarterly wellbeing pauses: A quarterly company-wide shutdown day in each region to to collectively pause, reset and focus on restoration and rest, without having to tap into individual vacation time
Extended year-end breaks: An extended refresh period at the end of year
Excellent parental leave and in work support program available from day 1 of joining Culture Amp
5 Social Impact Days a year to make a positive impact on the community outside of work
MacBooks for you to do your best & a work from home office budget to spend on setting up your home office
Medical insurance coverage for you and your family (Available for US & UK only) 

Additionally, we don't just focus on our internal community; we believe in creating a better world of work for all. We're committed to diversity, equity, and inclusion, with Employee Resource Groups and ally communities in place. 

We have a strong commitment to Anti-Racism, and endeavor to lead by example. Every step we make as a business towards anti-racism is another step we can take to support our customers in making a better world (of work). You can see our current commitments to Anti-Racism here."
90024576,Data Scientist - Engineering & Architecture Group,Microsoft,https://www.seek.com.au/job/90024576?type=standard&ref=search-standalone&origin=jobCard#sol=108d3f7aa6f1162b8b00883bd778199953444e2a,5h ago,5.0,2026-01-30T02:00:00+00:00,Sydney NSW,Architects (Information & Communication Technology),Full time,Subsidised health insurance + stock discounts,"Overview

Do you enjoy solving problems, looking at problems through a different lens, and working closely with customers to innovate new solutions to complex problems? Do you jump with excitement at the opportunity to identify trends and provide unique business solutions? Do you want to join a team where learning about a new technology or solution is part of our work every day? 

The Industry Solutions Delivery (ISD) Engineering & Architecture Group (EAG) is a global consulting and engineering organization that supports our most complex and leading-edge customer engagements.  Driving early-stage deliveries, enhances ISD’s technical capabilities, and partnering with others to develop approaches, innovative solutions, and engineering standards in order to set our sales and delivery teams up for success.  We provide consistent high-quality customer experience through technical and AI leadership and IP capture centred on delivery truth. 

Responsibilities

Engage stakeholders to understand business drivers and confidently communicate insights, recommendations, and tradeoffs 

Partner with customers to translate complex business problems into data science solutions with clear objectives, assumptions, risks, and success criteria 

Work closely with Solution Architects, Consultants, and Data Engineers who will source and prepare data from multiple systems. 

Explore and evaluate data quality, integrity, and fitness for purpose, clearly explaining implications to customers.  

Design and deliver machine learning solutions covering Generative AI, Agentic solutions, computer vision, speech processing,  forecasting, NLP, classification, clustering, reinforcement learning and optimization.  

Frame the problem appropriately; and select and apply appropriate algorithms, modelling techniques, and experimental methods to meet client and project requirements  

Conduct statistical analysis and controlled experiments, translating findings into measurable business outcomes  

Support model testing and validation using test and production data, incorporating customer feedback into improvements  

Collaborate with engineering teams to deploy scalable, secure, and reliable models into customer environments  

Manage customer expectations on scope, timelines, and outcomes, contributing to strong delivery experiences  

Stay current with industry trends and contribute to thought leadership and reusable intellectual property 

Qualifications

Required/Minimum Qualifications 

Master’s degree in Data Science, Mathematics, Statistics, Econometrics, Economics, Operations Research, Computer Science, or a related field and 7+ years of professional data science experience 
or 

Doctorate in Data Science, Mathematics, Statistics, Econometrics, Economics, Operations Research, Computer Science, or a related field and 4+ years of professional data science experience 
or 

Equivalent practical experience demonstrated through long-term, hands-on delivery of data science solutions 

Strong foundation in data science principles, including statistics, machine learning, and analytical modelling 

Proven problem-solving skills with the ability to break down complex business and technical challenges 

Handson experience developing and deploying machine learning and advanced AI solutions to production environments on public cloud platforms 

Professional experience working with Generative AI solutions in production environments (beyond pilots or POC /proof of concepts) 

This position will be open for a minimum of 5 days, with applications accepted on an ongoing basis until the position is filled.

Microsoft is an equal opportunity employer. All qualified applicants will receive consideration for employment without regard to age, ancestry, citizenship, color, family or medical care leave, gender identity or expression, genetic information, immigration status, marital status, medical condition, national origin, physical or mental disability, political affiliation, protected veteran or military status, race, ethnicity, religion, sex (including pregnancy), sexual orientation, or any other characteristic protected by applicable local laws, regulations and ordinances. If you need assistance with religious accommodations and/or a reasonable accommodation due to a disability during the application process, read more about requesting accommodations."
