Job ID,Job Title,Company,Detail URL,Posted Label,Hours Old,Posted Datetime (Local),Location,Category,Work Type,Salary,Ad Text
86799592,Senior Insights Analyst,Woolworths Group,https://www.seek.com.au/job/86799592?type=standard&ref=search-standalone&origin=jobCard#sol=28f6f851072edcbb12f15cea9e012fc6464cae3a,1d ago,24.0,2025-08-28T21:00:00+00:00,"Surry Hills, Sydney NSW (Hybrid)",Business/Systems Analysts (Information & Communication Technology),Full time,,"Permanent role
Open to Sydney, Brisbane and Melbourne office locations with hybrid working
Use data to drive commercial decision making in eCommerce at Woolworths




We strive to create better experiences together for a better tomorrow for our customers and team,  bringing the best of Woolworths Group and Quantium together to make data driven decisions. By partnering with Quantium, a world-class data science and advanced analytics business we’re excited about the future as we unlock the power of data to reimagine retail.

 

Through this partnership, we’ve created a new business called wiq who will harness the best of Woolworths Group and Quantium to reimagine retail by solving the most complex problems using data and analytics. As a team, we leverage Agile ways of working to help our team develop their skills while also making sure our team is focusing on solving the most complex problems for both our customers and team.




What you’ll do

The role of the Senior Insights Analyst within the Food eCom Business Unit is to measure, track, and optimise performance of digital assets & customer behaviour across the eCommerce business. Partnering with teams across Food eCom, you will be delivering data-driven insights related to the performance of digital assets, promotions and merchandising, as well as customer behaviour on web and app.




Provide insights to inform strategic decision making by analysing various commercial lenses in both digital and offline platforms
Build reports and customised data models/dashboards to track & evaluate performance of digital merchandising and promotional activities such campaigns & promotions, proof of concepts (POC), and more
Work across multiple systems in content management, financial reporting, & BI
Collaborate with BI team on dashboard requirements, use cases, and designs
Prioritise and respond to ad-hoc analytical requests from internal stakeholders
Be an advocate of analytics and collaborate within the Digital Trade & Commercial Insights CoE to promote knowledge sharing







What you’ll bring

We are looking for an experienced, commercially minded Senior Insights Analyst who is comfortable working in complex, multi-stakeholder environments.




5+ years experience in an Analyst role
Strong data visualisation and communication skills (both written & verbal)
Strong SQL, data analysis, and modelling skills 
Experience with BigQuery, Tableau, and Looker Studio highly desirable
Able to synthesise large amounts of data from a variety of sources
A self-starter – able to work with minimal supervision, able to deal with ambiguity, and self-motivated
Challenges the status quo and existing assumptions in order to promote innovative thinking and new solutions
Adaptable, collaborative, high attention to detail, improvement orientated




If you meet a number of requirements (and not all), we encourage you to submit your application.




What you’ll experience

Our Team Members are at the heart of everything we do and we’re always looking for ways to support your career journey and reward great work:

Team discounts across our range of Woolworths Group brands you know and love and a robust rewards program that celebrates and incentivises purpose-driven work.
A global business with endless career possibilities around every corner and across every discipline – with valuable exposure to a vast and exciting business network.
High impact role supporting our teams who enrich our communities. 
A range of programs to help you prioritise and manage your wellbeing, including 24/7 access to the Sonder app.
A progressive and competitive leave policy that gives you more space for what matters to you.  




Everyone Belongs at Woolworths Group

Diversity, equity, inclusion, and belonging are key to realising our purpose of better together for a better tomorrow. We recognise the value our team’s diversity brings to our business, customers, and communities and that teams with diverse experiences and backgrounds enrich our group and are better able to innovate and solve problems. As one of the largest employers in Australia and New Zealand, we aim to create a truly inclusive workplace where everyone feels that they belong, can be their best selves, and reach their full potential.

We encourage all candidates to apply; please let us know in your application if we can support you with any adjustments in the hiring process."
86794280,Data and Reporting Roles,face2face Recruitment,https://www.seek.com.au/job/86794280?type=standard&ref=search-standalone&origin=jobCard#sol=4faf3ebc2985d03083d414e48c62add25f2d8180,1d ago,24.0,2025-08-28T21:00:00+00:00,Melbourne VIC (Hybrid),Business/Systems Analysts (Information & Communication Technology),Contract/Temp,$70.00 – $80.00 p/h,"Closing Date: 9 am Monday, 1 September 
face2face reference: 648889
Locations: Richmond or Geelong VIC, Surry Hills NSW, Deakin ACT 
Contract Duration: 12 months + Potential extension/s


Why Join?

Contribute to shaping fair and sustainable pricing and policy outcomes
Apply your analytical skills to support evidence-based decision-making
Work on complex economic, market, and expenditure monitoring challenges
Be part of a collaborative team delivering high-impact insights
Develop innovative data solutions and reporting tools
Grow your expertise in statistical modelling and data analytics

About the Role

As part of a specialist data and reporting team, you will deliver analysis, reporting, and data management to support policy development and market monitoring. This role plays a key part in examining trends, identifying insights, and contributing to high-profile publications that inform decision-making.

Key Responsibilities

Design, build and deploy scalable statistical and data models
Develop and deliver regular and ad hoc reports, insights, and visualisations
Maintain and enhance performance dashboards and data reporting tools
Collect, analyse and present complex data to support policy outcomes
Identify, explore and formalise data insights, including third-party data integration
Engage with stakeholders to deliver data projects and contribute to forums

Skills & Experience

Strong analytical mindset with the ability to work with large datasets
Proficiency in statistical software such as R, Python, Excel, SAS or SQL
Experience in data manipulation, extraction, and modelling
Ability to synthesise complex information and present insights clearly
Strong collaboration and stakeholder engagement skills
Capacity to work independently as well as part of a team

Australian Citizenship is a mandatory requirement for this position. 

If you have any questions or would like more details, don’t hesitate to reach out to Urvish Kahar at urvish.kahar@f2frecruitment.com.au."
86825380,Senior Business Analyst - 12 Month Fixed Term,Reserve Bank of Australia,https://www.seek.com.au/job/86825380?type=standard&ref=search-standalone&origin=jobCard#sol=0a8abe1640eaf3c3ac6e2261876d371e5bf894fd,19h ago,19.0,2025-08-29T02:00:00+00:00,Sydney NSW (Hybrid),"Business/Systems Analysts (Information & Communication Technology)
Government - Federal (Government & Defence)",Contract/Temp,,"More sense, less common

We are looking for a Senior Business Analyst to join our POP Project for a 12 Month Fixed Term Salaried Contract. In this role, you will support the project with a strong foundation in ITIL v4 practices, this role requires effective vendor management, internal stakeholder engagement. The role plays a key part in delivering a Service Catalogue, Configuration Management Database (CMDB), and IT asset management.


Your background

Minimum of 5+ years' experience as a Business Analyst, including 2-3 years working with ServiceNow (desirable) or a similar ITSM platform
Deep expertise in delivering business analysis for large scale complex data migration projects.
Strong business analysis experience, knowledge and skillsets.
Experienced in understanding, gathering, and documenting complex requirements for a variety of business areas, systems and domains.
Basic knowledge in the storage, infrastructure, networking and IT security domains.
Proven track record of successful end to end project delivery experience (Agile/Waterfall) in large enterprise environments, with a focus on meeting deadlines and achieving objectives.
Exceptional interpersonal skills to collaborate, influence and partner effectively with key business and technical stakeholders across the Reserve Bank.
An energetic and strategic thinker who has a meticulous attention to detail.
Fast learner with a curious and proactive mindset-willing to drive progress and delivery proactively.


Additional Requirements

Proven track record in delivering Service Catalogue, CMDB, and/or asset management projects
Strong working knowledge of ITIL v4 frameworks and practices
Demonstrated experience in Agile and hybrid Agile/Waterfall environments, including writing user stories, acceptance criteria, and process documentation
Proficiency in process mapping and producing high-quality documentation such as service definitions, process flows, and RACI matrices
Solid understanding of system integrations and external interfaces
Familiarity with data cleansing, reconciliation, and governance practices to support CMDB accuracy
Ability to analyse data and derive meaningful insights and potential implications from statistical data.
Demonstrate ability to communicate effectively and credibly (both verbally and in writing) with key business stakeholders of all levels across the enterprise.


Be More

Working for an organisation that truly makes a difference to the people of Australia, we can offer development and career opportunities in a collaborative environment that supports your growth, wellbeing and promotes flexibility. Your individual growth and success drives the RBA forward as an organisation. Be more means you can do more, for yourself and for Australia.


Why RBA?

The RBA makes an important contribution to the Australian economy through the pursuit of national economic policy objectives and associated activities in financial markets and banking. We also issue Australia's banknotes and operate infrastructure critical to the payments system, all of which contribute to the welfare of the Australian people.


Made up of specialists across a wide range of fields, our people, values, and culture play a critical role in achieving our objectives. Striving to be Open & Dynamic, we consider and incorporate different perspectives, work across teams and are transparent with each other, whilst delivering quality together effectively and focusing on outcomes by prioritising, testing, learning, and refining as we go.


Our people conduct themselves with a high degree of integrity, while striving for excellence in the work they perform and the outcomes they achieve. We encourage intelligent inquiry and we treat one another with respect while promoting the public interest through our efforts.


We know it is the growth and success of our people that drives the RBA forward. Come and make a bigger contribution while you build and develop your own skills too, because being more means you can do more, for yourself and for Australia.


The Reserve Bank of Australia is committed to equity, diversity and inclusion through key initiatives. We welcome and encourage applicants from diverse backgrounds to apply, including Aboriginal and Torres Strait Islander peoples, culturally and linguistically diverse background, those living with a disability and from the LGBTQ+ community. We are committed to making the recruitment process fair and equitable for all our candidates."
86791959,Senior Commercial Strategy Analyst,Churches of Christ,https://www.seek.com.au/job/86791959?type=standard&ref=search-standalone&origin=jobCard#sol=5c16a427197832bce10a0f93c5d18a9e0d1acd82,1d ago,24.0,2025-08-28T21:00:00+00:00,"Kenmore, Brisbane QLD (Hybrid)",Analysis & Reporting (Accounting),Full time,,"Senior Commercial Strategy Analyst

Churches of Christ

Kenmore, QLD | Full-Time | | Hybrid Work Options Available (First 4 weeks in office)

 

Are you a strategic thinker with a sharp analytical mind and a passion for driving commercial performance?

Churches of Christ is seeking a Senior Commercial Strategy Analyst to join our Finance team and play a pivotal role in shaping the organisation’s strategic direction.

The Senior Commercial Strategy Analyst plays a critical role in driving strategic decision-making and commercial performance across the organisation. This role is responsible for delivering high-impact financial and strategic analysis, supporting investment decisions, and identifying opportunities for growth and efficiency. The analyst will work closely with senior leadership, finance, operations, and other key stakeholders to provide insights that shape the company’s strategic direction.

What you will be doing:

Support the annual strategy refresh process, ensuring alignment with organisational goals and market dynamics.
Conduct environmental scans, competitor benchmarking, and internal performance reviews to inform strategic priorities.
Support and collaborate with senior leaders to shape strategic direction and investment / divestment priorities.
Translate strategic objectives into actionable business plans, including timelines, resource requirements, and measurable outcomes.
Partner with business units to ensure alignment between strategy and operational execution.
Monitor progress against strategic initiatives and escalate risks or barriers to execution.
Develop and maintain KPI dashboards and performance scorecards to track progress against strategic and financial goals.
Support monthly and quarterly reporting cycles with clear, data-driven commentary and recommendations.
Lead or support the development of robust business cases for new initiatives, capital investments, and strategic projects.
Ensure business cases include financial modelling, risk assessments, and alignment with strategic objectives.
Build and maintain complex financial models to evaluate investment opportunities, scenario planning, and sensitivity analysis.
Provide commercial insights and recommendations based on financial outcomes and market trends.
Support pricing strategies, cost-benefit analysis, and margin improvement initiatives.
Own and continuously improve the organisation’s investment evaluation framework, ensuring consistency, transparency, and alignment with strategic goals.
Provide guidance and training to stakeholders on investment governance, evaluation criteria, and post-implementation reviews.
Ensure all investment proposals meet internal standards and regulatory requirements.

About You and what you will bring:

Degree in Finance or related field (CA/CPA desirable)
5+ years’ experience in commercial strategy, financial analysis, or consulting
Advanced Excel and Power BI skills with strong financial modelling capability
Proven ability to influence senior stakeholders and communicate complex insights
Experience in aged care, healthcare, or property investment sectors is a plus
Strong leadership, problem-solving, and project management skills

 

Why Join Churches of Christ?

Make a meaningful impact in a purpose-driven organisation
Work with a collaborative, values-led team
Enjoy generous salary packaging benefits up to $18,549 p.a.
Access five weeks annual leave, EAP, and exclusive discounts
Be part of a culture that values innovation, integrity, and continuous improvement


🌐 Apply now or visit www.cofc.com.au to learn more.


We warmly welcome applications from Aboriginal and Torres Strait Islander peoples.


Applications will be reviewed as received – don’t wait to apply!"
86804197,Senior Risk Analyst,Origin,https://www.seek.com.au/job/86804197?type=standard&ref=search-standalone&origin=jobCard#sol=68a79a500d16bac4ce21089d22f61e9964ddbfc5,1d ago,24.0,2025-08-28T21:00:00+00:00,"Barangaroo, Sydney NSW","Other (Mining, Resources & Energy)",Full time,,"Full time permanent position | Sydney CBD
Analyse risk across diverse global energy trading portfolios
Sydney based

Join a team that's All Kinds of Useful

At Origin, being useful is more than a tagline - it's how we approach work every day. As a collective, we're a team that thrives on finding better ways, working together, and owning our impact. From powering homes to delivering award-winning internet and helping to lead Australia's energy transition. If you're driven by purpose and excited to be part of something bigger, we'd love to have you on the journey.

About the role:



Reporting to the Risk Reporting Manager, Financial Risk, this is a pivotal role that will analyse risks within Origin's commodity trading portfolios including Oil, LNG, Gas and Coal.

Key Responsibilities:

Support the development of tools and analytical models to provide insights into the energy commodity landscape and Origin's market exposures.
Manage the operation of key risk models, including data sourcing, validation, and reconciliation of model inputs and outputs.
Collaborate with internal stakeholders to ensure accurate and timely risk reporting, fostering strong working relationships across teams.
Communicate market developments and trading position changes across the commodity portfolio in a clear and effective manner.
Maintain comprehensive documentation of risk models, methodologies, and assumptions, and assist with the coordination and administration of risk committee activities.

What will you bring:

A proactive approach to learning and developing relationships. Tertiary qualifications in a economics, mathematics or related discipline (CFA). In addition, you'll possess:

Experience in energy derivatives and commodity markets.
Strong verbal and written communication skills, with the ability to present complex information clearly.
Advanced Excel skills; experience with data visualisation tools such as Tableau.
High attention to detail, particularly in data validation and reconciliation.
Solid understanding of quantitative finance concepts, including Value at Risk (VaR) and option pricing.
Proficiency in programming and data tools such as VBA, SQL, and Python.

So, why join us?

Discounted Origin products benefits for employees, including Electrical, Gas and Internet offers!
Hybrid working environment, opportunity to connect with your team in our CBD office.
Competitive salary + annual performance bonus + performance based reviews.
Origin 360 Electric Vehicles (EV) employee subscription offers a fantastic range of EVs, with flexible month-to-month plans and no lock-in contract.
Free and confidential counselling for employees and family members.
A great high energy team, that encourages interesting, rewarding, and engaging work!

Origin - Where good change happens

At Origin, we're powered by people who believe in creating change.


We are committed to fostering a diverse, gender equitable workforce, where everyone is welcome, and all applications are evaluated on merit and potential. We encourage applications from Aboriginal and Torres Strait Islander Peoples, people living with disabilities, culturally diverse people, any stage in life, people with intersex variations and people within LGBTQ+ communities, including trans and gender diverse.


Enjoy a challenging career in an exciting industry where you can grow and explore your potential. If you think you have transferable skills, an appetite to learn and would be a great fit, we'd love to hear from you.


Here's a little about us: https://www.originenergy.com.au/about/careers/

Background checks may be required to determine your suitability for this position as part of the recruitment process and during your employment. These checks may include police checks, AusCheck, medical assessment and/or drug and alcohol testing.

Please note unsolicited CVs from agencies will not be accepted.

Origin recognises Aboriginal and Torres Strait Islander Peoples as the Traditional Custodians of country throughout Australia, and we pay our respects to Elders past, present and future."
86839176,Senior Data Analyst,Valrose,https://www.seek.com.au/job/86839176?type=standard&ref=search-standalone&origin=jobCard#sol=7cdc82f14240de5a130a7e65757a66c30a10d775,13h ago,13.0,2025-08-29T08:00:00+00:00,Perth WA,Database Development & Administration (Information & Communication Technology),Contract/Temp,,"Join a fast-growing and innovative organisation as they harness data to drive smarter decision-making across the business. This is your opportunity to play a pivotal role in shaping data strategy and delivering advanced analytics solutions that make a real impact.
As a Senior Data Analyst, you will take ownership of designing, building, and maintaining robust data pipelines and reporting frameworks, influencing and deciding how projects are run and delivered. These projects range from customer behaviour segmentation and predictive modelling to advanced geo-location insights, helping the business deliver tailored and effective strategies.

What you'll be responsible for:
Designing, developing, and maintaining scalable data pipelines and reporting systems in GCP (BigQuery and Python).
Driving advanced analytics initiatives, including customer behavioural segmentation, predictive modelling, and recommendation systems.
Developing proprietary planning tools to surface insights from user behaviour data.
Creating advanced location-based analytics using GIS data sets and tools.
Implementing monitoring dashboards to detect and resolve scheduling or system errors proactively.
Applying advanced statistical methods to identify patterns and deliver actionable insights for strategic decision-making.
Collaborating with engineers and leadership to enhance data governance and promote best practices across the organisation.
What you'll bring to the role

Proven expertise in BigQuery and Python is a must.
Strong track record of leading data projects or teams from concept to delivery.
Exposure to advertising or media analytics is highly desirable.
Deep experience with big data tools, API integration, and scalable data solutions.
Proficiency in data visualisation platforms like Looker Studio, Power BI, or Tableau.
Exceptional stakeholder management and communication skills, with the ability to influence senior leaders.
A strategic mindset with a strong attention to detail and the ability to juggle multiple priorities effectively.

------------------------------------------------------------

About working with Valrose - We listen. We understand. We solve.

Valrose consultants work with you to understand where your character, aspirations, and skills will be most valued.
We will understand your priorities, whether financial, career progression, workplace culture or technology-related. We will discuss the opportunity thoroughly, how it aligns with your career goals, and guide you through the recruitment process, providing expert advice and support from the initial application to the offer.
We are trusted advisors to our clients, acting as an extension of their business.
We genuinely care about our candidates and love helping connect people with great opportunities. If you would like to understand more about the above role, please do get in touch.
   
Our Values
Humanity – Success – Integrity – Accountability – Curiosity
   
Diversity – Welcome it. Entrust it. Celebrate it.

Within our business, we have created an environment where anyone from any background can bring their authentic self to work, celebrating our differences whilst working towards a common purpose. We believe this is not just the ethical thing to do; it's the intelligent thing to do. Diversity drives innovation!
The Valrose team enjoys building inclusive cultures and promoting equality for all.

2024 - Sourcr Award for Best Agency for ICT, WA
2023 - Seek SARA Award Finalist for Outstanding Agency
2023 - RCSA Award Finalist for Outstanding Agency
2022 - Sourcr Award for Best Agency for Technology, WA
2021 - Seek SARA Award Finalist for Excellence in Candidate Engagement
Valrose is a Circle Back Initiative Recruitment Agency – we commit to responding to every applicant.
   
#SCR-Rupsha-Nandy"
