Job ID,Job Title,Company,Detail URL,Posted Label,Hours Old,Posted Datetime (Local),Location,Category,Work Type,Salary,Ad Text
87900345,Investments Business Analyst - 12 month max term contract,HESTA Super Fund,https://www.seek.com.au/job/87900345?type=standard&ref=search-standalone&origin=jobCard#sol=38e1f1a8bba0b003c1db7d9195cb1d2f3eefbdd2,7h ago,7.0,2025-10-16T01:00:00+00:00,Melbourne VIC (Hybrid),Analysis & Reporting (Banking & Financial Services),Contract/Temp,,"Careers with Impact

More than one million Australians trust HESTA with their money. HESTA is a top-performing industry super fund working for real-world impact. We use our expertise and influence to deliver strong long-term returns while accelerating our contribution to a more sustainable world.

HESTA is also an inspiring and rewarding place to work. That's because what we do makes a difference to the lives of our members. The people who work at HESTA are not only exceptional at what they do, they're focused on living and creating a strong organisational culture. We're an industry super fund dedicated to the people who keep our communities going. People who provide some of the best health, education and community services in the world are HESTA members - and we are proud to serve them.





Bring your authentic and passionate self to this exceptional role #careerswithimpact

Please note this role is a 12 month max term contract.


We're seeking an experienced Investments Business Analyst to join our dynamic Investment Execution team that consists of Investment Operations, Performance and Risk Attribution and Reporting, Oversight and Investment Data and Systems. This key position focuses on strategic initiatives across Investment Execution and Investment Management aimed at enhancing the way we operate to align with our evolving business. Working closely with stakeholders to optimise processes and deliver efficient solutions, you will help drive innovation across the Investments team.

In this role, you will lead requirements gathering and analysis with key stakeholders, developing and documenting comprehensive business requirements and process flows and identifying impacts to the current operating model across initiatives. Your expertise will be crucial in facilitating workshops and stakeholder meetings, documenting requirements, driving continuous improvement initiatives, and collaborating on strategic investment execution projects.

About You

The ideal candidate brings a significant track record in project delivery and Business Analysis in the finance industry, preferably in Superannuation, Funds Management, or Investment Administration. You should possess strong analytical and problem-solving abilities, coupled with excellent stakeholder management skills. Demonstrable skills and experience in consulting with senior executives, process mapping, operating model design and good requirement gathering is essential. Your outstanding communication and leadership skills will be vital in this role, as will your proven ability to work effectively in a fast-paced environment. Preferably you will have a good understanding of trading life cycles from Front to Back Office.

A tertiary qualification in Business, Finance, or equivalent is required for this position. Additional certifications in Business Analysis, Project Management, or Agile methodologies would be highly regarded. Your personal attributes should include strong business acumen, a results-driven mindset, and an unwavering commitment to continuous learning. The ability to build impactful relationships and collaborate effectively with diverse stakeholders is crucial for success in this role.

Benefits that matter and make a difference for our employees


• Leave for those moments that matter, an additional 6 days of leave at the end of year, up to 6 days paid volunteer leave, gender neutral paid parental leave of 20 weeks, Gender Affirmation leave, reproductive health and wellbeing leave, Cultural and Ceremonial leave. Access your LSL after 3 years, take AL at half pay, and purchase up to 2 weeks additional leave (just to name a few!).
• Your Professional development matters, up to $5k per year professional development and up to 8 days professional development leave, HESTA scholarships and free access to a range of premium learning tools.
• Your health and wellbeing matters, free annual flu shots and skin checks, incredible social events throughout the year and a comprehensive employee assistance program available 24/7.
• Your financial wellbeing matters, up to 15% super, financial planning support, end of year payment for all Enterprise Agreement-covered employees, incentivised Employee Referral Program and novated lease options.

We celebrate, value and include people of all backgrounds, genders, identities, cultures and abilities. We welcome and support applications from First Nations people, physically, neuro or culturally diverse, LGBTQI+, and people of any age. We are proud to be WGEA accredited as an Employer of Choice for Gender Equity.


We want all candidates to feel safe, included and provided with the best opportunity to thrive, if you require reasonable adjustments during your application or throughout the recruitment process, please reach out to a member of the Talent team careers@hesta.com.au and we'll call you to discuss.


Please note: Applications via recruitment agencies will not be accepted for this position





Outstanding opportunity for a Business Analyst with specialist Investment Management knowledge and strong technical skills.





Flexible Hybrid Working

Enhanced Leave Entitlements"
87899980,Senior Data Engineer,Bolton Clarke,https://www.seek.com.au/job/87899980?type=standard&ref=search-standalone&origin=jobCard#sol=786e7ea599e687ad229fac5d1ea574508e08c7d4,7h ago,7.0,2025-10-16T01:00:00+00:00,"St Leonards, Sydney NSW (Hybrid)",Engineering - Software (Information & Communication Technology),Contract/Temp,"$145,000 to $165,000","About us:

Bolton Clarke is Australia’s largest independent, not-for-profit aged care provider shaping the future of positive ageing. With RSL Queensland and the Royal District Nursing Service at the heart of our DNA, we have been caring for Australians since 1885. Today, our exceptional teams support more than 130,000 people to live independently at home and across our 43 retirement living communities and 88 residential aged care homes. Everything we do is dedicated to enabling, celebrating and supporting older Australians to live and age positively. 

About the opportunity:

This is a minimum 18-month max-term position supporting our Clinical Care System Project. As a Senior Data Engineer, you will play a key role in supporting the Clinical Care System Project by designing, developing, and maintaining data pipelines and integrations across legacy and modern platforms. This includes building scalable data stores and implementing ETL processes to ensure accurate, secure, and timely data flow. The role works closely with technical and business stakeholders to translate data requirements into robust solutions, supporting analytics, reporting, and compliance needs. Collaboration, data governance, and continuous improvement are central to delivering high-quality outcomes across both cloud and on-premises environments.

Key Responsibilities:

Design, build, and maintain data pipelines and integrations across hybrid cloud/on-prem environments.
Develop scalable data models, databases, warehouses, and Power BI datasets to support analytics and reporting.
Implement ETL processes for clinical, operational, and compliance data aligned with governance standards.
Ensure data quality, integrity, and security through validation, monitoring, and error handling.
Collaborate with architects, analysts, and stakeholders to define requirements and deliver technical solutions.
Develop and optimize SQL queries, stored procedures, and scripts for reporting and workflows.
Support testing phases (unit, integration, UAT) to ensure solutions meet functional and regulatory needs.
Maintain up-to-date knowledge of tools and technologies including MS SQL stack, Power BI, Azure, and ETL platforms.
  
About you:

Qualifications & Experience

Minimum 10 years’ industry experience in data engineering.
Tertiary qualifications in computer, data, or information science highly desirable.
Mandatory Skills

Deep expertise in star and relational schema design.
10+ years with Microsoft SQL Server Data Platform (T-SQL, SSIS, SSAS, SSRS, MDS).
Strong experience in Azure cloud technologies relevant to data engineering.
Advanced analytical and problem-solving skills.
Highly Desirable

Proficiency in Power BI (Power Query/M, DAX).
Experience with aged care systems (AutumnCare, ComCare, Procura) or ability to interrogate unfamiliar databases.
Familiarity with Agile (DSDM), Lean (Kanban), and data management frameworks (e.g., DAMA-DMBOK2).

Importantly, you will mirror our values of Be Kind; Listen; Be Curious; Always safe; and Always together in all aspects of your work. 

Our culture is both supportive and collaborative. In return for your hard work, you will receive a generous salary package plus:


Competitive base salary + $18,550 Salary packaging Benefits 
Private health insurance discounts · Flight Centre Travel holiday deals
Flexible working environment 
Employee Assistance Program
Fitness Passport Program 
Free Flu Vaccinations
  
How to Apply
To join our diverse, purpose driven organisation that offers rewarding professional development opportunities, please apply below with a resume and cover letter.
 
Applicants must obtain Federal Police Clearance or willingness to obtain, along with this season's flu vaccination and provide Covid-19 vaccination evidence."
87899515,Senior Conversation Designer,Bluefin Resources Pty Limited,https://www.seek.com.au/job/87899515?type=standard&ref=search-standalone&origin=jobCard#sol=c129467335c37145c9d1d67a431e353ea2c847b1,7h ago,7.0,2025-10-16T01:00:00+00:00,Sydney NSW (Hybrid),Product Management & Development (Marketing & Communications),Full time,,"Lead the conversational layer for a complex, high traffic environment where customers expect clarity and speed.

Own the work from discovery to measurement. Shape patterns that teams across product and service reuse with confidence. See your decisions improve CES, NPS and CSAT at national scale.

If you like turning complexity into calm conversations, this senior role will suit you. You will shape the conversational layer for a well known Australian travel and aviation group, based in Mascot, working hybrid with three days on site. The remit covers discovery through to measurement, so you will see your decisions land in market and move the numbers.

You will

Design, build, launch and iterate conversational journeys across voice and chat
Set intents, entities, flows and prototypes, then validate through research and real usage
Write LLM prompts that stay safe, accurate and aligned to brand voice
Improve containment and agent efficiency through clear paths and better context
Apply accessibility standards across every artefact
Contribute to the conversation design system so teams reuse patterns and ship faster
Report performance through CES, NPS and CSAT with a focus on action
You bring

5+ years as a Conversation Designer in complex settings
Portfolio of shipped work that shows language craft and measurable impact
Strong grasp of NLP, NLU and LLMs, including constraints and deployable use cases
Practice with Lean, Design Thinking, Scrum or Kanban
Tools, Miro, Figma, UserZoom, Qualtrics, Adobe Creative Suite, Jira and Confluence
Platform experience with Cognigy AI, or exposure to Genesys or Salesforce
Clear communication, stakeholder management and mentoring capability
Tertiary qualification in Design, HCD or similar
Why consider it

Permanent role, hybrid work and a comprehensive benefits program
Impact at scale with a mature digital practice and supportive leadership
Growth through training, coaching and varied problems across the travel journey
To discuss this opportunity confidentially, contact Dan O'Donnell at dan@bluefinresources.com.au"
87898891,Principal Data Platform Engineer,UpperGround by Hudson,https://www.seek.com.au/job/87898891?type=standard&ref=search-standalone&origin=jobCard#sol=f693a55bca26c1c8064558b8ba50bb90c40d5081,8h ago,8.0,2025-10-16T00:00:00+00:00,Sydney NSW (Hybrid),Database Development & Administration (Information & Communication Technology),Full time,,"Our client is undergoing a dynamic transformation, expanding its global footprint and investing heavily in data, analytics, and AI capabilities. With a mission to empower teams to uncover insights from complex digital data, it develops innovative software solutions that support decision-making across industries. The company promotes a collaborative and inclusive culture, values resilience and ownership, and is committed to doing the right thing quickly. Guided by a strong set of values, it’s building a future-focused team to drive scalable, secure, and intelligent data infrastructure.

About You:
This is a high-impact leadership role for a candidate who thrives on communication and influence. You'll be the bridge between technical teams and senior stakeholders, shaping the future of enterprise data infrastructure. If you're confident presenting ideas, driving alignment across departments, and translating complex data strategies into clear business value, this opportunity will put your strengths front and centre. Join a collaborative environment where your voice matters and your ability to lead through influence will drive real transformation.

About the role:
Lead the design, build, and optimisation of the enterprise data warehouse and modern data platform on AWS, enabling scalable analytics, AI, and enterprise data solutions through best-in-class architecture, automation, and governance.

To support AI and data enablement, our client is building an internal Data, Analytics and AI team. This team will have the following responsibilities:

Design, build and operate our enterprise data platform on Databricks
Design, build and operate integration for current and new data sources
Design data cleaning / governance / compliance tooling, standards and processes
Enable decision making with Data & Analytics capability through visualisations and tools
Required Skills and Expertise:

Deep expertise in cloud data platforms (AWS) ideally Databricks
Experience with data governance frameworks and security best practices
Leadership experience in architecting enterprise-scale data solutions 
To submit your application, in strict confidence, please submit your resume in Word Format using the appropriate link quoting reference No. 247019.  Should you require further information please email linda.hudson@hudson.com  

Your interest will be treated in the strictest of confidence.


Diversity, Equity & Inclusion at Hudson
Hudson is committed to helping you find a workplace where you feel respected, supported, and free to thrive. We welcome applications from all backgrounds, identities, and lived experiences—because when different voices come together, amazing things happen.

Casual Loading 
Please note for all Australian based contract and temporary roles only, the pay rate is inclusive of mandatory 25% casual loading. This excludes permanent and fixed term roles."
87898721,Principal Regulatory Analyst,Independent Pricing and Regulatory Tribunal,https://www.seek.com.au/job/87898721?type=standard&ref=search-standalone&origin=jobCard#sol=bf1879d82d86c8f3cfc7345f15ec1651b9858204,8h ago,8.0,2025-10-16T00:00:00+00:00,Sydney NSW (Hybrid),Analysts (Consulting & Strategy),Full time,,"Bring your policy and data analysis and systems thinking skills to this newly created position within our Energy Network Regulation team
Be part of group whose top priority is ensuring the safety and reliability of NSW’s energy networks
Advance your career working alongside highly skilled and motivated colleagues in a small, independent agency
Central Sydney location, with flexible working options

About the role

We are looking for a Principal Regulatory Analyst (this role is referred to internally as Principal Analyst) to join the Energy Network Regulation section within our Regulation and Compliance division. You will be part of a close-knit team responsible for monitoring energy network operators’ compliance with their safety and reliability obligations.

You will undertake detailed research, provide strategic policy advice, influence stakeholders, analyse data and deliver best-practice regulatory compliance work. 

Some of your key accountabilities will include:

- Reviewing and analysing data from incident reporting, audits and other regulatory tools to find improvements to our compliance approach

- Developing best practice regulation strategies for compliance frameworks

- Maintaining relationships with regulated network operators

- Maintaining cross-agency and cross-jurisdictional relationships

- Scoping and managing third party audits

- Identifying and developing responses to non-compliances

- Working with the Legal Team to develop and review licence conditions or interpret legal obligations

- Writing and presenting briefings to the Tribunal or Delegated Committees to facilitate decision making

About you

We are looking for someone who values being part of a team that is committed to the safety and reliability of energy networks through effective outcomes and risk-based regulation. 

You will be efficient at analysing complex information and data to address multiple priorities and unforeseen issues. You will have experience working with and analysing data as well as managing internal review projects. You will also feel comfortable engaging with a range of stakeholders.

Experience in the electricity sector, using data to provide meaningful insights or an engineering background would be an advantage but not essential. A positive attitude, willingness to learn, adaptability and teamwork are essential to this role.

The salary range for this role is $148,961- $158,157 per annum, plus superannuation and annual leave loading.

You can read the role description. If you have any access issues due to firewall settings, please try to access the role description from another device on a different network. 

About us

The Independent Pricing & Regulatory Tribunal (IPART) makes the people of NSW better off through its independent decisions and advice. We help people get safe and reliable services at a fair price.

IPART undertakes independent regulatory functions in the water, transport, local government and energy sectors in NSW. We also undertake reviews and investigations into a wide range of economic and policy issues.

Our organisational values are:

Integrity and courage – we are willing to make the difficult decision
Curiosity and openness – we seek out and develop new ideas that will improve our work
Respect and inclusion – we bring together diverse experiences and skills to generate better solutions
Making a difference – we pursue better outcomes for the people of NSW

If your values align with ours, we want to talk to you!

Applying for the role

Applications should include a cover letter (maximum 2 pages) that addresses the requirements detailed in the Role Description and a resume (maximum 5 pages) which clearly details your skills and experience as relevant to this role.  

Applications close Monday, 3rd November 2025 at 10.00am. Late applications will not be accepted. 

For further information about the role please contact Nicole Ghiotto, Nicole.Ghiotto@ipart.nsw.gov.au  

Our Commitment to Diversity, Inclusion & Flexibility 

IPART is proud to be an EEO Employer. We encourage and welcome applications from people from diverse backgrounds including: Aboriginal and Torres Strait Islanders; people living with disability; people from a Cultural and Linguistically Diverse (CALD) background; people who identify as LGBTQI+, people with a lived experience of mental health and people of mature age. 

We want you to bring your best self to this application process. If you feel you may require an adjustment during any stage of the recruitment process, please contact our HR Team via hrenquiry@ipart.nsw.gov.au or 02 9019 1953.

Additional information

This recruitment process will include pre-employment screening.
To apply for this role, you must be an Australian Citizen or Permanent Resident of Australia or a New Zealand citizen with a current New Zealand passport.
This recruitment activity may result in the creation of a talent pool to fill other ongoing and temporary vacancies for similar roles within IPART. Placement in the talent pool remains valid for 18 months.

Visit the Capability Application Tool to prepare for the recruitment process by accessing practice application and interview questions based on the focus capabilities listed in the role description."
87897754,Senior Business Analyst - Energy,Davidson,https://www.seek.com.au/job/87897754?type=standard&ref=search-standalone&origin=jobCard#sol=a5d986fc9b41bccb36eb74089af485267f6a78e9,8h ago,8.0,2025-10-16T00:00:00+00:00,Melbourne VIC (Hybrid),Business/Systems Analysts (Information & Communication Technology),Contract/Temp,$180k - $200k p.a.,"The Opportunity

Our client is seeking an accomplished Senior Business Analyst to play a key role in a high-impact energy reform program. This is an exciting opportunity to lead analysis efforts across complex business and regulatory initiatives within the energy utilities sector. You'll work with senior stakeholders, guide a small team, and contribute directly to shaping strategic and operational outcomes that drive the client's transformation journey.

Initial 12 month fixed term contract. Melbourne CBD location with flexible working conditions and 2 days work from home per week.


The Role

As a Senior Business Analyst you will be responsible for providing analytical leadership and strategic guidance across end-to-end project delivery.

Your other responsibilities will include:

Leading a team of Business Analysts to ensure consistent, high-quality analysis, documentation, and stakeholder engagement.
Facilitating workshops and discovery sessions to define business problems, uncover insights, and develop actionable recommendations.
Overseeing initiative scoping, prioritisation, and business case development to support funding and executive endorsement.
Guiding requirements definition, solution evaluation, and benefits tracking through project implementation.
Building strong relationships with senior stakeholders, regulators, and delivery teams to drive alignment and decision-making.
Maintaining governance and quality assurance practices aligned with enterprise standards.
About You

In order to be a successful applicant you will bring a combination of business acumen, analytical rigour, and energy sector expertise.

You will also have:

A tertiary qualification in business, finance, or a related discipline, and extensive experience as a Senior or Lead Business Analyst.
Proven experience in the energy, gas, or electricity sector-preferably in reform, transformation, or regulatory programs.
Strong leadership skills with the ability to mentor and uplift a team of analysts.
Demonstrated experience in developing business cases and defining both high-level and detailed business requirements.
Exceptional stakeholder management and communication skills, with the ability to engage senior leadership and regulatory bodies.
Advanced documentation and presentation capabilities, including reporting, roadmaps, and dashboards.
Benefits
Initial 12 month fixed term contract with a competitive salary
Flexible working conditions with 2 days work from home per week
Opportunity to influence major transformation within a leading energy organisation.
Collaborative and supportive team culture.
Exposure to complex, high-profile regulatory and technology programs.

Please note: We are receiving an extremely high volume of applications, please apply directly to the job advert and be patient while waiting for an update. Whilst we endeavour to respond to all enquiries, with current volumes it can be challenging - we're only human!

If you wish to apply via email please make sure you also apply directly - a lot of applications get phished, or sent to spam.

Please apply with current resume in Microsoft Word format only (.doc or .docx). helena.patterson@davidsonwp.com, JN -102025-41538. Want to know more about Davidson? Visit us at www.davidsonwp.com"
