Job ID,Job Title,Company,Detail URL,Posted Label,Hours Old,Posted Datetime (Local),Location,Category,Work Type,Salary,Ad Text
88590263,Senior Workforce Advisor,Wirrigan Group,https://www.seek.com.au/job/88590263?type=standard&ref=search-standalone&origin=jobCard#sol=7bc5a3501d923ef4135994adab1d194cca0f86ee,6h ago,6.0,2025-11-18T02:00:00+00:00,"Parramatta, Sydney NSW (Hybrid)",Database Development & Administration (Information & Communication Technology),Contract/Temp,$545/day plus super,"12 month-contract

$545/day plus super

Location Parramatta, hybrid

As a Senior Workforce Advisor, you will be responsible for undertaking and managing data requests, providing timely and accurate information to internal stakeholders, and delivering high-quality analysis and reporting. This is a key role that combines technical expertise with a strong customer-service focus to support workforce planning and broader organisational goals.

Key responsibilities

Manage and respond to workforce data requests, ensuring accurate, timely, and relevant information is delivered to stakeholders.

Provide expert advice on workforce data, systems, and analytical methods to support internal decision-making.

Utilise a range of systems and tools (e.g. SAP, iSeries, TRIM, Power BI, Alteryx, Excel, SQL, R, Python) to analyse and visualise data effectively.

Apply advanced analytical and problem-solving skills to produce evidence-based insights that inform strategic planning and improve student outcomes.

Prepare high-quality reports and recommendations, and work with your supervisor to develop an annual work plan outlining key responsibilities and success measures.

You

Demonstrated experience in workforce analytics, data reporting, or a related role.

Proficiency in data tools and technologies such as Power BI, Alteryx, SQL, Python, or R.

Strong communication skills, with the ability to convey complex information in a clear and compelling manner.

A proactive and organised approach, with strong attention to detail and a commitment to continuous improvement.

Experience working with HR systems such as SAP and TRIM is highly desirable.

Apply Now!"
88589977,Business Analyst (Platform),Mason Stevens,https://www.seek.com.au/job/88589977?type=standard&ref=search-standalone&origin=jobCard#sol=f35b3326b8646d6b18d3c9ea77f33bca6e189e35,7h ago,7.0,2025-11-18T01:00:00+00:00,Sydney NSW (Hybrid),Business/Systems Analysts (Information & Communication Technology),Full time,,"About Mason Stevens

Mason Stevens is a leading provider of integrated wealth platform technology, that uniquely focuses on investor portfolio outcomes. More than just an administration platform, the innovative technology, paired with experienced investment specialist support, empowers advisers to deliver on their clients’ investment objectives via an unconstrained investment universe, and backed by exceptional client service.

Established in 2010, Mason Stevens is privately owned with over $10 billion of funds under administration and management. Led by some of Australia’s most experienced finance, technology, and investment professionals, with over 80 staff nationally.

About the Role

The Business Analyst plays a key role in identifying operational challenges and designing effective solutions that support business goals. Working across multiple departments, this role helps implement and maintain business information systems that enhance performance and efficiency.

You’ll collaborate closely with financial reporting and IT teams to develop strategies that optimise costs and improve reporting outcomes. This role requires strong analytical thinking, cross-functional engagement, and a focus on delivering practical, data-driven improvements across platforms and operations.

Key Responsibilities:

Identify, create, and facilitate requirements elicitation by conducting business and systems process analysis and design.

Identifying business needs by focusing on quality improvement and data management.

Partner with a range of stakeholders to ensure requirements are aligned to meet the long-term business strategies.

Manage and coordinate various platform and business operations projects to monitor and report on the project outcomes to ensure they are delivered on time, within budget and to agreed quality standards.

Work with stakeholders, subject matter experts and project teams to develop, plan and implement testing, change management and training plans.

Assist concurrently on multiple projects while working closely with the Chief Technology Officer on platform strategy.

Required Skills/Experience/Knowledge:

Demonstrated experience in a Business Analyst role (minimum 3 years’ experience). 

Experience in working with a diverse range of stakeholders and applying change management principles through large and complex digital transformation projects. 

Ability to work autonomously to further scope future projects. 

Demonstrated experience in a range of methods, tools and techniques to capture requirements and evaluate and recommend appropriate solutions.

An appropriate tertiary qualification in a relevant discipline is desirable.

Excellent analytical, organisational, and communication skills.

Qualifications:

Tertiary degree, finance related discipline (preferred).

Ideally, 2 – 4 years’ experience in a client facing role within financial services.

Life at Mason Stevens

At Mason Stevens, relationships matter to us, and by fostering a culture of humility and collaboration, we achieve remarkable outcomes while supporting each individual to realise their potential.

We are committed to building and maintaining a diverse and talented team, backed by the belief that it is only by working together, that we will achieve our purpose; helping our Clients to realise better tomorrows.

We believe in keeping our ‘minds wide open’ and empowering people with the resources and trust needed to make a meaningful difference. We know an idea can only change lives if it happens, and value the kind of people who believe in being the change they seek and see opportunity in challenge.

Above all, we know you will be a great fit for us if you value people, show kindness and play fair.

Kindly note that Australian full work rights are required for this application."
88589879,Senior Business Analyst (Platform),Mason Stevens,https://www.seek.com.au/job/88589879?type=standard&ref=search-standalone&origin=jobCard#sol=c33f0ed31e18c6903319901353b2d61bfe52b849,7h ago,7.0,2025-11-18T01:00:00+00:00,Sydney NSW (Hybrid),Business/Systems Analysts (Information & Communication Technology),Full time,,"About Mason Stevens

Mason Stevens is a leading provider of integrated wealth platform technology, that uniquely focuses on investor portfolio outcomes. More than just an administration platform, the innovative technology, paired with experienced investment specialist support, empowers advisers to deliver on their clients’ investment objectives via an unconstrained investment universe, and backed by exceptional client service.

Established in 2010, Mason Stevens is privately owned with over $10 billion of funds under administration and management. Led by some of Australia’s most experienced finance, technology, and investment professionals, with over 80 staff nationally.

About the Role

The Senior Business Analyst plays a key role in identifying operational challenges and designing effective solutions that support business goals. Working across multiple departments, this role helps implement and maintain business information systems that enhance performance and efficiency.

You’ll collaborate closely with financial reporting and IT teams to develop strategies that optimise costs and improve reporting outcomes. This role requires strong analytical thinking, cross-functional engagement, and a focus on delivering practical, data-driven improvements across platforms and operations.

Key Responsibilities:

Identify, create, and facilitate requirements elicitation by conducting business and systems process analysis and design.

Identifying business needs by focusing on quality improvement and data management.

Partner with a range of stakeholders to ensure requirements are aligned to meet the long-term business strategies.

Manage and coordinate various platform and business operations projects to monitor and report on the project outcomes to ensure they are delivered on time, within budget and to agreed quality standards.

Work with stakeholders, subject matter experts and project teams to develop, plan and implement testing, change management and training plans.

Assist concurrently on multiple projects while working closely with the Chief Technology Officer on platform strategy.

Required Skills/Experience/Knowledge:

Demonstrated experience in a Senior Business Analyst role (minimum 5 years’ experience). 

Experience in working with a diverse range of stakeholders and applying change management principles through large and complex digital transformation projects. 

Ability to work autonomously to further scope future projects. 

Demonstrated experience in a range of methods, tools and techniques to capture requirements and evaluate and recommend appropriate solutions.

An appropriate tertiary qualification in a relevant discipline is desirable.

Excellent analytical, organisational, and communication skills.

Qualifications:

Tertiary degree, finance related discipline (preferred).

Ideally, 2 – 4 years’ experience in a client facing role within financial services.

Life at Mason Stevens

At Mason Stevens, relationships matter to us, and by fostering a culture of humility and collaboration, we achieve remarkable outcomes while supporting each individual to realise their potential.

We are committed to building and maintaining a diverse and talented team, backed by the belief that it is only by working together, that we will achieve our purpose; helping our Clients to realise better tomorrows.

We believe in keeping our ‘minds wide open’ and empowering people with the resources and trust needed to make a meaningful difference. We know an idea can only change lives if it happens, and value the kind of people who believe in being the change they seek and see opportunity in challenge.

Above all, we know you will be a great fit for us if you value people, show kindness and play fair.

Kindly note that Australian full work rights are required for this application."
88589543,Senior Business Process Consultant - SAP Business Data Cloud & Analytics...,SAP Australia Pty Ltd,https://www.seek.com.au/job/88589543?type=standard&ref=search-standalone&origin=jobCard#sol=25cb0c298a6f48e8ab86cff7acf6a9fbb4878b0a,7h ago,7.0,2025-11-18T01:00:00+00:00,"Southbank, Melbourne VIC (Hybrid)",Consultants (Information & Communication Technology),Full time,,"We help the world run betterAt SAP, we keep it simple: you bring your best to us, and we'll bring out the best in you. We're builders touching over 20 industries and 80% of global commerce, and we need your unique talents to help shape what's next. The work is challenging – but it matters. You'll find a place where you can be yourself, prioritize your wellbeing, and truly belong. What's in it for you? Constant learning, skill growth, great benefits, and a team that wants you to grow and succeed. 

Role Overview

Are you passionate about the transformative power of cloud data and analytics? Are you ready to help Australia’s public and private sectors unlock greater efficiency and insight through smarter data strategies and migrations?

Join SAP and play a leading role in redefining how organisations harness the potential of SAP Business Data Cloud and advanced analytics. As a Senior Business Process Consultant, you will architect and design complex data and analytics solutions, provide strategic leadership, and guide teams to deliver impactful outcomes. This is your opportunity to set new industry benchmarks and drive real transformation where it matters most.

Key Responsibilities

Architect and design end-to-end data management and analytics solutions using SAP Business Data Cloud, ensuring scalability, security, and alignment with industry best practices.

Provide strategic advisory to clients, developing data strategies and roadmaps that align with organisational objectives and compliance requirements.

Lead and mentor delivery teams, providing technical direction and best practice guidance at both regional and, where required, global levels.

Engage with senior stakeholders (including C-level executives) to understand business needs, facilitate workshops, and drive business use case discovery.

Oversee the implementation of data integration, modelling, and analytics solutions, ensuring quality and consistency across projects.

Maintain deep expertise in SAP’s data and analytics portfolio, with a focus on SAP Datasphere, SAP Analytics Cloud, and SAP HANA Cloud.

Foster a culture of innovation, collaboration, and continuous learning within project teams and across the wider SAP community.

Contribute to the development of best practices, technical documentation, and knowledge sharing across teams.

Support the sales process as a subject matter expert, including proposal development, solution scoping, and customer presentations.

Ensure adherence to SAP and client project methodologies, including Activate and relevant frameworks.

Education, Skills & Competencies

Bachelor’s or Master’s degree in Business Administration, Computer Science, Information Management, or a related field.

Proven expertise in solution architecture and design for large-scale data and analytics platforms, ideally within the SAP ecosystem.

Strong experience with SAP data and analytics solutions (such as SAP Analytics Cloud, SAP Datasphere, SAP HANA Cloud, or similar platforms), with the ability and motivation to rapidly learn and apply new SAP Business Data Cloud capabilities.

Demonstrated ability to lead, guide, and instruct teams across regions and, where required, globally, fostering knowledge transfer and capability uplift.

Solid understanding of cloud concepts, data architecture, and enterprise data management.

Demonstrated experience working with or for government agencies or large enterprises.

Excellent communication and stakeholder engagement skills, with the ability to present complex concepts to non-technical audiences.

Proven ability to capture business requirements and translate them into effective data solutions.

Beneficial

Experience with modern data platforms such as Databricks and/or Snowflake.

Hands-on experience in artificial intelligence (AI), particularly with SAP Business AI or similar enterprise AI solutions.

Experience in business planning and financial processes (e.g., SAP BPC, SAP Planning, or similar solutions).

Knowledge of ABAP programming and its application within SAP data and analytics environments.

Personal Attributes

High integrity, reliability, and ability to work effectively under pressure.

Self-starter with a passion for learning and staying ahead of technology trends.

Team player with strong interpersonal skills and a collaborative, inclusive mindset.

Customer-Facing Skills

Ability to inspire confidence and engage with stakeholders at all levels, including executives.

Skilled at delivering clear, concise presentations and facilitating workshops.

Travel

Willingness to travel as required, primarily within Brisbane and occasionally interstate or internationally.

What We Offer

At SAP, you’ll join a dynamic, inclusive, and flexible work environment, with opportunities for personal and professional growth, recognition for your unique contributions, and the chance to make a real impact on digital transformation in Australia.

Bring out your bestSAP innovations help more than four hundred thousand customers worldwide work together more efficiently and use business insight more effectively. Originally known for leadership in enterprise resource planning (ERP) software, SAP has evolved to become a market leader in end-to-end business application software and related services for database, analytics, intelligent technologies, and experience management. As a cloud company with two hundred million users and more than one hundred thousand employees worldwide, we are purpose-driven and future-focused, with a highly collaborative team ethic and commitment to personal development. Whether connecting global industries, people, or platforms, we help ensure every challenge gets the solution it deserves. At SAP, you can bring out your best.  

Please note that any violation of these guidelines may result in disqualification from the hiring process.

Requisition ID: 440071  | Work Area: Consulting and Professional Services  | Expected Travel: 0 - 30%  | Career Status: Professional  | Employment Type: Regular Full Time   | Additional Locations:  #LI-Hybrid"
88589542,Principal Business Process Consultant - SAP Business Data Cloud (Centre of...,SAP Australia Pty Ltd,https://www.seek.com.au/job/88589542?type=standard&ref=search-standalone&origin=jobCard#sol=19f6cb76736e4c1b84b8ced32bcabc0ffc29ca3f,7h ago,7.0,2025-11-18T01:00:00+00:00,"Deakin, Canberra ACT",Consultants (Information & Communication Technology),Full time,,"We help the world run betterAt SAP, we keep it simple: you bring your best to us, and we'll bring out the best in you. We're builders touching over 20 industries and 80% of global commerce, and we need your unique talents to help shape what's next. The work is challenging – but it matters. You'll find a place where you can be yourself, prioritize your wellbeing, and truly belong. What's in it for you? Constant learning, skill growth, great benefits, and a team that wants you to grow and succeed. 

Lead the Future of Data & Analytics Transformation – Join Our Centre of Excellence
Are you passionate about the transformative power of cloud data and analytics? Are you ready to help Australia’s public sector unlock greater efficiency and insight through smarter data strategies and migrations?
Join SAP and take the lead in a bold new initiative that’s redefining how key government agencies harness the potential of SAP Business Data Cloud and advanced analytics. With the establishment of a Centre of Excellence (CoE) for Federal Australian Agencies, we’re assembling a high-performance team to guide major agencies through the “how” of data and analytics transformation—delivering proven strategy, expert implementation, and scalable, lasting impact.
This high-profile, strategic initiative will begin as an 18-month transformation programme, serving as your initial assignment. Upon completion, you’ll transition into the broader Customer Success and Delivery area, extending best practices and knowledge gained to drive ongoing value for our clients. This is your opportunity to set new industry benchmarks and drive real transformation where it matters most.
As a Principal Business Process Consultant specialising in SAP Business Data Cloud and Analytics, you will architect and design complex data and analytics solutions, provide strategic leadership, and guide both regional and global teams. You will play a key role in shaping strategy, delivering impactful solutions, and building trusted relationships with government stakeholders.
Please note: As this role supports the Australian Public Sector, Australian citizens with the capability to secure and maintain government security clearance are preferred.

Key Responsibilities

Architect and design end-to-end data management and analytics solutions using SAP Business Data Cloud, ensuring scalability, security, and alignment with industry best practices.
Provide strategic advisory to Federal Government clients, developing data strategies and roadmaps that align with public sector objectives and compliance requirements.
Lead and mentor delivery teams, providing technical direction and best practice guidance at both regional and global levels.
Engage with senior stakeholders (including C-level and government executives) to understand business needs, facilitate workshops, and drive business use case discovery.
Oversee the implementation of data integration, modelling, and analytics solutions, ensuring quality and consistency across projects.
Maintain deep expertise in SAP’s data and analytics portfolio, with a focus on SAP Datasphere, SAP Analytics Cloud, and SAP HANA Cloud.
Foster a culture of innovation, collaboration, and continuous learning within the CoE and across the wider SAP community.
Contribute to the development of best practices, technical documentation, and knowledge sharing across the CoE and globally.
Support the sales process as a subject matter expert, including proposal development, solution scoping, and customer presentations.
Ensure adherence to SAP and government project methodologies, including Activate and relevant public sector frameworks.


Education, Skills & Competencies

Bachelor’s or Master’s degree in Business Administration, Computer Science, Information Management, or a related field.
Proven expertise in solution architecture and design for large-scale data and analytics platforms, ideally within the SAP ecosystem.
Strong experience with SAP data and analytics solutions (such as SAP Analytics Cloud, SAP Datasphere, SAP HANA Cloud, or similar platforms), with the ability and motivation to rapidly learn and apply new SAP Business Data Cloud capabilities.
Demonstrated ability to lead, guide, and instruct teams across regions and on a global scale, fostering knowledge transfer and capability uplift.
Solid understanding of cloud concepts, data architecture, and enterprise data management in a public sector context.
Demonstrated experience working with or for government agencies, ideally within the Federal Government sector.
Solid financial background in planning, with proven experience in budgeting processes and financial modelling.
Excellent communication and stakeholder engagement skills, with the ability to present complex concepts to non-technical audiences.
Proven ability to capture business requirements and translate them into effective data solutions.
Experience in financial planning (using SAP BPC, SAC Planning) is advantageous.
Australian citizenship and the ability to secure and maintain government security clearance are preferred.

Personal Attributes

High integrity, reliability, and ability to work effectively under pressure.
Self-starter with a passion for learning and staying ahead of technology trends.
Team player with strong interpersonal skills and a collaborative, inclusive mindset.

Customer-Facing Skills

Ability to inspire confidence and engage with stakeholders at all levels, including government executives.
Skilled at delivering clear, concise presentations and facilitating workshops.


Travel

Willingness to travel as required, primarily within Canberra and occasionally interstate or internationally.

Location

•    Canberra, ACT

What We Offer

At SAP, you’ll join a dynamic, inclusive, and flexible work environment, with opportunities for personal and professional growth, recognition for your unique contributions, and the chance to make a real impact on Australia’s digital government transformation

Bring out your bestSAP innovations help more than four hundred thousand customers worldwide work together more efficiently and use business insight more effectively. Originally known for leadership in enterprise resource planning (ERP) software, SAP has evolved to become a market leader in end-to-end business application software and related services for database, analytics, intelligent technologies, and experience management. As a cloud company with two hundred million users and more than one hundred thousand employees worldwide, we are purpose-driven and future-focused, with a highly collaborative team ethic and commitment to personal development. Whether connecting global industries, people, or platforms, we help ensure every challenge gets the solution it deserves. At SAP, you can bring out your best.  

Please note that any violation of these guidelines may result in disqualification from the hiring process.

Requisition ID: 440326  | Work Area: Consulting and Professional Services  | Expected Travel: 0 - 30%  | Career Status: Professional  | Employment Type: Regular Full Time   | Additional Locations:  #LI-Hybrid"
