Job ID,Job Title,Company,Detail URL,Posted Label,Hours Old,Posted Datetime (Local),Location,Category,Work Type,Salary,Ad Text
90023067,Senior Systems Engineer - MQ-28 Payloads Engineering,Boeing Defence Australia,https://www.seek.com.au/job/90023067?type=standard&ref=search-standalone&origin=jobCard#sol=2c1bf683a2814746856bffadd47ed7d9d57b37e5,5h ago,5.0,2026-01-30T02:00:00+00:00,Brisbane QLD (Hybrid),Systems Engineering (Engineering),Full time,,"The Boeing MQ-28 Ghost Bat is a globally-significant program that will deliver a disruptive advantage to support Defence operational capabilities. Developed in partnership with the Royal Australian Air Force, it is the first military combat aircraft to be designed, manufactured and assembled in Australia in 50 years. 

As we continue to mature the platform and rapidly expand on its skills and capabilities, Boeing Defence Australia (BDA) are seeking an experienced Systems Engineer to support the design, development, integration and testing of new capability for the MQ-28 Ghost Bat. You will work collaboratively across an interdisciplinary and multinational team on cutting edge systems. 

This role is based in Brisbane and reports into the MQ-28 Payloads Engineering Manager. 

As an experienced Senior Systems Engineer you will:

Engage and collaborate with key internal and external stakeholders across technical engineering and specialty areas to develop and integrate innovative solutions to achieve capability objectives and requirements of the MQ-28 Mission System.
Apply an interdisciplinary, collaborative approach to requirements development and management including analysis of functional and non-functional requirements, functional performance specifications, architecture and interfaces to develop effective solutions for complex systems.
Manage dependencies, assess trades and conduct technical design reviews in collaboration with the broader project team to ensure the engineering scope is delivered with quality and on schedule.
Lead and develop verification requirements, test plans, procedures and reports.
Coordinate, plan and conduct integration and formal verification testing of the MQ-28 Mission System.
Support ground and flight test operations for the MQ-28 Mission System.
Demonstrate leadership in development, review and approval of engineering documentation and designs while providing mentoring of less experienced staff.
Manage technical risk and support identification, analysis and resolution of problem reports.
Plan and coordinate incremental capability development and delivery within an AGILE framework. 

To be considered for the role you will have:

Minimum of 5 years' experience in complex technical development and integration projects
Hold Tertiary qualifications in either Aerospace, Avionics, Electrical or Mechatronics Engineering or equivalent technical experience in a Systems Engineering discipline.
Demonstrated experience in systems and software development lifecycle (essential).
Demonstrated experience in avionics system level testing in a laboratory and ground test environments (desirable).
Experience with aircraft avionics, sensors and UAV systems (desirable).
Familiarity with engineering change processes.
Familiarity with software development, test and integration.
Experience with aerospace and / or Defence projects (highly regarded). 

Applicants must be Australian Citizens to meet Defence security requirements. 

What's on offer?

Boeing values the health and wellbeing of our employees and offer true flexibility including working from home, compressed work weeks, and opportunities for part time arrangements, allowing you to balance your career with what is important to you outside of work.

Other benefits:

Work on cutting edge projects with opportunities to work across platforms.
Attractive remuneration and annual bonus.
Formal mentoring and training as well as on the job learning.
Formal reward and recognition program.
Access discounts for health insurance, travel and accommodation.
Paid study leave, paid parental leave and Defence leave.
Salary packaging options available.
Health and wellbeing benefits including annual flu vaccinations and Employee Assistance Program.
Social and community groups. 

BDA works with strong links with our global Boeing community and we strongly encourage collaboration with our international counterparts. 

We are committed to building a diverse and inclusive workplace. Female applicants, people of Aboriginal or Torres Strait Island descent and veterans are encouraged to apply. 

If you are ready to join an innovative industry leader and would like to register your interest in working for Boeing, please click Apply Now."
90022581,Senior Data Observability Engineer,FinXL IT Professional Services,https://www.seek.com.au/job/90022581?type=standard&ref=search-standalone&origin=jobCard#sol=7db1ef9a8d5e0675303543bb7340ab619362e22f,6h ago,6.0,2026-01-30T01:00:00+00:00,Canberra ACT,Other (Information & Communication Technology),Full time,,"Canberra ACT
Long-term Contract
Must have be Australian Citizen with minimum of NV1 Clearance

FInXL is seeking a Senior Data Observability Engineer to play a pivotal role in designing and implementing the analytics infrastructure for the Validation Lab. You will be responsible for building systems that provide deep visibility into complex networks, supporting test and evaluation, risk reduction, and large-scale experimentation.

This role sits at the intersection of Data Engineering, DevSecOps, and Systems Integration, requiring a technical expert who can bridge the gap between experimental systems and operational excellence.

Key Responsibilities
Design and build data observability tooling to support validation activities and directed initiatives.
Develop and maintain data observability practices for experimentation, root cause analysis, and network optimization.
Provide technical advice and assistance to staff and supported elements, contributing towards future architectural decisions.
Partner with DevSecOps and Automation elements to incorporate data observability tooling and configurations for test activity preparation.
Provide technical support to exercises, activities, and trials for role-specific technologies and systems.
Deliver just-in-time training and actively mentor personnel during periods of instruction.
Provide written and oral reports from test events and post-activity assessments.
Provide technical guidance to developing capabilities via the Digital Integration Framework to enable an integrated system within a Joint and Coalition Force.
Required Skills & Experience:
Extensive experience with ELK (Elasticsearch, Logstash, Kibana), Elastic Stacks, and Netflow.
Deep proficiency in Linux (primarily Red Hat) and virtualization technologies (KVM, VMware).
Relevant experience in developing/employing DevSecOps systems (CI/CD pipelines, GitLab).
Proficiency in code languages and scripts - Python, Bash, PowerShell, Java, C, C++, etc.
Proficiency in API development, configuration, and integration.
Strong knowledge of networking, storage, and integrating emerging technologies into secure infrastructure.

Desirable Qualifications:

Google Cloud, AWS, or Azure Data Analytics; industry certifications in data observability (Datadog, New Relic, Prometheus, Grafana, etc).
10+ years relevant experience in Data Engineering and Analytics roles.
Experience or exposure to employing Agile project management practices and processes.
Tertiary or vocational qualifications in data engineering, data analytics, IT engineering, or related fields.

If you are ready to take on this exciting opportunity, we encourage you to apply by clicking the ""Apply Now"" Button. Only suitable candidates will be contacted.

FinXL does not accept unsolicited resumes or appreciate unsolicited calls from recruitment agencies.

FinXL encourages applications from Aboriginal and Torres Strait Islander people."
90021433,Build Automation Technical Specialist,Downer EDI Limited,https://www.seek.com.au/job/90021433?type=standard&ref=search-standalone&origin=jobCard#sol=917f4ae2c740bfda29db115dff002886471ea591,6h ago,6.0,2026-01-30T01:00:00+00:00,Canberra ACT,Developers/Programmers (Information & Communication Technology),Full time,,"Join our Downer Professional Services team and play a key role in delivering complex defence and national security projects that safeguard Australia's future.

Downer Professional Services comprises of three business units our Technical, Advisory, and Capability consulting practice, and Team Downer, which partners with CASG and NSSG as a major service provider to Defence. Together, we are a multi-disciplinary advisory and delivery partner of choice for clients across Defence and National Security.

We currently have an opportunity for a Build Automation Technical Specialist in Canberra to work on Defence LNIC projects.

What You'll Do

This role offers a broad scope, with key role responsibilities including:


Develop and maintain automation tools to streamline system build, configuration, and deployment for deployable ICT nodes
Provide scripting, automation, and orchestration support within a DevSecOps environment.
Design and implement VMware based disaster recovery solutions.
Produce clear technical documentation covering automation workflows, system design, and configuration.
Support configuration management, technical planning, risk activities, and collaborate with SMEs, stakeholders, and user groups

What You'll Bring

Hands on experience with PowerShell, Ansible, version controlled infrastructure, and automated patching & compliance processes.
Strong knowledge of DevSecOps methodologies and toolsets, including GitLab and Kubernetes container platforms.
Experience working with Microsoft and Linux OS environments, as well as VMware datacentre technologies.
Familiarity with secure ICT systems, ideally within Defence, including vulnerability scanning, secrets management, and identity/access control.
Understanding of security frameworks (NIST, ISO27001, ASD Essential 8), with experience in air gapped or cloud & hybrid environments


Due to the nature of the work, you are required to currently hold and maintain a minimum Negative Vetting 1 or higher Security clearance as required by the Commonwealth. In some instances, compliance with International Traffic in Arms Regulations (ITAR) requirements may also be an inherent requirement.

More than anything, you'll bring a strong work ethic, a positive attitude, and a commitment to delivering high-quality outcomes for our clients.

Why Downer Professional Services

At Downer Professional Services, we're not just a workplace - we're a business dedicated to contributing to the shaping of the future of defence in Australia. As the country's only sovereign prime, we're committed to making a real difference in protecting Australia's interests.

What is means to belong at Downer Professional Services

Meaningful work: Help to deliver critical Defence projects that protect Australia and shape its future.
Professional development: Access career mapping, accelerated learning programs, and shared learning through our Communities of Practice.
Great perks: Enjoy discounts on healthcare, retail, vehicles, and more through Perks@Downer.
Veteran support: Benefit from initiatives like up to 20 days of Reservist Leave to stay connected post-service.

You want your work to matter and so do we. With over 26,000 people across Australia, New Zealand and the Pacific, our team is made up of individuals with unique perspectives, backgrounds, and ideas.

We know that diversity makes us stronger and we actively celebrate it through our commitment to inclusion and belonging.

We're committed to building a team that reflects the diverse communities we serve and we welcome people of all ages, genders, sexual orientations, cultures, abilities, and lived experiences. We especially encourage applications from those whose voices have traditionally been underrepresented in our industry, including women, Aboriginal and Torres Strait Islander Peoples, Māori and Pasifika Peoples, veterans, people with disability, and neurodivergent individuals. Even if your experience doesn't align perfectly with this role, we'd still like to hear from you. If it feels like the right fit, apply - potential counts, and so do you.


As a WORK180 Endorsed Employer, we support flexibility that works for your life, inclusive leadership that values your voice, and equitable access to opportunity so you can do your best work and bring your whole self to it.

If you need support or adjustments through the recruitment process, just let us know, we're here to help you put your best foot forward."
90021138,Intelligent Automation Engineer,FourQuarters Recruitment,https://www.seek.com.au/job/90021138?type=standard&ref=search-standalone&origin=jobCard#sol=2edd8db4055bb9fded5f8dfb08106e17939abef4,7h ago,7.0,2026-01-30T00:00:00+00:00,Melbourne VIC (Hybrid),Developers/Programmers (Information & Communication Technology),Full time,,"We are seeking an Intelligent Automation Engineer to join a Professional Services business, delivering end-to-end automation solutions for enterprise clients across multiple industries. You'll work closely with business stakeholders, process SMEs, and delivery teams to design, build, and deploy scalable RPA and Intelligent Automation solutions using Blue Prism and/or UiPath.
This is a hands-on delivery role with strong exposure to client engagement, solution design, and continuous improvement.
Key responsibilities

Design, develop, test, and deploy RPA solutions using Blue Prism and/or UiPath
Engage with client stakeholders to understand business processes and identify automation opportunities
Translate business requirements into technical automation designs and solution documentation
Build robust, scalable, and reusable automation components aligned with best practices
Support solution architecture decisions across RPA, AI, OCR, and workflow tools where relevant
Conduct process assessments, PDDs, SDDs, and effort estimates
Troubleshoot, maintain, and optimise live automations in production environments
Collaborate with project managers, business analysts, and other engineers to deliver on time and on budget
Contribute to automation standards, frameworks, and accelerators within the practice
Provide knowledge transfer, documentation, and client enablement as part of delivery
Skills & experience
Essential:

2+ years' hands-on experience delivering RPA solutions using Blue Prism and/or UiPath
Experience working in a consulting or professional services environment
Strong understanding of end-to-end RPA delivery lifecycle
Experience gathering requirements and working directly with business stakeholders
Solid understanding of exception handling, logging, security, and performance optimisation
Familiarity with SQL, APIs, and system integrations
Strong documentation and communication skills"
90020156,"Data Scientist - Junior, Mid and Senior Opportunities - Sydney/Melbourne",Capgemini Australia Pty Ltd,https://www.seek.com.au/job/90020156?type=standard&ref=search-standalone&origin=jobCard#sol=3fcf116875d478c7c03c280d98e7467e8bccfab8,8h ago,8.0,2026-01-29T23:00:00+00:00,Melbourne VIC,Consultants (Information & Communication Technology),Full time,,"Company description:



Come and join a thriving company and become part of a diverse global collective of free-thinkers, entrepreneurs and industry experts who are all driven to use technology to reimagine what's possible. Capgemini. Get the future you want.

For more about why Capgemini https://www.capgemini.com/au-en/careers/why-join-capgemini/





Job description:



About Capgemini:

Capgemini is a diverse collective of more than 350,000 strategic and technological experts based across more than 50 countries, partnering with world-renowned clients to transform and manage their businesses.

We are dedicated to leveraging cloud, data, AI, connectivity, software, digital engineering, and platforms to address the entire breadth of their business needs. This passion drives a powerful commitment - to unlock the true value of technology. ​

Our business in Australia and New Zealand has over 3,000 team members devoted to helping clients get the future they want.

Now is the time to join our rapidly growing team who are at the forefront of finding new ways technology can help us reimagine what's possible, collecting unique career experiences with global brands and game-changing tech projects.

About the Service Line:

Capgemini Global Insights & Data business line is a market leader in Data Engineering, Cloud Data Platforms, Data Science, and AI and Advanced Analytics across all sectors including financial services, public sector, consumer products, telecommunication & energy resources. Our offerings include end-2-end data integration to cloud platforms, complete suite of data engineering capabilities and a category of sector-based advanced analytics and AI driven solutions.

This is a unique opportunity within the Insights & Data (I&D) Global Business Line (GBL) to help grow the data, AI and Data Science engagements across all sectors in Australia and New Zealand. You will help shape and deliver complex projects and programs of work for our clients. You will understand our client's need to bring maximum value, impact, and innovation to the market as you oversee the delivery of client engagements for data and AI initiatives.

Let's talk about the roles and responsibilities:



Experience working in the field of generative AI applying large language models to real world problems.
Experience working with agentic AI frameworks such as Langgraph, Autogen and CrewAI etc.
Build data science and AI solutions for clients relating to their business problems in areas such as generative AI, NLP, computer vision, machine learning, etc.    
Collaborate with sales and engagement teams to build client proposals in response to RFPs.
Experience in designing end-to-end Generative AI/ Data Science solutions.
Experience and Qualifications:
We're interested in hearing from people across junior, mid and senior levels.
For Mid and senior levels, we are seeking extensive experience in AI and Machine Learning: Proven track record of leading, developing and implementing AI and machine learning solutions across various industries.
Strong Programming Skills: Proficiency in Python programming
Experience in Data Analysis and Visualization: Strong skills in data analysis, visualization, and tools such as Tableau, Power BI, and other data visualization platforms(preferred).
Degree in Data Science or Related Field: Bachelor's or master's in data science, Computer Science, Statistics, or a related field.
Due to the nature of the role, Australian citizens are highly desirable.


We offer:

What You'll Love About Working Here:
Exposure to transformational programs in AI & Data portfolio.
Career growth through learning platforms, certifications, and global mobility.
Inclusive culture backed by our ""Inclusive Future for All"" commitment.
Competitive total rewards and recognition programs."
90018405,Backend Software Engineer (Blockchain Analytics),Binance,https://www.seek.com.au/job/90018405?type=standard&ref=search-standalone&origin=jobCard#sol=a9c1a0b904fd0f5820a3efdc58e27b9397c5c5f0,12h ago,12.0,2026-01-29T19:00:00+00:00,Sydney NSW (Remote),Developers/Programmers (Information & Communication Technology),Full time,,"Binance is a leading global blockchain ecosystem behind the world’s largest cryptocurrency exchange by trading volume and registered users. We are trusted by over 280 million people in 100+ countries for our industry-leading security, user fund transparency, trading engine speed, deep liquidity, and an unmatched portfolio of digital-asset products. Binance offerings range from trading and finance to education, research, payments, institutional services, Web3 features, and more. We leverage the power of digital assets and blockchain to build an inclusive financial ecosystem to advance the freedom of money and improve financial access for people around the world.

Design, develop, and operate backend systems that power blockchain analytics, attribution, and risk intelligence products
Build scalable, high-throughput services to process and serve large volumes of on-chain data, including transactions, addresses, entities, and relationships
Implement backend components supporting address clustering, entity resolution, and transaction graph analysis
Collaborate closely with data scientists, analysts, and product teams to productionize analytical models and heuristics
Design APIs and internal services that expose blockchain intelligence to downstream applications and customers
Improve system reliability, performance, and maintainability through thoughtful architecture and continuous optimization
Write clear technical documentation and contribute to engineering best practices
Bachelor’s degree or above in Computer Science, Engineering, or a related field
3+ years of backend development experience using Java
Strong experience with Spring / Spring Boot / Spring Cloud in production environments
Solid understanding of backend infrastructure and data stores, including relational databases (MySQL, PostgreSQL), caching systems (Redis), and messaging systems (Kafka)
Strong understanding of blockchain fundamentals, such as public blockchain data structures (blocks, transactions, addresses), UTXO vs account-based models, and on-chain data ingestion and normalization
Ability to work effectively in a data-heavy, problem-driven environment
Strong English communication skills, both written and spoken
Working proficiency in Chinese to collaborate with regional stakeholders
Experience at blockchain analytics, crypto compliance, or fintech companies
Hands-on experience with graph-based systems, including address clustering, wallet attribution, entity resolution, and transaction graph traversal
Familiarity with clustering algorithms (heuristic, rule-based, or ML-assisted) applied to real-world datasets
Experience with big data frameworks such as Spark or Flink
Exposure to AML, sanctions screening, risk scoring, or compliance-related systems
Experience building or operating distributed systems at scale
Familiarity with Docker, Kubernetes, and cloud-native architectures

Why Binance

• Shape the future with the world’s leading blockchain ecosystem

• Collaborate with world-class talent in a user-centric global organization with a flat structure

• Tackle unique, fast-paced projects with autonomy in an innovative environment

• Thrive in a results-driven workplace with opportunities for career growth and continuous learning

• Competitive salary and company benefits

• Work-from-home arrangement (the arrangement may vary depending on the work nature of the business team)

Binance is committed to being an equal opportunity employer. We believe that having a diverse workforce is fundamental to our success.

By submitting a job application, you confirm that you have read and agree to our Candidate Privacy Notice.

We may use artificial intelligence (AI) tools to support parts of the hiring process, such as reviewing applications, analyzing resumes, or assessing responses. These tools assist our recruitment team but do not replace human judgment. Final hiring decisions are ultimately made by humans. If you would like more information about how your data is processed, please contact us."
