Job ID,Job Title,Company,Detail URL,Posted Label,Hours Old,Posted Datetime (Local),Location,Category,Work Type,Salary,Ad Text
90149025,Senior Business Analyst,K&S Freighters,https://www.seek.com.au/job/90149025?type=standard&ref=search-standalone&origin=jobCard#sol=63103de1907e4932682afbbb8e5b11a044b4fa89,3h ago,3.0,2026-02-05T03:00:00+00:00,"Truganina, Melbourne VIC","Road Transport (Manufacturing, Transport & Logistics)",Full time,Competitive salary commensurate with experience,"Why join us:

Competitive salary designed to grow with your career
Employee Assistance Program - Including Financial Wellness
Novated Car Lease option
Paid parental leave
Corporate Health Plan Discount
Salary Sacrifice
Employee Recognition and Rewards Program
Salary Sacrifice

Our Company:

K&S Corporation is an ASX-listed company and has provided transport, logistics, energy, and dangerous goods services since 1945. Now one of Australia and New Zealand's largest multi-modal providers with 80 locations and 1800 employees, our brand is known for innovation, customer focus, safety and continuous improvement.

About the role:

We are on the lookout for a dynamic and driven Senior Business Analyst who will join our IT team and drive business transformation by analysing data, defining requirements and design tech solutions that optimizes the processes.

This role will report directly to the Business System Manager and is based full time on site at our Truganina support office, placing you at the heart of our dynamic IT Operations!

Your Mission:

Act as the critical link between transport operations, business stakeholders, and IT delivery teams, ensuring alignment from strategy through execution
Lead end-to-end business analysis across enterprise, digital, and transformation initiatives
Translate complex operational, regulatory, and compliance requirements into clear functional and technical solutions
Drive the adoption of AI-driven insights, intelligent automation, and advanced analytics within transport systems
Facilitate stakeholder workshops, business process mapping, and solution design sessions
Support Agile and hybrid delivery teams throughout development, UAT, deployment, and post-go-live optimisation
Identify and recommend opportunities for process optimisation and efficiency gains using data, AI, and automation
Conduct business reviews to assess current-state performance and identify improvement opportunities
Lead business process re-engineering (BPR) workshops and support the design of future-state processes, policies, and procedures
Develop comprehensive artefacts including business requirements, scope definitions, process models, functional designs, test scenarios, and user training materials
Work closely with developers and delivery teams to ensure solutions are delivered on time, within scope, and aligned to business needs

What you'll bring to the table:

5+ years' experience as a Business Analyst in digital, enterprise or technology-focused environments
Experience within transport, logistics, supply chain, or infrastructure environments
Exposure to AI-enabled solutions, data analytics, or intelligent automation initiatives
Strong understanding of system integrations, APIs, and enterprise data flows
Proven experience working across Agile, DevOps, and SDLC delivery models
Strong analytical and problem-solving skills, with the ability to interpret complex data
Excellent stakeholder engagement and communication skills, including senior leadership
Experience contributing to large-scale, complex programs or transformation initiatives

If you're a collaborative team player with a strong work ethic, a positive attitude, and a passion for seizing every opportunity to make an impact we want to hear from you.!

Ready to apply? Use the link today! If you have any questions, simply text us at 0491258572 with your availability and we'll get back to you at a time that suits you best!

To uphold our core value of ""Everybody Safe Everyday"" a pre-employment medical and police check will be required to be successful in this role.

We foster a warm supportive culture grounded in our values: Safety, Customer Service, People and Community and Innovation."
90148834,Senior Pricing Advisor,Suncorp,https://www.seek.com.au/job/90148834?type=standard&ref=search-standalone&origin=jobCard#sol=476f66d460991b255167a20504cadc9671c111db,3h ago,3.0,2026-02-05T03:00:00+00:00,Sydney NSW (Hybrid),Other (Insurance & Superannuation),Full time,Attractive salary + bonus + great benefits,"Collaborate with Commercial and Consumer Pricing Managers to deliver business objectives
Provide technical support on model methodologies and their implementation
Sydney OR Melbourne CBD location – hybrid office/ work from home
Permanent role

The purpose of the Senior Pricing Advisor role is to execute business modelling for pricing initiatives in SME Packages, Commercial Motor, Residential Strata, and consulting projects. The role also involves proposing, developing, and actioning pricing insights to enable SME Packages, Commercial Motor and Residential Strata products to achieve financial targets.

What you’ll do:

Lead communication with key stakeholders and lead/mentor junior members of the team in their analytical work and career development
Develop pricing recommendations and proposals designed to closely align pricing strategy to each of the brand’s budgets and implement price changes timely and accurately within the business/function
Execute commercial data capability by maintaining existing Commercial pricing infrastructure as well as supporting the build of modelling ready datasets
Lead pricing and senior pricing analysts to model products and covers within SME/CI Motor/Strata as other members focus on BAU deliverables  
Lead pricing initiatives to explore, develop both internal and external data/modelling capabilities.

What you’ll bring:

Minimum of 5 years of relevant experience, preferably in the General Insurance industry
Proven ability to lead and engage team members to achieve individual, team and divisional goals
Strong knowledge of GI products and pricing of key business drivers
Strong knowledge of business modelling – GLMs, GBMs and other machine learning techniques
Advanced analytical skills, ability to develop solutions and courses of action by using an information base to identify key issues, compare with other data and determine cause effect relationships.

What we can offer you

Discounts of up to 25% on our various Insurance products
Flexible working environment and arrangements; genuine focus on work-life balance
Numerous discounts with our corporate partners (retail & shopping / travel & holiday / health & wellbeing)
We offer support and various programs for our people: (Employee Assistance Program (EAP), Referral Program ($600), Facilities for nursing mothers, Years of Service Recognition)

Employee benefits | Suncorp Group

If this opportunity sounds like the challenge you have been looking for please apply online today or for more information please contact Annette_frasca@suncorp.com.au

At Suncorp we build inclusion by providing an environment where everyone can be themselves and feel valued, involved and respected for their perspectives and contribution.

We believe we are at our best when our workforce is as diverse, talented and passionate as the communities in which we live and operate, and where our people feel included, valued and connected. We are passionate about inspiring our people by creating a diverse, accessible, and inclusive culture, offering flexible work, career development and internal mobility, and building connected relationships amongst our team members and with our customers.

If you require any support and adjustments to participate equitably in our recruitment process or in the workplace, we encourage you to contact Annette_frasca@suncorp.com.au for a confidential conversation."
90148834,Senior Pricing Advisor,Suncorp,https://www.seek.com.au/job/90148834?type=standard&ref=search-standalone&origin=jobCard#sol=f240a5b5985f7f9cfcefa5a7121f55b98244e7e9,3h ago,3.0,2026-02-05T03:00:00+00:00,Sydney NSW (Hybrid),Other (Insurance & Superannuation),Full time,Attractive salary + bonus + great benefits,"Collaborate with Commercial and Consumer Pricing Managers to deliver business objectives
Provide technical support on model methodologies and their implementation
Sydney OR Melbourne CBD location – hybrid office/ work from home
Permanent role

The purpose of the Senior Pricing Advisor role is to execute business modelling for pricing initiatives in SME Packages, Commercial Motor, Residential Strata, and consulting projects. The role also involves proposing, developing, and actioning pricing insights to enable SME Packages, Commercial Motor and Residential Strata products to achieve financial targets.

What you’ll do:

Lead communication with key stakeholders and lead/mentor junior members of the team in their analytical work and career development
Develop pricing recommendations and proposals designed to closely align pricing strategy to each of the brand’s budgets and implement price changes timely and accurately within the business/function
Execute commercial data capability by maintaining existing Commercial pricing infrastructure as well as supporting the build of modelling ready datasets
Lead pricing and senior pricing analysts to model products and covers within SME/CI Motor/Strata as other members focus on BAU deliverables  
Lead pricing initiatives to explore, develop both internal and external data/modelling capabilities.

What you’ll bring:

Minimum of 5 years of relevant experience, preferably in the General Insurance industry
Proven ability to lead and engage team members to achieve individual, team and divisional goals
Strong knowledge of GI products and pricing of key business drivers
Strong knowledge of business modelling – GLMs, GBMs and other machine learning techniques
Advanced analytical skills, ability to develop solutions and courses of action by using an information base to identify key issues, compare with other data and determine cause effect relationships.

What we can offer you

Discounts of up to 25% on our various Insurance products
Flexible working environment and arrangements; genuine focus on work-life balance
Numerous discounts with our corporate partners (retail & shopping / travel & holiday / health & wellbeing)
We offer support and various programs for our people: (Employee Assistance Program (EAP), Referral Program ($600), Facilities for nursing mothers, Years of Service Recognition)

Employee benefits | Suncorp Group

If this opportunity sounds like the challenge you have been looking for please apply online today or for more information please contact Annette_frasca@suncorp.com.au

At Suncorp we build inclusion by providing an environment where everyone can be themselves and feel valued, involved and respected for their perspectives and contribution.

We believe we are at our best when our workforce is as diverse, talented and passionate as the communities in which we live and operate, and where our people feel included, valued and connected. We are passionate about inspiring our people by creating a diverse, accessible, and inclusive culture, offering flexible work, career development and internal mobility, and building connected relationships amongst our team members and with our customers.

If you require any support and adjustments to participate equitably in our recruitment process or in the workplace, we encourage you to contact Annette_frasca@suncorp.com.au for a confidential conversation."
90148285,Data Analyst & Reports Developer | Tableau & PowerBI,Profusion PAC Pty Ltd,https://www.seek.com.au/job/90148285?type=standard&ref=search-standalone&origin=jobCard#sol=1403e9ab04899c4eafb63a5916b35f3d8aa1b160,3h ago,3.0,2026-02-05T03:00:00+00:00,Melbourne VIC (Hybrid),Database Development & Administration (Information & Communication Technology),Contract/Temp,Daily Rate on a 12-Month Contract,"About the Company

Our client is a leading organisation in the Financial Services sector undergoing a period of reporting transformation. With a supportive analytics leadership team and growing demand for insightful, high‑quality reporting, they are now looking for a Data Analyst & Reports Developer to join their team.

About the Role

This is a hands‑on data analysis & reports development role and stakeholder‑facing role, ideal for someone who enjoys solving business problems and bring both Tableau and Power BI experience.

You will sit between the business and technical teams, ensuring clear requirements, high‑quality delivery, and meaningful insights. You will contribute to both ongoing reporting needs and strategic uplift initiatives.
Contribute to both strategic reporting initiatives and tactical BAU deliverables.
Develop dashboards and data models in both Tableau and Power BI.
Write and maintain SQL queries, perform data validation, and apply sound data‑modelling techniques.
Act as a trusted partner between business and technology teams, ensuring clear communication and successful delivery.
 
Skills & Experience Required

Strong experience in both Tableau and Power BI (essential).
Solid SQL skills, including writing queries, validating data and building data models, and experienced in building data pipelines would be highly regarded.
Demonstrated ability to work directly with business stakeholders: confident, clear, and able to shape requirements.
Experience building reporting solutions that solve real business problems.
Comfortable working through ambiguity, particularly during technology transition phases.
Open‑minded, collaborative, and willing to adopt new approaches (ideal for someone without rigid, “fixed” ways of working).
Financial Services industry experience is highly desirable.


What's on Offer
An immediate 12 months' contract opportunity with potential of extension. A unique opportunity to influence a major platform decision.
A hybrid working model balancing 3 days in the office with 2 days at home.
Excellent exposure to both reporting operations and long‑term strategic uplift.
Supportive leadership and strong professional development environment.

Click on the ‘APPLY’ button or contact Angela Tan Jenkin on angela.jenkin@profusiongroup.com 

We are committed to providing a supportive culture and positively contributing towards creating diverse and inclusive workplaces for our candidates & clients. We invite candidates of all ages, genders, sexual orientation, cultural backgrounds, people with disability, neurodiverse individuals, and Indigenous Australians to apply."
90148047,Analytics Engineer,LEAP,https://www.seek.com.au/job/90148047?type=standard&ref=search-standalone&origin=jobCard#sol=3c146c0bee8e28f1b2620859d92584584d0f478f,3h ago,3.0,2026-02-05T03:00:00+00:00,Sydney NSW (Hybrid),Other (Engineering),Full time,,"About LEAP

LEAP is the leading provider of Legal Practice Management Solutions in the world and is part of ATI – one of the largest international LegalTech companies. For more than 30 years, our curiosity and commitment to continual improvement has kept us reimagining productivity tools for lawyers and their staff to support our guiding purpose, to ‘Help lawyers who help people’. The market-leading software we develop, and support is used by more than 70,000 lawyers and their staff in small and medium-sized law firms.

Working alongside our international team of passionate high achievers, you’ll join a fast-growing technology business where things seldom stay the same for long. With more than 800 smart, caring and ambitious ‘LEAPsters’ working together across Australia, Canada, the United States, the United Kingdom, the Republic of Ireland, Poland and New Zealand, you’ll find yourself in good company here.

Meet the Global Business Systems team

We’re a fast growing business built on a foundation of cutting edge technology and our Global Business Systems Teams are the sharp minds and steady hands keeping us running smoothly and making sure we’re always one step ahead. 

Whether you’re keeping user’s technology up to date, using analytics to solve complex business problems, or digitising processes to improve the ways we work, our technology specialists are the forward thinking experts keeping the engine of our continued success running – and the success of our clients too.  

If you’re a tech-savvy critical thinker with big ambitions and a passion to make an impact, you’ll discover not just a fulfilling career, but the opportunity to redefine the world of LegalTech. 

What you'll do

As our newest Analytics Engineer, you’ll be designing and scaling LEAP’s new enterprise data platform and semantic layer - the foundation for consistent metrics, AI enablement, and trusted insights that guide decisions across Executive, Product, Marketing, and Finance. This is a hands-on, engineering-focused role where you’ll partner closely with our BI Manager and Insight Analyst to ensure that metrics are standardised and data is accessible, trustworthy, and ready for both dashboards and advanced analytics. 

To make this happen, you will:

Build and maintain scalable, governed data models in dbt/Snowflake that power cross-functional reporting and advanced analytics. 
Develop and extend the universal semantic layer, ensuring metrics are consistent, reusable, and ready for both BI and AI applications. 
Structure high-quality, well-documented data assets that serve as the knowledge base for AI agents, predictive analytics, and self-service BI. 
Optimise and manage data pipelines (Fivetran/dbt) for reliability, performance and incremental refresh. 
Collaborate with the Data & Insights Analysts to translate the Metrics That Matter, a unified KPI framework across functions, into scalable, governed data models within the semantic layer. 
Ensure data quality and trust through testing, monitoring, and documentation.  

What you'll bring

Proficiency in SQL and modern data modelling (dbt preferred). 
Hands-on experience with Snowflake (or other cloud data warehouses). 
Familiarity with Fivetran (or similar ELT tools). 
Proven ability to design reusable, scalable data models that drive business outcomes. 
Experience integrating multiple data sources (Salesforce, Zuora, product usage, financial systems). 
Proactive, detail-oriented, and able to balance speed with governance. 
Experience with version control systems (Git preferred) and familiarity with CI/CD practices. 

Consider it a bonus if you have: 

Exposure to BI/visualisation tools (Tableau, Power BI, or similar). 
Experience with Python for data processing or automation. 
Interest in AI/ML integration (no need to be an expert yet). 

You are the type of person who

Has a collaborative, proactive mindset and you’re comfortable working in a fast-paced, evolving environment. 
Has strong communication skills, able to translate technical concepts into business outcomes. 
Is a self-starter attitude with a willingness to learn, experiment, and take ownership of tasks. 
Is a team player who understands that diverse opinions make a team and the benefit of achieving goals and decisions together. 
Is curious - you're not afraid to ask questions, explore and share your thoughts and ideas.  

LEAP is an inclusive, people-first company committed to breaking down institutional barriers that keep people from reaching their potential. If you meet some, but not all the requirements above, we encourage you to still submit your application.

Why join LEAP?

Your work matters. Helping lawyers help people sits at the heart of everything we do. We solve real world problems that improve and support local, everyday law firms. So they can do their best work for the people in the communities they serve.
Make an impact. You won’t be another ‘cog in the wheel’ here. We give full trust and autonomy for you to be heard, to work on big & complex projects – and to make a real difference.
Work with a group of authentic, passionate people who love what they do.
Well-funded and global. LEAP is the leading provider of Legal Practice Productivity Solutions across Australia, Canada, the United States, the United Kingdom, the Republic of Ireland and New Zealand. We're part of ATI – one of the largest international LegalTech companies.
Flexible and hybrid working. We'd like to find this person in Sydney, but we want you to work in a way that suits you and we're open to flexible arrangements that support you.
Grow your career with us. Our founder Christian Beck has been building legal tech businesses for over 30 years. There are opportunities galore to expand your career based on where your interests lie. We're not afraid to pivot based on market conditions - you will always have the opportunity to stay ahead of the curve and do your best work here.
Have fun with us. Celebrations. Socials. Sports teams. Access to sailing and yacht events.
We value your well-being - enjoy an additional paid wellbeing day every year, free gym membership, corporate dental plan and monthly massages in the office. We'll throw in a catered lunch and breakfast every week too. Oh and an on-site barista.
Access to LEAP Home - a program unique to LEAP to support you in buying your primary residence. 

#LI-MB1"
