Job ID,Job Title,Company,Detail URL,Posted Label,Hours Old,Posted Datetime (Local),Location,Category,Work Type,Salary,Ad Text
89186536,Senior Analyst - Defence Strategy,Australian Strategic Policy Institute,https://www.seek.com.au/job/89186536?type=standard&ref=search-standalone&origin=jobCard#sol=1197b2b19ec54c701a3a67f79e21502cb7639eb3,7h ago,7.0,2025-12-17T00:00:00+00:00,"Barton, Canberra ACT",Analysts (Consulting & Strategy),Full time,,"Senior Analyst – Defence Strategy




About the Role

The Defence Strategy Program is seeking an experienced Senior Analyst capable of producing influential research and briefing senior policymakers, who has recognised subject-matter expertise and a credible reputation.  The Senior Analyst will conduct rigorous research and analysis and contribute to ASPI events that enhance contestable advice to government and contribute to public debate and understanding of defence and strategic affairs. The successful candidate will lead independent research, produce high-impact analysis, and engage with government, industry, and international partners on key strategic issues shaping Australia’s security environment. The Senior Analyst will shape the institute’s defence research agenda, focusing on matters related to U.S.–allied/partner cooperation, Southeast Asia geopolitics, regional security architecture, deterrence and denial concepts, maritime security, China and the PLA, defence industry policy and economics, defence capability, force posture, force design, and joint operations and planning.

Duty Statement

·         Conduct original research resulting in evidence-based analysis, to include development of policy-relevant recommendations for high-impact publications.

·         Manage major research projects, overseeing timelines, budgets, and ensuring the delivery of high-quality outputs, to include commissioned publications.

·         Publish timely analysis in response to significant regional or global events, to include media engagement activities (social media, responding to media inquiries) as agreed to with senior staff.

·         Provide authoritative strategic advice and policy recommendations to senior leadership within domestic and foreign government agencies and external stakeholders.

·         Represent ASPI as a speaker or moderator at forums, conferences, and briefings.

·         Deliver or contribute to impactful events from conception to execution.

·         Cultivate and maintain strong relationships with a wide range of stakeholders, representing ASPI's expertise and promoting its work.

·         Mentor junior analysts and Defence Fellows.

·         Build networks with domestic and international governments, militaries, industry, academia and think tanks.

·         Contribute strategically to ASPI's forward research agenda.

 

Selection Criteria

Essential:

·         Advanced Research, Analytical and Writing Skills: Ability to design and execute complex research methodologies, critically analyse information from diverse sources, and develop evidence-based conclusions. Strong writing skills and an existing publication track record.

·         Strategic Thinking: Capacity to understand the broader strategic context, identify emerging trends, communicate complex concepts clearly, and develop forward-looking, actionable policy recommendations.

·         Policy Analysis and Development: Expertise in analysing existing policies, identifying gaps, and developing innovative, constructive and practical policy solutions.

·         Project Management: Proven ability to manage complex research or event projects, including planning, resource allocation, risk assessment, and stakeholder management. An ability to work independently and manage multiple projects and requirements beyond research.

·         Subject Matter Expertise: At least 10+ years’ experience working on defence and security matters working in or alongside government or military, industry, think tanks or academic institutions.

Desirable:

·         Experience working in government, preferably in Defence, DFAT, ADF, Intelligence Community, or an allied or partner government or as an academic with demonstrated expertise in Australian defence matters.

·         Evidence of published analysis or research in reputable outlets on relevant defence topics.

·         Experience sourcing and writing funding/grant proposals.

·         Organise public events, closed-door roundtables, and expert workshops.

·         Postgraduate qualifications, Master’s or PhD, in a relevant field (e.g., International Relations, Security Studies, Political Science, Defence Studies, Economics, or similar).

 

About ASPI

The Australian Strategic Policy Institute (ASPI) is an independent, non-partisan think tank that produces expert and timely advice for political, strategic and security leaders in Australia and the Indo-Pacific region.

ASPI was established by the Australian Government in 2001 to provide independent advice on Defence and strategic issues. ASPI’s Charter, which guides all our work, explains the government’s aims in establishing ASPI as:  

·         Improving the quality of policy advice received by government by providing contestability. 

·         Nourishing public debate and understanding of Defence and strategic affairs.  

·         Developing professional strategic policy expertise in Australia.  

ASPI’s Defence Strategy Program analyses how Australia defends its national interests in an era of intensifying strategic competition. Our research focuses on three areas: Australia’s security environment and regional partnerships; developing military strategy, deterrence and denial concepts, and future force design; and strengthening the defence industrial base, supply chains, and economic resilience. Together, these efforts provide government, industry, and the public with evidence‑based insights to enhance Australia’s defence and security.

ASPI Values

·         Independent – Conducting impartial, balanced, and objective analysis;

·         Rigorous – Applying structured research methods and evidence-based reasoning;

·         Innovative – Bringing fresh thinking to emerging security challenges;

·         Engaging – Communicating ideas clearly and collaborating respectfully;

·         Collegial – Contributing to a professional, inclusive, and respectful work culture;

·         Impactful – Supporting outcomes that influence policy and public debate.

      

How to Apply

1.       Please refer to the position description attached.

2.       All applications should be submitted to jobs@aspi.org.au including the following documents:

·         Cover letter (addressing the Position Description and selection criteria) not to exceed three pages.

·         Resume/CV including two current referee contact details.

ASPI promotes a workplace that actively seeks to include, welcome and values unique contributions of all people. The Institute strongly encourages women and people from diverse cultural backgrounds including applicants from Aboriginal and Torres Strait Islander backgrounds to apply.

Preference will be given to Australian citizens or residents, but ASPI will consider visa sponsorship for exceptional international candidates.

The closing date for applications is Thursday, 29 January 2026."
89186368,"Manager, Aviation Commercial",Sydney Airport Corporation Limited,https://www.seek.com.au/job/89186368?type=standard&ref=search-standalone&origin=jobCard#sol=807f89603afb39ad419f5d167e6c9d5d734516bc,7h ago,7.0,2025-12-17T00:00:00+00:00,"Mascot, Sydney NSW (Hybrid)",Analysts (Consulting & Strategy),Contract/Temp,,"Company Description

MAKE IT AMAZING

At Sydney Airport, the future of air travel is shaped by you.

As a team, we connect the world. More than just a hub of activity and boundless energy, we’re creating a destination of amazing experiences. Like seeing wonderful moments unfold in front of you, knowing “I made that possible!”.

Dynamic. Fast-paced. We thrive in a place where fresh challenges land daily. Backed by positive and supportive team players and inspiring leaders, we adapt to change. Driven to grow. Owning every action. To do things better.

As smart, problem-solvers, we are always learning and growing. And that’s easier to do alongside passionate experts, as we collaborate across teams readily sharing our knowledge.

Each day is a new journey, as we bring an exciting vision to life. With significant capital investment in new, improved infrastructure, there’s never been a better time to expand your potential at Sydney Airport. The range of responsibilities and diverse pathways you can take on with us, are surprising.

We are SYD. United in the pride that comes with welcoming the world at Australia’s premier gateway.

Job Description

About the team

This role sits within our Aviation Growth & Group Strategy function, one of the key contributors to value creation at Sydney Airport. You will be part of a team focused on shaping the future revenue trajectory for Sydney Airport through innovative aviation products, compelling propositions for airline partners and data‑driven insights. 

About the role

You’ll sponsor and support the development and commercialisation of aviation products and services, combining strategic commercial work with hands‑on analytics. Day‑to‑day, you will:

Develop proposals and pitch materials for airline partnerships, backed by rigorous analysis of performance, demand, capacity and pricing. 
Build full business cases and materials to support approvals (LT, IC, Board) across the initiative lifecycle. 
Work closely with stakeholders across the airport - including Operations, Finance, Planning & Delivery, Government Relations, Sustainability and Legal - to drive outcomes. 
Interrogate large datasets to uncover insights, forecast capacity and performance, and inform strategy recommendations for the Aviation Commercial team. 
Collaborate with external consultants and airline contacts, building strong relationships and an understanding of commercial drivers and propensity to pay. 

Please note this is a 7 month fixed term contract. Applications will be reviwed early January 2026.

About you

You thrive in complex, dynamic environments and are comfortable balancing strategic thinking with deep analytical work. 

Degree‑qualified in data analytics, business, economics or finance (or similar). 
5+ years’ experience in commercial/strategic analytics (management consulting or advisory a plus); aviation or infrastructure exposure is advantageous. 
Advanced Excel; strong ability to structure insights in PowerPoint and concise written formats. 
Proven stakeholder management and influencing skills, with a clear and confident communication style across senior audiences. 
Highly organised, detail‑oriented and self‑driven, with the ability to manage competing priorities and deliver under time pressure.


What we offer

To find out more about the amazing work environment here at SYD, be sure to check out the Join us section of Sydney Airport’s website, where you can also see more about our flexible culture and work practices, alongside our other Employee benefits, or take a look at our LinkedIn Sydney Airport: Life page.

Make it Amazing

SYD is an Equal Opportunity Employer and encourages all suitably qualified applicants to apply, including First Nations Australians, and people from culturally diverse backgrounds."
89186226,Digital Business Transformation Project Manager,ACCESSEAP,https://www.seek.com.au/job/89186226?type=standard&ref=search-standalone&origin=jobCard#sol=6b459b2f823182aa992e9f6e4d9a34b263621dee,7h ago,7.0,2025-12-17T00:00:00+00:00,Sydney NSW (Hybrid),Strategy & Planning (Consulting & Strategy),Contract/Temp,,"AccessEAP is an Australian-owned, not-for-profit organisation with over 30 years of experience in the Employee Assistance Program (EAP) industry. As one of the founding members of the sector, we’re proud to have helped shape best practice across a broad range of industries.

Our mission since 1989 has been to improve workplace wellbeing and support Australians’ mental health. We provide services such as EAP counselling, critical incident response, onsite and remote support, psychosocial risk management, and tailored wellbeing consultation to help individuals and organisations thrive.

We are looking for a Digital Innovator to lead our business transformation. Reporting to the CEO, step into a pivotal role where you’ll drive the delivery of digital transformation initiatives that align with our business objectives.

This is a 12 month maximum term contract. Applications close 5 January 2026 and won't be reviewed until this time.

Key Responsibilities

Lead Digital Transformation: Plan, execute, and deliver technology initiatives on time and within budget.

Change Management: Drive adoption of new tools and processes, design training programs, and create user-friendly resources.

Executive & Stakeholder Engagement: Align projects with organisational strategy, provide updates to leadership, and manage expectations across teams.

Project Governance: Manage sprints, workflows, milestones, and compliance with governance standards.

Budget & Resource Management: Maintain financial discipline and optimise resource allocation.

Technical Oversight: Use Azure DevOps/Jira for tracking; collaborate with development and QA teams to meet UAT standards.

Risk & Quality Management: Identify risks, implement QA processes, and ensure continuous improvement.

What We’re Looking For

Tertiary qualifications in Project Management, IT, or Business.

PMP, PRINCE2, Agile/Scrum highly regarded.

Proven track record in managing complex digital transformation projects.

Exposure to C#, .NET, Angular desirable.

Strong stakeholder engagement, change management, and communication skills.

Proficiency in Azure DevOps or Jira.

Collaborative, solution-oriented, and results-driven with high professionalism and confidentiality.

Experience in the Mental Health industry highly regarded."
89185716,Lead Data Engineer,HorizonOne Recruitment,https://www.seek.com.au/job/89185716?type=standard&ref=search-standalone&origin=jobCard#sol=c39b2acc2ebe264b74d7fe6acf263a43a64b09a8,8h ago,8.0,2025-12-16T23:00:00+00:00,Canberra ACT,Government - Federal (Government & Defence),Full time,,"This role sits within a national security agency that plays a key role in Australia’s National Intelligence Community.

The agency operates at the intersection of data, technology and operational intelligence, integrating vast, complex data sets to support real-world investigations and high-impact decision-making.
 
The work directly enables operational analytics used to disrupt serious and organised crime, financial crime and national security threats.
 
The Opportunity

You will join a small, highly technical team building a data collection and integration hub that enables secure data sharing across internal platforms and trusted external partners.

This is a hands-on Senior Data Engineer role focused on API design, data integration and scalable architecture, with your work directly consumed by operational and intelligence teams.

Work on mission-critical systems supporting operational intelligence
Design and own APIs that connect large, sensitive data sets
Modern data stack, strong engineering standards, and real technical depth
The Role

This role blends data engineering with software API engineering, with API and integration work accounting for around 30–50% of the role.

You will:

Design, build and manage RESTful APIs, including gateways, authentication and secure access
Develop data integration pipelines to ingest large, complex data sets from internal and external sources
Work with big data frameworks and Python/SQL to process and prepare data for operational use
Collaborate with software engineers and architects to embed APIs into mission-critical systems
Contribute to scalable technical design, engineering standards and CI/CD practices
 
The Ideal Person

You are a senior data engineer with 5+ years’ experience working in complex, highly regulated environments and are motivated by work that has a clear operational impact.
 
You bring strong hands-on experience across API engineering (REST, integrations, gateways) alongside core data engineering skills using Python, SQL and modern big data frameworks.

You likely have experience within the national security, intelligence, Defence, ATO, consulting or major financial institutions. Experience with Palantir Foundry would be well-regarded but is not essential.
 
Due to the nature of the work, Australian Citizenship and an active NV1 clearance is mandatory.
 
Salary / Rate

This is a full-time contract commencing in February for an initial 6 month (into the next financial year) with likely 2x 3-month extensions.

A rate is not listed; however, my estimation range; however, it would be $135/hr- $160/hr based on skills and experience.
 
How to Apply

To apply online, please click on the appropriate link.
 
Alternatively, for a confidential discussion, please contact Lucas Walker on 0483 911 561 quoting ref no. 21219
 
HorizonOne is committed to building a diverse and inclusive workforce and we encourage applications from people of all cultures, capabilities and backgrounds."
89185461,"Director, Commercial Payments Practice Lead, Visa Consulting & Analytics",Visa,https://www.seek.com.au/job/89185461?type=standard&ref=search-standalone&origin=jobCard#sol=741699d3948cfc9aa93efa2513656ff1676849f4,8h ago,8.0,2025-12-16T23:00:00+00:00,Sydney NSW (Hybrid),Strategy & Planning (Consulting & Strategy),Full time,,"Company Description


Visa is a world leader in payments and technology, with over 259 billion payments transactions flowing safely between consumers, merchants, financial institutions, and government entities in more than 200 countries and territories each year. Our mission is to connect the world through the most innovative, convenient, reliable, and secure payments network, enabling individuals, businesses, and economies to thrive while driven by a common purpose – to uplift everyone, everywhere by being the best way to pay and be paid.

Make an impact with a purpose-driven industry leader. Join us today and experience Life at Visa.

Job Description


Team Summary

Visa Consulting & Analytics (VCA) is Visa's consulting division, serving Visa's clients (including card issuers, acquirers, and merchants) and solving their strategic problems focused on improving performance and profitability.  Drawing on our expertise in strategy consulting, payments, data analytics, marketing, operational and macroeconomics, VCA drives high impact and tangible financial results.

The VCA team within Australia provides a comprehensive range of consulting services and solutions to our clients in Australia and New Zealand, that address unique challenges in areas such as strategic growth, profitability, risk management and digital strategy.        

The Role

We are currently looking for a Director to lead VCA’s Commercial Payments Practice for the AuNZPI region. The Commercial Payments Practice supports our clients to create and launch market-leading business payments solutions, derive greater value from the active management of their existing business cards portfolios, and identify new strategic growth opportunities. 

As the Practice lead, the Director will be responsible for growing the Commerical Payments Practice through business development, leading and delivering consulting engagements, and developing new solutions to continuously enhance and diversify the Practice’s client offerings.

In this role, the Director will lead a small team of consultants and collaborate with cross-functional experts across Visa’s business to jointly develop client proposals, participate in client sales activities and ensure client engagements are delivered with excellence. The full range of responsibilities are detailed below:

Responsibilities

On a project-by-project basis:

Prepare client project proposals, clarifying objectives, scope, deliverables, approach, dependencies, roles and responsibilities, draw input from clients, local client relationship managers and functional teams.
Oversee project setup including contracting documentation, stakeholder engagement, interview guides and client data requirements.
Develop a fact base by undertaking client interviews, collecting and analysing inputs such as client data, process flows, policies, competitive, industry and environmental information.
Analyse Visa and client data to conduct benchmarking, identify performance gaps and improvement opportunities.
Collaborate with data science team members to leverage data analytics capabilities
Manage execution of one or more project engagements, building client relationships, utilising governance frameworks and mitigating or resolving complex problems that emerge.
Identify solutions and recommendations that address client objectives and result in performance improvement, leverage relevant VCA methodologies, frameworks and global best practices.
Design and deliver compelling presentations to illustrate findings, ideas, recommendations within consulting engagements and more broadly and at times support implementation at the client onsite.

More generally:

Identify and surface opportunities for client projects.
Create, develop and maintain VCA IP and consulting offerings.
Continuously build knowledge, surface new insights and produce thought leadership pieces that contribute to practice development and global best practice.

This is a hybrid position. Expectation of days in office will be confirmed by your hiring manager. This role can be based in either Sydney or Melbourne.

Qualifications


Having already accumulated a variety of experience, you will be familiar with the payments industry and keen to work alongside an experienced team in gaining a deeper understanding. You will be client driven, comfortable managing a project end to end and relishing the opportunity to work closely with clients to influence their future performance.

Specific skills and experience you may bring are:

10+ years in consulting, business management or product management.
Deep experience in strategy consulting.
Deep experience in SMB or Corporate banking and / or payments solutions.
Deep experience in product P&L or portfolio management.
Superior analytical and problem solving skills, with demonstrated intellectual and analytical rigor.
Strong team orientation with a collaborative, diplomatic, and flexible style and be able to work effectively in a matrixed organisation.
Excellent detail orientation, ensuring the highest level of quality and rigour in reports and data analysis.
Excellent presentation skills, including strong oral and written capabilities.
Self-motivated, results-oriented individual with the ability to progress multiple priorities concurrently.
Experience in and passion for the power of analytics to inform and drive strategy and tactics, and proven ability to generate insights from data.
Strong commercial acumen, with experience in working on business cases that prove ROI.

Additional Information


Visa is an EEO Employer. Qualified applicants will receive consideration for employment without regard to race, color, religion, sex, national origin, sexual orientation, gender identity, disability or protected veteran status. Visa will also consider for employment qualified applicants with criminal histories in a manner consistent with EEOC guidelines and applicable local law."
