Job ID,Job Title,Company,Detail URL,Posted Label,Hours Old,Posted Datetime (Local),Location,Category,Work Type,Salary,Ad Text
87803461,Commercial Analyst,Perigon Group Pty Limited,https://www.seek.com.au/job/87803461?type=standard&ref=search-standalone&origin=jobCard#sol=c9d68691084e638d1fe75f3e56b5d62f4dd8e69a,3h ago,3.0,2025-10-12T19:00:00+00:00,Sydney NSW (Hybrid),Analysis & Reporting (Accounting),Full time,$110-125K plus super,"This is an excellent opportunity for an energetic, dynamic Commercial Analyst to join a successful, Aussie company.

Reporting into the CFO you'll act as a business partner to operational stakeholders, providing commercial, financial & analytical support, to help drive decisions & business performance.

Your analytical scope will encompass areas such as category sales, discounting, gross margins, pre & post promotional analysis and wages. You'll create financial models in order to provide meaningful insights into business performance issues, challenging decisions where necessary.

You'll also prepare and distribute weekly & monthly reports, with associated commentary, for use by the business. And will hold regular meetings with Category Managers and the Commercial Director, to review monthly sales, margin results etc.

Additionally, you'll play a key role in business planning for new stores, budgeting, forecasting and other ad hoc analysis when required.

You are an up-and-coming Financial or Commercial Analyst, with recent, extensive experience in a similar role. 

You'll have proven analytical skills, combined with a background in business partnering. You will also have advanced Excel / modelling skills, whilst experience using a BI tool such as TM1 will be well regarded.

For more information, please contact Schenuk Wijesekera on 02 9775 5916. Or to apply, hit the ""apply"" button."
87803427,Financial Analyst,Perigon Group Pty Limited,https://www.seek.com.au/job/87803427?type=standard&ref=search-standalone&origin=jobCard#sol=24cf99f64bf9e965ea6a8572bf9e01559f69b67c,3h ago,3.0,2025-10-12T19:00:00+00:00,Sydney NSW (Hybrid),Analysis & Reporting (Accounting),Full time,$110-125K + super,"Our client
We are exclusively partnered with a blue-chip market-leader, recruiting for a Financial Planning Analyst to join their FP&A division and be at the forefront of change for this business.

Reporting into the Financial Planning Manager of this leading globally listed global business, this Financial Analyst role is an amazing opportunity for an up-and-coming FP&A candidate. 

Your remit will include budgeting, forecasting, P&L review, financial modelling and commercial analysis, providing commercial support to department heads, monitoring key performance metrics and other ad hoc analysis.

About you

This role is an excellent role for a Financial Analyst with <3 years experience, or a Financial/Management Accountant with some budgeting/forecasting experience to take on this highly analytical role which will be hands on with implementing and driving change across this large corporate. Strong excel and BI skills is highly regarded.


For more information, please contact Schenuk Wijesekera on 02 9775 5916. Or to apply, hit the ""apply"" button."
87802918,Senior Data Engineer - AWS Cloud,Randstad Digital,https://www.seek.com.au/job/87802918?type=standard&ref=search-standalone&origin=jobCard#sol=ac841de614907775568237b8615b6a6a5147850e,6h ago,6.0,2025-10-12T16:00:00+00:00,Sydney NSW (Hybrid),Other (Information & Communication Technology),Contract/Temp,,"The Opportunity

Are you an expert Senior Data Engineer ready for a high-impact role at a Leading Banking Client in Sydney?

We're seeking a seasoned professional to drive the development of a New Data Analytics Platform leveraging the latest AWS Cloud technologies. This is a critical 12-month contract where your expertise will directly shape the future of data and analytics capabilities.

Contract Details

Duration : 12 Months
Location : Sydney CBD
Work Arrangement : Hybrid
Daily Rate : Excellent rate on offer




Key Responsibilities & Technical Expertise
Essential AWS Services Experience:

We are looking for hands-on, recent experience across a broad range of AWS Data Services:

Orchestration & Compute: Airflow, EMR, StepFunctions

Data Warehousing & Storage: Redshift, S3, Lake Formation

ETL & Integration: Glue, DMS

Messaging & Security: MSK (Kafka), KMS, EventBridge

Infrastructure as Code: CFN/CDK

Advanced Analytics/Governance (Bonus): Sagemaker, Data Zone

Core Programming Proficiency (Non-Negotiable):

Python

PySpark

Advanced SQL

Developed Knowledge/Understanding (Highly Valued):

Deep understanding of event-driven data architecture.

Expertise in traditional data warehouse concepts (Facts/Dims, normalisation).

Solid grasp of SQL / NoSQL data structures.

Experience with Parquet File Format and knowledge of Iceberg.

Proven ability to handle complex file formats and structures efficiently.

Why Apply?

This is a chance to work on a major, greenfield project within a top-tier financial institution, utilising a comprehensive and modern AWS stack. You'll enjoy a competitive daily rate and a balanced hybrid work environment right in the heart of Sydney's CBD.

Ready to lead the way in cloud data innovation? Apply now!

At Randstad, we are passionate about providing equal employment opportunities and embracing diversity to the benefit of all. We actively encourage applications from any background."
