Job ID,Job Title,Company,Detail URL,Posted Label,Hours Old,Posted Datetime (Local),Location,Category,Work Type,Salary,Ad Text
89210416,"Multiple Roles - IT and Cyber Security, Identity and Access Management",Australian Transaction Reports and Analysis Centre (AUSTRAC),https://www.seek.com.au/job/89210416?type=standard&ref=search-standalone&origin=jobCard#sol=585750bdce082827712d55dcde6cf0c83fcf5b4b,3h ago,3.0,2025-12-18T00:00:00+00:00,Canberra ACT (Hybrid),"Security (Information & Communication Technology)
Government - Federal (Government & Defence)",Full time,"$123,799 to $170,488 plus 15.4% super","AUSTRAC, Australia’s financial intelligence agency, is evolving to strengthen its fight against money laundering and terrorism financing. As we expand our regulatory reach and broaden our digital transformation, this introduces new technologies and threats. We are now recruiting several, leadership positions to strengthen the agency's IT and Cyber Security function. These role offers a unique opportunity to help shape cyber security strategy and champion positive security culture across AUSTRAC. We're looking for strategic and people-focussed leaders to lead cross-functional IT teams in navigating an evolving threat landscape. You'll guide cross-functional teams and create an atmosphere where people feel empowered and encouraged to contribute their best ideas. If you embrace challenges diligently, passionate about leading teams in a collaborative environment, and eager to make a meaningful impact we encourage you to apply!

This recruitment process will be used to fill both ongoing and non-ongoing vacancies and build a merit pool for future roles over the next 18 months. 

Director IT Security /IT Security Advisor (ITSA) EL2 

The Director, IT Security / IT Security Advisor (ITSA) leads AUSTRAC’s IT Security function, with direct responsibility for managing a small, high-performing information security team. The ITSA supports the delivery of the agency’s cyber security strategy and ensures that security practices, systems, and advice are continuously improved and aligned with national standards and internal priorities. This position works closely with Executives and governance forums to uplift cyber maturity and deliver secure outcomes across the organisation. 

Key duties include: 

Providing operational leadership to AUSTRAC’s IT Security team, setting direction, allocating priorities, and managing performance to ensure effective delivery of security services, compliance activities, and internal capability uplift.
Providing high-level insights and trusted advice to executive leadership, translating complex cyber policy and risk matters into clear strategic impacts.
Driving the ongoing development and refinement of security risk frameworks. Providing subject matter expertise on risk tolerance, control assurance, and compliance against relevant legislative, audit, and operational requirements.
Representing the agency at inter-agency forums and with external partners, shaping whole-of-government discussions on security policy and aligning standards.

Director Identity and Access Management (IDAM) EL2

The Director Identity & Access Management (IDAM) leads the IDAM function delivering the IDAM roadmap in alignment with AUSTRAC’s Cybersecurity Strategy Roadmap and Implementation Plan. The role provides strategic leadership, technical oversight, and governance across enterprise identity, authentication, and authorisation services to safeguard AUSTRAC’s systems and data.

Key duties include: 

Providing operational leadership to AUSTRAC’s Identity and Access Management Team, 
setting direction, allocating priorities, and managing performance to ensure effective delivery of identity and access management services, compliance activities, and internal capability uplift.
Delivering the IDAM roadmap, milestones, and outcomes per the AUSTRAC Cybersecurity Strategy Roadmap and Implementation Plan, translating strategic objectives into actionable programs and projects with clear success measures, benefits, and risk controls
Implementing and maintaining IDAM controls aligned to ISM/PSPF, Essential Eight, ISO 27001, and applicable privacy obligations including the management of identity related risks, assurance activities, and audit findings while driving continual control uplift, identity threat modelling, and identity detection/response in partnership with Cyber Operations.
Partnering with business owners, product teams, and security stakeholders to embed identity requirements in change initiatives.

Lead Analyst Operational Security EL1

The Lead Analyst, Security Advisory is a key member of the Technology Platforms and Solutions Operational Security team within the Innovation and Technology Solutions (ITS) branch. This position will collaborate with IT, business stakeholders, and senior leadership to ensure that the AUSTRAC ITS branch can meet the security policy requirements and support projects and operational teams in maintaining a strong security posture. 

Key duties include: 

Delivering security analytics, analysis, and audits across a broad range of security data sources.
Maintaining a high awareness of external and insider threats and responding accordingly.
Developing and maintaining Information Security policies, procedures, and other documentation to ensure effective storage, coverage, review, and sign-off.
Leading Information Security projects and initiatives and conducting risk assessments for internal and external systems and applications, ensuring risk is managed accordingly.

For more information about the role and the capabilities where looking for, please refer to the Candidate Pack on the AUSTRAC Careers Page

Affirmative Measures

This vacancy is also being advertised concurrently under both general and affirmative measures recruitment processes.

Applications made under affirmative measures are only available to affirmative measures indigenous applicants or affirmative measures disability applicants.

Evidence will be requested if your application progresses under an affirmative measures process.

Notes

This recruitment process will initially be used to fill a current vacancy and in future, may be used to fill similar positions in the event positions become vacant. The merit pools established from this recruitment process will be valid for 18 months from the date of advertising.

We offer competitive remuneration and great conditions, including:

Annual leave of 4 weeks (20 days) per year + additional paid Christmas close down.

·       Cultural, Ceremonial and NAIDOC leave.

·       18 days of paid personal leave per year.

·       15.4% superannuation, which continues through paid parental leave.

·       18 weeks of paid parental leave.

·       Competitive APS salaries with access to annual salary progression.

·       Study assistance - up to $6,000 per annum and up to 120 hours of study leave.

View the AUSTRAC Enterprise Agreement for more information about current salaries and other conditions of employment.

About Us

AUSTRAC, Australia’s financial intelligence agency and anti-money laundering and terrorism financing regulator, is undergoing a significant transformation to enhance its role in combating money laundering and terrorism financing. This includes proposed expansion of its regulatory regime and a broader digital transformation to support our growing agency. As we embrace these changes and grow, our focus is on fostering innovation, collaboration, and effective problem-solving within an inclusive and supportive work environment. At AUSTRAC, you’ll be part of a team dedicated to maintaining the integrity of Australia’s financial system and making a real impact in preventing financial crime.

Closing Date and further details 

Applications close at 11:30 pm on Sunday 11 January 2026

For enquiries, please contact: ict.recruitment@austrac.gov.au

Please note, we can only accept applications via the AUSTRAC Careers Portal."
89210414,"Multiple Roles - IT and Cyber Security, Identity and Access Management",Australian Transaction Reports and Analysis Centre (AUSTRAC),https://www.seek.com.au/job/89210414?type=standard&ref=search-standalone&origin=jobCard#sol=34e0656bdc2e2cf20d9d3f3f7b21efb85832efdd,3h ago,3.0,2025-12-18T00:00:00+00:00,Melbourne VIC (Hybrid),"Security (Information & Communication Technology)
Government - Federal (Government & Defence)",Full time,"$123,799 to $170,488 plus 15.4% super","AUSTRAC, Australia’s financial intelligence agency, is evolving to strengthen its fight against money laundering and terrorism financing. As we expand our regulatory reach and broaden our digital transformation, this introduces new technologies and threats. We are now recruiting several, leadership positions to strengthen the agency's IT and Cyber Security function. These role offers a unique opportunity to help shape cyber security strategy and champion positive security culture across AUSTRAC. We're looking for strategic and people-focussed leaders to lead cross-functional IT teams in navigating an evolving threat landscape. You'll guide cross-functional teams and create an atmosphere where people feel empowered and encouraged to contribute their best ideas. If you embrace challenges diligently, passionate about leading teams in a collaborative environment, and eager to make a meaningful impact we encourage you to apply!

This recruitment process will be used to fill both ongoing and non-ongoing vacancies and build a merit pool for future roles over the next 18 months. 

Director IT Security /IT Security Advisor (ITSA) EL2 

The Director, IT Security / IT Security Advisor (ITSA) leads AUSTRAC’s IT Security function, with direct responsibility for managing a small, high-performing information security team. The ITSA supports the delivery of the agency’s cyber security strategy and ensures that security practices, systems, and advice are continuously improved and aligned with national standards and internal priorities. This position works closely with Executives and governance forums to uplift cyber maturity and deliver secure outcomes across the organisation. 

Key duties include: 

Providing operational leadership to AUSTRAC’s IT Security team, setting direction, allocating priorities, and managing performance to ensure effective delivery of security services, compliance activities, and internal capability uplift.
Providing high-level insights and trusted advice to executive leadership, translating complex cyber policy and risk matters into clear strategic impacts.
Driving the ongoing development and refinement of security risk frameworks. Providing subject matter expertise on risk tolerance, control assurance, and compliance against relevant legislative, audit, and operational requirements.
Representing the agency at inter-agency forums and with external partners, shaping whole-of-government discussions on security policy and aligning standards.

Director Identity and Access Management (IDAM) EL2

The Director Identity & Access Management (IDAM) leads the IDAM function delivering the IDAM roadmap in alignment with AUSTRAC’s Cybersecurity Strategy Roadmap and Implementation Plan. The role provides strategic leadership, technical oversight, and governance across enterprise identity, authentication, and authorisation services to safeguard AUSTRAC’s systems and data.

Key duties include: 

Providing operational leadership to AUSTRAC’s Identity and Access Management Team, 
setting direction, allocating priorities, and managing performance to ensure effective delivery of identity and access management services, compliance activities, and internal capability uplift.
Delivering the IDAM roadmap, milestones, and outcomes per the AUSTRAC Cybersecurity Strategy Roadmap and Implementation Plan, translating strategic objectives into actionable programs and projects with clear success measures, benefits, and risk controls
Implementing and maintaining IDAM controls aligned to ISM/PSPF, Essential Eight, ISO 27001, and applicable privacy obligations including the management of identity related risks, assurance activities, and audit findings while driving continual control uplift, identity threat modelling, and identity detection/response in partnership with Cyber Operations.
Partnering with business owners, product teams, and security stakeholders to embed identity requirements in change initiatives.

Lead Analyst Operational Security EL1

The Lead Analyst, Security Advisory is a key member of the Technology Platforms and Solutions Operational Security team within the Innovation and Technology Solutions (ITS) branch. This position will collaborate with IT, business stakeholders, and senior leadership to ensure that the AUSTRAC ITS branch can meet the security policy requirements and support projects and operational teams in maintaining a strong security posture. 

Key duties include: 

Delivering security analytics, analysis, and audits across a broad range of security data sources.
Maintaining a high awareness of external and insider threats and responding accordingly.
Developing and maintaining Information Security policies, procedures, and other documentation to ensure effective storage, coverage, review, and sign-off.
Leading Information Security projects and initiatives and conducting risk assessments for internal and external systems and applications, ensuring risk is managed accordingly.

For more information about the role and the capabilities where looking for, please refer to the Candidate Pack on the AUSTRAC Careers Page

Affirmative Measures

This vacancy is also being advertised concurrently under both general and affirmative measures recruitment processes.

Applications made under affirmative measures are only available to affirmative measures indigenous applicants or affirmative measures disability applicants.

Evidence will be requested if your application progresses under an affirmative measures process.

Notes

This recruitment process will initially be used to fill a current vacancy and in future, may be used to fill similar positions in the event positions become vacant. The merit pools established from this recruitment process will be valid for 18 months from the date of advertising.

We offer competitive remuneration and great conditions, including:

Annual leave of 4 weeks (20 days) per year + additional paid Christmas close down.

·       Cultural, Ceremonial and NAIDOC leave.

·       18 days of paid personal leave per year.

·       15.4% superannuation, which continues through paid parental leave.

·       18 weeks of paid parental leave.

·       Competitive APS salaries with access to annual salary progression.

·       Study assistance - up to $6,000 per annum and up to 120 hours of study leave.

View the AUSTRAC Enterprise Agreement for more information about current salaries and other conditions of employment.

About Us

AUSTRAC, Australia’s financial intelligence agency and anti-money laundering and terrorism financing regulator, is undergoing a significant transformation to enhance its role in combating money laundering and terrorism financing. This includes proposed expansion of its regulatory regime and a broader digital transformation to support our growing agency. As we embrace these changes and grow, our focus is on fostering innovation, collaboration, and effective problem-solving within an inclusive and supportive work environment. At AUSTRAC, you’ll be part of a team dedicated to maintaining the integrity of Australia’s financial system and making a real impact in preventing financial crime.

Closing Date and further details 

Applications close at 11:30 pm on Sunday 11 January 2026

For enquiries, please contact: ict.recruitment@austrac.gov.au

Please note, we can only accept applications via the AUSTRAC Careers Portal."
89210097,Senior Business Analyst,"Talent – Specialists in tech, transformation & beyond",https://www.seek.com.au/job/89210097?type=standard&ref=search-standalone&origin=jobCard#sol=1d3ab622cacd5e0a254e7b1a0bd1788237c33554,3h ago,3.0,2025-12-18T00:00:00+00:00,Adelaide SA (Hybrid),Business/Systems Analysts (Information & Communication Technology),Contract/Temp,Contract,"Business Analyst
📍 Adelaide, SA | 📅 12-month contract (commencing Feb 2026, high likelihood of extension) | Hybrid arrangements

Project Overview

Our client is seeking an experienced Business Analyst to support upcoming projects across their portfolio. This key role focuses on delivering customer-focused, scalable solutions that meet business and operational requirements. The BA will initially work on planning activities, including project scoping, tendering, and business case preparation, before moving into broader project delivery or other applications-based initiatives. The role requires collaboration with stakeholders, process improvement, and contributing to the successful delivery of practical, business-focused outcomes.










Key Responsibilities

Capture, analyse, and document business requirements

Map as-is and to-be processes to identify gaps and improvement opportunities

Facilitate stakeholder workshops and manage expectations

Support project lifecycle activities, including initiation, planning, and operational handover

Apply lean process improvement to identify areas of waste and enhance efficiency

Contribute to procurement processes (RFP, RFQ, RFT) and evaluation support where required

Lead project planning activities when PM support is limited

Skills & Experience

Strong core BA skills - requirements gathering, workshops, data analysis, benefits realisation

Confident communicator, able to translate complex technical concepts into lay terms

Agile environment experience, without necessarily implementing Agile methodology

Experience in utilities, mining, or similar sectors highly desirable

Dynamic, flexible, and creative with the ability to deliver innovative solutions

Why Join

Work on a high-profile, strategic project delivering tangible impact

Hybrid working arrangement balancing on-site collaboration with remote work

Opportunity to contribute across multiple projects in a fast-paced, evolving IT environment

Work within a team aligned to our clients' values: safety, initiative, collaboration, and rising to the challenge

If you are interested, call Ella at 0480 804 548 to speak further about this position."
89210076,Data Scientist,HorizonOne Recruitment,https://www.seek.com.au/job/89210076?type=standard&ref=search-standalone&origin=jobCard#sol=0ad047c8de6bf0a5f3541d5cd96ccb061122e4b2,3h ago,3.0,2025-12-18T00:00:00+00:00,Canberra ACT,Government - Federal (Government & Defence),Full time,$130/hr - $150/hr,"A federal government agency providing analytical advice and insight on a range of economic and policy themes, supporting decision-making on complex, economy-wide policy questions, including those relating to labour markets and productivity
 
The Opportunity
Newly created roles
2x positions available
Work on high-profile research programs exploring labour market efficiency, productivity, and workforce dynamics. Join a multidisciplinary team of economists, data scientists, and policy specialists, applying advanced modelling to complex linked administrative data to generate insights that inform national decision-making.

The project pipeline includes applying search and matching models to determine outcomes for specific cohorts, analysing labour market and productivity trends, and producing dashboards and visualisations to support evidence-based advice.

Flexible working arrangements are supported, with most team members attending the office around two days per week.

The Role

You will:

Support analysis and modelling across multiple high-impact research programs
Apply search and matching models to understand outcomes for specific cohorts
Analyse labour market and productivity trends, producing dashboards and visualisations to guide evidence-based advice
Assist and mentor team members, contributing to high-quality, timely analytical outputs across a multidisciplinary, dispersed team
The work is primarily undertaken in Azure Databricks using PySpark, but the team is flexible and also uses R and SQL. Visualisations are delivered via Highcharts, Power BI, R Shiny and Qlik, ensuring insights are accessible, reproducible, and well-documented.
 
The Ideal Person

You are an experienced data scientist or applied economist with a strong interest in labour markets, productivity and workforce dynamics, and you enjoy working at the intersection of data, economics and public policy.

You may be coming from organisations including ABS, ATO, Treasury, DEWR, Health, DSS or Big 4/Economic focused consulting.

You may have worked on economic modelling, workforce analysis, productivity research, skills forecasting or evaluation work, and are comfortable applying advanced quantitative methods to real-world policy questions.

You bring:

Experience applying advanced quantitative methods, including multilevel modelling and Bayesian inference
Experience with labour market analysis, applied economics, workforce dynamics or productivity research
Robust and methodical approach to analysis whilst being skilled at translating complex data into actionable policy insights
Australian citizenship and existing Baseline clearance is mandatory
 
Salary / Rate

This is a full-time contract commencing in February for an initial 12 month contract with 12 month extension

A rate is not listed; however, my estimation range is $135/hr - $160/hr based on skills and experience.
 
How to Apply

To apply online, please click on the appropriate link.
 
Alternatively, for a confidential discussion, please contact Lucas Walker on 0483 911 561 quoting ref no. 21228
 
HorizonOne is committed to building a diverse and inclusive workforce and we encourage applications from people of all cultures, capabilities and backgrounds."
89209956,Manager/Director Data/AI,PRA,https://www.seek.com.au/job/89209956?type=standard&ref=search-standalone&origin=jobCard#sol=6d2fa6acae95699bca306d3a3cbc12f04d8d5626,3h ago,3.0,2025-12-18T00:00:00+00:00,Sydney NSW (Hybrid),Management (Information & Communication Technology),Full time,n,"Consulting Manager/Director - Data & AI

Lead data-driven transformation and AI-enabled outcomes for clients.
We're seeking an experienced Consulting Manager/Director - Data & AI to lead high-impact consulting engagements and grow our Data & AI consulting capability.

This is a senior, client-facing role where you'll combine people leadership, delivery excellence, and commercial acumen to help clients solve complex data, analytics, and AI challenges.

You'll work closely with clients and internal teams to deliver scalable data platforms, advanced analytics, and AI-enabled solutions that drive real business value.

What you'll do

Lead, mentor, and grow a team of Data, Analytics, and AI consultants, fostering a collaborative and innovative culture.
Build and maintain trusted executive-level client relationships, understanding data and AI challenges and delivering tailored solutions.
Collaborate with technical and delivery teams to design and deliver Data, Analytics, and AI solutions including data platforms, BI, ML, and AI use cases.
Identify and develop new business opportunities across Data & AI engagements and expand existing client accounts.
Lead proposal development, client presentations, and contract negotiations for Data & AI initiatives.
Contribute to the strategic direction and growth of the Data & AI consulting practice.
Support oversight of financial performance, ensuring engagements are delivered within budget and meet profitability targets.
Partner with other service lines to deliver a cohesive, end-to-end client experience.
What you'll bring

Bachelor's degree in a relevant discipline, or equivalent practical experience.
7+ years' experience in industry or consulting, including 3+ years in a consulting leadership role focused on Data, Analytics, or AI.
Proven track record delivering Data & AI consulting engagements, from strategy through to implementation.
Strong understanding of data platforms, analytics, AI/ML concepts, and modern data architectures.
Experience with consulting methodologies, program delivery, and stakeholder management.
Commercial mindset with experience in business development, account growth, and client management.
Excellent leadership, communication, and presentation skills.
A continuous learning mindset, staying current with emerging data, analytics, and AI trends.
Nice to have

Postgraduate qualification such as an MBA or Master's in Data, Analytics, or AI.
Relevant certifications (e.g. PMP, SAFe, cloud or data platform certifications).
Exposure to cloud data platforms (e.g. Azure, AWS, GCP) and AI frameworks.
Why join us?

Lead and grow a high-performing Data & AI consulting practice.
Work with leading organisations on complex, high-value data and AI transformations.
Influence strategy and capability development within a growing consulting division.
Competitive remuneration, flexible working, and strong career progression opportunities.
Ready to lead the next wave of Data & AI consulting?
Apply now and help clients turn data into insight and AI into impact.
Australian workrights needed, security clearance a bonus."
