Job ID,Job Title,Company,Detail URL,Posted Label,Hours Old,Posted Datetime (Local),Location,Category,Work Type,Salary,Ad Text
89859309,Senior Commercial Analyst,EDL,https://www.seek.com.au/job/89859309?type=standard&ref=search-standalone&origin=jobCard#sol=5625225db6ac55bb240d946b1b48cbb21aa59764,3h ago,3.0,2026-01-22T03:00:00+00:00,Perth WA,"Power Generation & Distribution (Mining, Resources & Energy)",Full time,,"EDL owns and operates a global portfolio of power stations in Australia, North America and Europe. Our vision is to be the leading global producer of sustainable distributed energy. At EDL, we are playing a key role in the world's transition from traditional energy sources to decarbonised solutions.

This is an exciting opportunity to join EDL's Remote Energy Commercial Team. The role will manage, monitor and support a portfolio of projects/contracts with an Operational focus to add value to the Remote Energy business. This position is based in our office in Perth, with some travel to site required.

Key Areas of Responsibility


Lead/support the management of the existing contract suite including power purchase agreements, gas agreements, connection agreements, electricity market agreements and leases to ensure EDL is abiding by its contractual obligations to its principle customers.

Ownership of a defined suite of contracts (by region or nature), but also expected to

take an interest in adjacent/complimentary projects as required.

Lead/support interactions with customers and major suppliers as required to address contractual issues and/or requirements.

Lead/support the implementation of new contractual arrangements to support the existing assets.

Gain a thorough knowledge of all sales contract documentation including project deeds and major supplier contracts.

Lead/support the development of the processes and systems required for compliance with relevant energy market compliance and settlements.

Lead/support compliance with various licences and statutory requirements.

Work closely with the Australian business development team to deliver growth opportunities while managing commercial risks; this includes assisting/leading commercial negotiations as required.

Support the project delivery, finance and operations teams in their understanding of commercial contracts and advise of commercial obligations as required

Work with the team of analysts to provide analytical support to all areas of the Remote Energy business as required, and provide insight into improvements and possible corrective actions.

Identify and deliver opportunities to maximise value from existing contracts and manage compliance to the requirements of the agreements.

General:

Contribute to the operations and growth of the company

Live the EDL values of SPIRIT - Safety, Performance, Innovation and Initiate, Respect & Responsibility, Integrity and Teamwork

Be an active agent of change. Identify and lead continuous improvement initiatives.

In addition to the duties set out above, the Principal Commercial Analyst Remote Energy may be expected to perform other duties appropriate to the level and responsibility of the position as assigned from time to time by the Company

Person Specification

Strong time management and organisational skills.

Ability to work un-supervised.

Ability to lead cross-functional teams to achieve commercial outcomes.

Ability to undertake technical analysis of power generation systems performance.

Ability to interpret complex commercial contracts.

Demonstrated initiative.

Accurate and attentive to detail.

Flexible but focussed on the quality of work.

Effective written and verbal communication skills.

Team oriented.

Committed.

Qualifications and Experience

Strong computer literacy essential, including basic Word & PowerPoint.

Strong analytical skills using Microsoft Excel

Tertiary qualification in a finance or energy related discipline, preferably accounting, economics, or engineering.

Post-graduate qualifications in Renewable Energy highly desirable.

Project management experience desirable.

Training and/or experience in principles of contract law

Experience in the WA Electricity Market, NEM or NT electricity market desirable

2 years' experience in a commercial role desirable

5 years' experience in the power generation industry desirable, with experience in remote energy, solar PV or wind generation highly desirable.

Successful applicants will be required to undergo background screening prior to commencement with EDL.



EDL is committed to creating a diverse and inclusive environment and is proud to be an equal opportunity employer



This role is being sourced through EDL directly and we will not accept applications via external recruitment agencies."
89859257,Business Analyst,Change Recruitment,https://www.seek.com.au/job/89859257?type=standard&ref=search-standalone&origin=jobCard#sol=bc04b64ff9cd374817914352de31860753fab59b,3h ago,3.0,2026-01-22T03:00:00+00:00,Melbourne VIC,Business/Systems Analysts (Information & Communication Technology),Full time,"$140,000 – $180,000 per year","Counterparty Credit Risk (CCR) Business Analyst

Risk Transformation | Tier-1 Banking Program

We’re working with a leading consulting firm delivering a large-scale Risk Technology transformation for a major Australian bank. They’re seeking a senior CCR / CVA Business Analyst to support enhancements, migrations, and optimisation of enterprise risk platforms.

This role suits someone who thrives in complex environments, can engage confidently with senior stakeholders, and brings deep expertise in counterparty credit risk and derivatives.

The Role

Deliver CCR & CVA enhancements across enterprise risk platforms

Own exposure modelling, netting, CSA configuration, stress testing and back-testing

Lead functional testing, parallel runs, and risk metric validation (MtM, VaR, Monte Carlo exposures)

Analyse and resolve issues across pricing, sensitivities, and market data

Work closely with consulting, bank Risk, Front Office, and Technology teams

About You

8+ years’ experience as a CCR / Market Risk Business Analyst

Strong expertise in CCR, CVA, FRTB, and risk models

Solid understanding of derivatives pricing and market data

Hands-on experience validating EE, PD, LGD, VaR, and stress testing

Strong SQL skills (Oracle / SQL Server)

Experience with Murex, Calypso, or FIS highly regarded

Why Join?

High-profile consulting engagement at a tier-one bank

Technically challenging work with real delivery ownership"
89859151,"Data Engineer | Cloud, Databricks & AI Projects (Sydney)",DyFlex Solutions,https://www.seek.com.au/job/89859151?type=standard&ref=search-standalone&origin=jobCard#sol=9894db5caad7be857f60d7dec729fef49dc138d5,3h ago,3.0,2026-01-22T03:00:00+00:00,Sydney NSW (Hybrid),Business/Systems Analysts (Information & Communication Technology),Full time,,"DyFlex is an established SAP Platinum Partner with offices across Australia. We are recognised as a leader in our area of SAP expertise. We deliver fit-for-purpose SAP solutions, and our services range from greenfield and brownfield implementations, change management to ongoing Aftercare services and support.
In 2025, we have been awarded


✓ Best Performing Partner in Australia for S/4 HANA Public Cloud
✓ Best Performing Partner in Australia for Speed of Delivery
✓ Best Performing Partner in Mid-Market
✓ Highest Selling Partner in Australia

About the Role:
As a Principal Consulting AI / Data Engineer, you will design, build, and optimise enterprise-scale data and AI solutions, while also leading engagements with executive stakeholders. This role requires both technical depth and consulting acumen: you will be expected to explain complex technical concepts clearly to non-technical directors, C-suite executives, and senior customer stakeholders. You’ll play a critical role in shaping DyFlex’s growing Data and AI practice, delivering innovative, business-aligned solutions that drive measurable outcomes.

Your tasks and responsibilities:

Design, build, and maintain scalable data and AI solutions using Databricks, cloud platforms, and modern frameworks
Lead solution architecture discussions with clients, ensuring alignment of technical delivery with business strategy
Present to and influence executive-level stakeholders, including boards, C-suite, and senior directors
Translate highly technical solutions into clear business value propositions for non-technical audiences
Mentor and guide teams of engineers and consultants to deliver high-quality solutions
Champion best practices across data engineering, MLOps, and cloud delivery
Build DyFlex’s reputation as a trusted partner in Data & AI through thought leadership and client advocacy

Your qualifications and experience:

Proven expertise in delivering enterprise-grade data engineering and AI solutions in production environments
Strong proficiency in Python and SQL, plus experience with Spark, Airflow, dbt, Kafka, or Flink
Experience with cloud platforms (AWS, Azure, or GCP) and Databricks
Ability to confidently communicate and present at C-suite level, simplifying technical concepts into business impact
Track record of engaging senior executives and influencing strategic decisions
Strong consulting and stakeholder management skills with client-facing experience
Background in MLOps, ML pipelines, or AI solution delivery highly regarded
Degree in Computer Science, Engineering, Data Science, Mathematics, or a related field

What we offer:

Work with SAP’s latest technologies on cloud as S/4HANA, BTP and Joule, plus Databricks, ML/AI tools and cloud platforms
A flexible and supportive work environment including work from home
Competitive remuneration and benefits including novated lease, birthday leave, salary packaging, wellbeing programme, additional purchased leave, and company-provided laptop
Comprehensive training budget and paid certifications (Databricks, SAP, cloud platforms)
Structured career advancement pathways with opportunities to lead large-scale client programs
Exposure to diverse industries and client environments, including executive-level engagement
Join a renowned organisation delivering projects to some of Australia’s leading enterprises

DyFlex is committed to providing a safe, flexible and respectful environment for staff free from all forms of discrimination, bullying and harassment. We are proud of our diverse and inclusive team as only together we can continually improve ourselves and achieve best outcomes for our customers– we are the region's leading SAP Platinum Partner!

Please note that we can’t offer sponsorship for this role and we expect a clear statement about your legal rights in Australia, especially if you are applying from overseas."
89858240,Product & Procurement Analyst,Australian Venue Co,https://www.seek.com.au/job/89858240?type=standard&ref=search-standalone&origin=jobCard#sol=abfcc32741e8b05ff2fd567cd3aaa8ead17468ff,4h ago,4.0,2026-01-22T02:00:00+00:00,Melbourne VIC (Hybrid),"Purchasing, Procurement & Inventory (Manufacturing, Transport & Logistics)",Full time,,"Australian Venue Company operates hundreds of venues across Australia and New Zealand. Procurement decisions - products, suppliers, pricing, and volume commitments - have a direct and material impact on gross margin and operational risk.

This role exists to improve gross margin and supply decisions through better product and procurement analytics. You'll work closely with procurement while maintaining enough independence to provide objective, commercially grounded insight.



What You'll Do

Support procurement decisions with analytics


Analyse supplier tenders and procurement options
Build models to compare pricing, rebates, volumes, and scenarios
Support demand forecasting and volume planning
Help quantify trade-offs between margin, risk, and operational complexity



Analyse product and category performance


Assess performance of products, categories, and beverage verticals
Identify drivers of margin, mix, and velocity
Support range and supplier decisions with evidence



Report on procurement performance


Produce clear views of procurement outcomes and performance
Highlight risks, opportunities, and emerging issues
Ensure analysis is transparent and commercially focused

Evaluation is part of the role, but the focus is on enabling better decisions, not auditing.



What Success Looks Like


Procurement decisions are supported by clear, credible analysis
Trade-offs between price, volume, and margin are explicit
Product and supplier performance is well understood
Procurement leaders trust and use your work



This Role Is a Good Fit If You


Have experience in analytics, finance, or commercial roles
Are comfortable working with product, pricing, and supplier data
Prefer structured problems with clear commercial outcomes
Can work closely with stakeholders while remaining objective



This Role Is Not For You If You


Are looking for a general-purpose analytics role
Want to work primarily on experimentation or marketing analytics
Prefer highly ambiguous, unstructured problem spaces"
89858043,Technical Data Migration Consultant,Peoplebank Australia QLD,https://www.seek.com.au/job/89858043?type=standard&ref=search-standalone&origin=jobCard#sol=a461b42a987336e1467f7d2cc5234c911dc5c147,4h ago,4.0,2026-01-22T02:00:00+00:00,Brisbane QLD,Consultants (Information & Communication Technology),Contract/Temp,Competitive Market Rate,"Join a leading local government in Brisbane as a Technical Data Migration Consultant. In this full-time role, you will play a crucial part in the city's SAP S/4 HANA migration project. Based in Brisbane, the role offers flexible work arrangements, with an initial contract duration aligned to project timelines. This is an excellent opportunity to contribute to a significant public sector digital transformation.
As the selected candidate, you will:

Manage data migration efforts for S/4 HANA, ensuring data integrity, quality, and consistency throughout the process.
Utilise SAP Data Services to design, implement, and monitor data extraction, transformation, and loading (ETL) processes.
Conduct thorough data analysis and mapping to ensure accurate data migration across systems.
Work closely with business stakeholders to understand data requirements and align migration strategies with business needs.
Develop and implement SQL queries to extract, cleanse, and validate data during migration.
Create comprehensive reports and dashboards using PowerBI to provide clear insights into the migration progress and data quality.
Apply Python (preferred but not mandatory) to automate processes, manipulate data, and perform advanced analytics as needed.
Collaborate with cross-functional teams to ensure timely and successful data migration.
To be successful in this role you should have:

Expertise in SAP BusinessObjects Data Services (BODS) and SAP Info Steward for data migration and quality management.
Strong proficiency in SQL for data querying, manipulation, and transformation.
Solid experience in data analysis to ensure data quality and integrity throughout the migration process.
Proficiency in PowerBI for reporting and data visualisation.
Proven ability to lead a team of technical and business data analysts and ETL specialists.
Good understanding of SAP environments and business processes related to data management.
It is desirable if you have:

Basic familiarity with Python for automation and analytics.
Knowledge of SAP Cloud Application Lifecycle Management (CALM) and JIRA for project coordination.
This role is perfect for an experienced data migration professional eager to contribute to a significant city-wide ERP upgrade. If you meet the above criteria and are looking for an impactful opportunity, we encourage you to apply. chantelle.lee@peoplebank.com.au / 07 3291 5405.


Peoplebank and Leaders IT are committed to creating a diverse and inclusive workplace where everyone belongs. We welcome applications from people of all backgrounds, identities, and experiences. If you need adjustments to the recruitment process due to your circumstances, please let us know—we’re here to support you."
89857412,Asset Systems Analyst,DBP,https://www.seek.com.au/job/89857412?type=standard&ref=search-standalone&origin=jobCard#sol=5361e7291e292cff93ac7757fc36c84f18c64a7c,4h ago,4.0,2026-01-22T02:00:00+00:00,"Jandakot, Perth WA","Analysis & Reporting (Mining, Resources & Energy)",Full time,,"Who we are

Australian Gas Infrastructure Group (AGIG) owns, operates and invests in infrastructure which delivers gas to more than two million homes and businesses, and is one of the largest gas infrastructure businesses in Australia. AGIG manages over 36,000km of distribution networks, more than 4,300km of transmission pipelines and 60 petajoules of storage capacity. We employ over 500 team members and manage a contractor workforce of approximately 1600, who provide both specialist and operating and maintenance services on AGIG's gas distribution networks.

Our business is actively participating in the energy transition by delivering the natural gas needed today and advancing solutions for the future. Our Net Zero goal and emissions reduction targets outline our ongoing commitment to a sustainable energy future. We know that to deliver our net zero goal in a timely, affordable and reliable way for all customers, a diverse range of energy supply is needed. We will continue to work with customers and stakeholders to deliver and develop the energy infrastructure solutions essential to lowering emissions - including through natural gas, renewable gas and carbon capture and sequestration solutions.



About the opportunity

Join our Transmission Operations team as an Asset System Analyst, reporting to the Head of Planning and Operational Performance. In this key role, you will support, manage, and enhance our Computerised Maintenance Management System (CMMS), Maximo, ensuring it meets evolving business needs.

As the Subject Matter Expert, you will play a vital role in providing best‑practice guidance, enabling effective work management processes, and strengthening operational performance.

Key responsibilities
Manage system changes, enhancements, and updates, ensuring minimal operational impact.
Proactively identify opportunities to improve efficiency and strengthen operational resilience.
Assist with the development and production of reporting to support business operations.
Translate work management and business processes into effective system configurations.
Provide functional support for CMMS users and assist in troubleshooting system issues.
Deliver Maximo training and develop training materials and documentation.
Maintain system, master, and reporting data to ensure accuracy and reliability.
About you
Previous experience and proven expertise in Maximo.
Qualification in Data science, SQL or Software Engineering
Demonstrated technical understanding of Maintenance Management Systems.
Strong analytical skills and an ability to translate business needs into system requirements.
What we offer
We are proud to be recognised as an inclusive employer by Diversity Council Australia, and our commitment to diversity and inclusion has earned us recognition in 2023-2024. Join us to be part of a team that values and celebrates differences, ensuring that everyone's voice is heard and respected.
AGIG is proudly recognised by WORK180 as a committed and supportive employer of choice for women, reflecting our dedication to creating a diverse, inclusive, and equitable workplace.
Dive into a culture that supports the community through the Community Partnerships Program: with 2 paid volunteer leave days across the year, join a team that has dedicated over 1,900 volunteer hours, and collectively raised more than $100,000 through donations, fundraising and our dollar matching program.
Bonus incentive program.
A range of flexible working arrangements and leave options, including three additional leave days and to option to purchase two weeks of additional leave each year.
20 weeks paid parental leave for primary carer.
Professional Development opportunities to support your career growth.
Wellbeing and Inclusion program including Employee Assistance Program, annual flu vaccinations and access to free annual health checks.
Join in on social activities through our AGIG Social Club.
Range of rewards and recognition activities across the company.
Salary Continuance Insurance.

AGIG is committed to a workplace that promotes and recognises the diversity of its employees and the broader community that we serve by applying the principles of equity, fairness and transparency. A diverse and inclusive workplace is consistent with achieving AGIG's values of Trust, Accountable, Care and One Team.

Interested in this opportunity but are unsure of meeting all the requirements? If this role excites you, we strongly encourage you to apply - your unique skills and experience could be exactly what we need!

We are an equal opportunity employer and encourage applications from female, Aboriginal and Torres Strait Island peoples, people from culturally diverse backgrounds and people with disabilities.

As part of the recruitment process, candidates will be required to undertake background checks which include reference checks, police check and a pre-employment medical.

Applications Close: 4.00pm (AWST), Friday 6 February 2026"
89856766,Senior Commercial Analyst,craveable brands,https://www.seek.com.au/job/89856766?type=standard&ref=search-standalone&origin=jobCard#sol=8c48d69046ec95689024b75507ceb4a0c4c1a1bc,4h ago,4.0,2026-01-22T02:00:00+00:00,"Chatswood, Sydney NSW (Hybrid)",Analysis & Reporting (Accounting),Full time,,"About Us
At Craveable Brands we’re the proud owner of four iconic Australian food brands: Red Rooster, Oporto, Chicken Treat and Chargrill Charlie’s. And while some of our brands have been around for over 50 years, today we’re one of the fastest growing restaurant brands in the country.​
  
We're big but well portioned, so everyone has the chance to make a difference. As customer fanatics, we’re all committed to success and can see the outcomes of our efforts. You can even taste it.
  
About the role
Reporting to the Commercial Manager, this role is the key business partner for the Chargrill Charlie’s brand, the Wholesale business and manages marketing fund accounting (Adfund). The position is responsible for delivering end-to-end financial and commercial analysis, providing clear, executive-level insights to support the CEO and senior leadership decision-making. Working closely with brand, marketing, operations, and wholesale stakeholders across the Craveable Brands group, the role plays a critical role in driving performance, forecasting outcomes, and ensuring commercially sound decisions from planning through execution.
  
Key Activities Include:
Management of Financial Outcomes – Chargrill Charlie’s

Lead the end‑to‑end budget and rolling forecast cycle, owning performance management for the brand.
Deliver accurate, timely reporting across daily/weekly/monthly/annual cycles, including period review packs and board report excerpts.
Analyse sales, ad‑hoc income streams (incl. fees) and brand costs; provide variance analysis (A/B/F), forecasting updates and clear commercial recommendations.
Build and maintain core reporting (standard suites plus ad‑hoc analysis) to support strategic initiatives and decision‑making.
Partner with brand, marketing and operations to convert financial insights into actionable plans and measurable outcomes.
Marketing Adfund Accounting

Own Adfund accounting activities, including month‑end close and preparation of monthly Adfund accounts.
Track and analyse company‑store sales, including forecasting and variance commentary.
Prepare accurate, timely Adfund statements for GFC review and sign‑off; provide ad‑hoc analysis of key movements.
Wholesale Margin Governance & Disclosure

Produce regular reporting and analysis of wholesale margins.
Provide periodic reporting on rate and margin changes.
Support annual franchise disclosure requirements with accurate financial inputs.
About You 
Essential

2 – 3 years in a Commercial finance position.
CA, CPA or similar qualification and/or a bachelor's degree in a related field.
A passion for numbers, being curious, and getting into the details!
Proficiency in stakeholder management and business partnering.
Desirable

Previous experience in the Quick Service Restaurant (QSR), Retail or Fast-Moving Consumer Goods (FMCG)
Advanced Excel Modelling Skills and experience using Tableau
We offer: 

Summer Working Hours so you can make the most of the warmer weather. That means Friday afternoons off in summer!
Free food at all our brands because don’t we all love chicken!
Paid Good Deed dayssupporting a charity that means something to you.
Extra day of leave in your birthday monthto celebrate.
26 weeks paid parental leave.
Don't let the passion for chicken fool you, we're a very human organisation and put our people first. Hard working, caring and fun, we enjoy a collaborative culture where our key ingredient is our people who strive to be their best.

If this sounds like the type of place you can spread your wings, apply today.

We truly believe that bringing together people from diverse backgrounds is key to our ability to continue to grow and do our best work. That’s why we want you to apply even if you don’t think you tick all the boxes – we’re looking for many different skills and abilities to build our culture."
